No.,Time,Source,Destination,Protocol,Length,Info,App,Mixed_Traffic,Time_Diff,Src_Port,Dst_Port,Flow_ID
1,0.0,192.168.56.210,192.168.56.255,UDP,86,57621  >  57621 Len=44,Firefox,False,0.0,57621.0,57621.0,-2419916614360054039
2,0.394600487,2a0d:6fc7:505:6e3:b391:e2e3:ca0d:6126,2a0d:6fc7:505:6e3::be,DNS,94,Standard query 0x2fdd AAAA www.google.com,Firefox,False,0.394600487,,,2351851782027266242
3,0.464302963,2a0d:6fc7:505:6e3::be,2a0d:6fc7:505:6e3:b391:e2e3:ca0d:6126,DNS,122,Standard query response 0x2fdd AAAA www.google.com AAAA 2a00:1450:4028:80a::2004,Firefox,False,0.06970247600000001,,,-3069401969345213175
4,0.464631796,2a0d:6fc7:505:6e3:b391:e2e3:ca0d:6126,2a00:1450:4028:80a::2004,TCP,94,59984  >  443 [SYN] Seq=0 Win=33120 Len=0 MSS=1440 SACK_PERM TSval=482064606 TSecr=0 WS=128,Firefox,False,0.00032883299999997284,59984.0,443.0,-1429296984425834311
5,0.464814715,2a0d:6fc7:505:6e3:b391:e2e3:ca0d:6126,2a00:1450:4028:80a::2004,TCP,94,59992  >  443 [SYN] Seq=0 Win=33120 Len=0 MSS=1440 SACK_PERM TSval=482064606 TSecr=0 WS=128,Firefox,False,0.0001829190000000036,59992.0,443.0,-821849069302390154
6,0.500256244,2a00:1450:4028:80a::2004,2a0d:6fc7:505:6e3:b391:e2e3:ca0d:6126,TCP,94,"443  >  59984 [SYN, ACK] Seq=0 Ack=1 Win=65535 Len=0 MSS=1300 SACK_PERM TSval=2600508979 TSecr=482064606 WS=256",Firefox,False,0.03544152900000003,443.0,59984.0,8464530201920232345
7,0.50025649,2a00:1450:4028:80a::2004,2a0d:6fc7:505:6e3:b391:e2e3:ca0d:6126,TCP,94,"443  >  59992 [SYN, ACK] Seq=0 Ack=1 Win=65535 Len=0 MSS=1300 SACK_PERM TSval=473583790 TSecr=482064606 WS=256",Firefox,False,2.460000000370499e-07,443.0,59992.0,-4524193753973475960
8,0.500318694,2a0d:6fc7:505:6e3:b391:e2e3:ca0d:6126,2a00:1450:4028:80a::2004,TCP,86,59984  >  443 [ACK] Seq=1 Ack=1 Win=33152 Len=0 TSval=482064642 TSecr=2600508979,Firefox,False,6.220399999989912e-05,59984.0,443.0,-1429296984425834311
9,0.500473134,2a0d:6fc7:505:6e3:b391:e2e3:ca0d:6126,2a00:1450:4028:80a::2004,TCP,86,59992  >  443 [ACK] Seq=1 Ack=1 Win=33152 Len=0 TSval=482064642 TSecr=473583790,Firefox,False,0.00015444000000008895,59992.0,443.0,-821849069302390154
10,0.501919682,2a0d:6fc7:505:6e3:b391:e2e3:ca0d:6126,2a00:1450:4028:80a::2004,TLSv1.3,603,Client Hello (SNI=www.google.com),Firefox,False,0.001446547999999992,,,7766148485364104488
11,0.503658569,2a0d:6fc7:505:6e3:b391:e2e3:ca0d:6126,2a00:1450:4028:80a::2004,TLSv1.3,603,Client Hello (SNI=www.google.com),Firefox,False,0.0017388869999999113,,,7766148485364104488
12,0.546452047,2a00:1450:4028:80a::2004,2a0d:6fc7:505:6e3:b391:e2e3:ca0d:6126,TCP,86,443  >  59992 [ACK] Seq=1 Ack=518 Win=269568 Len=0 TSval=473583837 TSecr=482064645,Firefox,False,0.04279347800000011,443.0,59992.0,-4524193753973475960
13,0.546452282,2a00:1450:4028:80a::2004,2a0d:6fc7:505:6e3:b391:e2e3:ca0d:6126,TCP,86,443  >  59984 [ACK] Seq=1 Ack=518 Win=269568 Len=0 TSval=2600509026 TSecr=482064643,Firefox,False,2.3499999990406195e-07,443.0,59984.0,8464530201920232345
14,0.618913077,2a00:1450:4028:80a::2004,2a0d:6fc7:505:6e3:b391:e2e3:ca0d:6126,TLSv1.3,2502,"Server Hello, Change Cipher Spec",Firefox,False,0.07246079500000002,,,5816378878603992574
15,0.618989842,2a0d:6fc7:505:6e3:b391:e2e3:ca0d:6126,2a00:1450:4028:80a::2004,TCP,86,59984  >  443 [ACK] Seq=518 Ack=2417 Win=31872 Len=0 TSval=482064760 TSecr=2600509078,Firefox,False,7.676499999997866e-05,59984.0,443.0,-1429296984425834311
16,0.663594428,2a00:1450:4028:80a::2004,2a0d:6fc7:505:6e3:b391:e2e3:ca0d:6126,TLSv1.3,1769,Application Data,Firefox,False,0.04460458600000006,,,5816378878603992574
17,0.663650417,2a0d:6fc7:505:6e3:b391:e2e3:ca0d:6126,2a00:1450:4028:80a::2004,TCP,86,59984  >  443 [ACK] Seq=518 Ack=4100 Win=31872 Len=0 TSval=482064805 TSecr=2600509078,Firefox,False,5.598900000003404e-05,59984.0,443.0,-1429296984425834311
18,0.666278875,2a00:1450:4028:80a::2004,2a0d:6fc7:505:6e3:b391:e2e3:ca0d:6126,TLSv1.3,2502,"Server Hello, Change Cipher Spec",Firefox,False,0.002628458,,,5816378878603992574
19,0.666278959,2a00:1450:4028:80a::2004,2a0d:6fc7:505:6e3:b391:e2e3:ca0d:6126,TLSv1.3,1768,Application Data,Firefox,False,8.399999995578611e-08,,,5816378878603992574
20,0.666318122,2a0d:6fc7:505:6e3:b391:e2e3:ca0d:6126,2a00:1450:4028:80a::2004,TCP,86,59992  >  443 [ACK] Seq=518 Ack=2417 Win=31872 Len=0 TSval=482064808 TSecr=473583890,Firefox,False,3.916299999995321e-05,59992.0,443.0,-821849069302390154
21,0.666407228,2a0d:6fc7:505:6e3:b391:e2e3:ca0d:6126,2a00:1450:4028:80a::2004,TCP,86,59992  >  443 [ACK] Seq=518 Ack=4099 Win=31872 Len=0 TSval=482064808 TSecr=473583890,Firefox,False,8.910600000000546e-05,59992.0,443.0,-821849069302390154
22,0.671013356,2a0d:6fc7:505:6e3:b391:e2e3:ca0d:6126,2a0d:6fc7:505:6e3::be,DNS,90,Standard query 0xbf4f AAAA o.pki.goog,Firefox,False,0.004606128000000043,,,2351851782027266242
23,0.675967535,2a0d:6fc7:505:6e3::be,2a0d:6fc7:505:6e3:b391:e2e3:ca0d:6126,DNS,153,Standard query response 0xbf4f AAAA o.pki.goog CNAME pki-goog.l.google.com AAAA 2a00:1450:4028:804::2003,Firefox,False,0.0049541789999999475,,,-3069401969345213175
24,0.676190129,2a0d:6fc7:505:6e3:b391:e2e3:ca0d:6126,2a00:1450:4028:804::2003,TCP,94,38206  >  80 [SYN] Seq=0 Win=33120 Len=0 MSS=1440 SACK_PERM TSval=3994641956 TSecr=0 WS=128,Firefox,False,0.0002225940000000204,38206.0,80.0,-6619552151434761760
25,0.676379851,2a0d:6fc7:505:6e3:b391:e2e3:ca0d:6126,2a00:1450:4028:804::2003,TCP,94,38212  >  80 [SYN] Seq=0 Win=33120 Len=0 MSS=1440 SACK_PERM TSval=3994641956 TSecr=0 WS=128,Firefox,False,0.00018972200000000328,38212.0,80.0,-5853958554766049343
26,0.70154873,2a00:1450:4028:80a::2004,2a0d:6fc7:505:6e3:b391:e2e3:ca0d:6126,TCP,560,"[TCP Spurious Retransmission] 443  >  59992 [PSH, ACK] Seq=3625 Ack=518 Win=269568 Len=474 TSval=473583989 TSecr=482064645 [TCP segment of a reassembled PDU]",Firefox,False,0.025168878999999977,443.0,59992.0,-4524193753973475960
27,0.701584358,2a0d:6fc7:505:6e3:b391:e2e3:ca0d:6126,2a00:1450:4028:80a::2004,TCP,98,[TCP Dup ACK 21#1] 59992  >  443 [ACK] Seq=518 Ack=4099 Win=31872 Len=0 TSval=482064843 TSecr=473583989 SLE=3625 SRE=4099,Firefox,False,3.562800000000976e-05,59992.0,443.0,-821849069302390154
28,0.726388088,2a00:1450:4028:804::2003,2a0d:6fc7:505:6e3:b391:e2e3:ca0d:6126,TCP,94,"80  >  38206 [SYN, ACK] Seq=0 Ack=1 Win=65535 Len=0 MSS=1300 SACK_PERM TSval=809732434 TSecr=3994641956 WS=256",Firefox,False,0.024803730000000024,80.0,38206.0,-3117080213808756886
29,0.726388497,2a00:1450:4028:804::2003,2a0d:6fc7:505:6e3:b391:e2e3:ca0d:6126,TCP,94,"80  >  38212 [SYN, ACK] Seq=0 Ack=1 Win=65535 Len=0 MSS=1300 SACK_PERM TSval=4228419494 TSecr=3994641956 WS=256",Firefox,False,4.089999999790095e-07,80.0,38212.0,3958893836178028693
30,0.726443359,2a0d:6fc7:505:6e3:b391:e2e3:ca0d:6126,2a00:1450:4028:804::2003,TCP,86,38206  >  80 [ACK] Seq=1 Ack=1 Win=33152 Len=0 TSval=3994642006 TSecr=809732434,Firefox,False,5.4862000000044375e-05,38206.0,80.0,-6619552151434761760
31,0.726536888,2a0d:6fc7:505:6e3:b391:e2e3:ca0d:6126,2a00:1450:4028:804::2003,TCP,86,38212  >  80 [ACK] Seq=1 Ack=1 Win=33152 Len=0 TSval=3994642006 TSecr=4228419494,Firefox,False,9.352900000003661e-05,38212.0,80.0,-5853958554766049343
32,0.726706034,2a0d:6fc7:505:6e3:b391:e2e3:ca0d:6126,2a00:1450:4028:804::2003,OCSP,498,Request,Firefox,False,0.0001691459999999534,,,-1278878559938829420
33,0.726890121,2a0d:6fc7:505:6e3:b391:e2e3:ca0d:6126,2a00:1450:4028:804::2003,OCSP,498,Request,Firefox,False,0.00018408699999994393,,,-1278878559938829420
34,0.770473483,2a00:1450:4028:804::2003,2a0d:6fc7:505:6e3:b391:e2e3:ca0d:6126,TCP,86,80  >  38206 [ACK] Seq=1 Ack=413 Win=269568 Len=0 TSval=809732486 TSecr=3994642006,Firefox,False,0.043583362000000014,80.0,38206.0,-3117080213808756886
35,0.770474414,2a00:1450:4028:804::2003,2a0d:6fc7:505:6e3:b391:e2e3:ca0d:6126,TCP,86,80  >  38212 [ACK] Seq=1 Ack=413 Win=269568 Len=0 TSval=4228419546 TSecr=3994642006,Firefox,False,9.310000000928298e-07,80.0,38212.0,3958893836178028693
36,0.910243133,2a00:1450:4028:804::2003,2a0d:6fc7:505:6e3:b391:e2e3:ca0d:6126,OCSP,787,Response,Firefox,False,0.13976871899999999,,,4300435190118394157
37,0.91024342,2a00:1450:4028:804::2003,2a0d:6fc7:505:6e3:b391:e2e3:ca0d:6126,OCSP,787,Response,Firefox,False,2.8699999998771375e-07,,,4300435190118394157
38,0.910350371,2a0d:6fc7:505:6e3:b391:e2e3:ca0d:6126,2a00:1450:4028:804::2003,TCP,86,38206  >  80 [ACK] Seq=413 Ack=702 Win=32512 Len=0 TSval=3994642190 TSecr=809732621,Firefox,False,0.00010695100000002178,38206.0,80.0,-6619552151434761760
39,0.910469552,2a0d:6fc7:505:6e3:b391:e2e3:ca0d:6126,2a00:1450:4028:804::2003,TCP,86,38212  >  80 [ACK] Seq=413 Ack=702 Win=32512 Len=0 TSval=3994642190 TSecr=4228419681,Firefox,False,0.00011918099999996823,38212.0,80.0,-5853958554766049343
40,0.912455905,2a0d:6fc7:505:6e3:b391:e2e3:ca0d:6126,2a00:1450:4028:80a::2004,TLSv1.3,150,"Change Cipher Spec, Application Data",Firefox,False,0.0019863529999999407,,,7766148485364104488
41,0.913484256,2a0d:6fc7:505:6e3:b391:e2e3:ca0d:6126,2a00:1450:4028:80a::2004,TLSv1.3,256,Application Data,Firefox,False,0.001028351000000094,,,7766148485364104488
42,0.913652101,2a0d:6fc7:505:6e3:b391:e2e3:ca0d:6126,2a00:1450:4028:80a::2004,TCP,1374,59984  >  443 [ACK] Seq=752 Ack=4100 Win=31872 Len=1288 TSval=482065055 TSecr=2600509078 [TCP segment of a reassembled PDU],Firefox,False,0.0001678449999999998,59984.0,443.0,-1429296984425834311
43,0.913654717,2a0d:6fc7:505:6e3:b391:e2e3:ca0d:6126,2a00:1450:4028:80a::2004,TLSv1.3,849,Application Data,Firefox,False,2.6159999999553207e-06,,,7766148485364104488
44,0.91393753,2a0d:6fc7:505:6e3:b391:e2e3:ca0d:6126,2a00:1450:4028:80a::2004,TLSv1.3,150,"Change Cipher Spec, Application Data",Firefox,False,0.0002828129999999929,,,7766148485364104488
45,0.91430001,2a0d:6fc7:505:6e3:b391:e2e3:ca0d:6126,2a00:1450:4028:80a::2004,TLSv1.3,273,Application Data,Firefox,False,0.00036248000000005387,,,7766148485364104488
46,0.949025132,2a00:1450:4028:80a::2004,2a0d:6fc7:505:6e3:b391:e2e3:ca0d:6126,TCP,86,443  >  59984 [ACK] Seq=4100 Ack=582 Win=269568 Len=0 TSval=2600509428 TSecr=482065054,Firefox,False,0.034725122,443.0,59984.0,8464530201920232345
47,0.949025378,2a00:1450:4028:80a::2004,2a0d:6fc7:505:6e3:b391:e2e3:ca0d:6126,TCP,86,443  >  59984 [ACK] Seq=4100 Ack=752 Win=269568 Len=0 TSval=2600509428 TSecr=482065055,Firefox,False,2.459999999260276e-07,443.0,59984.0,8464530201920232345
48,0.949629055,2a00:1450:4028:80a::2004,2a0d:6fc7:505:6e3:b391:e2e3:ca0d:6126,TLSv1.3,700,"Application Data, Application Data",Firefox,False,0.0006036770000000802,,,5816378878603992574
49,0.949684085,2a0d:6fc7:505:6e3:b391:e2e3:ca0d:6126,2a00:1450:4028:80a::2004,TCP,86,59984  >  443 [ACK] Seq=2803 Ack=4714 Win=31872 Len=0 TSval=482065091 TSecr=2600509428,Firefox,False,5.502999999995595e-05,59984.0,443.0,-1429296984425834311
50,0.950851772,2a0d:6fc7:505:6e3:b391:e2e3:ca0d:6126,2a00:1450:4028:80a::2004,TLSv1.3,117,Application Data,Firefox,False,0.0011676870000000283,,,7766148485364104488
51,0.951441267,2a00:1450:4028:80a::2004,2a0d:6fc7:505:6e3:b391:e2e3:ca0d:6126,TCP,86,443  >  59992 [ACK] Seq=4099 Ack=582 Win=269568 Len=0 TSval=473584240 TSecr=482065055,Firefox,False,0.0005894949999999399,443.0,59992.0,-4524193753973475960
52,0.951441407,2a00:1450:4028:80a::2004,2a0d:6fc7:505:6e3:b391:e2e3:ca0d:6126,TCP,98,[TCP Dup ACK 47#1] 443  >  59984 [ACK] Seq=4714 Ack=752 Win=269568 Len=0 TSval=2600509429 TSecr=482065055 SLE=2040 SRE=2803,Firefox,False,1.4000000003733248e-07,443.0,59984.0,8464530201920232345
53,0.951441446,2a00:1450:4028:80a::2004,2a0d:6fc7:505:6e3:b391:e2e3:ca0d:6126,TCP,86,443  >  59984 [ACK] Seq=4714 Ack=2803 Win=267520 Len=0 TSval=2600509429 TSecr=482065055,Firefox,False,3.90000000072277e-08,443.0,59984.0,8464530201920232345
54,0.951441486,2a00:1450:4028:80a::2004,2a0d:6fc7:505:6e3:b391:e2e3:ca0d:6126,TCP,86,443  >  59992 [ACK] Seq=4099 Ack=769 Win=269568 Len=0 TSval=473584240 TSecr=482065056,Firefox,False,3.9999999978945766e-08,443.0,59992.0,-4524193753973475960
55,0.961219138,2a00:1450:4028:80a::2004,2a0d:6fc7:505:6e3:b391:e2e3:ca0d:6126,TLSv1.3,700,"Application Data, Application Data",Firefox,False,0.009777652000000026,,,5816378878603992574
56,0.96126772,2a0d:6fc7:505:6e3:b391:e2e3:ca0d:6126,2a00:1450:4028:80a::2004,TCP,86,59992  >  443 [ACK] Seq=769 Ack=4713 Win=31872 Len=0 TSval=482065103 TSecr=473584241,Firefox,False,4.858200000001922e-05,59992.0,443.0,-821849069302390154
57,0.96208373,2a0d:6fc7:505:6e3:b391:e2e3:ca0d:6126,2a00:1450:4028:80a::2004,TLSv1.3,110,Application Data,Firefox,False,0.0008160099999999781,,,7766148485364104488
58,0.962411882,2a0d:6fc7:505:6e3:b391:e2e3:ca0d:6126,2a00:1450:4028:80a::2004,TCP,86,"59992  >  443 [FIN, ACK] Seq=793 Ack=4713 Win=31872 Len=0 TSval=482065104 TSecr=473584241",Firefox,False,0.000328152000000026,59992.0,443.0,-821849069302390154
59,0.96306508,2a00:1450:4028:80a::2004,2a0d:6fc7:505:6e3:b391:e2e3:ca0d:6126,TLSv1.3,117,Application Data,Firefox,False,0.000653197999999966,,,5816378878603992574
60,0.963065476,2a00:1450:4028:80a::2004,2a0d:6fc7:505:6e3:b391:e2e3:ca0d:6126,TLSv1.3,117,Application Data,Firefox,False,3.960000000136077e-07,,,5816378878603992574
61,0.963311438,2a0d:6fc7:505:6e3:b391:e2e3:ca0d:6126,2a00:1450:4028:80a::2004,TCP,74,59992  >  443 [RST] Seq=769 Win=0 Len=0,Firefox,False,0.00024596199999993296,59992.0,443.0,-821849069302390154
62,0.985946675,2a00:1450:4028:80a::2004,2a0d:6fc7:505:6e3:b391:e2e3:ca0d:6126,TCP,86,443  >  59984 [ACK] Seq=4745 Ack=2834 Win=267520 Len=0 TSval=2600509465 TSecr=482065092,Firefox,False,0.02263523700000003,443.0,59984.0,8464530201920232345
63,1.001170791,2a00:1450:4028:80a::2004,2a0d:6fc7:505:6e3:b391:e2e3:ca0d:6126,TCP,86,443  >  59992 [ACK] Seq=4744 Ack=794 Win=269568 Len=0 TSval=473584288 TSecr=482065103,Firefox,False,0.015224116000000065,443.0,59992.0,-4524193753973475960
64,1.001170956,2a00:1450:4028:80a::2004,2a0d:6fc7:505:6e3:b391:e2e3:ca0d:6126,TCP,86,"443  >  59992 [FIN, ACK] Seq=4744 Ack=794 Win=269568 Len=0 TSval=473584288 TSecr=482065103",Firefox,False,1.649999998853957e-07,443.0,59992.0,-4524193753973475960
65,1.001200804,2a0d:6fc7:505:6e3:b391:e2e3:ca0d:6126,2a00:1450:4028:80a::2004,TCP,74,59992  >  443 [RST] Seq=794 Win=0 Len=0,Firefox,False,2.9848000000054498e-05,59992.0,443.0,-821849069302390154
66,1.001338106,2a0d:6fc7:505:6e3:b391:e2e3:ca0d:6126,2a00:1450:4028:80a::2004,TCP,74,59992  >  443 [RST] Seq=794 Win=0 Len=0,Firefox,False,0.0001373019999999503,59992.0,443.0,-821849069302390154
67,1.007165312,2a0d:6fc7:505:6e3:b391:e2e3:ca0d:6126,2a00:1450:4028:80a::2004,TCP,86,59984  >  443 [ACK] Seq=2834 Ack=4745 Win=31872 Len=0 TSval=482065149 TSecr=2600509430,Firefox,False,0.005827205999999974,59984.0,443.0,-1429296984425834311
68,1.070535972,2a00:1450:4028:80a::2004,2a0d:6fc7:505:6e3:b391:e2e3:ca0d:6126,TLSv1.3,644,Application Data,Firefox,False,0.06337066000000013,,,5816378878603992574
69,1.070536099,2a00:1450:4028:80a::2004,2a0d:6fc7:505:6e3:b391:e2e3:ca0d:6126,TLSv1.3,128,Application Data,Firefox,False,1.2699999984988608e-07,,,5816378878603992574
70,1.07059228,2a0d:6fc7:505:6e3:b391:e2e3:ca0d:6126,2a00:1450:4028:80a::2004,TCP,86,59984  >  443 [ACK] Seq=2834 Ack=5303 Win=31872 Len=0 TSval=482065212 TSecr=2600509538,Firefox,False,5.6181000000155024e-05,59984.0,443.0,-1429296984425834311
71,1.070690733,2a0d:6fc7:505:6e3:b391:e2e3:ca0d:6126,2a00:1450:4028:80a::2004,TCP,86,59984  >  443 [ACK] Seq=2834 Ack=5345 Win=31872 Len=0 TSval=482065212 TSecr=2600509538,Firefox,False,9.845299999988733e-05,59984.0,443.0,-1429296984425834311
72,1.074692488,2a0d:6fc7:505:6e3:b391:e2e3:ca0d:6126,2a00:1450:4028:80a::2004,QUIC,1399,"Initial, DCID=2fb6cc70e31b694f27e2325ec201, SCID=03e89b, PKN: 0, CRYPTO",Firefox,False,0.004001754999999996,,,7766148485364104488
73,1.115939279,2a00:1450:4028:80a::2004,2a0d:6fc7:505:6e3:b391:e2e3:ca0d:6126,QUIC,1399,"Initial, DCID=03e89b, SCID=efb6cc70e31b694f, PKN: 1, ACK, CRYPTO, PADDING",Firefox,False,0.04124679100000006,,,5816378878603992574
74,1.116465005,2a0d:6fc7:505:6e3:b391:e2e3:ca0d:6126,2a00:1450:4028:80a::2004,QUIC,102,"Handshake, DCID=efb6cc70e31b694f, SCID=03e89b",Firefox,False,0.0005257260000000041,,,7766148485364104488
75,1.139738359,2a00:1450:4028:80a::2004,2a0d:6fc7:505:6e3:b391:e2e3:ca0d:6126,TLSv1.3,1294,Application Data,Firefox,False,0.02327335400000008,,,5816378878603992574
76,1.139738666,2a00:1450:4028:80a::2004,2a0d:6fc7:505:6e3:b391:e2e3:ca0d:6126,TLSv1.3,1294,Application Data,Firefox,False,3.0699999986616433e-07,,,5816378878603992574
77,1.139738686,2a00:1450:4028:80a::2004,2a0d:6fc7:505:6e3:b391:e2e3:ca0d:6126,TLSv1.3,2502,"Application Data, Application Data",Firefox,False,2.0000000100495186e-08,,,5816378878603992574
78,1.139782134,2a0d:6fc7:505:6e3:b391:e2e3:ca0d:6126,2a00:1450:4028:80a::2004,TCP,86,59984  >  443 [ACK] Seq=2834 Ack=6553 Win=31872 Len=0 TSval=482065281 TSecr=2600509606,Firefox,False,4.3448000000001485e-05,59984.0,443.0,-1429296984425834311
79,1.139864053,2a0d:6fc7:505:6e3:b391:e2e3:ca0d:6126,2a00:1450:4028:80a::2004,TCP,86,59984  >  443 [ACK] Seq=2834 Ack=7761 Win=31872 Len=0 TSval=482065281 TSecr=2600509606,Firefox,False,8.191899999987484e-05,59984.0,443.0,-1429296984425834311
80,1.139895371,2a0d:6fc7:505:6e3:b391:e2e3:ca0d:6126,2a00:1450:4028:80a::2004,TCP,86,59984  >  443 [ACK] Seq=2834 Ack=10177 Win=31872 Len=0 TSval=482065281 TSecr=2600509608,Firefox,False,3.13180000000024e-05,59984.0,443.0,-1429296984425834311
81,1.143991699,2a00:1450:4028:80a::2004,2a0d:6fc7:505:6e3:b391:e2e3:ca0d:6126,TLSv1.3,2502,"Application Data, Application Data",Firefox,False,0.004096328000000149,,,5816378878603992574
82,1.143991866,2a00:1450:4028:80a::2004,2a0d:6fc7:505:6e3:b391:e2e3:ca0d:6126,TLSv1.3,2502,"Application Data, Application Data",Firefox,False,1.6699999982883185e-07,,,5816378878603992574
83,1.144015929,2a0d:6fc7:505:6e3:b391:e2e3:ca0d:6126,2a00:1450:4028:80a::2004,TCP,86,59984  >  443 [ACK] Seq=2834 Ack=12593 Win=31872 Len=0 TSval=482065285 TSecr=2600509610,Firefox,False,2.406300000012962e-05,59984.0,443.0,-1429296984425834311
84,1.144096131,2a0d:6fc7:505:6e3:b391:e2e3:ca0d:6126,2a00:1450:4028:80a::2004,TCP,86,59984  >  443 [ACK] Seq=2834 Ack=15009 Win=31872 Len=0 TSval=482065285 TSecr=2600509612,Firefox,False,8.020199999991817e-05,59984.0,443.0,-1429296984425834311
85,1.144465094,2a00:1450:4028:80a::2004,2a0d:6fc7:505:6e3:b391:e2e3:ca0d:6126,TLSv1.3,2502,"Application Data, Application Data",Firefox,False,0.00036896300000011095,,,5816378878603992574
86,1.14446527,2a00:1450:4028:80a::2004,2a0d:6fc7:505:6e3:b391:e2e3:ca0d:6126,TLSv1.3,2502,"Application Data, Application Data",Firefox,False,1.7599999990736137e-07,,,5816378878603992574
87,1.144469317,2a0d:6fc7:505:6e3:b391:e2e3:ca0d:6126,2a00:1450:4028:80a::2004,TCP,86,59984  >  443 [ACK] Seq=2834 Ack=17425 Win=31872 Len=0 TSval=482065286 TSecr=2600509614,Firefox,False,4.047000000007017e-06,59984.0,443.0,-1429296984425834311
88,1.144494794,2a0d:6fc7:505:6e3:b391:e2e3:ca0d:6126,2a00:1450:4028:80a::2004,TCP,86,59984  >  443 [ACK] Seq=2834 Ack=19841 Win=31872 Len=0 TSval=482065286 TSecr=2600509616,Firefox,False,2.5477000000106997e-05,59984.0,443.0,-1429296984425834311
89,1.148567922,2a00:1450:4028:80a::2004,2a0d:6fc7:505:6e3:b391:e2e3:ca0d:6126,TLSv1.3,1294,Application Data,Firefox,False,0.004073127999999926,,,5816378878603992574
90,1.148600531,2a0d:6fc7:505:6e3:b391:e2e3:ca0d:6126,2a00:1450:4028:80a::2004,TCP,86,59984  >  443 [ACK] Seq=2834 Ack=21049 Win=31872 Len=0 TSval=482065290 TSecr=2600509618,Firefox,False,3.2609000000016763e-05,59984.0,443.0,-1429296984425834311
91,1.151983766,2a00:1450:4028:80a::2004,2a0d:6fc7:505:6e3:b391:e2e3:ca0d:6126,TLSv1.3,1294,Application Data,Firefox,False,0.00338323500000004,,,5816378878603992574
92,1.151984072,2a00:1450:4028:80a::2004,2a0d:6fc7:505:6e3:b391:e2e3:ca0d:6126,TLSv1.3,2502,"Application Data, Application Data",Firefox,False,3.0600000000546856e-07,,,5816378878603992574
93,1.1519841,2a00:1450:4028:80a::2004,2a0d:6fc7:505:6e3:b391:e2e3:ca0d:6126,TLSv1.3,656,Application Data,Firefox,False,2.7999999874239734e-08,,,5816378878603992574
94,1.152023489,2a0d:6fc7:505:6e3:b391:e2e3:ca0d:6126,2a00:1450:4028:80a::2004,TCP,86,59984  >  443 [ACK] Seq=2834 Ack=22257 Win=31872 Len=0 TSval=482065293 TSecr=2600509618,Firefox,False,3.938900000011181e-05,59984.0,443.0,-1429296984425834311
95,1.152107743,2a0d:6fc7:505:6e3:b391:e2e3:ca0d:6126,2a00:1450:4028:80a::2004,TCP,86,59984  >  443 [ACK] Seq=2834 Ack=24673 Win=31872 Len=0 TSval=482065293 TSecr=2600509621,Firefox,False,8.42539999998948e-05,59984.0,443.0,-1429296984425834311
96,1.152247352,2a0d:6fc7:505:6e3:b391:e2e3:ca0d:6126,2a00:1450:4028:80a::2004,TCP,86,59984  >  443 [ACK] Seq=2834 Ack=25243 Win=31872 Len=0 TSval=482065294 TSecr=2600509623,Firefox,False,0.00013960900000009602,59984.0,443.0,-1429296984425834311
97,1.165457743,2a0d:6fc7:505:6e3:b391:e2e3:ca0d:6126,2a0d:6fc7:505:6e3::be,DNS,97,Standard query 0xe736 AAAA fonts.gstatic.com,Firefox,False,0.013210390999999877,,,2351851782027266242
98,1.172592462,2a00:1450:4028:80a::2004,2a0d:6fc7:505:6e3:b391:e2e3:ca0d:6126,QUIC,1399,"Handshake, DCID=03e89b, SCID=efb6cc70e31b694f",Firefox,False,0.007134718999999956,,,5816378878603992574
99,1.172592755,2a00:1450:4028:80a::2004,2a0d:6fc7:505:6e3:b391:e2e3:ca0d:6126,QUIC,1399,"Handshake, DCID=03e89b, SCID=efb6cc70e31b694f",Firefox,False,2.9300000004006677e-07,,,5816378878603992574
100,1.172592775,2a00:1450:4028:80a::2004,2a0d:6fc7:505:6e3:b391:e2e3:ca0d:6126,QUIC,1399,"Handshake, DCID=03e89b, SCID=efb6cc70e31b694f",Firefox,False,2.0000000100495186e-08,,,5816378878603992574
101,1.172780037,2a0d:6fc7:505:6e3:b391:e2e3:ca0d:6126,2a00:1450:4028:80a::2004,QUIC,104,"Handshake, DCID=efb6cc70e31b694f, SCID=03e89b",Firefox,False,0.00018726200000007687,,,7766148485364104488
102,1.173135933,2a0d:6fc7:505:6e3::be,2a0d:6fc7:505:6e3:b391:e2e3:ca0d:6126,DNS,125,Standard query response 0xe736 AAAA fonts.gstatic.com AAAA 2a00:1450:4028:80a::2003,Firefox,False,0.00035589599999985566,,,-3069401969345213175
103,1.173135964,2a00:1450:4028:80a::2004,2a0d:6fc7:505:6e3:b391:e2e3:ca0d:6126,QUIC,105,"Handshake, DCID=03e89b, SCID=efb6cc70e31b694f",Firefox,False,3.100000012246085e-08,,,5816378878603992574
104,1.17370962,2a0d:6fc7:505:6e3:b391:e2e3:ca0d:6126,2a00:1450:4028:80a::2003,QUIC,1399,"Initial, DCID=2f91abbbba2f77ad, SCID=d624aa, PKN: 0, CRYPTO",Firefox,False,0.0005736559999998114,,,-8876585847863696825
105,1.182737556,2a0d:6fc7:505:6e3:b391:e2e3:ca0d:6126,2a00:1450:4028:80a::2004,TLSv1.3,266,Application Data,Firefox,False,0.00902793600000007,,,7766148485364104488
106,1.182894381,2a0d:6fc7:505:6e3:b391:e2e3:ca0d:6126,2a00:1450:4028:80a::2004,TLSv1.3,121,Application Data,Firefox,False,0.0001568250000001381,,,7766148485364104488
107,1.215953082,2a00:1450:4028:80a::2004,2a0d:6fc7:505:6e3:b391:e2e3:ca0d:6126,QUIC,1399,"Handshake, DCID=03e89b, SCID=efb6cc70e31b694f",Firefox,False,0.03305870099999986,,,5816378878603992574
108,1.215953384,2a00:1450:4028:80a::2004,2a0d:6fc7:505:6e3:b391:e2e3:ca0d:6126,QUIC,1399,"Handshake, DCID=03e89b, SCID=efb6cc70e31b694f",Firefox,False,3.020000001185963e-07,,,5816378878603992574
109,1.215953404,2a00:1450:4028:80a::2004,2a0d:6fc7:505:6e3:b391:e2e3:ca0d:6126,QUIC,297,"Protected Payload (KP0), DCID=03e89b",Firefox,False,1.999999987845058e-08,,,5816378878603992574
110,1.217113438,2a0d:6fc7:505:6e3:b391:e2e3:ca0d:6126,2a00:1450:4028:80a::2004,QUIC,105,"Handshake, DCID=efb6cc70e31b694f, SCID=03e89b",Firefox,False,0.0011600339999999765,,,7766148485364104488
111,1.220216207,2a00:1450:4028:80a::2004,2a0d:6fc7:505:6e3:b391:e2e3:ca0d:6126,TCP,86,443  >  59984 [ACK] Seq=25243 Ack=3014 Win=267520 Len=0 TSval=2600509699 TSecr=482065324,Firefox,False,0.0031027690000000607,443.0,59984.0,8464530201920232345
112,1.220216385,2a00:1450:4028:80a::2004,2a0d:6fc7:505:6e3:b391:e2e3:ca0d:6126,TCP,86,443  >  59984 [ACK] Seq=25243 Ack=3049 Win=267520 Len=0 TSval=2600509699 TSecr=482065324,Firefox,False,1.780000000728421e-07,443.0,59984.0,8464530201920232345
113,1.220723899,2a0d:6fc7:505:6e3:b391:e2e3:ca0d:6126,2a00:1450:4028:804::2003,OCSP,498,Request,Firefox,False,0.0005075139999999312,,,-1278878559938829420
114,1.223302394,2a00:1450:4028:80a::2003,2a0d:6fc7:505:6e3:b391:e2e3:ca0d:6126,QUIC,1399,"Initial, DCID=d624aa, SCID=ef91abbbba2f77ad, PKN: 1, ACK, CRYPTO, PADDING",Firefox,False,0.0025784950000000695,,,-6758213627511268222
115,1.223862688,2a0d:6fc7:505:6e3:b391:e2e3:ca0d:6126,2a00:1450:4028:80a::2003,QUIC,102,"Handshake, DCID=ef91abbbba2f77ad, SCID=d624aa",Firefox,False,0.0005602940000000167,,,-8876585847863696825
116,1.23283788,2a00:1450:4028:80a::2004,2a0d:6fc7:505:6e3:b391:e2e3:ca0d:6126,TLSv1.3,1294,Application Data,Firefox,False,0.008975191999999854,,,5816378878603992574
117,1.232838094,2a00:1450:4028:80a::2004,2a0d:6fc7:505:6e3:b391:e2e3:ca0d:6126,TLSv1.3,831,Application Data,Firefox,False,2.140000001649156e-07,,,5816378878603992574
118,1.232901614,2a0d:6fc7:505:6e3:b391:e2e3:ca0d:6126,2a00:1450:4028:80a::2004,TCP,86,59984  >  443 [ACK] Seq=3049 Ack=27196 Win=31872 Len=0 TSval=482065374 TSecr=2600509710,Firefox,False,6.351999999987257e-05,59984.0,443.0,-1429296984425834311
119,1.237514715,2a0d:6fc7:505:6e3:b391:e2e3:ca0d:6126,2a00:1450:4028:80a::2004,QUIC,102,"Handshake, DCID=efb6cc70e31b694f, SCID=03e89b",Firefox,False,0.004613101000000119,,,7766148485364104488
120,1.237680753,2a0d:6fc7:505:6e3:b391:e2e3:ca0d:6126,2a00:1450:4028:80a::2004,QUIC,102,"Handshake, DCID=efb6cc70e31b694f, SCID=03e89b",Firefox,False,0.00016603799999992397,,,7766148485364104488
121,1.239592932,2a00:1450:4028:80a::2004,2a0d:6fc7:505:6e3:b391:e2e3:ca0d:6126,TLSv1.3,1294,Application Data,Firefox,False,0.0019121790000000694,,,5816378878603992574
122,1.240206428,2a00:1450:4028:80a::2004,2a0d:6fc7:505:6e3:b391:e2e3:ca0d:6126,TLSv1.3,1294,Application Data,Firefox,False,0.0006134959999999356,,,5816378878603992574
123,1.240224051,2a0d:6fc7:505:6e3:b391:e2e3:ca0d:6126,2a00:1450:4028:80a::2004,TCP,86,59984  >  443 [ACK] Seq=3049 Ack=29612 Win=36736 Len=0 TSval=482065382 TSecr=2600509717,Firefox,False,1.7622999999966638e-05,59984.0,443.0,-1429296984425834311
124,1.243085441,2a00:1450:4028:80a::2004,2a0d:6fc7:505:6e3:b391:e2e3:ca0d:6126,TLSv1.3,2502,"Application Data, Application Data",Firefox,False,0.0028613900000000747,,,5816378878603992574
125,1.243085853,2a00:1450:4028:80a::2004,2a0d:6fc7:505:6e3:b391:e2e3:ca0d:6126,TLSv1.3,659,Application Data,Firefox,False,4.119999998941637e-07,,,5816378878603992574
126,1.243116622,2a0d:6fc7:505:6e3:b391:e2e3:ca0d:6126,2a00:1450:4028:80a::2004,TCP,86,59984  >  443 [ACK] Seq=3049 Ack=32028 Win=41600 Len=0 TSval=482065384 TSecr=2600509719,Firefox,False,3.076900000009708e-05,59984.0,443.0,-1429296984425834311
127,1.244284993,2a00:1450:4028:80a::2004,2a0d:6fc7:505:6e3:b391:e2e3:ca0d:6126,TLSv1.3,220,Application Data,Firefox,False,0.0011683709999998904,,,5816378878603992574
128,1.244768684,2a0d:6fc7:505:6e3:b391:e2e3:ca0d:6126,2a00:1450:4028:80a::2004,TCP,86,59984  >  443 [ACK] Seq=3049 Ack=32735 Win=46464 Len=0 TSval=482065386 TSecr=2600509721,Firefox,False,0.00048369100000011933,59984.0,443.0,-1429296984425834311
129,1.247837633,2a0d:6fc7:505:6e3:b391:e2e3:ca0d:6126,2a0d:6fc7:505:6e3::be,DNS,104,Standard query 0x2e27 AAAA www.googleadservices.com,Firefox,False,0.0030689489999999875,,,2351851782027266242
130,1.250714468,2a00:1450:4028:80a::2004,2a0d:6fc7:505:6e3:b391:e2e3:ca0d:6126,TLSv1.3,828,Application Data,Firefox,False,0.002876834999999911,,,5816378878603992574
131,1.250714891,2a00:1450:4028:80a::2004,2a0d:6fc7:505:6e3:b391:e2e3:ca0d:6126,TLSv1.3,145,Application Data,Firefox,False,4.2300000013817396e-07,,,5816378878603992574
132,1.25088752,2a0d:6fc7:505:6e3:b391:e2e3:ca0d:6126,2a00:1450:4028:80a::2004,TCP,86,59984  >  443 [ACK] Seq=3049 Ack=33536 Win=48768 Len=0 TSval=482065392 TSecr=2600509727,Firefox,False,0.0001726289999999242,59984.0,443.0,-1429296984425834311
133,1.251934886,2a0d:6fc7:505:6e3:b391:e2e3:ca0d:6126,2a00:1450:4028:80a::2004,TLSv1.3,244,Application Data,Firefox,False,0.001047365999999883,,,7766148485364104488
134,1.267053388,2a00:1450:4028:80a::2004,2a0d:6fc7:505:6e3:b391:e2e3:ca0d:6126,TLSv1.3,1294,Application Data,Firefox,False,0.015118501999999978,,,5816378878603992574
135,1.267053636,2a00:1450:4028:80a::2004,2a0d:6fc7:505:6e3:b391:e2e3:ca0d:6126,TLSv1.3,982,Application Data,Firefox,False,2.4800000009150835e-07,,,5816378878603992574
136,1.267053664,2a00:1450:4028:804::2003,2a0d:6fc7:505:6e3:b391:e2e3:ca0d:6126,TCP,86,80  >  38206 [ACK] Seq=702 Ack=825 Win=269312 Len=0 TSval=809732974 TSecr=3994642500,Firefox,False,2.800000009628434e-08,80.0,38206.0,-3117080213808756886
137,1.267088862,2a0d:6fc7:505:6e3:b391:e2e3:ca0d:6126,2a00:1450:4028:80a::2004,TCP,86,59984  >  443 [ACK] Seq=3207 Ack=35640 Win=53632 Len=0 TSval=482065408 TSecr=2600509736,Firefox,False,3.519799999995854e-05,59984.0,443.0,-1429296984425834311
138,1.273052104,2a00:1450:4028:80a::2004,2a0d:6fc7:505:6e3:b391:e2e3:ca0d:6126,TLSv1.3,1294,Application Data,Firefox,False,0.00596324199999998,,,5816378878603992574
139,1.273052389,2a00:1450:4028:80a::2004,2a0d:6fc7:505:6e3:b391:e2e3:ca0d:6126,TLSv1.3,1294,Application Data,Firefox,False,2.850000000442776e-07,,,5816378878603992574
140,1.273052408,2a00:1450:4028:80a::2004,2a0d:6fc7:505:6e3:b391:e2e3:ca0d:6126,TLSv1.3,2502,"Application Data, Application Data",Firefox,False,1.9000000017754815e-08,,,5816378878603992574
141,1.273087869,2a0d:6fc7:505:6e3:b391:e2e3:ca0d:6126,2a00:1450:4028:80a::2004,TCP,86,59984  >  443 [ACK] Seq=3207 Ack=38056 Win=58496 Len=0 TSval=482065414 TSecr=2600509746,Firefox,False,3.5460999999958887e-05,59984.0,443.0,-1429296984425834311
142,1.273160256,2a0d:6fc7:505:6e3:b391:e2e3:ca0d:6126,2a00:1450:4028:80a::2004,TCP,86,59984  >  443 [ACK] Seq=3207 Ack=40472 Win=63360 Len=0 TSval=482065415 TSecr=2600509748,Firefox,False,7.238699999989606e-05,59984.0,443.0,-1429296984425834311
143,1.274002678,2a00:1450:4028:80a::2004,2a0d:6fc7:505:6e3:b391:e2e3:ca0d:6126,TLSv1.3,1294,Application Data,Firefox,False,0.0008424220000000648,,,5816378878603992574
144,1.274516975,2a00:1450:4028:80a::2004,2a0d:6fc7:505:6e3:b391:e2e3:ca0d:6126,TLSv1.3,1294,Application Data,Firefox,False,0.0005142970000000524,,,5816378878603992574
145,1.274517101,2a00:1450:4028:80a::2003,2a0d:6fc7:505:6e3:b391:e2e3:ca0d:6126,QUIC,1399,"Handshake, DCID=d624aa, SCID=ef91abbbba2f77ad",Firefox,False,1.2599999998919031e-07,,,-6758213627511268222
146,1.27451712,2a00:1450:4028:80a::2003,2a0d:6fc7:505:6e3:b391:e2e3:ca0d:6126,QUIC,1399,"Handshake, DCID=d624aa, SCID=ef91abbbba2f77ad",Firefox,False,1.9000000017754815e-08,,,-6758213627511268222
147,1.27451714,2a00:1450:4028:80a::2003,2a0d:6fc7:505:6e3:b391:e2e3:ca0d:6126,QUIC,1399,"Handshake, DCID=d624aa, SCID=ef91abbbba2f77ad",Firefox,False,1.999999987845058e-08,,,-6758213627511268222
148,1.274517159,2a00:1450:4028:80a::2003,2a0d:6fc7:505:6e3:b391:e2e3:ca0d:6126,QUIC,105,"Handshake, DCID=d624aa, SCID=ef91abbbba2f77ad",Firefox,False,1.9000000017754815e-08,,,-6758213627511268222
149,1.274526013,2a0d:6fc7:505:6e3:b391:e2e3:ca0d:6126,2a00:1450:4028:80a::2004,TCP,86,59984  >  443 [ACK] Seq=3207 Ack=42888 Win=68096 Len=0 TSval=482065416 TSecr=2600509750,Firefox,False,8.854000000058093e-06,59984.0,443.0,-1429296984425834311
150,1.27732295,2a0d:6fc7:505:6e3:b391:e2e3:ca0d:6126,2a00:1450:4028:80a::2003,QUIC,104,"Handshake, DCID=ef91abbbba2f77ad, SCID=d624aa",Firefox,False,0.002796937000000055,,,-8876585847863696825
151,1.283780927,2a00:1450:4028:80a::2004,2a0d:6fc7:505:6e3:b391:e2e3:ca0d:6126,TLSv1.3,2502,"Application Data, Application Data",Firefox,False,0.006457976999999948,,,5816378878603992574
152,1.283781066,2a00:1450:4028:80a::2004,2a0d:6fc7:505:6e3:b391:e2e3:ca0d:6126,TLSv1.3,186,Application Data,Firefox,False,1.389999999545921e-07,,,5816378878603992574
153,1.283781094,2a00:1450:4028:80a::2004,2a0d:6fc7:505:6e3:b391:e2e3:ca0d:6126,QUIC,105,"Handshake, DCID=03e89b, SCID=efb6cc70e31b694f",Firefox,False,2.800000009628434e-08,,,5816378878603992574
154,1.283781113,2a0d:6fc7:505:6e3::be,2a0d:6fc7:505:6e3:b391:e2e3:ca0d:6126,DNS,164,Standard query response 0x2e27 AAAA www.googleadservices.com SOA ns1.google.com,Firefox,False,1.9000000017754815e-08,,,-3069401969345213175
155,1.283781132,2a00:1450:4028:80a::2004,2a0d:6fc7:505:6e3:b391:e2e3:ca0d:6126,QUIC,105,"Handshake, DCID=03e89b, SCID=efb6cc70e31b694f",Firefox,False,1.9000000017754815e-08,,,5816378878603992574
156,1.283809546,2a0d:6fc7:505:6e3:b391:e2e3:ca0d:6126,2a00:1450:4028:80a::2004,TCP,86,59984  >  443 [ACK] Seq=3207 Ack=45304 Win=72960 Len=0 TSval=482065425 TSecr=2600509752,Firefox,False,2.8413999999976625e-05,59984.0,443.0,-1429296984425834311
157,1.284072746,2a0d:6fc7:505:6e3:b391:e2e3:ca0d:6126,2a0d:6fc7:505:6e3::be,DNS,104,Standard query 0x9e06 AAAA www.googleadservices.com,Firefox,False,0.000263200000000019,,,2351851782027266242
158,1.293789119,2a0d:6fc7:505:6e3::be,2a0d:6fc7:505:6e3:b391:e2e3:ca0d:6126,DNS,104,Standard query response 0x9e06 AAAA www.googleadservices.com,Firefox,False,0.009716372999999834,,,-3069401969345213175
159,1.293789377,2a00:1450:4028:80a::2004,2a0d:6fc7:505:6e3:b391:e2e3:ca0d:6126,TCP,86,443  >  59984 [ACK] Seq=45404 Ack=3207 Win=267520 Len=0 TSval=2600509770 TSecr=482065393,Firefox,False,2.5800000003073364e-07,443.0,59984.0,8464530201920232345
160,1.294281331,2a0d:6fc7:505:6e3:b391:e2e3:ca0d:6126,2a0d:6fc7:505:6e3::be,DNS,104,Standard query 0x0521 AAAA www.googleadservices.com,Firefox,False,0.0004919540000001277,,,2351851782027266242
161,1.294855402,2a0d:6fc7:505:6e3:b391:e2e3:ca0d:6126,2a00:1450:4028:80a::2004,TLSv1.3,186,Application Data,Firefox,False,0.0005740709999999538,,,7766148485364104488
162,1.294927774,2a0d:6fc7:505:6e3:b391:e2e3:ca0d:6126,2a00:1450:4028:80a::2004,TLSv1.3,121,Application Data,Firefox,False,7.237199999998722e-05,,,7766148485364104488
163,1.298424373,2a0d:6fc7:505:6e3::be,2a0d:6fc7:505:6e3:b391:e2e3:ca0d:6126,DNS,104,Standard query response 0x0521 AAAA www.googleadservices.com,Firefox,False,0.003496598999999989,,,-3069401969345213175
164,1.298661822,2a0d:6fc7:505:6e3:b391:e2e3:ca0d:6126,2a0d:6fc7:505:6e3::be,DNS,104,Standard query 0x07b0 AAAA www.googleadservices.com,Firefox,False,0.00023744899999988966,,,2351851782027266242
165,1.303756731,2a0d:6fc7:505:6e3:b391:e2e3:ca0d:6126,2a00:1450:4028:80a::2004,TLSv1.3,359,Application Data,Firefox,False,0.005094909000000092,,,7766148485364104488
166,1.30400991,2a0d:6fc7:505:6e3:b391:e2e3:ca0d:6126,2a00:1450:4028:80a::2004,TLSv1.3,117,Application Data,Firefox,False,0.00025317899999999227,,,7766148485364104488
167,1.309507767,2a00:1450:4028:80a::2004,2a0d:6fc7:505:6e3:b391:e2e3:ca0d:6126,TLSv1.3,1294,Application Data,Firefox,False,0.005497856999999939,,,5816378878603992574
168,1.311331628,2a0d:6fc7:505:6e3::be,2a0d:6fc7:505:6e3:b391:e2e3:ca0d:6126,DNS,104,Standard query response 0x07b0 AAAA www.googleadservices.com,Firefox,False,0.0018238610000000932,,,-3069401969345213175
169,1.321215868,2a00:1450:4028:80a::2004,2a0d:6fc7:505:6e3:b391:e2e3:ca0d:6126,TLSv1.3,1294,Application Data,Firefox,False,0.009884239999999878,,,5816378878603992574
170,1.321245721,2a0d:6fc7:505:6e3:b391:e2e3:ca0d:6126,2a00:1450:4028:80a::2004,TCP,86,59984  >  443 [ACK] Seq=3646 Ack=47820 Win=77824 Len=0 TSval=482065463 TSecr=2600509786,Firefox,False,2.985300000002411e-05,59984.0,443.0,-1429296984425834311
171,1.326119222,2a00:1450:4028:80a::2004,2a0d:6fc7:505:6e3:b391:e2e3:ca0d:6126,TLSv1.3,2502,"Application Data, Application Data",Firefox,False,0.004873501000000058,,,5816378878603992574
172,1.326119454,2a00:1450:4028:80a::2004,2a0d:6fc7:505:6e3:b391:e2e3:ca0d:6126,TLSv1.3,2502,"Application Data, Application Data",Firefox,False,2.3200000009993005e-07,,,5816378878603992574
173,1.326119472,2a00:1450:4028:80a::2004,2a0d:6fc7:505:6e3:b391:e2e3:ca0d:6126,TLSv1.3,2502,"Application Data, Application Data",Firefox,False,1.7999999935014444e-08,,,5816378878603992574
174,1.32611949,2a00:1450:4028:80a::2004,2a0d:6fc7:505:6e3:b391:e2e3:ca0d:6126,TLSv1.3,2502,"Application Data, Application Data",Firefox,False,1.7999999935014444e-08,,,5816378878603992574
175,1.3261518,2a0d:6fc7:505:6e3:b391:e2e3:ca0d:6126,2a00:1450:4028:80a::2004,TCP,86,59984  >  443 [ACK] Seq=3646 Ack=50236 Win=82688 Len=0 TSval=482065468 TSecr=2600509788,Firefox,False,3.231000000014639e-05,59984.0,443.0,-1429296984425834311
176,1.326232635,2a0d:6fc7:505:6e3:b391:e2e3:ca0d:6126,2a00:1450:4028:80a::2004,TCP,86,59984  >  443 [ACK] Seq=3646 Ack=52652 Win=87424 Len=0 TSval=482065468 TSecr=2600509790,Firefox,False,8.08349999998903e-05,59984.0,443.0,-1429296984425834311
177,1.326254357,2a0d:6fc7:505:6e3:b391:e2e3:ca0d:6126,2a00:1450:4028:80a::2004,TCP,86,59984  >  443 [ACK] Seq=3646 Ack=55068 Win=92288 Len=0 TSval=482065468 TSecr=2600509792,Firefox,False,2.1722000000057307e-05,59984.0,443.0,-1429296984425834311
178,1.326271302,2a0d:6fc7:505:6e3:b391:e2e3:ca0d:6126,2a00:1450:4028:80a::2004,TCP,86,59984  >  443 [ACK] Seq=3646 Ack=57484 Win=97152 Len=0 TSval=482065468 TSecr=2600509794,Firefox,False,1.694500000004595e-05,59984.0,443.0,-1429296984425834311
179,1.328398355,2a0d:6fc7:505:6e3:b391:e2e3:ca0d:6126,2a00:1450:4028:80a::2004,QUIC,102,"Handshake, DCID=efb6cc70e31b694f, SCID=03e89b",Firefox,False,0.0021270529999999344,,,7766148485364104488
180,1.32857538,2a0d:6fc7:505:6e3:b391:e2e3:ca0d:6126,2a00:1450:4028:80a::2004,QUIC,102,"Handshake, DCID=efb6cc70e31b694f, SCID=03e89b",Firefox,False,0.0001770249999999418,,,7766148485364104488
181,1.329323405,2a00:1450:4028:80a::2004,2a0d:6fc7:505:6e3:b391:e2e3:ca0d:6126,TLSv1.3,2502,"Application Data, Application Data",Firefox,False,0.000748025000000041,,,5816378878603992574
182,1.329323642,2a00:1450:4028:80a::2004,2a0d:6fc7:505:6e3:b391:e2e3:ca0d:6126,TLSv1.3,1509,"Application Data, Application Data",Firefox,False,2.370000000695427e-07,,,5816378878603992574
183,1.329323661,2a00:1450:4028:80a::2004,2a0d:6fc7:505:6e3:b391:e2e3:ca0d:6126,TLSv1.3,1294,Application Data,Firefox,False,1.9000000017754815e-08,,,5816378878603992574
184,1.329323682,2a00:1450:4028:80a::2004,2a0d:6fc7:505:6e3:b391:e2e3:ca0d:6126,TLSv1.3,1294,Application Data,Firefox,False,2.099999996119095e-08,,,5816378878603992574
185,1.329363729,2a0d:6fc7:505:6e3:b391:e2e3:ca0d:6126,2a00:1450:4028:80a::2004,TCP,86,59984  >  443 [ACK] Seq=3646 Ack=59900 Win=102016 Len=0 TSval=482065471 TSecr=2600509796,Firefox,False,4.0046999999932e-05,59984.0,443.0,-1429296984425834311
186,1.329436412,2a0d:6fc7:505:6e3:b391:e2e3:ca0d:6126,2a00:1450:4028:80a::2004,TCP,86,59984  >  443 [ACK] Seq=3646 Ack=63739 Win=104576 Len=0 TSval=482065471 TSecr=2600509798,Firefox,False,7.26829999999623e-05,59984.0,443.0,-1429296984425834311
187,1.332335775,2a00:1450:4028:80a::2003,2a0d:6fc7:505:6e3:b391:e2e3:ca0d:6126,QUIC,405,"Protected Payload (KP0), DCID=d624aa",Firefox,False,0.0028993630000000437,,,-6758213627511268222
188,1.333254167,2a0d:6fc7:505:6e3:b391:e2e3:ca0d:6126,2a00:1450:4028:80a::2003,QUIC,105,"Handshake, DCID=ef91abbbba2f77ad, SCID=d624aa",Firefox,False,0.0009183919999999901,,,-8876585847863696825
189,1.335316523,2a00:1450:4028:80a::2004,2a0d:6fc7:505:6e3:b391:e2e3:ca0d:6126,TLSv1.3,2502,"Application Data, Application Data",Firefox,False,0.002062355999999932,,,5816378878603992574
190,1.33531677,2a00:1450:4028:80a::2004,2a0d:6fc7:505:6e3:b391:e2e3:ca0d:6126,TLSv1.3,1294,Application Data,Firefox,False,2.47000000008768e-07,,,5816378878603992574
191,1.33534958,2a0d:6fc7:505:6e3:b391:e2e3:ca0d:6126,2a00:1450:4028:80a::2004,TCP,86,59984  >  443 [ACK] Seq=3646 Ack=66155 Win=109440 Len=0 TSval=482065477 TSecr=2600509804,Firefox,False,3.280999999999423e-05,59984.0,443.0,-1429296984425834311
192,1.335814223,2a00:1450:4028:80a::2004,2a0d:6fc7:505:6e3:b391:e2e3:ca0d:6126,TLSv1.3,1294,Application Data,Firefox,False,0.00046464300000015335,,,5816378878603992574
