"No.","Time","Source","Destination","Protocol","Length","Info"
"1","0.000000000","2a0d:6fc7:505:6e3:2f1f:5c99:6afa:38e4","2407:30c0:100:721:a380:8d6a:6b10:9d9b","TCP","86","52312  >  443 [ACK] Seq=1 Ack=1 Win=249 Len=0 TSval=2447732805 TSecr=3063459390"
"2","0.173102308","2407:30c0:100:721:a380:8d6a:6b10:9d9b","2a0d:6fc7:505:6e3:2f1f:5c99:6afa:38e4","TCP","86","[TCP ACKed unseen segment] 443  >  52312 [ACK] Seq=1 Ack=2 Win=501 Len=0 TSval=3063469649 TSecr=2447712573"
"3","0.688489383","2407:30c0:180::1","2a0d:6fc7:505:6e3:2f1f:5c99:6afa:38e4","UDP","553","443  >  36993 Len=491"
"4","0.688489693","2407:30c0:180::1","2a0d:6fc7:505:6e3:2f1f:5c99:6afa:38e4","UDP","97","443  >  36993 Len=35"
"5","0.688489721","2407:30c0:181::1","2a0d:6fc7:505:6e3:2f1f:5c99:6afa:38e4","UDP","553","443  >  47613 Len=491"
"6","0.688489740","2407:30c0:181::1","2a0d:6fc7:505:6e3:2f1f:5c99:6afa:38e4","UDP","97","443  >  47613 Len=35"
"7","0.688515475","2a0d:6fc7:505:6e3:2f1f:5c99:6afa:38e4","2407:30c0:180::1","ICMPv6","601","Destination Unreachable (Port unreachable)"
"8","0.688590601","2a0d:6fc7:505:6e3:2f1f:5c99:6afa:38e4","2407:30c0:180::1","ICMPv6","145","Destination Unreachable (Port unreachable)"
"9","0.688617758","2a0d:6fc7:505:6e3:2f1f:5c99:6afa:38e4","2407:30c0:181::1","ICMPv6","601","Destination Unreachable (Port unreachable)"
"10","0.688640261","2a0d:6fc7:505:6e3:2f1f:5c99:6afa:38e4","2407:30c0:181::1","ICMPv6","145","Destination Unreachable (Port unreachable)"
"11","0.722468671","2a0d:6fc7:505:6e3:2f1f:5c99:6afa:38e4","2a02:6ea0:e700::7","TLSv1.2","125","Application Data"
"12","0.859549111","2a02:6ea0:e700::7","2a0d:6fc7:505:6e3:2f1f:5c99:6afa:38e4","TLSv1.2","125","Application Data"
"13","0.912137750","2a0d:6fc7:505:6e3:2f1f:5c99:6afa:38e4","2a02:6ea0:e700::7","TCP","86","57298  >  443 [ACK] Seq=40 Ack=40 Win=688 Len=0 TSval=3257653137 TSecr=524969294"
"14","2.819996373","2a0d:6fc7:505:6e3:2f1f:5c99:6afa:38e4","2600:9000:2600:400:5:c033:1800:93a1","TCP","86","53542  >  443 [ACK] Seq=1 Ack=1 Win=1846 Len=0 TSval=2800822249 TSecr=1153442668"
"15","2.820125944","192.168.56.42","23.40.158.218","TCP","66","45240  >  80 [ACK] Seq=1 Ack=1 Win=249 Len=0 TSval=1412361758 TSecr=2554894807"
"16","2.874399192","2407:30c0:182::aa72:3403","2a0d:6fc7:505:6e3:2f1f:5c99:6afa:38e4","TCP","86","443  >  45356 [ACK] Seq=1 Ack=1 Win=9 Len=0 TSval=1900272007 TSecr=3143523286"
"17","2.874419729","2a0d:6fc7:505:6e3:2f1f:5c99:6afa:38e4","2407:30c0:182::aa72:3403","TCP","86","[TCP ACKed unseen segment] 45356  >  443 [ACK] Seq=1 Ack=2 Win=1754 Len=0 TSval=3143538767 TSecr=1900241435"
"18","2.912729360","2600:9000:2600:400:5:c033:1800:93a1","2a0d:6fc7:505:6e3:2f1f:5c99:6afa:38e4","TCP","86","[TCP ACKed unseen segment] 443  >  53542 [ACK] Seq=1 Ack=2 Win=145 Len=0 TSval=1153452908 TSecr=2800801817"
"19","2.912818523","23.40.158.218","192.168.56.42","TCP","66","[TCP ACKed unseen segment] 80  >  45240 [ACK] Seq=1 Ack=2 Win=506 Len=0 TSval=2554905045 TSecr=1412341431"
"20","3.071992889","192.168.56.42","134.224.0.55","TCP","66","53664  >  443 [ACK] Seq=1 Ack=1 Win=249 Len=0 TSval=375573975 TSecr=3383497972"
"21","3.267015621","134.224.0.55","192.168.56.42","TCP","66","[TCP ACKed unseen segment] 443  >  53664 [ACK] Seq=1 Ack=2 Win=478 Len=0 TSval=3383508351 TSecr=375553578"
"22","3.548461695","2407:30c0:181::1","2a0d:6fc7:505:6e3:2f1f:5c99:6afa:38e4","UDP","553","443  >  40200 Len=491"
"23","3.548462072","2407:30c0:181::1","2a0d:6fc7:505:6e3:2f1f:5c99:6afa:38e4","UDP","97","443  >  40200 Len=35"
"24","3.548501394","2a0d:6fc7:505:6e3:2f1f:5c99:6afa:38e4","2407:30c0:181::1","ICMPv6","601","Destination Unreachable (Port unreachable)"
"25","3.548642668","2a0d:6fc7:505:6e3:2f1f:5c99:6afa:38e4","2407:30c0:181::1","ICMPv6","145","Destination Unreachable (Port unreachable)"
"26","4.095975823","2a0d:6fc7:505:6e3:2f1f:5c99:6afa:38e4","2600:9000:2600:400:5:c033:1800:93a1","TCP","86","[TCP ZeroWindow] 53530  >  443 [ACK] Seq=1 Ack=1 Win=0 Len=0 TSval=2800823525 TSecr=2280973367"
"27","4.216060581","2600:9000:2600:400:5:c033:1800:93a1","2a0d:6fc7:505:6e3:2f1f:5c99:6afa:38e4","TCP","86","[TCP ACKed unseen segment] 443  >  53530 [ACK] Seq=1 Ack=2 Win=145 Len=0 TSval=2280983626 TSecr=2800814337"
"28","5.772805632","2600:9000:2600:400:5:c033:1800:93a1","2a0d:6fc7:505:6e3:2f1f:5c99:6afa:38e4","TCP","86","[TCP Keep-Alive] 443  >  53530 [ACK] Seq=0 Ack=2 Win=145 Len=0 TSval=2280985182 TSecr=2800814337"
"29","5.772840745","2a0d:6fc7:505:6e3:2f1f:5c99:6afa:38e4","2600:9000:2600:400:5:c033:1800:93a1","TCP","86","[TCP ZeroWindow] [TCP Previous segment not captured] 53530  >  443 [ACK] Seq=2 Ack=1 Win=0 Len=0 TSval=2800825201 TSecr=2280983626"
"30","6.399947175","2a0d:6fc7:505:6e3:2f1f:5c99:6afa:38e4","2a00:1450:4028:806::2003","TCP","86","44200  >  80 [ACK] Seq=1 Ack=1 Win=254 Len=0 TSval=1734292958 TSecr=596811313"
"31","6.434054876","2a00:1450:4028:806::2003","2a0d:6fc7:505:6e3:2f1f:5c99:6afa:38e4","TCP","86","[TCP ACKed unseen segment] 80  >  44200 [ACK] Seq=1 Ack=2 Win=1053 Len=0 TSval=596821534 TSecr=1734231757"
"32","7.068543673","2407:30c0:182::aa72:3403","2a0d:6fc7:505:6e3:2f1f:5c99:6afa:38e4","TCP","86","443  >  42118 [ACK] Seq=1 Ack=1 Win=9 Len=0 TSval=2325267708 TSecr=3143527602"
"33","7.068563106","2a0d:6fc7:505:6e3:2f1f:5c99:6afa:38e4","2407:30c0:182::aa72:3403","TCP","86","[TCP ACKed unseen segment] 42118  >  443 [ACK] Seq=1 Ack=2 Win=4945 Len=0 TSval=3143542961 TSecr=2325237145"
"34","7.423965524","192.168.56.42","170.114.12.132","TCP","54","53678  >  443 [ACK] Seq=1 Ack=1 Win=249 Len=0"
"35","7.618395919","170.114.12.132","192.168.56.42","TCP","60","[TCP ACKed unseen segment] 443  >  53678 [ACK] Seq=1 Ack=2 Win=9 Len=0"
"36","9.724112030","2a0d:6fc7:505:6e3:2f1f:5c99:6afa:38e4","2a04:4e42:8e::485","TLSv1.2","125","Application Data"
"37","9.724311069","192.168.56.42","34.96.118.58","TLSv1.2","105","Application Data"
"38","9.773070180","34.96.118.58","192.168.56.42","TCP","66","443  >  53966 [ACK] Seq=1 Ack=40 Win=996 Len=0 TSval=440692896 TSecr=2045638562"
"39","9.773070452","34.96.118.58","192.168.56.42","TLSv1.2","105","Application Data"
"40","9.815982698","192.168.56.42","34.96.118.58","TCP","66","53966  >  443 [ACK] Seq=40 Ack=40 Win=5853 Len=0 TSval=2045638654 TSecr=440692896"
"41","9.825444914","2a04:4e42:8e::485","2a0d:6fc7:505:6e3:2f1f:5c99:6afa:38e4","TCP","86","443  >  33422 [ACK] Seq=1 Ack=40 Win=284 Len=0 TSval=1052581330 TSecr=262732549"
"42","9.825445211","2a04:4e42:8e::485","2a0d:6fc7:505:6e3:2f1f:5c99:6afa:38e4","TLSv1.2","125","Application Data"
"43","9.867983489","2a0d:6fc7:505:6e3:2f1f:5c99:6afa:38e4","2a04:4e42:8e::485","TCP","86","33422  >  443 [ACK] Seq=40 Ack=40 Win=249 Len=0 TSval=262732693 TSecr=1052581330"
"44","10.239990049","2a0d:6fc7:505:6e3:2f1f:5c99:6afa:38e4","2407:30c0:100:721:a380:8d6a:6b10:9d9b","TCP","86","[TCP Dup ACK 1#1] 52312  >  443 [ACK] Seq=1 Ack=1 Win=249 Len=0 TSval=2447743045 TSecr=3063469649"
"45","10.441794979","2407:30c0:100:721:a380:8d6a:6b10:9d9b","2a0d:6fc7:505:6e3:2f1f:5c99:6afa:38e4","TCP","86","[TCP Dup ACK 2#1] 443  >  52312 [ACK] Seq=1 Ack=2 Win=501 Len=0 TSval=3063479918 TSecr=2447712573"
"46","10.724780433","192.168.56.42","20.50.73.13","TLSv1.2","105","Application Data"
"47","10.987269321","20.50.73.13","192.168.56.42","TLSv1.2","105","Application Data"
"48","10.987290820","192.168.56.42","20.50.73.13","TCP","66","53182  >  443 [ACK] Seq=40 Ack=40 Win=249 Len=0 TSval=3547315257 TSecr=6467248"
"49","11.930494789","192.168.56.210","192.168.56.255","UDP","86","57621  >  57621 Len=44"
"50","11.971061942","192.168.56.210","192.168.56.255","UDP","86","57621  >  57621 Len=44"
"51","12.043434753","2a0d:6fc7:505:6e3:d91a:4fac:c3ba:77f6","2001:40a8:4400:3::5266:9831","TLSv1","2176","Client Hello (SNI=i.scdn.co)"
"52","12.117052443","2a0d:6fc7:505:6e3:d91a:4fac:c3ba:77f6","2600:1901:1:7c5::","TLSv1","1807","Client Hello (SNI=spclient.wg.spotify.com)"
"53","13.007469966","2a0d:6fc7:505:6e3:d91a:4fac:c3ba:77f6","2600:1901:1:5a5::","TLSv1","2197","Client Hello (SNI=gew1-spclient.spotify.com)"
"54","13.056003990","2a0d:6fc7:505:6e3:2f1f:5c99:6afa:38e4","2600:9000:2600:400:5:c033:1800:93a1","TCP","86","[TCP Dup ACK 14#1] 53542  >  443 [ACK] Seq=1 Ack=1 Win=1846 Len=0 TSval=2800832485 TSecr=1153452908"
"55","13.056182917","192.168.56.42","23.40.158.218","TCP","66","[TCP Dup ACK 15#1] 45240  >  80 [ACK] Seq=1 Ack=1 Win=249 Len=0 TSval=1412371994 TSecr=2554905045"
"56","13.157467124","2600:9000:2600:400:5:c033:1800:93a1","2a0d:6fc7:505:6e3:2f1f:5c99:6afa:38e4","TCP","86","[TCP Dup ACK 18#1] 443  >  53542 [ACK] Seq=1 Ack=2 Win=145 Len=0 TSval=1153463147 TSecr=2800801817"
"57","13.164015739","23.40.158.218","192.168.56.42","TCP","66","[TCP Dup ACK 19#1] 80  >  45240 [ACK] Seq=1 Ack=2 Win=506 Len=0 TSval=2554915285 TSecr=1412341431"
"58","13.311951297","192.168.56.42","134.224.0.55","TCP","66","[TCP Dup ACK 20#1] 53664  >  443 [ACK] Seq=1 Ack=1 Win=249 Len=0 TSval=375584215 TSecr=3383508351"
"59","13.496117206","134.224.0.55","192.168.56.42","TCP","66","[TCP Dup ACK 21#1] 443  >  53664 [ACK] Seq=1 Ack=2 Win=478 Len=0 TSval=3383518573 TSecr=375553578"
"60","13.588687328","2407:30c0:182::aa72:344a","2a0d:6fc7:505:6e3:2f1f:5c99:6afa:38e4","TCP","86","443  >  52602 [ACK] Seq=1 Ack=1 Win=9 Len=0 TSval=1645680107 TSecr=145754545"
"61","13.588708248","2a0d:6fc7:505:6e3:2f1f:5c99:6afa:38e4","2407:30c0:182::aa72:344a","TCP","86","[TCP ACKed unseen segment] 52602  >  443 [ACK] Seq=1 Ack=2 Win=249 Len=0 TSval=145769702 TSecr=1645634250"
"62","13.725626037","2a0d:6fc7:505:6e3:2f1f:5c99:6afa:38e4","2600:9000:2600:be00:8:3f23:2f00:93a1","TLSv1.2","125","Application Data"
"63","13.816177455","2600:9000:2600:be00:8:3f23:2f00:93a1","2a0d:6fc7:505:6e3:2f1f:5c99:6afa:38e4","TLSv1.2","125","Application Data"
"64","13.816211522","2a0d:6fc7:505:6e3:2f1f:5c99:6afa:38e4","2600:9000:2600:be00:8:3f23:2f00:93a1","TCP","86","51660  >  443 [ACK] Seq=40 Ack=40 Win=9262 Len=0 TSval=4166378924 TSecr=3176104779"
"65","14.119768555","fe80::20c:29ff:fe2c:8247","ff02::16","ICMPv6","110","Multicast Listener Report Message v2"
"66","14.335967095","2a0d:6fc7:505:6e3:2f1f:5c99:6afa:38e4","2600:9000:2600:400:5:c033:1800:93a1","TCP","86","[TCP ZeroWindow] [TCP Keep-Alive] 53530  >  443 [ACK] Seq=1 Ack=1 Win=0 Len=0 TSval=2800833765 TSecr=2280983626"
"67","14.447133657","2600:9000:2600:400:5:c033:1800:93a1","2a0d:6fc7:505:6e3:2f1f:5c99:6afa:38e4","TCP","86","[TCP Keep-Alive ACK] 443  >  53530 [ACK] Seq=1 Ack=2 Win=145 Len=0 TSval=2280993858 TSecr=2800825201"
"68","15.032617264","192.168.56.210","192.168.56.255","UDP","86","57621  >  57621 Len=44"
"69","15.072060058","fe80::20c:29ff:fe2c:8247","ff02::16","ICMPv6","110","Multicast Listener Report Message v2"
"70","16.111326286","2a0d:6fc7:505:6e3:2f1f:5c99:6afa:38e4","2600:9000:2600:400:5:c033:1800:93a1","TCP","86","[TCP Window Update] 53530  >  443 [ACK] Seq=2 Ack=1 Win=1874 Len=0 TSval=2800835540 TSecr=2280993858"
"71","16.112280822","2a0d:6fc7:505:6e3:2f1f:5c99:6afa:38e4","2600:9000:2600:400:5:c033:1800:93a1","TCP","86","[TCP Window Update] 53530  >  443 [ACK] Seq=2 Ack=1 Win=3800 Len=0 TSval=2800835541 TSecr=2280993858"
"72","16.115811756","2a0d:6fc7:505:6e3:2f1f:5c99:6afa:38e4","2600:9000:2600:400:5:c033:1800:93a1","TCP","86","[TCP Window Update] 53530  >  443 [ACK] Seq=2 Ack=1 Win=7758 Len=0 TSval=2800835544 TSecr=2280993858"
"73","16.118576530","2a0d:6fc7:505:6e3:2f1f:5c99:6afa:38e4","2600:9000:2600:400:5:c033:1800:93a1","TCP","86","[TCP Window Update] 53530  >  443 [ACK] Seq=2 Ack=1 Win=15621 Len=0 TSval=2800835547 TSecr=2280993858"
"74","16.218818696","2600:9000:2600:400:5:c033:1800:93a1","2a0d:6fc7:505:6e3:2f1f:5c99:6afa:38e4","TCP","2502","[TCP segment of a reassembled PDU]"
"75","16.218819034","2600:9000:2600:400:5:c033:1800:93a1","2a0d:6fc7:505:6e3:2f1f:5c99:6afa:38e4","TCP","2502","[TCP segment of a reassembled PDU]"
"76","16.218841889","2a0d:6fc7:505:6e3:2f1f:5c99:6afa:38e4","2600:9000:2600:400:5:c033:1800:93a1","TCP","86","53530  >  443 [ACK] Seq=2 Ack=2417 Win=16887 Len=0 TSval=2800835647 TSecr=2280995616"
"77","16.218933000","2a0d:6fc7:505:6e3:2f1f:5c99:6afa:38e4","2600:9000:2600:400:5:c033:1800:93a1","TCP","86","53530  >  443 [ACK] Seq=2 Ack=4833 Win=16869 Len=0 TSval=2800835648 TSecr=2280995617"
"78","16.318171776","2600:9000:2600:400:5:c033:1800:93a1","2a0d:6fc7:505:6e3:2f1f:5c99:6afa:38e4","TCP","2502","[TCP segment of a reassembled PDU]"
"79","16.318203820","2a0d:6fc7:505:6e3:2f1f:5c99:6afa:38e4","2600:9000:2600:400:5:c033:1800:93a1","TCP","86","53530  >  443 [ACK] Seq=2 Ack=7249 Win=16851 Len=0 TSval=2800835747 TSecr=2280995726"
"80","16.327109058","2600:9000:2600:400:5:c033:1800:93a1","2a0d:6fc7:505:6e3:2f1f:5c99:6afa:38e4","TCP","2502","[TCP segment of a reassembled PDU]"
"81","16.327135245","2a0d:6fc7:505:6e3:2f1f:5c99:6afa:38e4","2600:9000:2600:400:5:c033:1800:93a1","TCP","86","53530  >  443 [ACK] Seq=2 Ack=9665 Win=16833 Len=0 TSval=2800835756 TSecr=2280995726"
"82","16.424424699","2600:9000:2600:400:5:c033:1800:93a1","2a0d:6fc7:505:6e3:2f1f:5c99:6afa:38e4","TCP","2502","[TCP segment of a reassembled PDU]"
"83","16.424425100","2600:9000:2600:400:5:c033:1800:93a1","2a0d:6fc7:505:6e3:2f1f:5c99:6afa:38e4","TCP","2502","[TCP segment of a reassembled PDU]"
"84","16.424425174","2600:9000:2600:400:5:c033:1800:93a1","2a0d:6fc7:505:6e3:2f1f:5c99:6afa:38e4","TCP","1294","[TCP segment of a reassembled PDU]"
"85","16.424469444","2a0d:6fc7:505:6e3:2f1f:5c99:6afa:38e4","2600:9000:2600:400:5:c033:1800:93a1","TCP","86","53530  >  443 [ACK] Seq=2 Ack=12081 Win=16816 Len=0 TSval=2800835853 TSecr=2280995826"
"86","16.424601999","2a0d:6fc7:505:6e3:2f1f:5c99:6afa:38e4","2600:9000:2600:400:5:c033:1800:93a1","TCP","86","53530  >  443 [ACK] Seq=2 Ack=14497 Win=16798 Len=0 TSval=2800835853 TSecr=2280995826"
"87","16.424652226","2a0d:6fc7:505:6e3:2f1f:5c99:6afa:38e4","2600:9000:2600:400:5:c033:1800:93a1","TCP","86","53530  >  443 [ACK] Seq=2 Ack=15705 Win=16789 Len=0 TSval=2800835853 TSecr=2280995827"
"88","16.439489496","2600:9000:2600:400:5:c033:1800:93a1","2a0d:6fc7:505:6e3:2f1f:5c99:6afa:38e4","TCP","1294","[TCP segment of a reassembled PDU]"
"89","16.439489669","2600:9000:2600:400:5:c033:1800:93a1","2a0d:6fc7:505:6e3:2f1f:5c99:6afa:38e4","TCP","2502","[TCP segment of a reassembled PDU]"
"90","16.439489689","2600:9000:2600:400:5:c033:1800:93a1","2a0d:6fc7:505:6e3:2f1f:5c99:6afa:38e4","TCP","2502","[TCP segment of a reassembled PDU]"
"91","16.439489708","2600:9000:2600:400:5:c033:1800:93a1","2a0d:6fc7:505:6e3:2f1f:5c99:6afa:38e4","TCP","2502","[TCP segment of a reassembled PDU]"
"92","16.439489727","2600:9000:2600:400:5:c033:1800:93a1","2a0d:6fc7:505:6e3:2f1f:5c99:6afa:38e4","TCP","2502","[TCP segment of a reassembled PDU]"
"93","16.439514873","2a0d:6fc7:505:6e3:2f1f:5c99:6afa:38e4","2600:9000:2600:400:5:c033:1800:93a1","TCP","86","53530  >  443 [ACK] Seq=2 Ack=16913 Win=16780 Len=0 TSval=2800835868 TSecr=2280995827"
"94","16.439579160","2a0d:6fc7:505:6e3:2f1f:5c99:6afa:38e4","2600:9000:2600:400:5:c033:1800:93a1","TCP","86","53530  >  443 [ACK] Seq=2 Ack=19329 Win=16763 Len=0 TSval=2800835868 TSecr=2280995828"
"95","16.439601794","2a0d:6fc7:505:6e3:2f1f:5c99:6afa:38e4","2600:9000:2600:400:5:c033:1800:93a1","TCP","86","53530  >  443 [ACK] Seq=2 Ack=21745 Win=16745 Len=0 TSval=2800835868 TSecr=2280995829"
"96","16.439620564","2a0d:6fc7:505:6e3:2f1f:5c99:6afa:38e4","2600:9000:2600:400:5:c033:1800:93a1","TCP","86","53530  >  443 [ACK] Seq=2 Ack=24161 Win=16727 Len=0 TSval=2800835868 TSecr=2280995830"
"97","16.439637724","2a0d:6fc7:505:6e3:2f1f:5c99:6afa:38e4","2600:9000:2600:400:5:c033:1800:93a1","TCP","86","53530  >  443 [ACK] Seq=2 Ack=26577 Win=16709 Len=0 TSval=2800835868 TSecr=2280995831"
"98","16.439673549","2600:9000:2600:400:5:c033:1800:93a1","2a0d:6fc7:505:6e3:2f1f:5c99:6afa:38e4","TCP","2502","[TCP segment of a reassembled PDU]"
"99","16.439673576","2600:9000:2600:400:5:c033:1800:93a1","2a0d:6fc7:505:6e3:2f1f:5c99:6afa:38e4","TCP","2502","[TCP segment of a reassembled PDU]"
"100","16.439673595","2600:9000:2600:400:5:c033:1800:93a1","2a0d:6fc7:505:6e3:2f1f:5c99:6afa:38e4","TCP","2502","[TCP segment of a reassembled PDU]"
"101","16.439673615","2600:9000:2600:400:5:c033:1800:93a1","2a0d:6fc7:505:6e3:2f1f:5c99:6afa:38e4","TCP","2502","[TCP segment of a reassembled PDU]"
"102","16.439676788","2a0d:6fc7:505:6e3:2f1f:5c99:6afa:38e4","2600:9000:2600:400:5:c033:1800:93a1","TCP","86","53530  >  443 [ACK] Seq=2 Ack=28993 Win=16691 Len=0 TSval=2800835868 TSecr=2280995832"
"103","16.439698101","2a0d:6fc7:505:6e3:2f1f:5c99:6afa:38e4","2600:9000:2600:400:5:c033:1800:93a1","TCP","86","53530  >  443 [ACK] Seq=2 Ack=31409 Win=16673 Len=0 TSval=2800835868 TSecr=2280995833"
"104","16.439716008","2a0d:6fc7:505:6e3:2f1f:5c99:6afa:38e4","2600:9000:2600:400:5:c033:1800:93a1","TCP","86","53530  >  443 [ACK] Seq=2 Ack=33825 Win=16655 Len=0 TSval=2800835868 TSecr=2280995834"
"105","16.439732983","2a0d:6fc7:505:6e3:2f1f:5c99:6afa:38e4","2600:9000:2600:400:5:c033:1800:93a1","TCP","86","53530  >  443 [ACK] Seq=2 Ack=36241 Win=16638 Len=0 TSval=2800835868 TSecr=2280995835"
"106","16.447496780","2600:9000:2600:400:5:c033:1800:93a1","2a0d:6fc7:505:6e3:2f1f:5c99:6afa:38e4","SSLv2","2502","Encrypted Data"
"107","16.447497014","2600:9000:2600:400:5:c033:1800:93a1","2a0d:6fc7:505:6e3:2f1f:5c99:6afa:38e4","TCP","2502","[TCP segment of a reassembled PDU]"
"108","16.447497034","2600:9000:2600:400:5:c033:1800:93a1","2a0d:6fc7:505:6e3:2f1f:5c99:6afa:38e4","TCP","2502","[TCP segment of a reassembled PDU]"
"109","16.447497056","2600:9000:2600:400:5:c033:1800:93a1","2a0d:6fc7:505:6e3:2f1f:5c99:6afa:38e4","TCP","582","[TCP segment of a reassembled PDU]"
"110","16.447497077","2600:9000:2600:400:5:c033:1800:93a1","2a0d:6fc7:505:6e3:2f1f:5c99:6afa:38e4","TCP","2502","[TCP segment of a reassembled PDU]"
"111","16.447543724","2600:9000:2600:400:5:c033:1800:93a1","2a0d:6fc7:505:6e3:2f1f:5c99:6afa:38e4","SSLv2","2502","Encrypted Data"
"112","16.447543751","2600:9000:2600:400:5:c033:1800:93a1","2a0d:6fc7:505:6e3:2f1f:5c99:6afa:38e4","TCP","2502","[TCP segment of a reassembled PDU]"
"113","16.447543782","2600:9000:2600:400:5:c033:1800:93a1","2a0d:6fc7:505:6e3:2f1f:5c99:6afa:38e4","TCP","2502","[TCP segment of a reassembled PDU]"
"114","16.447543803","2600:9000:2600:400:5:c033:1800:93a1","2a0d:6fc7:505:6e3:2f1f:5c99:6afa:38e4","TCP","2502","[TCP segment of a reassembled PDU]"
"115","16.448849221","2600:9000:2600:400:5:c033:1800:93a1","2a0d:6fc7:505:6e3:2f1f:5c99:6afa:38e4","TCP","2502","[TCP segment of a reassembled PDU]"
"116","16.449784323","2600:9000:2600:400:5:c033:1800:93a1","2a0d:6fc7:505:6e3:2f1f:5c99:6afa:38e4","TCP","2502","[TCP segment of a reassembled PDU]"
"117","16.452160482","2600:9000:2600:400:5:c033:1800:93a1","2a0d:6fc7:505:6e3:2f1f:5c99:6afa:38e4","SSLv2","2502","Encrypted Data"
"118","16.452160511","2600:9000:2600:400:5:c033:1800:93a1","2a0d:6fc7:505:6e3:2f1f:5c99:6afa:38e4","TCP","2502","443  >  53530 [PSH, ACK] Seq=63313 Ack=2 Win=145 Len=2416 TSval=2280995848 TSecr=2800835756 [TCP segment of a reassembled PDU]"
"119","16.452964277","2600:9000:2600:400:5:c033:1800:93a1","2a0d:6fc7:505:6e3:2f1f:5c99:6afa:38e4","TCP","2502","443  >  53530 [PSH, ACK] Seq=65729 Ack=2 Win=145 Len=2416 TSval=2280995849 TSecr=2800835756 [TCP segment of a reassembled PDU]"
"120","16.454698522","2600:9000:2600:400:5:c033:1800:93a1","2a0d:6fc7:505:6e3:2f1f:5c99:6afa:38e4","TCP","2502","443  >  53530 [PSH, ACK] Seq=68145 Ack=2 Win=145 Len=2416 TSval=2280995850 TSecr=2800835756 [TCP segment of a reassembled PDU]"
"121","16.455764194","2600:9000:2600:400:5:c033:1800:93a1","2a0d:6fc7:505:6e3:2f1f:5c99:6afa:38e4","TCP","2502","443  >  53530 [PSH, ACK] Seq=70561 Ack=2 Win=145 Len=2416 TSval=2280995850 TSecr=2800835756 [TCP segment of a reassembled PDU]"
"122","16.457742982","2600:9000:2600:400:5:c033:1800:93a1","2a0d:6fc7:505:6e3:2f1f:5c99:6afa:38e4","TCP","2502","443  >  53530 [PSH, ACK] Seq=72977 Ack=2 Win=145 Len=2416 TSval=2280995851 TSecr=2800835756 [TCP segment of a reassembled PDU]"
"123","16.458746723","2600:9000:2600:400:5:c033:1800:93a1","2a0d:6fc7:505:6e3:2f1f:5c99:6afa:38e4","TCP","2502","443  >  53530 [PSH, ACK] Seq=75393 Ack=2 Win=145 Len=2416 TSval=2280995852 TSecr=2800835756 [TCP segment of a reassembled PDU]"
"124","16.469972061","2600:9000:2600:400:5:c033:1800:93a1","2a0d:6fc7:505:6e3:2f1f:5c99:6afa:38e4","TCP","2502","443  >  53530 [PSH, ACK] Seq=77809 Ack=2 Win=145 Len=2416 TSval=2280995853 TSecr=2800835756 [TCP segment of a reassembled PDU]"
"125","16.469972286","2600:9000:2600:400:5:c033:1800:93a1","2a0d:6fc7:505:6e3:2f1f:5c99:6afa:38e4","TCP","2502","443  >  53530 [PSH, ACK] Seq=80225 Ack=2 Win=145 Len=2416 TSval=2280995854 TSecr=2800835756 [TCP segment of a reassembled PDU]"
"126","16.469972319","2600:9000:2600:400:5:c033:1800:93a1","2a0d:6fc7:505:6e3:2f1f:5c99:6afa:38e4","TCP","2502","443  >  53530 [PSH, ACK] Seq=82641 Ack=2 Win=145 Len=2416 TSval=2280995855 TSecr=2800835756 [TCP segment of a reassembled PDU]"
"127","16.469972338","2600:9000:2600:400:5:c033:1800:93a1","2a0d:6fc7:505:6e3:2f1f:5c99:6afa:38e4","TCP","2502","443  >  53530 [PSH, ACK] Seq=85057 Ack=2 Win=145 Len=2416 TSval=2280995856 TSecr=2800835756 [TCP segment of a reassembled PDU]"
"128","16.470584911","2600:9000:2600:400:5:c033:1800:93a1","2a0d:6fc7:505:6e3:2f1f:5c99:6afa:38e4","TCP","2502","443  >  53530 [PSH, ACK] Seq=87473 Ack=2 Win=145 Len=2416 TSval=2280995857 TSecr=2800835756 [TCP segment of a reassembled PDU]"
"129","16.470584937","2600:9000:2600:400:5:c033:1800:93a1","2a0d:6fc7:505:6e3:2f1f:5c99:6afa:38e4","TCP","2502","443  >  53530 [PSH, ACK] Seq=89889 Ack=2 Win=145 Len=2416 TSval=2280995858 TSecr=2800835756 [TCP segment of a reassembled PDU]"
"130","16.470584966","2600:9000:2600:400:5:c033:1800:93a1","2a0d:6fc7:505:6e3:2f1f:5c99:6afa:38e4","TCP","2502","443  >  53530 [PSH, ACK] Seq=92305 Ack=2 Win=145 Len=2416 TSval=2280995859 TSecr=2800835756 [TCP segment of a reassembled PDU]"
"131","16.470584985","2600:9000:2600:400:5:c033:1800:93a1","2a0d:6fc7:505:6e3:2f1f:5c99:6afa:38e4","SSLv2","2502","Encrypted Data, Encrypted Data"
"132","16.485226939","2600:9000:2600:400:5:c033:1800:93a1","2a0d:6fc7:505:6e3:2f1f:5c99:6afa:38e4","TCP","2502","443  >  53530 [PSH, ACK] Seq=97137 Ack=2 Win=145 Len=2416 TSval=2280995861 TSecr=2800835756 [TCP segment of a reassembled PDU]"
"133","16.485227184","2600:9000:2600:400:5:c033:1800:93a1","2a0d:6fc7:505:6e3:2f1f:5c99:6afa:38e4","TCP","2502","443  >  53530 [PSH, ACK] Seq=99553 Ack=2 Win=145 Len=2416 TSval=2280995862 TSecr=2800835756 [TCP segment of a reassembled PDU]"
"134","16.485227206","2600:9000:2600:400:5:c033:1800:93a1","2a0d:6fc7:505:6e3:2f1f:5c99:6afa:38e4","TCP","2502","443  >  53530 [PSH, ACK] Seq=101969 Ack=2 Win=145 Len=2416 TSval=2280995863 TSecr=2800835756 [TCP segment of a reassembled PDU]"
"135","16.485227228","2600:9000:2600:400:5:c033:1800:93a1","2a0d:6fc7:505:6e3:2f1f:5c99:6afa:38e4","TCP","2502","443  >  53530 [PSH, ACK] Seq=104385 Ack=2 Win=145 Len=2416 TSval=2280995864 TSecr=2800835756 [TCP segment of a reassembled PDU]"
"136","16.485266537","2a0d:6fc7:505:6e3:2f1f:5c99:6afa:38e4","2600:9000:2600:400:5:c033:1800:93a1","TCP","86","53530  >  443 [ACK] Seq=2 Ack=99553 Win=16165 Len=0 TSval=2800835914 TSecr=2280995836"
"137","16.485352526","2600:9000:2600:400:5:c033:1800:93a1","2a0d:6fc7:505:6e3:2f1f:5c99:6afa:38e4","TCP","2502","443  >  53530 [PSH, ACK] Seq=106801 Ack=2 Win=145 Len=2416 TSval=2280995865 TSecr=2800835756 [TCP segment of a reassembled PDU]"
"138","16.485352561","2600:9000:2600:400:5:c033:1800:93a1","2a0d:6fc7:505:6e3:2f1f:5c99:6afa:38e4","TCP","2502","443  >  53530 [PSH, ACK] Seq=109217 Ack=2 Win=145 Len=2416 TSval=2280995866 TSecr=2800835756 [TCP segment of a reassembled PDU]"
"139","16.485352595","2600:9000:2600:400:5:c033:1800:93a1","2a0d:6fc7:505:6e3:2f1f:5c99:6afa:38e4","TCP","2502","443  >  53530 [PSH, ACK] Seq=111633 Ack=2 Win=145 Len=2416 TSval=2280995867 TSecr=2800835756 [TCP segment of a reassembled PDU]"
"140","16.485352616","2600:9000:2600:400:5:c033:1800:93a1","2a0d:6fc7:505:6e3:2f1f:5c99:6afa:38e4","TCP","2502","443  >  53530 [PSH, ACK] Seq=114049 Ack=2 Win=145 Len=2416 TSval=2280995868 TSecr=2800835756 [TCP segment of a reassembled PDU]"
"141","16.485382041","2600:9000:2600:400:5:c033:1800:93a1","2a0d:6fc7:505:6e3:2f1f:5c99:6afa:38e4","TCP","2502","443  >  53530 [PSH, ACK] Seq=116465 Ack=2 Win=145 Len=2416 TSval=2280995869 TSecr=2800835756 [TCP segment of a reassembled PDU]"
"142","16.485382065","2600:9000:2600:400:5:c033:1800:93a1","2a0d:6fc7:505:6e3:2f1f:5c99:6afa:38e4","TCP","2502","443  >  53530 [PSH, ACK] Seq=118881 Ack=2 Win=145 Len=2416 TSval=2280995870 TSecr=2800835756 [TCP segment of a reassembled PDU]"
"143","16.485619423","2600:9000:2600:400:5:c033:1800:93a1","2a0d:6fc7:505:6e3:2f1f:5c99:6afa:38e4","SSLv2","2502","Encrypted Data, Encrypted Data"
"144","16.485835524","2600:9000:2600:400:5:c033:1800:93a1","2a0d:6fc7:505:6e3:2f1f:5c99:6afa:38e4","TCP","2502","443  >  53530 [PSH, ACK] Seq=123713 Ack=2 Win=145 Len=2416 TSval=2280995872 TSecr=2800835756 [TCP segment of a reassembled PDU]"
"145","16.487806139","2600:9000:2600:400:5:c033:1800:93a1","2a0d:6fc7:505:6e3:2f1f:5c99:6afa:38e4","TCP","2502","443  >  53530 [PSH, ACK] Seq=126129 Ack=2 Win=145 Len=2416 TSval=2280995873 TSecr=2800835756 [TCP segment of a reassembled PDU]"
"146","16.488897587","2600:9000:2600:400:5:c033:1800:93a1","2a0d:6fc7:505:6e3:2f1f:5c99:6afa:38e4","TCP","2502","443  >  53530 [PSH, ACK] Seq=128545 Ack=2 Win=145 Len=2416 TSval=2280995874 TSecr=2800835756 [TCP segment of a reassembled PDU]"
"147","16.489752781","2600:9000:2600:400:5:c033:1800:93a1","2a0d:6fc7:505:6e3:2f1f:5c99:6afa:38e4","TCP","2502","443  >  53530 [PSH, ACK] Seq=130961 Ack=2 Win=145 Len=2416 TSval=2280995875 TSecr=2800835756 [TCP segment of a reassembled PDU]"
"148","16.502904991","2600:9000:2600:400:5:c033:1800:93a1","2a0d:6fc7:505:6e3:2f1f:5c99:6afa:38e4","TCP","2502","443  >  53530 [PSH, ACK] Seq=133377 Ack=2 Win=145 Len=2416 TSval=2280995876 TSecr=2800835756 [TCP segment of a reassembled PDU]"
"149","16.502905229","2600:9000:2600:400:5:c033:1800:93a1","2a0d:6fc7:505:6e3:2f1f:5c99:6afa:38e4","TCP","2502","443  >  53530 [PSH, ACK] Seq=135793 Ack=2 Win=145 Len=2416 TSval=2280995877 TSecr=2800835756 [TCP segment of a reassembled PDU]"
"150","16.502905277","2600:9000:2600:400:5:c033:1800:93a1","2a0d:6fc7:505:6e3:2f1f:5c99:6afa:38e4","TCP","2502","443  >  53530 [PSH, ACK] Seq=138209 Ack=2 Win=145 Len=2416 TSval=2280995878 TSecr=2800835756 [TCP segment of a reassembled PDU]"
"151","16.502905322","2600:9000:2600:400:5:c033:1800:93a1","2a0d:6fc7:505:6e3:2f1f:5c99:6afa:38e4","TCP","2502","443  >  53530 [PSH, ACK] Seq=140625 Ack=2 Win=145 Len=2416 TSval=2280995879 TSecr=2800835756 [TCP segment of a reassembled PDU]"
"152","16.502957972","2600:9000:2600:400:5:c033:1800:93a1","2a0d:6fc7:505:6e3:2f1f:5c99:6afa:38e4","SSLv2","2502","Encrypted Data"
"153","16.502958021","2600:9000:2600:400:5:c033:1800:93a1","2a0d:6fc7:505:6e3:2f1f:5c99:6afa:38e4","TCP","1294","443  >  53530 [ACK] Seq=145457 Ack=2 Win=145 Len=1208 TSval=2280995881 TSecr=2800835756 [TCP segment of a reassembled PDU]"
"154","16.504401671","2600:9000:2600:400:5:c033:1800:93a1","2a0d:6fc7:505:6e3:2f1f:5c99:6afa:38e4","TCP","1294","443  >  53530 [PSH, ACK] Seq=146665 Ack=2 Win=145 Len=1208 TSval=2280995881 TSecr=2800835756 [TCP segment of a reassembled PDU]"
"155","16.504401925","2600:9000:2600:400:5:c033:1800:93a1","2a0d:6fc7:505:6e3:2f1f:5c99:6afa:38e4","TCP","2502","443  >  53530 [PSH, ACK] Seq=147873 Ack=2 Win=145 Len=2416 TSval=2280995882 TSecr=2800835756 [TCP segment of a reassembled PDU]"
"156","16.504401973","2600:9000:2600:400:5:c033:1800:93a1","2a0d:6fc7:505:6e3:2f1f:5c99:6afa:38e4","TCP","2502","443  >  53530 [PSH, ACK] Seq=150289 Ack=2 Win=145 Len=2416 TSval=2280995883 TSecr=2800835756 [TCP segment of a reassembled PDU]"
"157","16.504402025","2600:9000:2600:400:5:c033:1800:93a1","2a0d:6fc7:505:6e3:2f1f:5c99:6afa:38e4","TCP","2502","443  >  53530 [PSH, ACK] Seq=152705 Ack=2 Win=145 Len=2416 TSval=2280995884 TSecr=2800835756 [TCP segment of a reassembled PDU]"
"158","16.527951384","2a0d:6fc7:505:6e3:2f1f:5c99:6afa:38e4","2600:9000:2600:400:5:c033:1800:93a1","TCP","86","53530  >  443 [ACK] Seq=2 Ack=155121 Win=15755 Len=0 TSval=2800835957 TSecr=2280995862"
"159","16.552747646","2600:9000:2600:400:5:c033:1800:93a1","2a0d:6fc7:505:6e3:2f1f:5c99:6afa:38e4","TCP","2502","443  >  53530 [PSH, ACK] Seq=155121 Ack=2 Win=145 Len=2416 TSval=2280995885 TSecr=2800835756 [TCP segment of a reassembled PDU]"
"160","16.552747937","2600:9000:2600:400:5:c033:1800:93a1","2a0d:6fc7:505:6e3:2f1f:5c99:6afa:38e4","TCP","2502","443  >  53530 [PSH, ACK] Seq=157537 Ack=2 Win=145 Len=2416 TSval=2280995886 TSecr=2800835756 [TCP segment of a reassembled PDU]"
"161","16.552747957","2600:9000:2600:400:5:c033:1800:93a1","2a0d:6fc7:505:6e3:2f1f:5c99:6afa:38e4","TCP","2502","443  >  53530 [PSH, ACK] Seq=159953 Ack=2 Win=145 Len=2416 TSval=2280995887 TSecr=2800835756 [TCP segment of a reassembled PDU]"
"162","16.552747977","2600:9000:2600:400:5:c033:1800:93a1","2a0d:6fc7:505:6e3:2f1f:5c99:6afa:38e4","TCP","2502","443  >  53530 [PSH, ACK] Seq=162369 Ack=2 Win=145 Len=2416 TSval=2280995888 TSecr=2800835756 [TCP segment of a reassembled PDU]"
"163","16.552785307","2600:9000:2600:400:5:c033:1800:93a1","2a0d:6fc7:505:6e3:2f1f:5c99:6afa:38e4","TCP","2502","443  >  53530 [PSH, ACK] Seq=164785 Ack=2 Win=145 Len=2416 TSval=2280995889 TSecr=2800835756 [TCP segment of a reassembled PDU]"
"164","16.552785336","2600:9000:2600:400:5:c033:1800:93a1","2a0d:6fc7:505:6e3:2f1f:5c99:6afa:38e4","TCP","2502","443  >  53530 [PSH, ACK] Seq=167201 Ack=2 Win=145 Len=2416 TSval=2280995890 TSecr=2800835756 [TCP segment of a reassembled PDU]"
"165","16.555752423","2600:9000:2600:400:5:c033:1800:93a1","2a0d:6fc7:505:6e3:2f1f:5c99:6afa:38e4","TCP","1294","443  >  53530 [ACK] Seq=169617 Ack=2 Win=145 Len=1208 TSval=2280995891 TSecr=2800835756 [TCP segment of a reassembled PDU]"
"166","16.555943783","2600:9000:2600:400:5:c033:1800:93a1","2a0d:6fc7:505:6e3:2f1f:5c99:6afa:38e4","TCP","1294","443  >  53530 [PSH, ACK] Seq=170825 Ack=2 Win=145 Len=1208 TSval=2280995891 TSecr=2800835756 [TCP segment of a reassembled PDU]"
"167","16.555943830","2600:9000:2600:400:5:c033:1800:93a1","2a0d:6fc7:505:6e3:2f1f:5c99:6afa:38e4","SSLv2","2502","Encrypted Data"
"168","16.596009128","2a0d:6fc7:505:6e3:2f1f:5c99:6afa:38e4","2600:9000:2600:400:5:c033:1800:93a1","TCP","86","53530  >  443 [ACK] Seq=2 Ack=174449 Win=15612 Len=0 TSval=2800836025 TSecr=2280995885"
"169","16.600248504","2600:9000:2600:400:5:c033:1800:93a1","2a0d:6fc7:505:6e3:2f1f:5c99:6afa:38e4","TCP","2502","443  >  53530 [PSH, ACK] Seq=174449 Ack=2 Win=145 Len=2416 TSval=2280995893 TSecr=2800835756 [TCP segment of a reassembled PDU]"
"170","16.600248584","2600:9000:2600:400:5:c033:1800:93a1","2a0d:6fc7:505:6e3:2f1f:5c99:6afa:38e4","TCP","2502","443  >  53530 [PSH, ACK] Seq=176865 Ack=2 Win=145 Len=2416 TSval=2280995894 TSecr=2800835756 [TCP segment of a reassembled PDU]"
"171","16.608155175","2600:9000:2600:400:5:c033:1800:93a1","2a0d:6fc7:505:6e3:2f1f:5c99:6afa:38e4","TCP","1294","443  >  53530 [ACK] Seq=179281 Ack=2 Win=145 Len=1208 TSval=2280995895 TSecr=2800835756 [TCP segment of a reassembled PDU]"
"172","16.610127597","2600:9000:2600:400:5:c033:1800:93a1","2a0d:6fc7:505:6e3:2f1f:5c99:6afa:38e4","TCP","1294","443  >  53530 [PSH, ACK] Seq=180489 Ack=2 Win=145 Len=1208 TSval=2280995895 TSecr=2800835756 [TCP segment of a reassembled PDU]"
"173","16.640644137","2a0d:6fc7:505:6e3:2f1f:5c99:6afa:38e4","2a00:1450:4028:806::2003","TCP","86","[TCP Dup ACK 30#1] 44200  >  80 [ACK] Seq=1 Ack=1 Win=254 Len=0 TSval=1734303198 TSecr=596821534"
"174","16.652814485","2600:9000:2600:400:5:c033:1800:93a1","2a0d:6fc7:505:6e3:2f1f:5c99:6afa:38e4","TCP","1294","443  >  53530 [ACK] Seq=181697 Ack=2 Win=145 Len=1208 TSval=2280995896 TSecr=2800835756 [TCP segment of a reassembled PDU]"
"175","16.652837450","2a0d:6fc7:505:6e3:2f1f:5c99:6afa:38e4","2600:9000:2600:400:5:c033:1800:93a1","TCP","86","53530  >  443 [ACK] Seq=2 Ack=182905 Win=15550 Len=0 TSval=2800836081 TSecr=2280995893"
"176","16.664169634","2600:9000:2600:400:5:c033:1800:93a1","2a0d:6fc7:505:6e3:2f1f:5c99:6afa:38e4","TCP","1294","443  >  53530 [PSH, ACK] Seq=182905 Ack=2 Win=145 Len=1208 TSval=2280995896 TSecr=2800835756 [TCP segment of a reassembled PDU]"
"177","16.675374572","2600:9000:2600:400:5:c033:1800:93a1","2a0d:6fc7:505:6e3:2f1f:5c99:6afa:38e4","TCP","2502","443  >  53530 [PSH, ACK] Seq=184113 Ack=2 Win=145 Len=2416 TSval=2280995897 TSecr=2800835756 [TCP segment of a reassembled PDU]"
"178","16.676501740","2600:9000:2600:400:5:c033:1800:93a1","2a0d:6fc7:505:6e3:2f1f:5c99:6afa:38e4","TCP","2502","443  >  53530 [PSH, ACK] Seq=186529 Ack=2 Win=145 Len=2416 TSval=2280995898 TSecr=2800835756 [TCP segment of a reassembled PDU]"
"179","16.677252451","2600:9000:2600:400:5:c033:1800:93a1","2a0d:6fc7:505:6e3:2f1f:5c99:6afa:38e4","TCP","2502","443  >  53530 [PSH, ACK] Seq=188945 Ack=2 Win=145 Len=2416 TSval=2280995899 TSecr=2800835756 [TCP segment of a reassembled PDU]"
"180","16.679134895","2600:9000:2600:400:5:c033:1800:93a1","2a0d:6fc7:505:6e3:2f1f:5c99:6afa:38e4","TCP","2502","443  >  53530 [PSH, ACK] Seq=191361 Ack=2 Win=145 Len=2416 TSval=2280995900 TSecr=2800835756 [TCP segment of a reassembled PDU]"
"181","16.679339757","2600:9000:2600:400:5:c033:1800:93a1","2a0d:6fc7:505:6e3:2f1f:5c99:6afa:38e4","SSLv2","2502","Encrypted Data"
"182","16.682237261","2600:9000:2600:400:5:c033:1800:93a1","2a0d:6fc7:505:6e3:2f1f:5c99:6afa:38e4","TCP","1294","443  >  53530 [ACK] Seq=196193 Ack=2 Win=145 Len=1208 TSval=2280995902 TSecr=2800835756 [TCP segment of a reassembled PDU]"
"183","16.707949947","2a0d:6fc7:505:6e3:2f1f:5c99:6afa:38e4","2600:9000:2600:400:5:c033:1800:93a1","TCP","86","53530  >  443 [ACK] Seq=2 Ack=197401 Win=15443 Len=0 TSval=2800836137 TSecr=2280995896"
"184","16.758113315","2600:9000:2600:400:5:c033:1800:93a1","2a0d:6fc7:505:6e3:2f1f:5c99:6afa:38e4","TCP","1294","443  >  53530 [PSH, ACK] Seq=197401 Ack=2 Win=145 Len=1208 TSval=2280995902 TSecr=2800835756 [TCP segment of a reassembled PDU]"
"185","16.758113502","2600:9000:2600:400:5:c033:1800:93a1","2a0d:6fc7:505:6e3:2f1f:5c99:6afa:38e4","TCP","2502","443  >  53530 [PSH, ACK] Seq=198609 Ack=2 Win=145 Len=2416 TSval=2280995903 TSecr=2800835756 [TCP segment of a reassembled PDU]"
"186","16.758113521","2600:9000:2600:400:5:c033:1800:93a1","2a0d:6fc7:505:6e3:2f1f:5c99:6afa:38e4","TCP","2502","443  >  53530 [PSH, ACK] Seq=201025 Ack=2 Win=145 Len=2416 TSval=2280995904 TSecr=2800835756 [TCP segment of a reassembled PDU]"
"187","16.758113540","2600:9000:2600:400:5:c033:1800:93a1","2a0d:6fc7:505:6e3:2f1f:5c99:6afa:38e4","TCP","2502","443  >  53530 [PSH, ACK] Seq=203441 Ack=2 Win=145 Len=2416 TSval=2280995905 TSecr=2800835756 [TCP segment of a reassembled PDU]"
"188","16.758113558","2600:9000:2600:400:5:c033:1800:93a1","2a0d:6fc7:505:6e3:2f1f:5c99:6afa:38e4","SSLv2","2502","Encrypted Data"
"189","16.758158754","2600:9000:2600:400:5:c033:1800:93a1","2a0d:6fc7:505:6e3:2f1f:5c99:6afa:38e4","TCP","2502","443  >  53530 [PSH, ACK] Seq=208273 Ack=2 Win=145 Len=2416 TSval=2280995907 TSecr=2800835756 [TCP segment of a reassembled PDU]"
"190","16.758158778","2600:9000:2600:400:5:c033:1800:93a1","2a0d:6fc7:505:6e3:2f1f:5c99:6afa:38e4","TCP","2502","443  >  53530 [PSH, ACK] Seq=210689 Ack=2 Win=145 Len=2416 TSval=2280995908 TSecr=2800835756 [TCP segment of a reassembled PDU]"
"191","16.758158807","2600:9000:2600:400:5:c033:1800:93a1","2a0d:6fc7:505:6e3:2f1f:5c99:6afa:38e4","TCP","2502","443  >  53530 [PSH, ACK] Seq=213105 Ack=2 Win=145 Len=2416 TSval=2280995909 TSecr=2800835756 [TCP segment of a reassembled PDU]"
"192","16.758158835","2600:9000:2600:400:5:c033:1800:93a1","2a0d:6fc7:505:6e3:2f1f:5c99:6afa:38e4","TCP","2502","443  >  53530 [PSH, ACK] Seq=215521 Ack=2 Win=145 Len=2416 TSval=2280995910 TSecr=2800835756 [TCP segment of a reassembled PDU]"
"193","16.758166602","2600:9000:2600:400:5:c033:1800:93a1","2a0d:6fc7:505:6e3:2f1f:5c99:6afa:38e4","TCP","2502","443  >  53530 [PSH, ACK] Seq=217937 Ack=2 Win=145 Len=2416 TSval=2280995911 TSecr=2800835756 [TCP segment of a reassembled PDU]"
"194","16.758166622","2600:9000:2600:400:5:c033:1800:93a1","2a0d:6fc7:505:6e3:2f1f:5c99:6afa:38e4","SSLv2","2502","Encrypted Data"
"195","16.758166641","2600:9000:2600:400:5:c033:1800:93a1","2a0d:6fc7:505:6e3:2f1f:5c99:6afa:38e4","TCP","2502","443  >  53530 [PSH, ACK] Seq=222769 Ack=2 Win=145 Len=2416 TSval=2280995913 TSecr=2800835756 [TCP segment of a reassembled PDU]"
"196","16.758166658","2600:9000:2600:400:5:c033:1800:93a1","2a0d:6fc7:505:6e3:2f1f:5c99:6afa:38e4","TCP","2502","443  >  53530 [PSH, ACK] Seq=225185 Ack=2 Win=145 Len=2416 TSval=2280995914 TSecr=2800835756 [TCP segment of a reassembled PDU]"
"197","16.758184224","2600:9000:2600:400:5:c033:1800:93a1","2a0d:6fc7:505:6e3:2f1f:5c99:6afa:38e4","SSLv2","2502","Encrypted Data"
"198","16.758184243","2600:9000:2600:400:5:c033:1800:93a1","2a0d:6fc7:505:6e3:2f1f:5c99:6afa:38e4","TCP","2502","443  >  53530 [PSH, ACK] Seq=230017 Ack=2 Win=145 Len=2416 TSval=2280995916 TSecr=2800835756 [TCP segment of a reassembled PDU]"
"199","16.758184262","2600:9000:2600:400:5:c033:1800:93a1","2a0d:6fc7:505:6e3:2f1f:5c99:6afa:38e4","TCP","2502","443  >  53530 [PSH, ACK] Seq=232433 Ack=2 Win=145 Len=2416 TSval=2280995917 TSecr=2800835756 [TCP segment of a reassembled PDU]"
"200","16.758184280","2600:9000:2600:400:5:c033:1800:93a1","2a0d:6fc7:505:6e3:2f1f:5c99:6afa:38e4","TCP","2502","443  >  53530 [PSH, ACK] Seq=234849 Ack=2 Win=145 Len=2416 TSval=2280995918 TSecr=2800835756 [TCP segment of a reassembled PDU]"
"201","16.758191243","2600:9000:2600:400:5:c033:1800:93a1","2a0d:6fc7:505:6e3:2f1f:5c99:6afa:38e4","SSLv2","2502","Encrypted Data"
"202","16.758191262","2600:9000:2600:400:5:c033:1800:93a1","2a0d:6fc7:505:6e3:2f1f:5c99:6afa:38e4","TCP","2502","443  >  53530 [PSH, ACK] Seq=239681 Ack=2 Win=145 Len=2416 TSval=2280995920 TSecr=2800835756 [TCP segment of a reassembled PDU]"
"203","16.758191281","2600:9000:2600:400:5:c033:1800:93a1","2a0d:6fc7:505:6e3:2f1f:5c99:6afa:38e4","TCP","2502","443  >  53530 [PSH, ACK] Seq=242097 Ack=2 Win=145 Len=2416 TSval=2280995921 TSecr=2800835756 [TCP segment of a reassembled PDU]"
"204","16.758191299","2600:9000:2600:400:5:c033:1800:93a1","2a0d:6fc7:505:6e3:2f1f:5c99:6afa:38e4","TCP","2502","443  >  53530 [PSH, ACK] Seq=244513 Ack=2 Win=145 Len=2416 TSval=2280995922 TSecr=2800835756 [TCP segment of a reassembled PDU]"
"205","16.758203583","2600:9000:2600:400:5:c033:1800:93a1","2a0d:6fc7:505:6e3:2f1f:5c99:6afa:38e4","TCP","2502","443  >  53530 [PSH, ACK] Seq=246929 Ack=2 Win=145 Len=2416 TSval=2280995923 TSecr=2800835756 [TCP segment of a reassembled PDU]"
"206","16.758203604","2600:9000:2600:400:5:c033:1800:93a1","2a0d:6fc7:505:6e3:2f1f:5c99:6afa:38e4","TCP","2502","443  >  53530 [PSH, ACK] Seq=249345 Ack=2 Win=145 Len=2416 TSval=2280995924 TSecr=2800835756 [TCP segment of a reassembled PDU]"
"207","16.758203622","2600:9000:2600:400:5:c033:1800:93a1","2a0d:6fc7:505:6e3:2f1f:5c99:6afa:38e4","TCP","2502","443  >  53530 [PSH, ACK] Seq=251761 Ack=2 Win=145 Len=2416 TSval=2280995925 TSecr=2800835756 [TCP segment of a reassembled PDU]"
"208","16.758203640","2600:9000:2600:400:5:c033:1800:93a1","2a0d:6fc7:505:6e3:2f1f:5c99:6afa:38e4","SSLv2","2502","Encrypted Data, Encrypted Data"
"209","16.758209824","2600:9000:2600:400:5:c033:1800:93a1","2a0d:6fc7:505:6e3:2f1f:5c99:6afa:38e4","TCP","2502","443  >  53530 [PSH, ACK] Seq=256593 Ack=2 Win=145 Len=2416 TSval=2280995927 TSecr=2800835756 [TCP segment of a reassembled PDU]"
"210","16.758209843","2600:9000:2600:400:5:c033:1800:93a1","2a0d:6fc7:505:6e3:2f1f:5c99:6afa:38e4","TCP","2502","443  >  53530 [PSH, ACK] Seq=259009 Ack=2 Win=145 Len=2416 TSval=2280995928 TSecr=2800835756 [TCP segment of a reassembled PDU]"
