"No.","Time","Source","Destination","Protocol","Length","Info"
"1","0.000000000","192.168.56.210","192.168.56.255","UDP","86","57621  >  57621 Len=44"
"2","0.394600487","2a0d:6fc7:505:6e3:b391:e2e3:ca0d:6126","2a0d:6fc7:505:6e3::be","DNS","94","Standard query 0x2fdd AAAA www.google.com"
"3","0.464302963","2a0d:6fc7:505:6e3::be","2a0d:6fc7:505:6e3:b391:e2e3:ca0d:6126","DNS","122","Standard query response 0x2fdd AAAA www.google.com AAAA 2a00:1450:4028:80a::2004"
"4","0.464631796","2a0d:6fc7:505:6e3:b391:e2e3:ca0d:6126","2a00:1450:4028:80a::2004","TCP","94","59984  >  443 [SYN] Seq=0 Win=33120 Len=0 MSS=1440 SACK_PERM TSval=482064606 TSecr=0 WS=128"
"5","0.464814715","2a0d:6fc7:505:6e3:b391:e2e3:ca0d:6126","2a00:1450:4028:80a::2004","TCP","94","59992  >  443 [SYN] Seq=0 Win=33120 Len=0 MSS=1440 SACK_PERM TSval=482064606 TSecr=0 WS=128"
"6","0.500256244","2a00:1450:4028:80a::2004","2a0d:6fc7:505:6e3:b391:e2e3:ca0d:6126","TCP","94","443  >  59984 [SYN, ACK] Seq=0 Ack=1 Win=65535 Len=0 MSS=1300 SACK_PERM TSval=2600508979 TSecr=482064606 WS=256"
"7","0.500256490","2a00:1450:4028:80a::2004","2a0d:6fc7:505:6e3:b391:e2e3:ca0d:6126","TCP","94","443  >  59992 [SYN, ACK] Seq=0 Ack=1 Win=65535 Len=0 MSS=1300 SACK_PERM TSval=473583790 TSecr=482064606 WS=256"
"8","0.500318694","2a0d:6fc7:505:6e3:b391:e2e3:ca0d:6126","2a00:1450:4028:80a::2004","TCP","86","59984  >  443 [ACK] Seq=1 Ack=1 Win=33152 Len=0 TSval=482064642 TSecr=2600508979"
"9","0.500473134","2a0d:6fc7:505:6e3:b391:e2e3:ca0d:6126","2a00:1450:4028:80a::2004","TCP","86","59992  >  443 [ACK] Seq=1 Ack=1 Win=33152 Len=0 TSval=482064642 TSecr=473583790"
"10","0.501919682","2a0d:6fc7:505:6e3:b391:e2e3:ca0d:6126","2a00:1450:4028:80a::2004","TLSv1.3","603","Client Hello (SNI=www.google.com)"
"11","0.503658569","2a0d:6fc7:505:6e3:b391:e2e3:ca0d:6126","2a00:1450:4028:80a::2004","TLSv1.3","603","Client Hello (SNI=www.google.com)"
"12","0.546452047","2a00:1450:4028:80a::2004","2a0d:6fc7:505:6e3:b391:e2e3:ca0d:6126","TCP","86","443  >  59992 [ACK] Seq=1 Ack=518 Win=269568 Len=0 TSval=473583837 TSecr=482064645"
"13","0.546452282","2a00:1450:4028:80a::2004","2a0d:6fc7:505:6e3:b391:e2e3:ca0d:6126","TCP","86","443  >  59984 [ACK] Seq=1 Ack=518 Win=269568 Len=0 TSval=2600509026 TSecr=482064643"
"14","0.618913077","2a00:1450:4028:80a::2004","2a0d:6fc7:505:6e3:b391:e2e3:ca0d:6126","TLSv1.3","2502","Server Hello, Change Cipher Spec"
"15","0.618989842","2a0d:6fc7:505:6e3:b391:e2e3:ca0d:6126","2a00:1450:4028:80a::2004","TCP","86","59984  >  443 [ACK] Seq=518 Ack=2417 Win=31872 Len=0 TSval=482064760 TSecr=2600509078"
"16","0.663594428","2a00:1450:4028:80a::2004","2a0d:6fc7:505:6e3:b391:e2e3:ca0d:6126","TLSv1.3","1769","Application Data"
"17","0.663650417","2a0d:6fc7:505:6e3:b391:e2e3:ca0d:6126","2a00:1450:4028:80a::2004","TCP","86","59984  >  443 [ACK] Seq=518 Ack=4100 Win=31872 Len=0 TSval=482064805 TSecr=2600509078"
"18","0.666278875","2a00:1450:4028:80a::2004","2a0d:6fc7:505:6e3:b391:e2e3:ca0d:6126","TLSv1.3","2502","Server Hello, Change Cipher Spec"
"19","0.666278959","2a00:1450:4028:80a::2004","2a0d:6fc7:505:6e3:b391:e2e3:ca0d:6126","TLSv1.3","1768","Application Data"
"20","0.666318122","2a0d:6fc7:505:6e3:b391:e2e3:ca0d:6126","2a00:1450:4028:80a::2004","TCP","86","59992  >  443 [ACK] Seq=518 Ack=2417 Win=31872 Len=0 TSval=482064808 TSecr=473583890"
"21","0.666407228","2a0d:6fc7:505:6e3:b391:e2e3:ca0d:6126","2a00:1450:4028:80a::2004","TCP","86","59992  >  443 [ACK] Seq=518 Ack=4099 Win=31872 Len=0 TSval=482064808 TSecr=473583890"
"22","0.671013356","2a0d:6fc7:505:6e3:b391:e2e3:ca0d:6126","2a0d:6fc7:505:6e3::be","DNS","90","Standard query 0xbf4f AAAA o.pki.goog"
"23","0.675967535","2a0d:6fc7:505:6e3::be","2a0d:6fc7:505:6e3:b391:e2e3:ca0d:6126","DNS","153","Standard query response 0xbf4f AAAA o.pki.goog CNAME pki-goog.l.google.com AAAA 2a00:1450:4028:804::2003"
"24","0.676190129","2a0d:6fc7:505:6e3:b391:e2e3:ca0d:6126","2a00:1450:4028:804::2003","TCP","94","38206  >  80 [SYN] Seq=0 Win=33120 Len=0 MSS=1440 SACK_PERM TSval=3994641956 TSecr=0 WS=128"
"25","0.676379851","2a0d:6fc7:505:6e3:b391:e2e3:ca0d:6126","2a00:1450:4028:804::2003","TCP","94","38212  >  80 [SYN] Seq=0 Win=33120 Len=0 MSS=1440 SACK_PERM TSval=3994641956 TSecr=0 WS=128"
"26","0.701548730","2a00:1450:4028:80a::2004","2a0d:6fc7:505:6e3:b391:e2e3:ca0d:6126","TCP","560","[TCP Spurious Retransmission] 443  >  59992 [PSH, ACK] Seq=3625 Ack=518 Win=269568 Len=474 TSval=473583989 TSecr=482064645 [TCP segment of a reassembled PDU]"
"27","0.701584358","2a0d:6fc7:505:6e3:b391:e2e3:ca0d:6126","2a00:1450:4028:80a::2004","TCP","98","[TCP Dup ACK 21#1] 59992  >  443 [ACK] Seq=518 Ack=4099 Win=31872 Len=0 TSval=482064843 TSecr=473583989 SLE=3625 SRE=4099"
"28","0.726388088","2a00:1450:4028:804::2003","2a0d:6fc7:505:6e3:b391:e2e3:ca0d:6126","TCP","94","80  >  38206 [SYN, ACK] Seq=0 Ack=1 Win=65535 Len=0 MSS=1300 SACK_PERM TSval=809732434 TSecr=3994641956 WS=256"
"29","0.726388497","2a00:1450:4028:804::2003","2a0d:6fc7:505:6e3:b391:e2e3:ca0d:6126","TCP","94","80  >  38212 [SYN, ACK] Seq=0 Ack=1 Win=65535 Len=0 MSS=1300 SACK_PERM TSval=4228419494 TSecr=3994641956 WS=256"
"30","0.726443359","2a0d:6fc7:505:6e3:b391:e2e3:ca0d:6126","2a00:1450:4028:804::2003","TCP","86","38206  >  80 [ACK] Seq=1 Ack=1 Win=33152 Len=0 TSval=3994642006 TSecr=809732434"
"31","0.726536888","2a0d:6fc7:505:6e3:b391:e2e3:ca0d:6126","2a00:1450:4028:804::2003","TCP","86","38212  >  80 [ACK] Seq=1 Ack=1 Win=33152 Len=0 TSval=3994642006 TSecr=4228419494"
"32","0.726706034","2a0d:6fc7:505:6e3:b391:e2e3:ca0d:6126","2a00:1450:4028:804::2003","OCSP","498","Request"
"33","0.726890121","2a0d:6fc7:505:6e3:b391:e2e3:ca0d:6126","2a00:1450:4028:804::2003","OCSP","498","Request"
"34","0.770473483","2a00:1450:4028:804::2003","2a0d:6fc7:505:6e3:b391:e2e3:ca0d:6126","TCP","86","80  >  38206 [ACK] Seq=1 Ack=413 Win=269568 Len=0 TSval=809732486 TSecr=3994642006"
"35","0.770474414","2a00:1450:4028:804::2003","2a0d:6fc7:505:6e3:b391:e2e3:ca0d:6126","TCP","86","80  >  38212 [ACK] Seq=1 Ack=413 Win=269568 Len=0 TSval=4228419546 TSecr=3994642006"
"36","0.910243133","2a00:1450:4028:804::2003","2a0d:6fc7:505:6e3:b391:e2e3:ca0d:6126","OCSP","787","Response"
"37","0.910243420","2a00:1450:4028:804::2003","2a0d:6fc7:505:6e3:b391:e2e3:ca0d:6126","OCSP","787","Response"
"38","0.910350371","2a0d:6fc7:505:6e3:b391:e2e3:ca0d:6126","2a00:1450:4028:804::2003","TCP","86","38206  >  80 [ACK] Seq=413 Ack=702 Win=32512 Len=0 TSval=3994642190 TSecr=809732621"
"39","0.910469552","2a0d:6fc7:505:6e3:b391:e2e3:ca0d:6126","2a00:1450:4028:804::2003","TCP","86","38212  >  80 [ACK] Seq=413 Ack=702 Win=32512 Len=0 TSval=3994642190 TSecr=4228419681"
"40","0.912455905","2a0d:6fc7:505:6e3:b391:e2e3:ca0d:6126","2a00:1450:4028:80a::2004","TLSv1.3","150","Change Cipher Spec, Application Data"
"41","0.913484256","2a0d:6fc7:505:6e3:b391:e2e3:ca0d:6126","2a00:1450:4028:80a::2004","TLSv1.3","256","Application Data"
"42","0.913652101","2a0d:6fc7:505:6e3:b391:e2e3:ca0d:6126","2a00:1450:4028:80a::2004","TCP","1374","59984  >  443 [ACK] Seq=752 Ack=4100 Win=31872 Len=1288 TSval=482065055 TSecr=2600509078 [TCP segment of a reassembled PDU]"
"43","0.913654717","2a0d:6fc7:505:6e3:b391:e2e3:ca0d:6126","2a00:1450:4028:80a::2004","TLSv1.3","849","Application Data"
"44","0.913937530","2a0d:6fc7:505:6e3:b391:e2e3:ca0d:6126","2a00:1450:4028:80a::2004","TLSv1.3","150","Change Cipher Spec, Application Data"
"45","0.914300010","2a0d:6fc7:505:6e3:b391:e2e3:ca0d:6126","2a00:1450:4028:80a::2004","TLSv1.3","273","Application Data"
"46","0.949025132","2a00:1450:4028:80a::2004","2a0d:6fc7:505:6e3:b391:e2e3:ca0d:6126","TCP","86","443  >  59984 [ACK] Seq=4100 Ack=582 Win=269568 Len=0 TSval=2600509428 TSecr=482065054"
"47","0.949025378","2a00:1450:4028:80a::2004","2a0d:6fc7:505:6e3:b391:e2e3:ca0d:6126","TCP","86","443  >  59984 [ACK] Seq=4100 Ack=752 Win=269568 Len=0 TSval=2600509428 TSecr=482065055"
"48","0.949629055","2a00:1450:4028:80a::2004","2a0d:6fc7:505:6e3:b391:e2e3:ca0d:6126","TLSv1.3","700","Application Data, Application Data"
"49","0.949684085","2a0d:6fc7:505:6e3:b391:e2e3:ca0d:6126","2a00:1450:4028:80a::2004","TCP","86","59984  >  443 [ACK] Seq=2803 Ack=4714 Win=31872 Len=0 TSval=482065091 TSecr=2600509428"
"50","0.950851772","2a0d:6fc7:505:6e3:b391:e2e3:ca0d:6126","2a00:1450:4028:80a::2004","TLSv1.3","117","Application Data"
"51","0.951441267","2a00:1450:4028:80a::2004","2a0d:6fc7:505:6e3:b391:e2e3:ca0d:6126","TCP","86","443  >  59992 [ACK] Seq=4099 Ack=582 Win=269568 Len=0 TSval=473584240 TSecr=482065055"
"52","0.951441407","2a00:1450:4028:80a::2004","2a0d:6fc7:505:6e3:b391:e2e3:ca0d:6126","TCP","98","[TCP Dup ACK 47#1] 443  >  59984 [ACK] Seq=4714 Ack=752 Win=269568 Len=0 TSval=2600509429 TSecr=482065055 SLE=2040 SRE=2803"
"53","0.951441446","2a00:1450:4028:80a::2004","2a0d:6fc7:505:6e3:b391:e2e3:ca0d:6126","TCP","86","443  >  59984 [ACK] Seq=4714 Ack=2803 Win=267520 Len=0 TSval=2600509429 TSecr=482065055"
"54","0.951441486","2a00:1450:4028:80a::2004","2a0d:6fc7:505:6e3:b391:e2e3:ca0d:6126","TCP","86","443  >  59992 [ACK] Seq=4099 Ack=769 Win=269568 Len=0 TSval=473584240 TSecr=482065056"
"55","0.961219138","2a00:1450:4028:80a::2004","2a0d:6fc7:505:6e3:b391:e2e3:ca0d:6126","TLSv1.3","700","Application Data, Application Data"
"56","0.961267720","2a0d:6fc7:505:6e3:b391:e2e3:ca0d:6126","2a00:1450:4028:80a::2004","TCP","86","59992  >  443 [ACK] Seq=769 Ack=4713 Win=31872 Len=0 TSval=482065103 TSecr=473584241"
"57","0.962083730","2a0d:6fc7:505:6e3:b391:e2e3:ca0d:6126","2a00:1450:4028:80a::2004","TLSv1.3","110","Application Data"
"58","0.962411882","2a0d:6fc7:505:6e3:b391:e2e3:ca0d:6126","2a00:1450:4028:80a::2004","TCP","86","59992  >  443 [FIN, ACK] Seq=793 Ack=4713 Win=31872 Len=0 TSval=482065104 TSecr=473584241"
"59","0.963065080","2a00:1450:4028:80a::2004","2a0d:6fc7:505:6e3:b391:e2e3:ca0d:6126","TLSv1.3","117","Application Data"
"60","0.963065476","2a00:1450:4028:80a::2004","2a0d:6fc7:505:6e3:b391:e2e3:ca0d:6126","TLSv1.3","117","Application Data"
"61","0.963311438","2a0d:6fc7:505:6e3:b391:e2e3:ca0d:6126","2a00:1450:4028:80a::2004","TCP","74","59992  >  443 [RST] Seq=769 Win=0 Len=0"
"62","0.985946675","2a00:1450:4028:80a::2004","2a0d:6fc7:505:6e3:b391:e2e3:ca0d:6126","TCP","86","443  >  59984 [ACK] Seq=4745 Ack=2834 Win=267520 Len=0 TSval=2600509465 TSecr=482065092"
"63","1.001170791","2a00:1450:4028:80a::2004","2a0d:6fc7:505:6e3:b391:e2e3:ca0d:6126","TCP","86","443  >  59992 [ACK] Seq=4744 Ack=794 Win=269568 Len=0 TSval=473584288 TSecr=482065103"
"64","1.001170956","2a00:1450:4028:80a::2004","2a0d:6fc7:505:6e3:b391:e2e3:ca0d:6126","TCP","86","443  >  59992 [FIN, ACK] Seq=4744 Ack=794 Win=269568 Len=0 TSval=473584288 TSecr=482065103"
"65","1.001200804","2a0d:6fc7:505:6e3:b391:e2e3:ca0d:6126","2a00:1450:4028:80a::2004","TCP","74","59992  >  443 [RST] Seq=794 Win=0 Len=0"
"66","1.001338106","2a0d:6fc7:505:6e3:b391:e2e3:ca0d:6126","2a00:1450:4028:80a::2004","TCP","74","59992  >  443 [RST] Seq=794 Win=0 Len=0"
"67","1.007165312","2a0d:6fc7:505:6e3:b391:e2e3:ca0d:6126","2a00:1450:4028:80a::2004","TCP","86","59984  >  443 [ACK] Seq=2834 Ack=4745 Win=31872 Len=0 TSval=482065149 TSecr=2600509430"
"68","1.070535972","2a00:1450:4028:80a::2004","2a0d:6fc7:505:6e3:b391:e2e3:ca0d:6126","TLSv1.3","644","Application Data"
"69","1.070536099","2a00:1450:4028:80a::2004","2a0d:6fc7:505:6e3:b391:e2e3:ca0d:6126","TLSv1.3","128","Application Data"
"70","1.070592280","2a0d:6fc7:505:6e3:b391:e2e3:ca0d:6126","2a00:1450:4028:80a::2004","TCP","86","59984  >  443 [ACK] Seq=2834 Ack=5303 Win=31872 Len=0 TSval=482065212 TSecr=2600509538"
"71","1.070690733","2a0d:6fc7:505:6e3:b391:e2e3:ca0d:6126","2a00:1450:4028:80a::2004","TCP","86","59984  >  443 [ACK] Seq=2834 Ack=5345 Win=31872 Len=0 TSval=482065212 TSecr=2600509538"
"72","1.074692488","2a0d:6fc7:505:6e3:b391:e2e3:ca0d:6126","2a00:1450:4028:80a::2004","QUIC","1399","Initial, DCID=2fb6cc70e31b694f27e2325ec201, SCID=03e89b, PKN: 0, CRYPTO"
"73","1.115939279","2a00:1450:4028:80a::2004","2a0d:6fc7:505:6e3:b391:e2e3:ca0d:6126","QUIC","1399","Initial, DCID=03e89b, SCID=efb6cc70e31b694f, PKN: 1, ACK, CRYPTO, PADDING"
"74","1.116465005","2a0d:6fc7:505:6e3:b391:e2e3:ca0d:6126","2a00:1450:4028:80a::2004","QUIC","102","Handshake, DCID=efb6cc70e31b694f, SCID=03e89b"
"75","1.139738359","2a00:1450:4028:80a::2004","2a0d:6fc7:505:6e3:b391:e2e3:ca0d:6126","TLSv1.3","1294","Application Data"
"76","1.139738666","2a00:1450:4028:80a::2004","2a0d:6fc7:505:6e3:b391:e2e3:ca0d:6126","TLSv1.3","1294","Application Data"
"77","1.139738686","2a00:1450:4028:80a::2004","2a0d:6fc7:505:6e3:b391:e2e3:ca0d:6126","TLSv1.3","2502","Application Data, Application Data"
"78","1.139782134","2a0d:6fc7:505:6e3:b391:e2e3:ca0d:6126","2a00:1450:4028:80a::2004","TCP","86","59984  >  443 [ACK] Seq=2834 Ack=6553 Win=31872 Len=0 TSval=482065281 TSecr=2600509606"
"79","1.139864053","2a0d:6fc7:505:6e3:b391:e2e3:ca0d:6126","2a00:1450:4028:80a::2004","TCP","86","59984  >  443 [ACK] Seq=2834 Ack=7761 Win=31872 Len=0 TSval=482065281 TSecr=2600509606"
"80","1.139895371","2a0d:6fc7:505:6e3:b391:e2e3:ca0d:6126","2a00:1450:4028:80a::2004","TCP","86","59984  >  443 [ACK] Seq=2834 Ack=10177 Win=31872 Len=0 TSval=482065281 TSecr=2600509608"
"81","1.143991699","2a00:1450:4028:80a::2004","2a0d:6fc7:505:6e3:b391:e2e3:ca0d:6126","TLSv1.3","2502","Application Data, Application Data"
"82","1.143991866","2a00:1450:4028:80a::2004","2a0d:6fc7:505:6e3:b391:e2e3:ca0d:6126","TLSv1.3","2502","Application Data, Application Data"
"83","1.144015929","2a0d:6fc7:505:6e3:b391:e2e3:ca0d:6126","2a00:1450:4028:80a::2004","TCP","86","59984  >  443 [ACK] Seq=2834 Ack=12593 Win=31872 Len=0 TSval=482065285 TSecr=2600509610"
"84","1.144096131","2a0d:6fc7:505:6e3:b391:e2e3:ca0d:6126","2a00:1450:4028:80a::2004","TCP","86","59984  >  443 [ACK] Seq=2834 Ack=15009 Win=31872 Len=0 TSval=482065285 TSecr=2600509612"
"85","1.144465094","2a00:1450:4028:80a::2004","2a0d:6fc7:505:6e3:b391:e2e3:ca0d:6126","TLSv1.3","2502","Application Data, Application Data"
"86","1.144465270","2a00:1450:4028:80a::2004","2a0d:6fc7:505:6e3:b391:e2e3:ca0d:6126","TLSv1.3","2502","Application Data, Application Data"
"87","1.144469317","2a0d:6fc7:505:6e3:b391:e2e3:ca0d:6126","2a00:1450:4028:80a::2004","TCP","86","59984  >  443 [ACK] Seq=2834 Ack=17425 Win=31872 Len=0 TSval=482065286 TSecr=2600509614"
"88","1.144494794","2a0d:6fc7:505:6e3:b391:e2e3:ca0d:6126","2a00:1450:4028:80a::2004","TCP","86","59984  >  443 [ACK] Seq=2834 Ack=19841 Win=31872 Len=0 TSval=482065286 TSecr=2600509616"
"89","1.148567922","2a00:1450:4028:80a::2004","2a0d:6fc7:505:6e3:b391:e2e3:ca0d:6126","TLSv1.3","1294","Application Data"
"90","1.148600531","2a0d:6fc7:505:6e3:b391:e2e3:ca0d:6126","2a00:1450:4028:80a::2004","TCP","86","59984  >  443 [ACK] Seq=2834 Ack=21049 Win=31872 Len=0 TSval=482065290 TSecr=2600509618"
"91","1.151983766","2a00:1450:4028:80a::2004","2a0d:6fc7:505:6e3:b391:e2e3:ca0d:6126","TLSv1.3","1294","Application Data"
"92","1.151984072","2a00:1450:4028:80a::2004","2a0d:6fc7:505:6e3:b391:e2e3:ca0d:6126","TLSv1.3","2502","Application Data, Application Data"
"93","1.151984100","2a00:1450:4028:80a::2004","2a0d:6fc7:505:6e3:b391:e2e3:ca0d:6126","TLSv1.3","656","Application Data"
"94","1.152023489","2a0d:6fc7:505:6e3:b391:e2e3:ca0d:6126","2a00:1450:4028:80a::2004","TCP","86","59984  >  443 [ACK] Seq=2834 Ack=22257 Win=31872 Len=0 TSval=482065293 TSecr=2600509618"
"95","1.152107743","2a0d:6fc7:505:6e3:b391:e2e3:ca0d:6126","2a00:1450:4028:80a::2004","TCP","86","59984  >  443 [ACK] Seq=2834 Ack=24673 Win=31872 Len=0 TSval=482065293 TSecr=2600509621"
"96","1.152247352","2a0d:6fc7:505:6e3:b391:e2e3:ca0d:6126","2a00:1450:4028:80a::2004","TCP","86","59984  >  443 [ACK] Seq=2834 Ack=25243 Win=31872 Len=0 TSval=482065294 TSecr=2600509623"
"97","1.165457743","2a0d:6fc7:505:6e3:b391:e2e3:ca0d:6126","2a0d:6fc7:505:6e3::be","DNS","97","Standard query 0xe736 AAAA fonts.gstatic.com"
"98","1.172592462","2a00:1450:4028:80a::2004","2a0d:6fc7:505:6e3:b391:e2e3:ca0d:6126","QUIC","1399","Handshake, DCID=03e89b, SCID=efb6cc70e31b694f"
"99","1.172592755","2a00:1450:4028:80a::2004","2a0d:6fc7:505:6e3:b391:e2e3:ca0d:6126","QUIC","1399","Handshake, DCID=03e89b, SCID=efb6cc70e31b694f"
"100","1.172592775","2a00:1450:4028:80a::2004","2a0d:6fc7:505:6e3:b391:e2e3:ca0d:6126","QUIC","1399","Handshake, DCID=03e89b, SCID=efb6cc70e31b694f"
"101","1.172780037","2a0d:6fc7:505:6e3:b391:e2e3:ca0d:6126","2a00:1450:4028:80a::2004","QUIC","104","Handshake, DCID=efb6cc70e31b694f, SCID=03e89b"
"102","1.173135933","2a0d:6fc7:505:6e3::be","2a0d:6fc7:505:6e3:b391:e2e3:ca0d:6126","DNS","125","Standard query response 0xe736 AAAA fonts.gstatic.com AAAA 2a00:1450:4028:80a::2003"
"103","1.173135964","2a00:1450:4028:80a::2004","2a0d:6fc7:505:6e3:b391:e2e3:ca0d:6126","QUIC","105","Handshake, DCID=03e89b, SCID=efb6cc70e31b694f"
"104","1.173709620","2a0d:6fc7:505:6e3:b391:e2e3:ca0d:6126","2a00:1450:4028:80a::2003","QUIC","1399","Initial, DCID=2f91abbbba2f77ad, SCID=d624aa, PKN: 0, CRYPTO"
"105","1.182737556","2a0d:6fc7:505:6e3:b391:e2e3:ca0d:6126","2a00:1450:4028:80a::2004","TLSv1.3","266","Application Data"
"106","1.182894381","2a0d:6fc7:505:6e3:b391:e2e3:ca0d:6126","2a00:1450:4028:80a::2004","TLSv1.3","121","Application Data"
"107","1.215953082","2a00:1450:4028:80a::2004","2a0d:6fc7:505:6e3:b391:e2e3:ca0d:6126","QUIC","1399","Handshake, DCID=03e89b, SCID=efb6cc70e31b694f"
"108","1.215953384","2a00:1450:4028:80a::2004","2a0d:6fc7:505:6e3:b391:e2e3:ca0d:6126","QUIC","1399","Handshake, DCID=03e89b, SCID=efb6cc70e31b694f"
"109","1.215953404","2a00:1450:4028:80a::2004","2a0d:6fc7:505:6e3:b391:e2e3:ca0d:6126","QUIC","297","Protected Payload (KP0), DCID=03e89b"
"110","1.217113438","2a0d:6fc7:505:6e3:b391:e2e3:ca0d:6126","2a00:1450:4028:80a::2004","QUIC","105","Handshake, DCID=efb6cc70e31b694f, SCID=03e89b"
"111","1.220216207","2a00:1450:4028:80a::2004","2a0d:6fc7:505:6e3:b391:e2e3:ca0d:6126","TCP","86","443  >  59984 [ACK] Seq=25243 Ack=3014 Win=267520 Len=0 TSval=2600509699 TSecr=482065324"
"112","1.220216385","2a00:1450:4028:80a::2004","2a0d:6fc7:505:6e3:b391:e2e3:ca0d:6126","TCP","86","443  >  59984 [ACK] Seq=25243 Ack=3049 Win=267520 Len=0 TSval=2600509699 TSecr=482065324"
"113","1.220723899","2a0d:6fc7:505:6e3:b391:e2e3:ca0d:6126","2a00:1450:4028:804::2003","OCSP","498","Request"
"114","1.223302394","2a00:1450:4028:80a::2003","2a0d:6fc7:505:6e3:b391:e2e3:ca0d:6126","QUIC","1399","Initial, DCID=d624aa, SCID=ef91abbbba2f77ad, PKN: 1, ACK, CRYPTO, PADDING"
"115","1.223862688","2a0d:6fc7:505:6e3:b391:e2e3:ca0d:6126","2a00:1450:4028:80a::2003","QUIC","102","Handshake, DCID=ef91abbbba2f77ad, SCID=d624aa"
"116","1.232837880","2a00:1450:4028:80a::2004","2a0d:6fc7:505:6e3:b391:e2e3:ca0d:6126","TLSv1.3","1294","Application Data"
"117","1.232838094","2a00:1450:4028:80a::2004","2a0d:6fc7:505:6e3:b391:e2e3:ca0d:6126","TLSv1.3","831","Application Data"
"118","1.232901614","2a0d:6fc7:505:6e3:b391:e2e3:ca0d:6126","2a00:1450:4028:80a::2004","TCP","86","59984  >  443 [ACK] Seq=3049 Ack=27196 Win=31872 Len=0 TSval=482065374 TSecr=2600509710"
"119","1.237514715","2a0d:6fc7:505:6e3:b391:e2e3:ca0d:6126","2a00:1450:4028:80a::2004","QUIC","102","Handshake, DCID=efb6cc70e31b694f, SCID=03e89b"
"120","1.237680753","2a0d:6fc7:505:6e3:b391:e2e3:ca0d:6126","2a00:1450:4028:80a::2004","QUIC","102","Handshake, DCID=efb6cc70e31b694f, SCID=03e89b"
"121","1.239592932","2a00:1450:4028:80a::2004","2a0d:6fc7:505:6e3:b391:e2e3:ca0d:6126","TLSv1.3","1294","Application Data"
"122","1.240206428","2a00:1450:4028:80a::2004","2a0d:6fc7:505:6e3:b391:e2e3:ca0d:6126","TLSv1.3","1294","Application Data"
"123","1.240224051","2a0d:6fc7:505:6e3:b391:e2e3:ca0d:6126","2a00:1450:4028:80a::2004","TCP","86","59984  >  443 [ACK] Seq=3049 Ack=29612 Win=36736 Len=0 TSval=482065382 TSecr=2600509717"
"124","1.243085441","2a00:1450:4028:80a::2004","2a0d:6fc7:505:6e3:b391:e2e3:ca0d:6126","TLSv1.3","2502","Application Data, Application Data"
"125","1.243085853","2a00:1450:4028:80a::2004","2a0d:6fc7:505:6e3:b391:e2e3:ca0d:6126","TLSv1.3","659","Application Data"
"126","1.243116622","2a0d:6fc7:505:6e3:b391:e2e3:ca0d:6126","2a00:1450:4028:80a::2004","TCP","86","59984  >  443 [ACK] Seq=3049 Ack=32028 Win=41600 Len=0 TSval=482065384 TSecr=2600509719"
"127","1.244284993","2a00:1450:4028:80a::2004","2a0d:6fc7:505:6e3:b391:e2e3:ca0d:6126","TLSv1.3","220","Application Data"
"128","1.244768684","2a0d:6fc7:505:6e3:b391:e2e3:ca0d:6126","2a00:1450:4028:80a::2004","TCP","86","59984  >  443 [ACK] Seq=3049 Ack=32735 Win=46464 Len=0 TSval=482065386 TSecr=2600509721"
"129","1.247837633","2a0d:6fc7:505:6e3:b391:e2e3:ca0d:6126","2a0d:6fc7:505:6e3::be","DNS","104","Standard query 0x2e27 AAAA www.googleadservices.com"
"130","1.250714468","2a00:1450:4028:80a::2004","2a0d:6fc7:505:6e3:b391:e2e3:ca0d:6126","TLSv1.3","828","Application Data"
"131","1.250714891","2a00:1450:4028:80a::2004","2a0d:6fc7:505:6e3:b391:e2e3:ca0d:6126","TLSv1.3","145","Application Data"
"132","1.250887520","2a0d:6fc7:505:6e3:b391:e2e3:ca0d:6126","2a00:1450:4028:80a::2004","TCP","86","59984  >  443 [ACK] Seq=3049 Ack=33536 Win=48768 Len=0 TSval=482065392 TSecr=2600509727"
"133","1.251934886","2a0d:6fc7:505:6e3:b391:e2e3:ca0d:6126","2a00:1450:4028:80a::2004","TLSv1.3","244","Application Data"
"134","1.267053388","2a00:1450:4028:80a::2004","2a0d:6fc7:505:6e3:b391:e2e3:ca0d:6126","TLSv1.3","1294","Application Data"
"135","1.267053636","2a00:1450:4028:80a::2004","2a0d:6fc7:505:6e3:b391:e2e3:ca0d:6126","TLSv1.3","982","Application Data"
"136","1.267053664","2a00:1450:4028:804::2003","2a0d:6fc7:505:6e3:b391:e2e3:ca0d:6126","TCP","86","80  >  38206 [ACK] Seq=702 Ack=825 Win=269312 Len=0 TSval=809732974 TSecr=3994642500"
"137","1.267088862","2a0d:6fc7:505:6e3:b391:e2e3:ca0d:6126","2a00:1450:4028:80a::2004","TCP","86","59984  >  443 [ACK] Seq=3207 Ack=35640 Win=53632 Len=0 TSval=482065408 TSecr=2600509736"
"138","1.273052104","2a00:1450:4028:80a::2004","2a0d:6fc7:505:6e3:b391:e2e3:ca0d:6126","TLSv1.3","1294","Application Data"
"139","1.273052389","2a00:1450:4028:80a::2004","2a0d:6fc7:505:6e3:b391:e2e3:ca0d:6126","TLSv1.3","1294","Application Data"
"140","1.273052408","2a00:1450:4028:80a::2004","2a0d:6fc7:505:6e3:b391:e2e3:ca0d:6126","TLSv1.3","2502","Application Data, Application Data"
"141","1.273087869","2a0d:6fc7:505:6e3:b391:e2e3:ca0d:6126","2a00:1450:4028:80a::2004","TCP","86","59984  >  443 [ACK] Seq=3207 Ack=38056 Win=58496 Len=0 TSval=482065414 TSecr=2600509746"
"142","1.273160256","2a0d:6fc7:505:6e3:b391:e2e3:ca0d:6126","2a00:1450:4028:80a::2004","TCP","86","59984  >  443 [ACK] Seq=3207 Ack=40472 Win=63360 Len=0 TSval=482065415 TSecr=2600509748"
"143","1.274002678","2a00:1450:4028:80a::2004","2a0d:6fc7:505:6e3:b391:e2e3:ca0d:6126","TLSv1.3","1294","Application Data"
"144","1.274516975","2a00:1450:4028:80a::2004","2a0d:6fc7:505:6e3:b391:e2e3:ca0d:6126","TLSv1.3","1294","Application Data"
"145","1.274517101","2a00:1450:4028:80a::2003","2a0d:6fc7:505:6e3:b391:e2e3:ca0d:6126","QUIC","1399","Handshake, DCID=d624aa, SCID=ef91abbbba2f77ad"
"146","1.274517120","2a00:1450:4028:80a::2003","2a0d:6fc7:505:6e3:b391:e2e3:ca0d:6126","QUIC","1399","Handshake, DCID=d624aa, SCID=ef91abbbba2f77ad"
"147","1.274517140","2a00:1450:4028:80a::2003","2a0d:6fc7:505:6e3:b391:e2e3:ca0d:6126","QUIC","1399","Handshake, DCID=d624aa, SCID=ef91abbbba2f77ad"
"148","1.274517159","2a00:1450:4028:80a::2003","2a0d:6fc7:505:6e3:b391:e2e3:ca0d:6126","QUIC","105","Handshake, DCID=d624aa, SCID=ef91abbbba2f77ad"
"149","1.274526013","2a0d:6fc7:505:6e3:b391:e2e3:ca0d:6126","2a00:1450:4028:80a::2004","TCP","86","59984  >  443 [ACK] Seq=3207 Ack=42888 Win=68096 Len=0 TSval=482065416 TSecr=2600509750"
"150","1.277322950","2a0d:6fc7:505:6e3:b391:e2e3:ca0d:6126","2a00:1450:4028:80a::2003","QUIC","104","Handshake, DCID=ef91abbbba2f77ad, SCID=d624aa"
"151","1.283780927","2a00:1450:4028:80a::2004","2a0d:6fc7:505:6e3:b391:e2e3:ca0d:6126","TLSv1.3","2502","Application Data, Application Data"
"152","1.283781066","2a00:1450:4028:80a::2004","2a0d:6fc7:505:6e3:b391:e2e3:ca0d:6126","TLSv1.3","186","Application Data"
"153","1.283781094","2a00:1450:4028:80a::2004","2a0d:6fc7:505:6e3:b391:e2e3:ca0d:6126","QUIC","105","Handshake, DCID=03e89b, SCID=efb6cc70e31b694f"
"154","1.283781113","2a0d:6fc7:505:6e3::be","2a0d:6fc7:505:6e3:b391:e2e3:ca0d:6126","DNS","164","Standard query response 0x2e27 AAAA www.googleadservices.com SOA ns1.google.com"
"155","1.283781132","2a00:1450:4028:80a::2004","2a0d:6fc7:505:6e3:b391:e2e3:ca0d:6126","QUIC","105","Handshake, DCID=03e89b, SCID=efb6cc70e31b694f"
"156","1.283809546","2a0d:6fc7:505:6e3:b391:e2e3:ca0d:6126","2a00:1450:4028:80a::2004","TCP","86","59984  >  443 [ACK] Seq=3207 Ack=45304 Win=72960 Len=0 TSval=482065425 TSecr=2600509752"
"157","1.284072746","2a0d:6fc7:505:6e3:b391:e2e3:ca0d:6126","2a0d:6fc7:505:6e3::be","DNS","104","Standard query 0x9e06 AAAA www.googleadservices.com"
"158","1.293789119","2a0d:6fc7:505:6e3::be","2a0d:6fc7:505:6e3:b391:e2e3:ca0d:6126","DNS","104","Standard query response 0x9e06 AAAA www.googleadservices.com"
"159","1.293789377","2a00:1450:4028:80a::2004","2a0d:6fc7:505:6e3:b391:e2e3:ca0d:6126","TCP","86","443  >  59984 [ACK] Seq=45404 Ack=3207 Win=267520 Len=0 TSval=2600509770 TSecr=482065393"
"160","1.294281331","2a0d:6fc7:505:6e3:b391:e2e3:ca0d:6126","2a0d:6fc7:505:6e3::be","DNS","104","Standard query 0x0521 AAAA www.googleadservices.com"
"161","1.294855402","2a0d:6fc7:505:6e3:b391:e2e3:ca0d:6126","2a00:1450:4028:80a::2004","TLSv1.3","186","Application Data"
"162","1.294927774","2a0d:6fc7:505:6e3:b391:e2e3:ca0d:6126","2a00:1450:4028:80a::2004","TLSv1.3","121","Application Data"
"163","1.298424373","2a0d:6fc7:505:6e3::be","2a0d:6fc7:505:6e3:b391:e2e3:ca0d:6126","DNS","104","Standard query response 0x0521 AAAA www.googleadservices.com"
"164","1.298661822","2a0d:6fc7:505:6e3:b391:e2e3:ca0d:6126","2a0d:6fc7:505:6e3::be","DNS","104","Standard query 0x07b0 AAAA www.googleadservices.com"
"165","1.303756731","2a0d:6fc7:505:6e3:b391:e2e3:ca0d:6126","2a00:1450:4028:80a::2004","TLSv1.3","359","Application Data"
"166","1.304009910","2a0d:6fc7:505:6e3:b391:e2e3:ca0d:6126","2a00:1450:4028:80a::2004","TLSv1.3","117","Application Data"
"167","1.309507767","2a00:1450:4028:80a::2004","2a0d:6fc7:505:6e3:b391:e2e3:ca0d:6126","TLSv1.3","1294","Application Data"
"168","1.311331628","2a0d:6fc7:505:6e3::be","2a0d:6fc7:505:6e3:b391:e2e3:ca0d:6126","DNS","104","Standard query response 0x07b0 AAAA www.googleadservices.com"
"169","1.321215868","2a00:1450:4028:80a::2004","2a0d:6fc7:505:6e3:b391:e2e3:ca0d:6126","TLSv1.3","1294","Application Data"
"170","1.321245721","2a0d:6fc7:505:6e3:b391:e2e3:ca0d:6126","2a00:1450:4028:80a::2004","TCP","86","59984  >  443 [ACK] Seq=3646 Ack=47820 Win=77824 Len=0 TSval=482065463 TSecr=2600509786"
"171","1.326119222","2a00:1450:4028:80a::2004","2a0d:6fc7:505:6e3:b391:e2e3:ca0d:6126","TLSv1.3","2502","Application Data, Application Data"
"172","1.326119454","2a00:1450:4028:80a::2004","2a0d:6fc7:505:6e3:b391:e2e3:ca0d:6126","TLSv1.3","2502","Application Data, Application Data"
"173","1.326119472","2a00:1450:4028:80a::2004","2a0d:6fc7:505:6e3:b391:e2e3:ca0d:6126","TLSv1.3","2502","Application Data, Application Data"
"174","1.326119490","2a00:1450:4028:80a::2004","2a0d:6fc7:505:6e3:b391:e2e3:ca0d:6126","TLSv1.3","2502","Application Data, Application Data"
"175","1.326151800","2a0d:6fc7:505:6e3:b391:e2e3:ca0d:6126","2a00:1450:4028:80a::2004","TCP","86","59984  >  443 [ACK] Seq=3646 Ack=50236 Win=82688 Len=0 TSval=482065468 TSecr=2600509788"
"176","1.326232635","2a0d:6fc7:505:6e3:b391:e2e3:ca0d:6126","2a00:1450:4028:80a::2004","TCP","86","59984  >  443 [ACK] Seq=3646 Ack=52652 Win=87424 Len=0 TSval=482065468 TSecr=2600509790"
"177","1.326254357","2a0d:6fc7:505:6e3:b391:e2e3:ca0d:6126","2a00:1450:4028:80a::2004","TCP","86","59984  >  443 [ACK] Seq=3646 Ack=55068 Win=92288 Len=0 TSval=482065468 TSecr=2600509792"
"178","1.326271302","2a0d:6fc7:505:6e3:b391:e2e3:ca0d:6126","2a00:1450:4028:80a::2004","TCP","86","59984  >  443 [ACK] Seq=3646 Ack=57484 Win=97152 Len=0 TSval=482065468 TSecr=2600509794"
"179","1.328398355","2a0d:6fc7:505:6e3:b391:e2e3:ca0d:6126","2a00:1450:4028:80a::2004","QUIC","102","Handshake, DCID=efb6cc70e31b694f, SCID=03e89b"
"180","1.328575380","2a0d:6fc7:505:6e3:b391:e2e3:ca0d:6126","2a00:1450:4028:80a::2004","QUIC","102","Handshake, DCID=efb6cc70e31b694f, SCID=03e89b"
"181","1.329323405","2a00:1450:4028:80a::2004","2a0d:6fc7:505:6e3:b391:e2e3:ca0d:6126","TLSv1.3","2502","Application Data, Application Data"
"182","1.329323642","2a00:1450:4028:80a::2004","2a0d:6fc7:505:6e3:b391:e2e3:ca0d:6126","TLSv1.3","1509","Application Data, Application Data"
"183","1.329323661","2a00:1450:4028:80a::2004","2a0d:6fc7:505:6e3:b391:e2e3:ca0d:6126","TLSv1.3","1294","Application Data"
"184","1.329323682","2a00:1450:4028:80a::2004","2a0d:6fc7:505:6e3:b391:e2e3:ca0d:6126","TLSv1.3","1294","Application Data"
"185","1.329363729","2a0d:6fc7:505:6e3:b391:e2e3:ca0d:6126","2a00:1450:4028:80a::2004","TCP","86","59984  >  443 [ACK] Seq=3646 Ack=59900 Win=102016 Len=0 TSval=482065471 TSecr=2600509796"
"186","1.329436412","2a0d:6fc7:505:6e3:b391:e2e3:ca0d:6126","2a00:1450:4028:80a::2004","TCP","86","59984  >  443 [ACK] Seq=3646 Ack=63739 Win=104576 Len=0 TSval=482065471 TSecr=2600509798"
"187","1.332335775","2a00:1450:4028:80a::2003","2a0d:6fc7:505:6e3:b391:e2e3:ca0d:6126","QUIC","405","Protected Payload (KP0), DCID=d624aa"
"188","1.333254167","2a0d:6fc7:505:6e3:b391:e2e3:ca0d:6126","2a00:1450:4028:80a::2003","QUIC","105","Handshake, DCID=ef91abbbba2f77ad, SCID=d624aa"
"189","1.335316523","2a00:1450:4028:80a::2004","2a0d:6fc7:505:6e3:b391:e2e3:ca0d:6126","TLSv1.3","2502","Application Data, Application Data"
"190","1.335316770","2a00:1450:4028:80a::2004","2a0d:6fc7:505:6e3:b391:e2e3:ca0d:6126","TLSv1.3","1294","Application Data"
"191","1.335349580","2a0d:6fc7:505:6e3:b391:e2e3:ca0d:6126","2a00:1450:4028:80a::2004","TCP","86","59984  >  443 [ACK] Seq=3646 Ack=66155 Win=109440 Len=0 TSval=482065477 TSecr=2600509804"
"192","1.335814223","2a00:1450:4028:80a::2004","2a0d:6fc7:505:6e3:b391:e2e3:ca0d:6126","TLSv1.3","1294","Application Data"
"193","1.335814434","2a00:1450:4028:80a::2004","2a0d:6fc7:505:6e3:b391:e2e3:ca0d:6126","TLSv1.3","2502","Application Data, Application Data"
"194","1.335814453","2a00:1450:4028:80a::2004","2a0d:6fc7:505:6e3:b391:e2e3:ca0d:6126","TCP","86","443  >  59984 [ACK] Seq=70987 Ack=3342 Win=267520 Len=0 TSval=2600509810 TSecr=482065436"
"195","1.335814472","2a00:1450:4028:80a::2004","2a0d:6fc7:505:6e3:b391:e2e3:ca0d:6126","TLSv1.3","2502","Application Data, Application Data"
"196","1.335838910","2a0d:6fc7:505:6e3:b391:e2e3:ca0d:6126","2a00:1450:4028:80a::2004","TCP","86","59984  >  443 [ACK] Seq=3646 Ack=68571 Win=110720 Len=0 TSval=482065477 TSecr=2600509806"
"197","1.335891543","2a0d:6fc7:505:6e3:b391:e2e3:ca0d:6126","2a00:1450:4028:80a::2004","TCP","86","59984  >  443 [ACK] Seq=3646 Ack=70987 Win=108416 Len=0 TSval=482065477 TSecr=2600509808"
"198","1.335974568","2a0d:6fc7:505:6e3:b391:e2e3:ca0d:6126","2a00:1450:4028:80a::2004","TCP","86","59984  >  443 [ACK] Seq=3646 Ack=73403 Win=106240 Len=0 TSval=482065477 TSecr=2600509810"
"199","1.336355347","2a0d:6fc7:505:6e3:b391:e2e3:ca0d:6126","2a00:1450:4028:804::2003","OCSP","498","Request"
"200","1.342910076","2a0d:6fc7:505:6e3:b391:e2e3:ca0d:6126","2a00:1450:4028:80a::2004","TLSv1.3","642","Application Data"
"201","1.344772721","2a0d:6fc7:505:6e3:b391:e2e3:ca0d:6126","2a00:1450:4028:80a::2004","TLSv1.3","121","Application Data"
"202","1.346837915","2a00:1450:4028:80a::2004","2a0d:6fc7:505:6e3:b391:e2e3:ca0d:6126","TLSv1.3","1294","Application Data"
"203","1.347405753","2a0d:6fc7:505:6e3:b391:e2e3:ca0d:6126","2a0d:6fc7:505:6e3::be","DNS","98","Standard query 0x88ea AAAA csp.withgoogle.com"
"204","1.352719219","2a0d:6fc7:505:6e3:b391:e2e3:ca0d:6126","2a00:1450:4028:80a::2003","QUIC","102","Handshake, DCID=ef91abbbba2f77ad, SCID=d624aa"
"205","1.352888746","2a0d:6fc7:505:6e3:b391:e2e3:ca0d:6126","2a00:1450:4028:80a::2003","QUIC","102","Handshake, DCID=ef91abbbba2f77ad, SCID=d624aa"
"206","1.362062067","2a00:1450:4028:80a::2004","2a0d:6fc7:505:6e3:b391:e2e3:ca0d:6126","TLSv1.3","1294","Application Data"
"207","1.362062319","2a00:1450:4028:80a::2004","2a0d:6fc7:505:6e3:b391:e2e3:ca0d:6126","TLSv1.3","2285","Application Data, Application Data"
"208","1.362062341","2a00:1450:4028:80a::2004","2a0d:6fc7:505:6e3:b391:e2e3:ca0d:6126","TLSv1.3","2502","Application Data, Application Data"
"209","1.362062362","2a00:1450:4028:80a::2004","2a0d:6fc7:505:6e3:b391:e2e3:ca0d:6126","TLSv1.3","2502","Application Data, Application Data"
"210","1.362062383","2a00:1450:4028:80a::2004","2a0d:6fc7:505:6e3:b391:e2e3:ca0d:6126","TLSv1.3","2252","Application Data, Application Data, Application Data, Application Data, Application Data"
"211","1.362083280","2a0d:6fc7:505:6e3:b391:e2e3:ca0d:6126","2a00:1450:4028:80a::2004","TCP","86","59984  >  443 [ACK] Seq=4237 Ack=75819 Win=110720 Len=0 TSval=482065503 TSecr=2600509813"
"212","1.362209381","2a00:1450:4028:80a::2004","2a0d:6fc7:505:6e3:b391:e2e3:ca0d:6126","TCP","86","443  >  59984 [ACK] Seq=85016 Ack=3646 Win=267264 Len=0 TSval=2600509825 TSecr=482065445"
"213","1.362209561","2a00:1450:4028:80a::2004","2a0d:6fc7:505:6e3:b391:e2e3:ca0d:6126","TLSv1.3","404","Application Data"
"214","1.362209582","2a00:1450:4028:80a::2004","2a0d:6fc7:505:6e3:b391:e2e3:ca0d:6126","TLSv1.3","117","Application Data"
"215","1.362233229","2a0d:6fc7:505:6e3:b391:e2e3:ca0d:6126","2a00:1450:4028:80a::2004","TCP","86","59984  >  443 [ACK] Seq=4237 Ack=85365 Win=101248 Len=0 TSval=482065504 TSecr=2600509815"
"216","1.362578955","2a0d:6fc7:505:6e3:b391:e2e3:ca0d:6126","2a00:1450:4028:80a::2004","TLSv1.3","125","Application Data"
"217","1.369457760","2a0d:6fc7:505:6e3:b391:e2e3:ca0d:6126","2a0d:6fc7:505:6e3::be","DNS","95","Standard query 0x57a3 AAAA www.gstatic.com"
"218","1.375025729","2a00:1450:4028:804::2003","2a0d:6fc7:505:6e3:b391:e2e3:ca0d:6126","TCP","86","80  >  38212 [ACK] Seq=702 Ack=825 Win=269312 Len=0 TSval=4228420144 TSecr=3994642616"
"219","1.375026051","2a00:1450:4028:80a::2004","2a0d:6fc7:505:6e3:b391:e2e3:ca0d:6126","QUIC","104","Handshake, DCID=03e89b, SCID=efb6cc70e31b694f"
"220","1.386106849","2a0d:6fc7:505:6e3:b391:e2e3:ca0d:6126","2a0d:6fc7:505:6e3::be","DNS","95","Standard query 0x8928 AAAA www.gstatic.com"
"221","1.399811405","2a0d:6fc7:505:6e3::be","2a0d:6fc7:505:6e3:b391:e2e3:ca0d:6126","DNS","126","Standard query response 0x88ea AAAA csp.withgoogle.com AAAA 2a00:1450:4028:80a::2011"
"222","1.399811525","2a00:1450:4028:80a::2004","2a0d:6fc7:505:6e3:b391:e2e3:ca0d:6126","TCP","86","443  >  59984 [ACK] Seq=85365 Ack=4237 Win=266752 Len=0 TSval=2600509864 TSecr=482065484"
"223","1.399811543","2a00:1450:4028:80a::2003","2a0d:6fc7:505:6e3:b391:e2e3:ca0d:6126","QUIC","105","Handshake, DCID=d624aa, SCID=ef91abbbba2f77ad"
"224","1.399811561","2a00:1450:4028:804::2003","2a0d:6fc7:505:6e3:b391:e2e3:ca0d:6126","OCSP","787","Response"
"225","1.399811579","2a00:1450:4028:80a::2003","2a0d:6fc7:505:6e3:b391:e2e3:ca0d:6126","QUIC","105","Handshake, DCID=d624aa, SCID=ef91abbbba2f77ad"
"226","1.399811597","2a00:1450:4028:80a::2004","2a0d:6fc7:505:6e3:b391:e2e3:ca0d:6126","TCP","86","443  >  59984 [ACK] Seq=85365 Ack=4276 Win=266752 Len=0 TSval=2600509878 TSecr=482065504"
"227","1.399851422","2a0d:6fc7:505:6e3:b391:e2e3:ca0d:6126","2a00:1450:4028:804::2003","TCP","86","38206  >  80 [ACK] Seq=825 Ack=1403 Win=31872 Len=0 TSval=3994642679 TSecr=809733110"
"228","1.402286883","2a0d:6fc7:505:6e3:b391:e2e3:ca0d:6126","2a00:1450:4028:80a::2004","QUIC","172","Protected Payload (KP0), DCID=efb6cc70e31b694f"
"229","1.402529620","2a0d:6fc7:505:6e3:b391:e2e3:ca0d:6126","2a00:1450:4028:80a::2004","QUIC","129","Protected Payload (KP0), DCID=efb6cc70e31b694f"
"230","1.404421126","2a0d:6fc7:505:6e3:b391:e2e3:ca0d:6126","2a00:1450:4028:80a::2011","QUIC","1399","Initial, DCID=eb26b954b1f78ea3, SCID=71993d, PKN: 0, CRYPTO"
"231","1.412649204","2a0d:6fc7:505:6e3::be","2a0d:6fc7:505:6e3:b391:e2e3:ca0d:6126","DNS","123","Standard query response 0x57a3 AAAA www.gstatic.com AAAA 2a00:1450:4028:80a::2003"
"232","1.422794605","2a00:1450:4028:80a::2004","2a0d:6fc7:505:6e3:b391:e2e3:ca0d:6126","TLSv1.3","402","Application Data"
"233","1.422794730","2a00:1450:4028:80a::2004","2a0d:6fc7:505:6e3:b391:e2e3:ca0d:6126","TLSv1.3","117","Application Data"
"234","1.423020525","2a0d:6fc7:505:6e3:b391:e2e3:ca0d:6126","2a00:1450:4028:80a::2004","TCP","86","59984  >  443 [ACK] Seq=4276 Ack=85712 Win=110720 Len=0 TSval=482065564 TSecr=2600509902"
"235","1.423518575","2a0d:6fc7:505:6e3:b391:e2e3:ca0d:6126","2a00:1450:4028:80a::2004","TLSv1.3","125","Application Data"
"236","1.423801761","2a0d:6fc7:505:6e3:b391:e2e3:ca0d:6126","2a00:1450:4028:80a::2004","TLSv1.3","110","Application Data"
"237","1.423900175","2a0d:6fc7:505:6e3:b391:e2e3:ca0d:6126","2a00:1450:4028:80a::2004","TCP","86","59984  >  443 [FIN, ACK] Seq=4339 Ack=85712 Win=110720 Len=0 TSval=482065565 TSecr=2600509902"
"238","1.424275125","2a00:1450:4028:80a::2004","2a0d:6fc7:505:6e3:b391:e2e3:ca0d:6126","TLSv1.3","125","Application Data"
"239","1.424302749","2a0d:6fc7:505:6e3:b391:e2e3:ca0d:6126","2a00:1450:4028:80a::2004","TCP","74","59984  >  443 [RST] Seq=4276 Win=0 Len=0"
"240","1.432923592","2a0d:6fc7:505:6e3::be","2a0d:6fc7:505:6e3:b391:e2e3:ca0d:6126","DNS","123","Standard query response 0x8928 AAAA www.gstatic.com AAAA 2a00:1450:4028:805::2003"
"241","1.433571346","2a0d:6fc7:505:6e3:b391:e2e3:ca0d:6126","2a00:1450:4028:805::2003","QUIC","1399","Initial, DCID=e9e231a2e884c77ff1d35643549d, SCID=b41f8e, PKN: 0, CRYPTO"
"242","1.441328430","2a00:1450:4028:80a::2004","2a0d:6fc7:505:6e3:b391:e2e3:ca0d:6126","QUIC","677","Protected Payload (KP0), DCID=03e89b"
"243","1.441328783","2a00:1450:4028:80a::2004","2a0d:6fc7:505:6e3:b391:e2e3:ca0d:6126","QUIC","186","Protected Payload (KP0), DCID=03e89b"
"244","1.443754290","2a0d:6fc7:505:6e3:b391:e2e3:ca0d:6126","2a00:1450:4028:80a::2004","QUIC","95","Protected Payload (KP0), DCID=efb6cc70e31b694f"
"245","1.448289139","2a0d:6fc7:505:6e3:b391:e2e3:ca0d:6126","2a00:1450:4028:80a::2011","TCP","94","39682  >  443 [SYN] Seq=0 Win=33120 Len=0 MSS=1440 SACK_PERM TSval=1587443953 TSecr=0 WS=128"
"246","1.451494856","2a0d:6fc7:505:6e3:b391:e2e3:ca0d:6126","2a00:1450:4028:80a::2003","QUIC","102","Handshake, DCID=ef91abbbba2f77ad, SCID=d624aa"
"247","1.451673003","2a0d:6fc7:505:6e3:b391:e2e3:ca0d:6126","2a00:1450:4028:80a::2003","QUIC","102","Handshake, DCID=ef91abbbba2f77ad, SCID=d624aa"
"248","1.466360385","2a00:1450:4028:80a::2011","2a0d:6fc7:505:6e3:b391:e2e3:ca0d:6126","QUIC","1399","Initial, DCID=71993d, SCID=eb26b954b1f78ea3, PKN: 1, ACK, CRYPTO, PADDING"
"249","1.467001614","2a0d:6fc7:505:6e3:b391:e2e3:ca0d:6126","2a00:1450:4028:80a::2011","QUIC","102","Handshake, DCID=eb26b954b1f78ea3, SCID=71993d"
"250","1.467623671","2a00:1450:4028:80a::2004","2a0d:6fc7:505:6e3:b391:e2e3:ca0d:6126","QUIC","89","Protected Payload (KP0), DCID=03e89b"
"251","1.468945369","2a00:1450:4028:80a::2004","2a0d:6fc7:505:6e3:b391:e2e3:ca0d:6126","TCP","86","443  >  59984 [ACK] Seq=85751 Ack=4340 Win=266752 Len=0 TSval=2600509947 TSecr=482065565"
"252","1.468945443","2a00:1450:4028:80a::2004","2a0d:6fc7:505:6e3:b391:e2e3:ca0d:6126","TCP","86","443  >  59984 [FIN, ACK] Seq=85751 Ack=4340 Win=266752 Len=0 TSval=2600509947 TSecr=482065565"
"253","1.468963551","2a0d:6fc7:505:6e3:b391:e2e3:ca0d:6126","2a00:1450:4028:80a::2004","TCP","74","59984  >  443 [RST] Seq=4340 Win=0 Len=0"
