"No.","Time","Source","Destination","Protocol","Length","Info"
"1","0.000000000","2a0d:6fc7:505:6e3:b391:e2e3:ca0d:6126","2001:40a8:4400:287::30bc","TCP","86","34108  >  443 [FIN, ACK] Seq=1 Ack=1 Win=249 Len=0 TSval=310091321 TSecr=3785802616"
"2","0.001181709","2a0d:6fc7:505:6e3:b391:e2e3:ca0d:6126","2001:40a8:4400:287::30bc","TCP","94","34118  >  443 [SYN] Seq=0 Win=33120 Len=0 MSS=1440 SACK_PERM TSval=310091323 TSecr=0 WS=128"
"3","0.040378672","192.168.56.42","142.250.75.46","TLSv1.2","128","Application Data"
"4","0.040949262","192.168.56.42","142.250.75.46","TLSv1.2","209","Application Data, Application Data"
"5","0.118522111","2001:40a8:4400:287::30bc","2a0d:6fc7:505:6e3:b391:e2e3:ca0d:6126","TCP","86","443  >  34108 [ACK] Seq=1 Ack=2 Win=501 Len=0 TSval=3785814403 TSecr=310091321"
"6","0.129752327","2001:40a8:4400:287::30bc","2a0d:6fc7:505:6e3:b391:e2e3:ca0d:6126","TCP","94","443  >  34118 [SYN, ACK] Seq=0 Ack=1 Win=64260 Len=0 MSS=1300 SACK_PERM TSval=1735644493 TSecr=310091323 WS=128"
"7","0.129752930","142.250.75.46","192.168.56.42","TCP","66","443  >  59480 [ACK] Seq=1 Ack=63 Win=1043 Len=0 TSval=2930283586 TSecr=2296144613"
"8","0.129895946","2a0d:6fc7:505:6e3:b391:e2e3:ca0d:6126","2001:40a8:4400:287::30bc","TCP","86","34118  >  443 [ACK] Seq=1 Ack=1 Win=33152 Len=0 TSval=310091451 TSecr=1735644493"
"9","0.129753015","142.250.75.46","192.168.56.42","TCP","66","443  >  59480 [ACK] Seq=1 Ack=206 Win=1043 Len=0 TSval=2930283586 TSecr=2296144613"
"10","0.129753092","142.250.75.46","192.168.56.42","TLSv1.2","105","Application Data"
"11","0.132909883","2a0d:6fc7:505:6e3:b391:e2e3:ca0d:6126","2001:40a8:4400:287::30bc","TCP","1374","34118  >  443 [ACK] Seq=1 Ack=1 Win=33152 Len=1288 TSval=310091454 TSecr=1735644493 [TCP segment of a reassembled PDU]"
"12","0.132926697","2a0d:6fc7:505:6e3:b391:e2e3:ca0d:6126","2001:40a8:4400:287::30bc","TLSv1.3","857","Client Hello (SNI=www.ynet.co.il)"
"13","0.174262258","192.168.56.42","142.250.75.46","TCP","66","59480  >  443 [ACK] Seq=206 Ack=40 Win=249 Len=0 TSval=2296144747 TSecr=2930283587"
"14","0.184621939","2001:40a8:4400:287::30bc","2a0d:6fc7:505:6e3:b391:e2e3:ca0d:6126","TCP","86","443  >  34118 [ACK] Seq=1 Ack=2060 Win=63360 Len=0 TSval=1735644552 TSecr=310091454"
"15","0.184622801","2001:40a8:4400:287::30bc","2a0d:6fc7:505:6e3:b391:e2e3:ca0d:6126","TLSv1.3","350","Server Hello, Change Cipher Spec, Encrypted Extensions, Finished"
"16","0.184727921","2a0d:6fc7:505:6e3:b391:e2e3:ca0d:6126","2001:40a8:4400:287::30bc","TCP","86","34118  >  443 [ACK] Seq=2060 Ack=265 Win=32896 Len=0 TSval=310091506 TSecr=1735644552"
"17","0.185590133","2a0d:6fc7:505:6e3:b391:e2e3:ca0d:6126","2001:40a8:4400:287::30bc","TLSv1.3","166","Change Cipher Spec, Finished"
"18","0.192864432","142.250.75.46","192.168.56.42","TLSv1.2","160","Application Data"
"19","0.192865066","142.250.75.46","192.168.56.42","TLSv1.2","312","Application Data"
"20","0.192865134","142.250.75.46","192.168.56.42","TLSv1.2","97","Application Data"
"21","0.192865207","142.250.75.46","192.168.56.42","TLSv1.2","105","Application Data"
"22","0.192983372","192.168.56.42","142.250.75.46","TCP","66","59480  >  443 [ACK] Seq=206 Ack=134 Win=249 Len=0 TSval=2296144765 TSecr=2930283652"
"23","0.193265740","192.168.56.42","142.250.75.46","TCP","66","59480  >  443 [ACK] Seq=206 Ack=450 Win=249 Len=0 TSval=2296144766 TSecr=2930283652"
"24","0.196398790","192.168.56.42","142.250.75.46","TLSv1.2","101","Application Data"
"25","0.196720248","192.168.56.42","142.250.75.46","TLSv1.2","105","Application Data"
"26","0.226216777","2001:40a8:4400:287::30bc","2a0d:6fc7:505:6e3:b391:e2e3:ca0d:6126","TCP","86","443  >  34118 [ACK] Seq=265 Ack=2140 Win=64128 Len=0 TSval=1735644593 TSecr=310091507"
"27","0.235200912","2001:40a8:4400:287::30bc","2a0d:6fc7:505:6e3:b391:e2e3:ca0d:6126","TLSv1.3","373","New Session Ticket"
"28","0.235201195","142.250.75.46","192.168.56.42","TCP","66","443  >  59480 [ACK] Seq=450 Ack=241 Win=1043 Len=0 TSval=2930283690 TSecr=2296144769"
"29","0.237110413","142.250.75.46","192.168.56.42","TCP","66","443  >  59480 [ACK] Seq=450 Ack=280 Win=1043 Len=0 TSval=2930283694 TSecr=2296144769"
"30","0.276457940","2a0d:6fc7:505:6e3:b391:e2e3:ca0d:6126","2001:40a8:4400:287::30bc","HTTP2","178","Magic, SETTINGS[0], WINDOW_UPDATE[0]"
"31","0.277037399","2a0d:6fc7:505:6e3:b391:e2e3:ca0d:6126","2001:40a8:4400:287::30bc","TCP","1374","34118  >  443 [ACK] Seq=2232 Ack=552 Win=32640 Len=1288 TSval=310091599 TSecr=1735644593 [TCP segment of a reassembled PDU]"
"32","0.277042443","2a0d:6fc7:505:6e3:b391:e2e3:ca0d:6126","2001:40a8:4400:287::30bc","TCP","1374","34118  >  443 [PSH, ACK] Seq=3520 Ack=552 Win=32640 Len=1288 TSval=310091599 TSecr=1735644593 [TCP segment of a reassembled PDU]"
"33","0.277230290","2a0d:6fc7:505:6e3:b391:e2e3:ca0d:6126","2001:40a8:4400:287::30bc","HTTP2","305","HEADERS[1]: GET /home/0,7340,L-8,00.html"
"34","0.325533938","2001:40a8:4400:287::30bc","2a0d:6fc7:505:6e3:b391:e2e3:ca0d:6126","TCP","86","443  >  34118 [ACK] Seq=552 Ack=2232 Win=64128 Len=0 TSval=1735644691 TSecr=310091598"
"35","0.325534207","2001:40a8:4400:287::30bc","2a0d:6fc7:505:6e3:b391:e2e3:ca0d:6126","TCP","86","443  >  34118 [ACK] Seq=552 Ack=3520 Win=64128 Len=0 TSval=1735644691 TSecr=310091599"
"36","0.330661282","2001:40a8:4400:287::30bc","2a0d:6fc7:505:6e3:b391:e2e3:ca0d:6126","TCP","86","443  >  34118 [ACK] Seq=552 Ack=4808 Win=63360 Len=0 TSval=1735644693 TSecr=310091599"
"37","0.330661632","2001:40a8:4400:287::30bc","2a0d:6fc7:505:6e3:b391:e2e3:ca0d:6126","TCP","86","443  >  34118 [ACK] Seq=552 Ack=5027 Win=63232 Len=0 TSval=1735644693 TSecr=310091599"
"38","0.352364185","2001:40a8:4400:287::30bc","2a0d:6fc7:505:6e3:b391:e2e3:ca0d:6126","HTTP2","147","SETTINGS[0]"
"39","0.352364334","2001:40a8:4400:287::30bc","2a0d:6fc7:505:6e3:b391:e2e3:ca0d:6126","HTTP2","117","SETTINGS[0]"
"40","0.352364366","2001:40a8:4400:287::30bc","2a0d:6fc7:505:6e3:b391:e2e3:ca0d:6126","HTTP2","399","HEADERS[1]: 200 OK"
"41","0.352364401","2001:40a8:4400:287::30bc","2a0d:6fc7:505:6e3:b391:e2e3:ca0d:6126","TCP","2662","443  >  34118 [PSH, ACK] Seq=957 Ack=5027 Win=64128 Len=2576 TSval=1735644719 TSecr=310091599 [TCP segment of a reassembled PDU]"
"42","0.352364434","2001:40a8:4400:287::30bc","2a0d:6fc7:505:6e3:b391:e2e3:ca0d:6126","TCP","2662","443  >  34118 [PSH, ACK] Seq=3533 Ack=5027 Win=64128 Len=2576 TSval=1735644719 TSecr=310091599 [TCP segment of a reassembled PDU]"
"43","0.352364467","2001:40a8:4400:287::30bc","2a0d:6fc7:505:6e3:b391:e2e3:ca0d:6126","TCP","2662","443  >  34118 [PSH, ACK] Seq=6109 Ack=5027 Win=64128 Len=2576 TSval=1735644719 TSecr=310091599 [TCP segment of a reassembled PDU]"
"44","0.352494443","2a0d:6fc7:505:6e3:b391:e2e3:ca0d:6126","2001:40a8:4400:287::30bc","TCP","86","34118  >  443 [ACK] Seq=5027 Ack=8685 Win=31872 Len=0 TSval=310091674 TSecr=1735644719"
"45","0.352955220","2a0d:6fc7:505:6e3:b391:e2e3:ca0d:6126","2001:40a8:4400:287::30bc","HTTP2","117","SETTINGS[0]"
"46","0.353994654","2001:40a8:4400:287::30bc","2a0d:6fc7:505:6e3:b391:e2e3:ca0d:6126","TCP","2662","443  >  34118 [PSH, ACK] Seq=8685 Ack=5027 Win=64128 Len=2576 TSval=1735644719 TSecr=310091599 [TCP segment of a reassembled PDU]"
"47","0.353994956","2001:40a8:4400:287::30bc","2a0d:6fc7:505:6e3:b391:e2e3:ca0d:6126","TCP","2662","443  >  34118 [PSH, ACK] Seq=11261 Ack=5027 Win=64128 Len=2576 TSval=1735644719 TSecr=310091599 [TCP segment of a reassembled PDU]"
"48","0.353994997","2001:40a8:4400:287::30bc","2a0d:6fc7:505:6e3:b391:e2e3:ca0d:6126","TCP","2662","443  >  34118 [PSH, ACK] Seq=13837 Ack=5027 Win=64128 Len=2576 TSval=1735644719 TSecr=310091599 [TCP segment of a reassembled PDU]"
"49","0.354018517","2a0d:6fc7:505:6e3:b391:e2e3:ca0d:6126","2001:40a8:4400:287::30bc","TCP","86","34118  >  443 [ACK] Seq=5058 Ack=11261 Win=31872 Len=0 TSval=310091676 TSecr=1735644719"
"50","0.354089800","2a0d:6fc7:505:6e3:b391:e2e3:ca0d:6126","2001:40a8:4400:287::30bc","TCP","86","34118  >  443 [ACK] Seq=5058 Ack=13837 Win=31872 Len=0 TSval=310091676 TSecr=1735644719"
"51","0.354134276","2a0d:6fc7:505:6e3:b391:e2e3:ca0d:6126","2001:40a8:4400:287::30bc","TCP","86","34118  >  443 [ACK] Seq=5058 Ack=16413 Win=31872 Len=0 TSval=310091676 TSecr=1735644719"
"52","0.360070105","2001:40a8:4400:287::30bc","2a0d:6fc7:505:6e3:b391:e2e3:ca0d:6126","TLSv1.3","1374","DATA[1]"
"53","0.395662064","2001:40a8:4400:287::30bc","2a0d:6fc7:505:6e3:b391:e2e3:ca0d:6126","TCP","2662","443  >  34118 [PSH, ACK] Seq=17701 Ack=5027 Win=64128 Len=2576 TSval=1735644756 TSecr=310091674 [TCP segment of a reassembled PDU]"
"54","0.395662394","2001:40a8:4400:287::30bc","2a0d:6fc7:505:6e3:b391:e2e3:ca0d:6126","TCP","2662","443  >  34118 [PSH, ACK] Seq=20277 Ack=5027 Win=64128 Len=2576 TSval=1735644757 TSecr=310091674 [TCP segment of a reassembled PDU]"
"55","0.395662436","2001:40a8:4400:287::30bc","2a0d:6fc7:505:6e3:b391:e2e3:ca0d:6126","TCP","2662","443  >  34118 [PSH, ACK] Seq=22853 Ack=5027 Win=64128 Len=2576 TSval=1735644760 TSecr=310091674 [TCP segment of a reassembled PDU]"
"56","0.395662469","2001:40a8:4400:287::30bc","2a0d:6fc7:505:6e3:b391:e2e3:ca0d:6126","TCP","2662","443  >  34118 [PSH, ACK] Seq=25429 Ack=5027 Win=64128 Len=2576 TSval=1735644762 TSecr=310091674 [TCP segment of a reassembled PDU]"
"57","0.395699120","2a0d:6fc7:505:6e3:b391:e2e3:ca0d:6126","2001:40a8:4400:287::30bc","TCP","86","34118  >  443 [ACK] Seq=5058 Ack=20277 Win=31872 Len=0 TSval=310091717 TSecr=1735644722"
"58","0.395827389","2a0d:6fc7:505:6e3:b391:e2e3:ca0d:6126","2001:40a8:4400:287::30bc","TCP","86","34118  >  443 [ACK] Seq=5058 Ack=22853 Win=31872 Len=0 TSval=310091717 TSecr=1735644757"
"59","0.395887784","2a0d:6fc7:505:6e3:b391:e2e3:ca0d:6126","2001:40a8:4400:287::30bc","TCP","86","34118  >  443 [ACK] Seq=5058 Ack=25429 Win=31872 Len=0 TSval=310091717 TSecr=1735644760"
"60","0.395926646","2a0d:6fc7:505:6e3:b391:e2e3:ca0d:6126","2001:40a8:4400:287::30bc","TCP","86","34118  >  443 [ACK] Seq=5058 Ack=28005 Win=31872 Len=0 TSval=310091717 TSecr=1735644762"
"61","0.397952253","2001:40a8:4400:287::30bc","2a0d:6fc7:505:6e3:b391:e2e3:ca0d:6126","TCP","2662","443  >  34118 [PSH, ACK] Seq=28005 Ack=5027 Win=64128 Len=2576 TSval=1735644765 TSecr=310091674 [TCP segment of a reassembled PDU]"
"62","0.398001707","2a0d:6fc7:505:6e3:b391:e2e3:ca0d:6126","2001:40a8:4400:287::30bc","TCP","86","34118  >  443 [ACK] Seq=5058 Ack=30581 Win=31872 Len=0 TSval=310091719 TSecr=1735644765"
"63","0.415784448","2001:40a8:4400:287::30bc","2a0d:6fc7:505:6e3:b391:e2e3:ca0d:6126","TCP","2662","443  >  34118 [PSH, ACK] Seq=30581 Ack=5027 Win=64128 Len=2576 TSval=1735644768 TSecr=310091674 [TCP segment of a reassembled PDU]"
"64","0.415784858","2001:40a8:4400:287::30bc","2a0d:6fc7:505:6e3:b391:e2e3:ca0d:6126","TLSv1.3","2662","DATA[1]"
"65","0.415784898","2001:40a8:4400:287::30bc","2a0d:6fc7:505:6e3:b391:e2e3:ca0d:6126","TCP","2662","443  >  34118 [PSH, ACK] Seq=35733 Ack=5058 Win=64128 Len=2576 TSval=1735644773 TSecr=310091674 [TCP segment of a reassembled PDU]"
"66","0.415784938","2001:40a8:4400:287::30bc","2a0d:6fc7:505:6e3:b391:e2e3:ca0d:6126","TCP","2662","443  >  34118 [PSH, ACK] Seq=38309 Ack=5058 Win=64128 Len=2576 TSval=1735644775 TSecr=310091674 [TCP segment of a reassembled PDU]"
"67","0.415873322","2a0d:6fc7:505:6e3:b391:e2e3:ca0d:6126","2001:40a8:4400:287::30bc","TCP","86","34118  >  443 [ACK] Seq=5058 Ack=33157 Win=37120 Len=0 TSval=310091737 TSecr=1735644768"
"68","0.415977272","2a0d:6fc7:505:6e3:b391:e2e3:ca0d:6126","2001:40a8:4400:287::30bc","TCP","86","34118  >  443 [ACK] Seq=5058 Ack=35733 Win=42240 Len=0 TSval=310091737 TSecr=1735644770"
"69","0.416007951","2a0d:6fc7:505:6e3:b391:e2e3:ca0d:6126","2001:40a8:4400:287::30bc","TCP","86","34118  >  443 [ACK] Seq=5058 Ack=38309 Win=47360 Len=0 TSval=310091738 TSecr=1735644773"
"70","0.416030188","2a0d:6fc7:505:6e3:b391:e2e3:ca0d:6126","2001:40a8:4400:287::30bc","TCP","86","34118  >  443 [ACK] Seq=5058 Ack=40885 Win=52480 Len=0 TSval=310091738 TSecr=1735644775"
"71","0.416067405","2001:40a8:4400:287::30bc","2a0d:6fc7:505:6e3:b391:e2e3:ca0d:6126","TCP","2662","443  >  34118 [PSH, ACK] Seq=40885 Ack=5058 Win=64128 Len=2576 TSval=1735644777 TSecr=310091674 [TCP segment of a reassembled PDU]"
"72","0.416067443","2001:40a8:4400:287::30bc","2a0d:6fc7:505:6e3:b391:e2e3:ca0d:6126","TCP","2662","443  >  34118 [PSH, ACK] Seq=43461 Ack=5058 Win=64128 Len=2576 TSval=1735644779 TSecr=310091674 [TCP segment of a reassembled PDU]"
"73","0.416070469","2a0d:6fc7:505:6e3:b391:e2e3:ca0d:6126","2001:40a8:4400:287::30bc","TCP","86","34118  >  443 [ACK] Seq=5058 Ack=43461 Win=57728 Len=0 TSval=310091738 TSecr=1735644777"
"74","0.416101692","2a0d:6fc7:505:6e3:b391:e2e3:ca0d:6126","2001:40a8:4400:287::30bc","TCP","86","34118  >  443 [ACK] Seq=5058 Ack=46037 Win=62848 Len=0 TSval=310091738 TSecr=1735644779"
"75","0.419208004","2001:40a8:4400:287::30bc","2a0d:6fc7:505:6e3:b391:e2e3:ca0d:6126","TCP","2662","443  >  34118 [PSH, ACK] Seq=46037 Ack=5058 Win=64128 Len=2576 TSval=1735644786 TSecr=310091717 [TCP segment of a reassembled PDU]"
"76","0.419234753","2a0d:6fc7:505:6e3:b391:e2e3:ca0d:6126","2001:40a8:4400:287::30bc","TCP","86","34118  >  443 [ACK] Seq=5058 Ack=48613 Win=67968 Len=0 TSval=310091741 TSecr=1735644786"
"77","0.419385155","2001:40a8:4400:287::30bc","2a0d:6fc7:505:6e3:b391:e2e3:ca0d:6126","TLSv1.3","2662","DATA[1]"
"78","0.419390800","2a0d:6fc7:505:6e3:b391:e2e3:ca0d:6126","2001:40a8:4400:287::30bc","TCP","86","34118  >  443 [ACK] Seq=5058 Ack=51189 Win=73088 Len=0 TSval=310091741 TSecr=1735644787"
"79","0.425175049","2001:40a8:4400:287::30bc","2a0d:6fc7:505:6e3:b391:e2e3:ca0d:6126","TCP","2662","443  >  34118 [PSH, ACK] Seq=51189 Ack=5058 Win=64128 Len=2576 TSval=1735644789 TSecr=310091717 [TCP segment of a reassembled PDU]"
"80","0.425216427","2a0d:6fc7:505:6e3:b391:e2e3:ca0d:6126","2001:40a8:4400:287::30bc","TCP","86","34118  >  443 [ACK] Seq=5058 Ack=53765 Win=78336 Len=0 TSval=310091747 TSecr=1735644789"
"81","0.429970528","2001:40a8:4400:287::30bc","2a0d:6fc7:505:6e3:b391:e2e3:ca0d:6126","TCP","2662","443  >  34118 [PSH, ACK] Seq=53765 Ack=5058 Win=64128 Len=2576 TSval=1735644795 TSecr=310091717 [TCP segment of a reassembled PDU]"
"82","0.429970894","2001:40a8:4400:287::30bc","2a0d:6fc7:505:6e3:b391:e2e3:ca0d:6126","TCP","2662","443  >  34118 [PSH, ACK] Seq=56341 Ack=5058 Win=64128 Len=2576 TSval=1735644796 TSecr=310091717 [TCP segment of a reassembled PDU]"
"83","0.430026365","2a0d:6fc7:505:6e3:b391:e2e3:ca0d:6126","2001:40a8:4400:287::30bc","TCP","86","34118  >  443 [ACK] Seq=5058 Ack=56341 Win=83456 Len=0 TSval=310091752 TSecr=1735644795"
"84","0.430154618","2a0d:6fc7:505:6e3:b391:e2e3:ca0d:6126","2001:40a8:4400:287::30bc","TCP","86","34118  >  443 [ACK] Seq=5058 Ack=58917 Win=88576 Len=0 TSval=310091752 TSecr=1735644796"
"85","0.431866221","2001:40a8:4400:287::30bc","2a0d:6fc7:505:6e3:b391:e2e3:ca0d:6126","TCP","1374","443  >  34118 [ACK] Seq=58917 Ack=5058 Win=64128 Len=1288 TSval=1735644798 TSecr=310091719 [TCP segment of a reassembled PDU]"
"86","0.432822861","2001:40a8:4400:287::30bc","2a0d:6fc7:505:6e3:b391:e2e3:ca0d:6126","TCP","1374","443  >  34118 [PSH, ACK] Seq=60205 Ack=5058 Win=64128 Len=1288 TSval=1735644798 TSecr=310091719 [TCP segment of a reassembled PDU]"
"87","0.432846371","2a0d:6fc7:505:6e3:b391:e2e3:ca0d:6126","2001:40a8:4400:287::30bc","TCP","86","34118  >  443 [ACK] Seq=5058 Ack=61493 Win=93696 Len=0 TSval=310091754 TSecr=1735644798"
"88","0.442319692","2001:40a8:4400:287::30bc","2a0d:6fc7:505:6e3:b391:e2e3:ca0d:6126","TCP","2662","443  >  34118 [PSH, ACK] Seq=61493 Ack=5058 Win=64128 Len=2576 TSval=1735644807 TSecr=310091737 [TCP segment of a reassembled PDU]"
"89","0.442320240","2001:40a8:4400:287::30bc","2a0d:6fc7:505:6e3:b391:e2e3:ca0d:6126","TCP","2662","443  >  34118 [PSH, ACK] Seq=64069 Ack=5058 Win=64128 Len=2576 TSval=1735644808 TSecr=310091737 [TCP segment of a reassembled PDU]"
"90","0.442359247","2a0d:6fc7:505:6e3:b391:e2e3:ca0d:6126","2001:40a8:4400:287::30bc","TCP","86","34118  >  443 [ACK] Seq=5058 Ack=64069 Win=98944 Len=0 TSval=310091764 TSecr=1735644807"
"91","0.442526069","2a0d:6fc7:505:6e3:b391:e2e3:ca0d:6126","2001:40a8:4400:287::30bc","TCP","86","34118  >  443 [ACK] Seq=5058 Ack=66645 Win=104064 Len=0 TSval=310091764 TSecr=1735644808"
"92","0.446529623","2001:40a8:4400:287::30bc","2a0d:6fc7:505:6e3:b391:e2e3:ca0d:6126","TLSv1.3","2662","DATA[1]"
"93","0.446529993","2001:40a8:4400:287::30bc","2a0d:6fc7:505:6e3:b391:e2e3:ca0d:6126","TCP","2662","443  >  34118 [PSH, ACK] Seq=69221 Ack=5058 Win=64128 Len=2576 TSval=1735644812 TSecr=310091737 [TCP segment of a reassembled PDU]"
"94","0.446604259","2a0d:6fc7:505:6e3:b391:e2e3:ca0d:6126","2001:40a8:4400:287::30bc","TCP","86","34118  >  443 [ACK] Seq=5058 Ack=69221 Win=109184 Len=0 TSval=310091768 TSecr=1735644810"
"95","0.446728421","2a0d:6fc7:505:6e3:b391:e2e3:ca0d:6126","2001:40a8:4400:287::30bc","TCP","86","34118  >  443 [ACK] Seq=5058 Ack=71797 Win=114304 Len=0 TSval=310091768 TSecr=1735644812"
"96","0.451208754","2001:40a8:4400:287::30bc","2a0d:6fc7:505:6e3:b391:e2e3:ca0d:6126","TCP","2662","443  >  34118 [PSH, ACK] Seq=71797 Ack=5058 Win=64128 Len=2576 TSval=1735644813 TSecr=310091738 [TCP segment of a reassembled PDU]"
"97","0.451209142","2001:40a8:4400:287::30bc","2a0d:6fc7:505:6e3:b391:e2e3:ca0d:6126","TCP","2662","443  >  34118 [PSH, ACK] Seq=74373 Ack=5058 Win=64128 Len=2576 TSval=1735644815 TSecr=310091738 [TCP segment of a reassembled PDU]"
"98","0.451254983","2a0d:6fc7:505:6e3:b391:e2e3:ca0d:6126","2001:40a8:4400:287::30bc","TCP","86","34118  >  443 [ACK] Seq=5058 Ack=74373 Win=119552 Len=0 TSval=310091773 TSecr=1735644813"
"99","0.451383234","2a0d:6fc7:505:6e3:b391:e2e3:ca0d:6126","2001:40a8:4400:287::30bc","TCP","86","34118  >  443 [ACK] Seq=5058 Ack=76949 Win=124672 Len=0 TSval=310091773 TSecr=1735644815"
"100","0.454068840","192.168.56.42","192.168.56.129","DNS","90","Standard query 0x753c AAAA securepubads.g.doubleclick.net"
"101","0.454357455","192.168.56.42","192.168.56.129","DNS","90","Standard query 0x1ed7 A securepubads.g.doubleclick.net"
"102","0.454666961","192.168.56.42","192.168.56.129","DNS","90","Standard query 0xdcb6 HTTPS securepubads.g.doubleclick.net"
"103","0.454785497","2001:40a8:4400:287::30bc","2a0d:6fc7:505:6e3:b391:e2e3:ca0d:6126","TCP","2662","443  >  34118 [PSH, ACK] Seq=76949 Ack=5058 Win=64128 Len=2576 TSval=1735644817 TSecr=310091738 [TCP segment of a reassembled PDU]"
"104","0.454785748","2001:40a8:4400:287::30bc","2a0d:6fc7:505:6e3:b391:e2e3:ca0d:6126","TCP","2662","443  >  34118 [PSH, ACK] Seq=79525 Ack=5058 Win=64128 Len=2576 TSval=1735644819 TSecr=310091741 [TCP segment of a reassembled PDU]"
"105","0.454785782","2001:40a8:4400:287::30bc","2a0d:6fc7:505:6e3:b391:e2e3:ca0d:6126","TLSv1.3","2662","DATA[1]"
"106","0.454785809","2001:40a8:4400:287::30bc","2a0d:6fc7:505:6e3:b391:e2e3:ca0d:6126","TCP","2662","443  >  34118 [PSH, ACK] Seq=84677 Ack=5058 Win=64128 Len=2576 TSval=1735644821 TSecr=310091747 [TCP segment of a reassembled PDU]"
"107","0.454812158","2a0d:6fc7:505:6e3:b391:e2e3:ca0d:6126","2001:40a8:4400:287::30bc","TCP","86","34118  >  443 [ACK] Seq=5058 Ack=79525 Win=129792 Len=0 TSval=310091776 TSecr=1735644817"
"108","0.454913615","2a0d:6fc7:505:6e3:b391:e2e3:ca0d:6126","2001:40a8:4400:287::30bc","TCP","86","34118  >  443 [ACK] Seq=5058 Ack=82101 Win=134912 Len=0 TSval=310091776 TSecr=1735644819"
"109","0.455065707","2a0d:6fc7:505:6e3:b391:e2e3:ca0d:6126","2001:40a8:4400:287::30bc","TCP","86","34118  >  443 [ACK] Seq=5058 Ack=84677 Win=140160 Len=0 TSval=310091777 TSecr=1735644820"
"110","0.455116898","2a0d:6fc7:505:6e3:b391:e2e3:ca0d:6126","2001:40a8:4400:287::30bc","TCP","86","34118  >  443 [ACK] Seq=5058 Ack=87253 Win=145280 Len=0 TSval=310091777 TSecr=1735644821"
"111","0.455197057","2001:40a8:4400:287::30bc","2a0d:6fc7:505:6e3:b391:e2e3:ca0d:6126","TCP","2662","443  >  34118 [PSH, ACK] Seq=87253 Ack=5058 Win=64128 Len=2576 TSval=1735644822 TSecr=310091747 [TCP segment of a reassembled PDU]"
"112","0.455197098","2001:40a8:4400:287::30bc","2a0d:6fc7:505:6e3:b391:e2e3:ca0d:6126","TCP","2662","443  >  34118 [PSH, ACK] Seq=89829 Ack=5058 Win=64128 Len=2576 TSval=1735644823 TSecr=310091747 [TCP segment of a reassembled PDU]"
"113","0.455202582","2a0d:6fc7:505:6e3:b391:e2e3:ca0d:6126","2001:40a8:4400:287::30bc","TCP","86","34118  >  443 [ACK] Seq=5058 Ack=89829 Win=150400 Len=0 TSval=310091777 TSecr=1735644822"
"114","0.455246033","2a0d:6fc7:505:6e3:b391:e2e3:ca0d:6126","2001:40a8:4400:287::30bc","TCP","86","34118  >  443 [ACK] Seq=5058 Ack=92405 Win=155520 Len=0 TSval=310091777 TSecr=1735644823"
"115","0.459890404","2001:40a8:4400:287::30bc","2a0d:6fc7:505:6e3:b391:e2e3:ca0d:6126","TCP","2662","443  >  34118 [PSH, ACK] Seq=92405 Ack=5058 Win=64128 Len=2576 TSval=1735644824 TSecr=310091747 [TCP segment of a reassembled PDU]"
"116","0.459890696","2001:40a8:4400:287::30bc","2a0d:6fc7:505:6e3:b391:e2e3:ca0d:6126","TCP","2662","443  >  34118 [PSH, ACK] Seq=94981 Ack=5058 Win=64128 Len=2576 TSval=1735644825 TSecr=310091747 [TCP segment of a reassembled PDU]"
"117","0.459890722","2001:40a8:4400:287::30bc","2a0d:6fc7:505:6e3:b391:e2e3:ca0d:6126","TLSv1.3","2662","DATA[1]"
"118","0.459918800","2a0d:6fc7:505:6e3:b391:e2e3:ca0d:6126","2001:40a8:4400:287::30bc","TCP","86","34118  >  443 [ACK] Seq=5058 Ack=94981 Win=160768 Len=0 TSval=310091781 TSecr=1735644824"
"119","0.460006735","2a0d:6fc7:505:6e3:b391:e2e3:ca0d:6126","2001:40a8:4400:287::30bc","TCP","86","34118  >  443 [ACK] Seq=5058 Ack=97557 Win=165888 Len=0 TSval=310091782 TSecr=1735644825"
"120","0.460032069","2a0d:6fc7:505:6e3:b391:e2e3:ca0d:6126","2001:40a8:4400:287::30bc","TCP","86","34118  >  443 [ACK] Seq=5058 Ack=100133 Win=171008 Len=0 TSval=310091782 TSecr=1735644826"
"121","0.460717670","192.168.56.42","192.168.56.129","DNS","82","Standard query 0x134e AAAA totalmedia2.ynet.co.il"
"122","0.460914119","192.168.56.42","192.168.56.129","DNS","82","Standard query 0x6c29 A totalmedia2.ynet.co.il"
"123","0.461105736","192.168.56.42","192.168.56.129","DNS","82","Standard query 0x1ea5 HTTPS totalmedia2.ynet.co.il"
"124","0.461415442","192.168.56.42","192.168.56.129","DNS","79","Standard query 0x7870 AAAA ynet-pic1.yit.co.il"
"125","0.461575130","192.168.56.42","192.168.56.129","DNS","79","Standard query 0x380a A ynet-pic1.yit.co.il"
"126","0.461687694","192.168.56.42","192.168.56.129","DNS","79","Standard query 0xdf6a HTTPS ynet-pic1.yit.co.il"
"127","0.466652271","2001:40a8:4400:287::30bc","2a0d:6fc7:505:6e3:b391:e2e3:ca0d:6126","TCP","2662","443  >  34118 [PSH, ACK] Seq=100133 Ack=5058 Win=64128 Len=2576 TSval=1735644827 TSecr=310091747 [TCP segment of a reassembled PDU]"
"128","0.466652596","2001:40a8:4400:287::30bc","2a0d:6fc7:505:6e3:b391:e2e3:ca0d:6126","TCP","2662","443  >  34118 [PSH, ACK] Seq=102709 Ack=5058 Win=64128 Len=2576 TSval=1735644827 TSecr=310091747 [TCP segment of a reassembled PDU]"
"129","0.466652625","2001:40a8:4400:287::30bc","2a0d:6fc7:505:6e3:b391:e2e3:ca0d:6126","TCP","2662","443  >  34118 [PSH, ACK] Seq=105285 Ack=5058 Win=64128 Len=2576 TSval=1735644828 TSecr=310091747 [TCP segment of a reassembled PDU]"
"130","0.466652670","2001:40a8:4400:287::30bc","2a0d:6fc7:505:6e3:b391:e2e3:ca0d:6126","TCP","2662","443  >  34118 [PSH, ACK] Seq=107861 Ack=5058 Win=64128 Len=2576 TSval=1735644829 TSecr=310091752 [TCP segment of a reassembled PDU]"
"131","0.466683964","2a0d:6fc7:505:6e3:b391:e2e3:ca0d:6126","2001:40a8:4400:287::30bc","TCP","86","34118  >  443 [ACK] Seq=5058 Ack=102709 Win=176128 Len=0 TSval=310091788 TSecr=1735644827"
"132","0.466804907","2a0d:6fc7:505:6e3:b391:e2e3:ca0d:6126","2001:40a8:4400:287::30bc","TCP","86","34118  >  443 [ACK] Seq=5058 Ack=105285 Win=181376 Len=0 TSval=310091788 TSecr=1735644827"
"133","0.466853184","2a0d:6fc7:505:6e3:b391:e2e3:ca0d:6126","2001:40a8:4400:287::30bc","TCP","86","34118  >  443 [ACK] Seq=5058 Ack=107861 Win=186496 Len=0 TSval=310091788 TSecr=1735644828"
"134","0.466883355","2a0d:6fc7:505:6e3:b391:e2e3:ca0d:6126","2001:40a8:4400:287::30bc","TCP","86","34118  >  443 [ACK] Seq=5058 Ack=110437 Win=191616 Len=0 TSval=310091788 TSecr=1735644829"
"135","0.466915844","2001:40a8:4400:287::30bc","2a0d:6fc7:505:6e3:b391:e2e3:ca0d:6126","TCP","2662","443  >  34118 [PSH, ACK] Seq=110437 Ack=5058 Win=64128 Len=2576 TSval=1735644830 TSecr=310091752 [TCP segment of a reassembled PDU]"
"136","0.466915876","2001:40a8:4400:287::30bc","2a0d:6fc7:505:6e3:b391:e2e3:ca0d:6126","TCP","2662","443  >  34118 [PSH, ACK] Seq=113013 Ack=5058 Win=64128 Len=2576 TSval=1735644831 TSecr=310091752 [TCP segment of a reassembled PDU]"
"137","0.466915904","2001:40a8:4400:287::30bc","2a0d:6fc7:505:6e3:b391:e2e3:ca0d:6126","TLSv1.3","2662","DATA[1]"
"138","0.466915943","2001:40a8:4400:287::30bc","2a0d:6fc7:505:6e3:b391:e2e3:ca0d:6126","TCP","2662","443  >  34118 [PSH, ACK] Seq=118165 Ack=5058 Win=64128 Len=2576 TSval=1735644833 TSecr=310091752 [TCP segment of a reassembled PDU]"
"139","0.466921975","2a0d:6fc7:505:6e3:b391:e2e3:ca0d:6126","2001:40a8:4400:287::30bc","TCP","86","34118  >  443 [ACK] Seq=5058 Ack=113013 Win=196736 Len=0 TSval=310091788 TSecr=1735644830"
"140","0.466965696","2a0d:6fc7:505:6e3:b391:e2e3:ca0d:6126","2001:40a8:4400:287::30bc","TCP","86","34118  >  443 [ACK] Seq=5058 Ack=115589 Win=201984 Len=0 TSval=310091788 TSecr=1735644831"
"141","0.466998205","2a0d:6fc7:505:6e3:b391:e2e3:ca0d:6126","2001:40a8:4400:287::30bc","TCP","86","34118  >  443 [ACK] Seq=5058 Ack=118165 Win=207104 Len=0 TSval=310091789 TSecr=1735644832"
"142","0.467032856","2a0d:6fc7:505:6e3:b391:e2e3:ca0d:6126","2001:40a8:4400:287::30bc","TCP","86","34118  >  443 [ACK] Seq=5058 Ack=120741 Win=212224 Len=0 TSval=310091789 TSecr=1735644833"
"143","0.468141426","2001:40a8:4400:287::30bc","2a0d:6fc7:505:6e3:b391:e2e3:ca0d:6126","HTTP2","1581","DATA[1] (text/html)"
"144","0.468158072","2a0d:6fc7:505:6e3:b391:e2e3:ca0d:6126","2001:40a8:4400:287::30bc","TCP","86","34118  >  443 [ACK] Seq=5058 Ack=122236 Win=215168 Len=0 TSval=310091790 TSecr=1735644834"
"145","1.466008083","2a0d:6fc7:505:6e3:b391:e2e3:ca0d:6126","ff02::1:ff00:be","ICMPv6","86","Neighbor Solicitation for 2a0d:6fc7:505:6e3::be from 00:0c:29:2c:82:47"
"146","1.644120578","2a0d:6fc7:505:6e3::be","2a0d:6fc7:505:6e3:b391:e2e3:ca0d:6126","ICMPv6","86","Neighbor Advertisement 2a0d:6fc7:505:6e3::be (rtr, sol, ovr) is at 1a:b5:0c:ee:81:45"
"147","1.644261031","2a0d:6fc7:505:6e3:b391:e2e3:ca0d:6126","2a0d:6fc7:505:6e3::be","DNS","110","Standard query 0x71ac AAAA securepubads.g.doubleclick.net"
"148","1.644827509","2a0d:6fc7:505:6e3:b391:e2e3:ca0d:6126","2a0d:6fc7:505:6e3::be","DNS","110","Standard query 0x999f A securepubads.g.doubleclick.net"
"149","1.645070205","2a0d:6fc7:505:6e3:b391:e2e3:ca0d:6126","2a0d:6fc7:505:6e3::be","DNS","110","Standard query 0xfdfb HTTPS securepubads.g.doubleclick.net"
"150","1.645176997","2a0d:6fc7:505:6e3:b391:e2e3:ca0d:6126","2a0d:6fc7:505:6e3::be","DNS","102","Standard query 0xd701 AAAA totalmedia2.ynet.co.il"
"151","1.645250825","2a0d:6fc7:505:6e3:b391:e2e3:ca0d:6126","2a0d:6fc7:505:6e3::be","DNS","102","Standard query 0x49de A totalmedia2.ynet.co.il"
"152","1.645345485","2a0d:6fc7:505:6e3:b391:e2e3:ca0d:6126","2a0d:6fc7:505:6e3::be","DNS","102","Standard query 0x3c9b HTTPS totalmedia2.ynet.co.il"
"153","1.645427697","2a0d:6fc7:505:6e3:b391:e2e3:ca0d:6126","2a0d:6fc7:505:6e3::be","DNS","99","Standard query 0x0cea AAAA ynet-pic1.yit.co.il"
"154","1.645517292","2a0d:6fc7:505:6e3:b391:e2e3:ca0d:6126","2a0d:6fc7:505:6e3::be","DNS","99","Standard query 0x964f A ynet-pic1.yit.co.il"
"155","1.645604089","2a0d:6fc7:505:6e3:b391:e2e3:ca0d:6126","2a0d:6fc7:505:6e3::be","DNS","99","Standard query 0x02d0 HTTPS ynet-pic1.yit.co.il"
"156","1.656249891","2a0d:6fc7:505:6e3::be","2a0d:6fc7:505:6e3:b391:e2e3:ca0d:6126","DNS","138","Standard query response 0x71ac AAAA securepubads.g.doubleclick.net AAAA 2a00:1450:4028:806::2002"
"157","1.656250431","2a0d:6fc7:505:6e3::be","2a0d:6fc7:505:6e3:b391:e2e3:ca0d:6126","DNS","126","Standard query response 0x999f A securepubads.g.doubleclick.net A 142.250.75.130"
"158","1.659796356","2a0d:6fc7:505:6e3::be","2a0d:6fc7:505:6e3:b391:e2e3:ca0d:6126","DNS","190","Standard query response 0xd701 AAAA totalmedia2.ynet.co.il CNAME totalmedia2.ynet.co.il-v1.edgekey.net CNAME e12476.b.akamaiedge.net"
"159","1.659796972","2a0d:6fc7:505:6e3::be","2a0d:6fc7:505:6e3:b391:e2e3:ca0d:6126","DNS","206","Standard query response 0x49de A totalmedia2.ynet.co.il CNAME totalmedia2.ynet.co.il-v1.edgekey.net CNAME e12476.b.akamaiedge.net A 23.48.109.100"
"160","1.659797080","2a0d:6fc7:505:6e3::be","2a0d:6fc7:505:6e3:b391:e2e3:ca0d:6126","DNS","207","Standard query response 0x0cea AAAA ynet-pic1.yit.co.il CNAME ynet-pic1.yit.co.il.cdn.cloudflare.net AAAA 2606:4700::6812:69e AAAA 2606:4700::6812:79e"
"161","1.659797158","2a0d:6fc7:505:6e3::be","2a0d:6fc7:505:6e3:b391:e2e3:ca0d:6126","DNS","183","Standard query response 0x964f A ynet-pic1.yit.co.il CNAME ynet-pic1.yit.co.il.cdn.cloudflare.net A 104.18.7.158 A 104.18.6.158"
"162","1.681754455","2a0d:6fc7:505:6e3::be","2a0d:6fc7:505:6e3:b391:e2e3:ca0d:6126","DNS","135","Standard query response 0xfdfb HTTPS securepubads.g.doubleclick.net HTTPS"
"163","1.681754592","2a0d:6fc7:505:6e3::be","2a0d:6fc7:505:6e3:b391:e2e3:ca0d:6126","DNS","265","Standard query response 0x3c9b HTTPS totalmedia2.ynet.co.il CNAME totalmedia2.ynet.co.il-v1.edgekey.net CNAME e12476.b.akamaiedge.net SOA n0b.akamaiedge.net"
"164","1.690044091","2a0d:6fc7:505:6e3::be","2a0d:6fc7:505:6e3:b391:e2e3:ca0d:6126","DNS","221","Standard query response 0x02d0 HTTPS ynet-pic1.yit.co.il CNAME ynet-pic1.yit.co.il.cdn.cloudflare.net HTTPS"
"165","1.691101223","2a0d:6fc7:505:6e3:b391:e2e3:ca0d:6126","2606:4700::6812:69e","TCP","94","46918  >  443 [SYN] Seq=0 Win=33120 Len=0 MSS=1440 SACK_PERM TSval=597038280 TSecr=0 WS=128"
"166","1.691803052","2a0d:6fc7:505:6e3:b391:e2e3:ca0d:6126","2606:4700::6812:69e","TCP","94","46922  >  443 [SYN] Seq=0 Win=33120 Len=0 MSS=1440 SACK_PERM TSval=597038280 TSecr=0 WS=128"
"167","1.692091492","2a0d:6fc7:505:6e3:b391:e2e3:ca0d:6126","2606:4700::6812:69e","TCP","94","46932  >  443 [SYN] Seq=0 Win=33120 Len=0 MSS=1440 SACK_PERM TSval=597038281 TSecr=0 WS=128"
"168","1.692394509","2a0d:6fc7:505:6e3:b391:e2e3:ca0d:6126","2606:4700::6812:69e","TCP","94","46942  >  443 [SYN] Seq=0 Win=33120 Len=0 MSS=1440 SACK_PERM TSval=597038281 TSecr=0 WS=128"
"169","1.716791218","2a0d:6fc7:505:6e3:b391:e2e3:ca0d:6126","2606:4700::6812:69e","TCP","94","46954  >  443 [SYN] Seq=0 Win=33120 Len=0 MSS=1440 SACK_PERM TSval=597038305 TSecr=0 WS=128"
"170","1.737391768","2606:4700::6812:69e","2a0d:6fc7:505:6e3:b391:e2e3:ca0d:6126","TCP","94","443  >  46932 [SYN, ACK] Seq=0 Ack=1 Win=65535 Len=0 MSS=1300 SACK_PERM TSval=1631902527 TSecr=597038281 WS=8192"
"171","1.737392406","2606:4700::6812:69e","2a0d:6fc7:505:6e3:b391:e2e3:ca0d:6126","TCP","94","443  >  46942 [SYN, ACK] Seq=0 Ack=1 Win=65535 Len=0 MSS=1300 SACK_PERM TSval=258622059 TSecr=597038281 WS=8192"
"172","1.737508218","2a0d:6fc7:505:6e3:b391:e2e3:ca0d:6126","2606:4700::6812:69e","TCP","86","46932  >  443 [ACK] Seq=1 Ack=1 Win=33152 Len=0 TSval=597038326 TSecr=1631902527"
"173","1.739656417","2a0d:6fc7:505:6e3:b391:e2e3:ca0d:6126","2606:4700::6812:69e","TCP","86","46942  >  443 [ACK] Seq=1 Ack=1 Win=33152 Len=0 TSval=597038328 TSecr=258622059"
"174","1.740674101","2a0d:6fc7:505:6e3:b391:e2e3:ca0d:6126","2606:4700::6812:69e","TCP","1374","46932  >  443 [ACK] Seq=1 Ack=1 Win=33152 Len=1288 TSval=597038329 TSecr=1631902527 [TCP segment of a reassembled PDU]"
"175","1.740687804","2a0d:6fc7:505:6e3:b391:e2e3:ca0d:6126","2606:4700::6812:69e","TLSv1.3","527","Client Hello (SNI=ynet-pic1.yit.co.il)"
"176","1.742138285","2a0d:6fc7:505:6e3:b391:e2e3:ca0d:6126","2606:4700::6812:69e","TCP","1374","46942  >  443 [ACK] Seq=1 Ack=1 Win=33152 Len=1288 TSval=597038331 TSecr=258622059 [TCP segment of a reassembled PDU]"
"177","1.742152983","2a0d:6fc7:505:6e3:b391:e2e3:ca0d:6126","2606:4700::6812:69e","TLSv1.3","559","Client Hello (SNI=ynet-pic1.yit.co.il)"
"178","1.751097644","2606:4700::6812:69e","2a0d:6fc7:505:6e3:b391:e2e3:ca0d:6126","TCP","94","443  >  46954 [SYN, ACK] Seq=0 Ack=1 Win=65535 Len=0 MSS=1300 SACK_PERM TSval=1961707083 TSecr=597038305 WS=8192"
"179","1.751226862","2a0d:6fc7:505:6e3:b391:e2e3:ca0d:6126","2606:4700::6812:69e","TCP","86","46954  >  443 [ACK] Seq=1 Ack=1 Win=33152 Len=0 TSval=597038340 TSecr=1961707083"
"180","1.752399529","2a0d:6fc7:505:6e3:b391:e2e3:ca0d:6126","2606:4700::6812:69e","TCP","1374","46954  >  443 [ACK] Seq=1 Ack=1 Win=33152 Len=1288 TSval=597038341 TSecr=1961707083 [TCP segment of a reassembled PDU]"
"181","1.752417892","2a0d:6fc7:505:6e3:b391:e2e3:ca0d:6126","2606:4700::6812:69e","TLSv1.3","527","Client Hello (SNI=ynet-pic1.yit.co.il)"
"182","1.770733501","2606:4700::6812:69e","2a0d:6fc7:505:6e3:b391:e2e3:ca0d:6126","TCP","94","443  >  46918 [SYN, ACK] Seq=0 Ack=1 Win=65535 Len=0 MSS=1300 SACK_PERM TSval=1805081696 TSecr=597038280 WS=8192"
"183","1.770892921","2a0d:6fc7:505:6e3:b391:e2e3:ca0d:6126","2606:4700::6812:69e","TCP","86","46918  >  443 [ACK] Seq=1 Ack=1 Win=33152 Len=0 TSval=597038359 TSecr=1805081696"
"184","1.771710411","2a0d:6fc7:505:6e3:b391:e2e3:ca0d:6126","2606:4700::6812:69e","TCP","1374","46918  >  443 [ACK] Seq=1 Ack=1 Win=33152 Len=1288 TSval=597038360 TSecr=1805081696 [TCP segment of a reassembled PDU]"
"185","1.771720677","2a0d:6fc7:505:6e3:b391:e2e3:ca0d:6126","2606:4700::6812:69e","TLSv1.3","623","Client Hello (SNI=ynet-pic1.yit.co.il)"
"186","1.777156834","2606:4700::6812:69e","2a0d:6fc7:505:6e3:b391:e2e3:ca0d:6126","TCP","94","443  >  46922 [SYN, ACK] Seq=0 Ack=1 Win=65535 Len=0 MSS=1300 SACK_PERM TSval=878563382 TSecr=597038280 WS=8192"
"187","1.777240850","2a0d:6fc7:505:6e3:b391:e2e3:ca0d:6126","2606:4700::6812:69e","TCP","86","46922  >  443 [ACK] Seq=1 Ack=1 Win=33152 Len=0 TSval=597038366 TSecr=878563382"
"188","1.778293364","2a0d:6fc7:505:6e3:b391:e2e3:ca0d:6126","2606:4700::6812:69e","TCP","1374","46922  >  443 [ACK] Seq=1 Ack=1 Win=33152 Len=1288 TSval=597038367 TSecr=878563382 [TCP segment of a reassembled PDU]"
"189","1.778305140","2a0d:6fc7:505:6e3:b391:e2e3:ca0d:6126","2606:4700::6812:69e","TLSv1.3","559","Client Hello (SNI=ynet-pic1.yit.co.il)"
"190","1.782895259","2606:4700::6812:69e","2a0d:6fc7:505:6e3:b391:e2e3:ca0d:6126","TCP","86","443  >  46942 [ACK] Seq=1 Ack=1762 Win=73728 Len=0 TSval=258622107 TSecr=597038331"
"191","1.789750523","2606:4700::6812:69e","2a0d:6fc7:505:6e3:b391:e2e3:ca0d:6126","TCP","86","443  >  46932 [ACK] Seq=1 Ack=1730 Win=73728 Len=0 TSval=1631902576 TSecr=597038329"
"192","1.789750958","2606:4700::6812:69e","2a0d:6fc7:505:6e3:b391:e2e3:ca0d:6126","TLSv1.3","3541","Server Hello, Change Cipher Spec, Encrypted Extensions, Compressed Certificate, Certificate Verify, Finished"
"193","1.789751010","2606:4700::6812:69e","2a0d:6fc7:505:6e3:b391:e2e3:ca0d:6126","TLSv1.3","3540","Server Hello, Change Cipher Spec, Encrypted Extensions, Compressed Certificate, Certificate Verify, Finished"
"194","1.789954537","2a0d:6fc7:505:6e3:b391:e2e3:ca0d:6126","2606:4700::6812:69e","TCP","86","46932  >  443 [ACK] Seq=1730 Ack=3456 Win=31872 Len=0 TSval=597038378 TSecr=1631902578"
"195","1.790264617","2a0d:6fc7:505:6e3:b391:e2e3:ca0d:6126","2606:4700::6812:69e","TCP","86","46942  >  443 [ACK] Seq=1762 Ack=3455 Win=31872 Len=0 TSval=597038379 TSecr=258622109"
"196","1.800902065","2606:4700::6812:69e","2a0d:6fc7:505:6e3:b391:e2e3:ca0d:6126","TCP","86","443  >  46954 [ACK] Seq=1 Ack=1289 Win=65536 Len=0 TSval=1961707135 TSecr=597038341"
"197","1.800902734","2606:4700::6812:69e","2a0d:6fc7:505:6e3:b391:e2e3:ca0d:6126","TCP","86","443  >  46954 [ACK] Seq=1 Ack=1730 Win=65536 Len=0 TSval=1961707135 TSecr=597038341"
"198","1.801221944","2a0d:6fc7:505:6e3:b391:e2e3:ca0d:6126","2606:4700::6812:69e","TLSv1.3","150","Change Cipher Spec, Finished"
"199","1.802068492","2a0d:6fc7:505:6e3:b391:e2e3:ca0d:6126","2606:4700::6812:69e","TLSv1.3","150","Change Cipher Spec, Finished"
"200","1.802602883","2a0d:6fc7:505:6e3:b391:e2e3:ca0d:6126","2606:4700::6812:69e","TCP","86","46942  >  443 [FIN, ACK] Seq=1826 Ack=3455 Win=31872 Len=0 TSval=597038391 TSecr=258622109"
"201","1.802849132","2a0d:6fc7:505:6e3:b391:e2e3:ca0d:6126","2606:4700::6812:69e","HTTP2","178","Magic, SETTINGS[0], WINDOW_UPDATE[0]"
"202","1.803065498","2a0d:6fc7:505:6e3:b391:e2e3:ca0d:6126","2606:4700::6812:69e","TCP","86","46918  >  443 [FIN, ACK] Seq=1826 Ack=1 Win=33152 Len=0 TSval=597038392 TSecr=1805081696"
"203","1.803129832","2606:4700::6812:69e","2a0d:6fc7:505:6e3:b391:e2e3:ca0d:6126","TLSv1.3","3541","Server Hello, Change Cipher Spec, Encrypted Extensions, Compressed Certificate, Certificate Verify, Finished"
"204","1.803153657","2a0d:6fc7:505:6e3:b391:e2e3:ca0d:6126","2606:4700::6812:69e","TCP","86","46954  >  443 [ACK] Seq=1730 Ack=3456 Win=31872 Len=0 TSval=597038392 TSecr=1961707138"
"205","1.803237437","2a0d:6fc7:505:6e3:b391:e2e3:ca0d:6126","2606:4700::6812:69e","TCP","86","46922  >  443 [FIN, ACK] Seq=1762 Ack=1 Win=33152 Len=0 TSval=597038392 TSecr=878563382"
"206","1.804355902","2a0d:6fc7:505:6e3:b391:e2e3:ca0d:6126","2606:4700::6812:69e","TLSv1.3","150","Change Cipher Spec, Finished"
"207","1.804916089","2a0d:6fc7:505:6e3:b391:e2e3:ca0d:6126","2606:4700::6812:69e","HTTP2","571","HEADERS[1]: GET /Common/Api/Scripts/paywall.piano-refactored-v8-prod.js"
"208","1.805176694","2a0d:6fc7:505:6e3:b391:e2e3:ca0d:6126","2606:4700::6812:69e","HTTP2","409","HEADERS[5]: GET /cdn-cgi/image/format=auto/picserver6/crop_images/2024/10/24/B1D3ZH6weyx/B1D3ZH6weyx_301_386_2202_1244_0_medium.jpg"
"209","1.805304102","2a0d:6fc7:505:6e3:b391:e2e3:ca0d:6126","2606:4700::6812:69e","HTTP2","213","HEADERS[7]: GET /cdn-cgi/image/format=auto/picserver6/crop_images/2019/05/20/9255956/9255956_169_0_832_467_0_x-large.jpg"
"210","1.857348011","2606:4700::6812:69e","2a0d:6fc7:505:6e3:b391:e2e3:ca0d:6126","HTTP2","598","SETTINGS[0], WINDOW_UPDATE[0]"
"211","1.857348604","2606:4700::6812:69e","2a0d:6fc7:505:6e3:b391:e2e3:ca0d:6126","TCP","86","443  >  46918 [ACK] Seq=1 Ack=1826 Win=65536 Len=0 TSval=1805081781 TSecr=597038360"
"212","1.857348646","2606:4700::6812:69e","2a0d:6fc7:505:6e3:b391:e2e3:ca0d:6126","HTTP2","598","SETTINGS[0], WINDOW_UPDATE[0]"
"213","1.857348689","2606:4700::6812:69e","2a0d:6fc7:505:6e3:b391:e2e3:ca0d:6126","TCP","86","443  >  46942 [FIN, ACK] Seq=3455 Ack=1827 Win=73728 Len=0 TSval=258622178 TSecr=597038391"
"214","1.857574838","2a0d:6fc7:505:6e3:b391:e2e3:ca0d:6126","2606:4700::6812:69e","TCP","86","46942  >  443 [ACK] Seq=1827 Ack=3456 Win=31872 Len=0 TSval=597038446 TSecr=258622178"
"215","1.858118084","2a0d:6fc7:505:6e3:b391:e2e3:ca0d:6126","2606:4700::6812:69e","HTTP2","117","SETTINGS[0]"
"216","1.860316962","2606:4700::6812:69e","2a0d:6fc7:505:6e3:b391:e2e3:ca0d:6126","TCP","86","443  >  46922 [ACK] Seq=1 Ack=1762 Win=65536 Len=0 TSval=878563467 TSecr=597038367"
"217","1.860317394","2606:4700::6812:69e","2a0d:6fc7:505:6e3:b391:e2e3:ca0d:6126","TLSv1.3","3541","Server Hello, Change Cipher Spec, Application Data"
"218","1.860381948","2a0d:6fc7:505:6e3:b391:e2e3:ca0d:6126","2606:4700::6812:69e","TCP","74","46918  >  443 [RST] Seq=1826 Win=0 Len=0"
"219","1.864991619","2606:4700::6812:69e","2a0d:6fc7:505:6e3:b391:e2e3:ca0d:6126","TLSv1.3","3541","Server Hello, Change Cipher Spec, Application Data"
"220","1.865089668","2a0d:6fc7:505:6e3:b391:e2e3:ca0d:6126","2606:4700::6812:69e","TCP","74","46922  >  443 [RST] Seq=1762 Win=0 Len=0"
"221","1.895404065","2606:4700::6812:69e","2a0d:6fc7:505:6e3:b391:e2e3:ca0d:6126","TCP","86","443  >  46922 [FIN, ACK] Seq=3456 Ack=1763 Win=65536 Len=0 TSval=878563501 TSecr=597038392"
