"No.","Time","Source","Destination","Protocol","Length","Info"
"1","0.000000000","192.168.56.210","192.168.56.255","UDP","86","57621  >  57621 Len=44"
"2","0.600240139","192.168.56.210","3.230.70.25","TCP","1514","59957  >  443 [ACK] Seq=1 Ack=1 Win=255 Len=1460 [TCP segment of a reassembled PDU]"
"3","0.600240833","192.168.56.210","3.230.70.25","TLSv1.2","524","Client Hello (SNI=auth.grammarly.com)"
"4","0.799093098","192.168.56.210","3.230.70.25","TCP","1514","[TCP Previous segment not captured] 59957  >  443 [ACK] Seq=2156 Ack=4269 Win=255 Len=1460 [TCP segment of a reassembled PDU]"
"5","0.799093334","192.168.56.210","3.230.70.25","TLSv1.2","513","Application Data"
"6","1.237788263","192.168.56.210","34.193.180.58","TCP","1514","59958  >  443 [ACK] Seq=1 Ack=1 Win=255 Len=1460 [TCP segment of a reassembled PDU]"
"7","1.237788486","192.168.56.210","34.193.180.58","TLSv1.2","529","Client Hello (SNI=treatment.grammarly.com)"
"8","1.286203848","2a0d:6fc7:505:6e3:b391:e2e3:ca0d:6126","2a00:1450:4028:80a::2004","TCP","86","39728  >  443 [FIN, ACK] Seq=1 Ack=1 Win=249 Len=0 TSval=482553216 TSecr=2187432520"
"9","1.286471676","2a0d:6fc7:505:6e3:b391:e2e3:ca0d:6126","2001:40a8:4400:3::5266:982a","TLSv1.2","857","Application Data"
"10","1.314545128","2a00:1450:4028:80a::2004","2a0d:6fc7:505:6e3:b391:e2e3:ca0d:6126","TCP","86","443  >  39728 [ACK] Seq=1 Ack=2 Win=1047 Len=0 TSval=2187444499 TSecr=482553216"
"11","1.322744436","2001:40a8:4400:3::5266:982a","2a0d:6fc7:505:6e3:b391:e2e3:ca0d:6126","TLSv1.2","667","Application Data"
"12","1.322790497","2a0d:6fc7:505:6e3:b391:e2e3:ca0d:6126","2001:40a8:4400:3::5266:982a","TCP","86","47056  >  443 [ACK] Seq=772 Ack=582 Win=6942 Len=0 TSval=1343687260 TSecr=3079458841"
"13","1.390285571","2001:40a8:4400:3::5266:982a","2a0d:6fc7:505:6e3:b391:e2e3:ca0d:6126","TCP","6466","443  >  47056 [PSH, ACK] Seq=582 Ack=772 Win=501 Len=6380 TSval=3079458847 TSecr=1343687224 [TCP segment of a reassembled PDU]"
"14","1.390285784","2001:40a8:4400:3::5266:982a","2a0d:6fc7:505:6e3:b391:e2e3:ca0d:6126","TCP","6466","443  >  47056 [PSH, ACK] Seq=6962 Ack=772 Win=501 Len=6380 TSval=3079458847 TSecr=1343687224 [TCP segment of a reassembled PDU]"
"15","1.390310570","2a0d:6fc7:505:6e3:b391:e2e3:ca0d:6126","2001:40a8:4400:3::5266:982a","TCP","86","47056  >  443 [ACK] Seq=772 Ack=6962 Win=6905 Len=0 TSval=1343687328 TSecr=3079458847"
"16","1.390408924","2a0d:6fc7:505:6e3:b391:e2e3:ca0d:6126","2001:40a8:4400:3::5266:982a","TCP","86","47056  >  443 [ACK] Seq=772 Ack=13342 Win=6858 Len=0 TSval=1343687328 TSecr=3079458847"
"17","1.390457069","2001:40a8:4400:3::5266:982a","2a0d:6fc7:505:6e3:b391:e2e3:ca0d:6126","TLSv1.2","6466","Application Data"
"18","1.390457100","2001:40a8:4400:3::5266:982a","2a0d:6fc7:505:6e3:b391:e2e3:ca0d:6126","TCP","6466","443  >  47056 [PSH, ACK] Seq=19722 Ack=772 Win=501 Len=6380 TSval=3079458849 TSecr=1343687224 [TCP segment of a reassembled PDU]"
"19","1.390461438","2a0d:6fc7:505:6e3:b391:e2e3:ca0d:6126","2001:40a8:4400:3::5266:982a","TCP","86","47056  >  443 [ACK] Seq=772 Ack=19722 Win=6812 Len=0 TSval=1343687328 TSecr=3079458848"
"20","1.390479325","2a0d:6fc7:505:6e3:b391:e2e3:ca0d:6126","2001:40a8:4400:3::5266:982a","TCP","86","47056  >  443 [ACK] Seq=772 Ack=26102 Win=6764 Len=0 TSval=1343687328 TSecr=3079458849"
"21","1.390499318","2001:40a8:4400:3::5266:982a","2a0d:6fc7:505:6e3:b391:e2e3:ca0d:6126","TCP","6466","443  >  47056 [PSH, ACK] Seq=26102 Ack=772 Win=501 Len=6380 TSval=3079458850 TSecr=1343687224 [TCP segment of a reassembled PDU]"
"22","1.390499337","2001:40a8:4400:3::5266:982a","2a0d:6fc7:505:6e3:b391:e2e3:ca0d:6126","TLSv1.2","6466","Application Data"
"23","1.390502189","2a0d:6fc7:505:6e3:b391:e2e3:ca0d:6126","2001:40a8:4400:3::5266:982a","TCP","86","47056  >  443 [ACK] Seq=772 Ack=32482 Win=6717 Len=0 TSval=1343687328 TSecr=3079458850"
"24","1.390519551","2a0d:6fc7:505:6e3:b391:e2e3:ca0d:6126","2001:40a8:4400:3::5266:982a","TCP","86","47056  >  443 [ACK] Seq=772 Ack=38862 Win=6671 Len=0 TSval=1343687328 TSecr=3079458851"
"25","1.390609076","2001:40a8:4400:3::5266:982a","2a0d:6fc7:505:6e3:b391:e2e3:ca0d:6126","TLSv1.2","6466","Application Data"
"26","1.390609226","2001:40a8:4400:3::5266:982a","2a0d:6fc7:505:6e3:b391:e2e3:ca0d:6126","TCP","6466","443  >  47056 [PSH, ACK] Seq=45242 Ack=772 Win=501 Len=6380 TSval=3079458852 TSecr=1343687224 [TCP segment of a reassembled PDU]"
"27","1.390621896","2a0d:6fc7:505:6e3:b391:e2e3:ca0d:6126","2001:40a8:4400:3::5266:982a","TCP","86","47056  >  443 [ACK] Seq=772 Ack=45242 Win=6623 Len=0 TSval=1343687328 TSecr=3079458852"
"28","1.390684802","2a0d:6fc7:505:6e3:b391:e2e3:ca0d:6126","2001:40a8:4400:3::5266:982a","TCP","86","47056  >  443 [ACK] Seq=772 Ack=51622 Win=6576 Len=0 TSval=1343687328 TSecr=3079458852"
"29","1.390728269","2001:40a8:4400:3::5266:982a","2a0d:6fc7:505:6e3:b391:e2e3:ca0d:6126","TLSv1.2","6466","Application Data"
"30","1.390728296","2001:40a8:4400:3::5266:982a","2a0d:6fc7:505:6e3:b391:e2e3:ca0d:6126","TCP","6466","443  >  47056 [PSH, ACK] Seq=58002 Ack=772 Win=501 Len=6380 TSval=3079458854 TSecr=1343687224 [TCP segment of a reassembled PDU]"
"31","1.390731517","2a0d:6fc7:505:6e3:b391:e2e3:ca0d:6126","2001:40a8:4400:3::5266:982a","TCP","86","47056  >  443 [ACK] Seq=772 Ack=58002 Win=6530 Len=0 TSval=1343687328 TSecr=3079458853"
"32","1.390753618","2001:40a8:4400:3::5266:982a","2a0d:6fc7:505:6e3:b391:e2e3:ca0d:6126","TCP","6466","443  >  47056 [PSH, ACK] Seq=64382 Ack=772 Win=501 Len=6380 TSval=3079458855 TSecr=1343687224 [TCP segment of a reassembled PDU]"
"33","1.390753638","2001:40a8:4400:3::5266:982a","2a0d:6fc7:505:6e3:b391:e2e3:ca0d:6126","TLSv1.2","6466","Application Data"
"34","1.390766827","2001:40a8:4400:3::5266:982a","2a0d:6fc7:505:6e3:b391:e2e3:ca0d:6126","TLSv1.2","5190","Application Data"
"35","1.390774317","2001:40a8:4400:3::5266:982a","2a0d:6fc7:505:6e3:b391:e2e3:ca0d:6126","TCP","1362","443  >  47056 [PSH, ACK] Seq=82246 Ack=772 Win=501 Len=1276 TSval=3079458857 TSecr=1343687224 [TCP segment of a reassembled PDU]"
"36","1.390774342","2001:40a8:4400:3::5266:982a","2a0d:6fc7:505:6e3:b391:e2e3:ca0d:6126","TCP","6466","443  >  47056 [PSH, ACK] Seq=83522 Ack=772 Win=501 Len=6380 TSval=3079458858 TSecr=1343687224 [TCP segment of a reassembled PDU]"
"37","1.390774077","2a0d:6fc7:505:6e3:b391:e2e3:ca0d:6126","2001:40a8:4400:3::5266:982a","TCP","86","47056  >  443 [ACK] Seq=772 Ack=82246 Win=6350 Len=0 TSval=1343687328 TSecr=3079458854"
"38","1.390774369","2001:40a8:4400:3::5266:982a","2a0d:6fc7:505:6e3:b391:e2e3:ca0d:6126","TCP","7742","443  >  47056 [PSH, ACK] Seq=89902 Ack=772 Win=501 Len=7656 TSval=3079458859 TSecr=1343687224 [TCP segment of a reassembled PDU]"
"39","1.390824432","2a0d:6fc7:505:6e3:b391:e2e3:ca0d:6126","2001:40a8:4400:3::5266:982a","TCP","86","47056  >  443 [ACK] Seq=772 Ack=83522 Win=6341 Len=0 TSval=1343687328 TSecr=3079458857"
"40","1.390844102","2a0d:6fc7:505:6e3:b391:e2e3:ca0d:6126","2001:40a8:4400:3::5266:982a","TCP","86","47056  >  443 [ACK] Seq=772 Ack=89902 Win=6294 Len=0 TSval=1343687328 TSecr=3079458858"
"41","1.390883008","2a0d:6fc7:505:6e3:b391:e2e3:ca0d:6126","2001:40a8:4400:3::5266:982a","TCP","86","47056  >  443 [ACK] Seq=772 Ack=97558 Win=6238 Len=0 TSval=1343687329 TSecr=3079458859"
"42","1.390908812","2001:40a8:4400:3::5266:982a","2a0d:6fc7:505:6e3:b391:e2e3:ca0d:6126","TLSv1.2","2638","Application Data"
"43","1.390910491","2a0d:6fc7:505:6e3:b391:e2e3:ca0d:6126","2001:40a8:4400:3::5266:982a","TCP","86","47056  >  443 [ACK] Seq=772 Ack=100110 Win=6220 Len=0 TSval=1343687329 TSecr=3079458860"
"44","1.391792854","2001:40a8:4400:3::5266:982a","2a0d:6fc7:505:6e3:b391:e2e3:ca0d:6126","TCP","3914","443  >  47056 [PSH, ACK] Seq=100110 Ack=772 Win=501 Len=3828 TSval=3079458860 TSecr=1343687224 [TCP segment of a reassembled PDU]"
"45","1.391792903","2001:40a8:4400:3::5266:982a","2a0d:6fc7:505:6e3:b391:e2e3:ca0d:6126","TCP","1362","443  >  47056 [ACK] Seq=103938 Ack=772 Win=501 Len=1276 TSval=3079458861 TSecr=1343687224 [TCP segment of a reassembled PDU]"
"46","1.391814530","2a0d:6fc7:505:6e3:b391:e2e3:ca0d:6126","2001:40a8:4400:3::5266:982a","TCP","86","47056  >  443 [ACK] Seq=772 Ack=103938 Win=6923 Len=0 TSval=1343687329 TSecr=3079458860"
"47","1.398341101","2001:40a8:4400:3::5266:982a","2a0d:6fc7:505:6e3:b391:e2e3:ca0d:6126","TCP","5190","443  >  47056 [PSH, ACK] Seq=105214 Ack=772 Win=501 Len=5104 TSval=3079458861 TSecr=1343687224 [TCP segment of a reassembled PDU]"
"48","1.398409557","2a0d:6fc7:505:6e3:b391:e2e3:ca0d:6126","2001:40a8:4400:3::5266:982a","TCP","86","47056  >  443 [ACK] Seq=772 Ack=110318 Win=6942 Len=0 TSval=1343687336 TSecr=3079458861"
"49","1.399939014","2001:40a8:4400:3::5266:982a","2a0d:6fc7:505:6e3:b391:e2e3:ca0d:6126","TLSv1.2","6466","Application Data"
"50","1.399974833","2a0d:6fc7:505:6e3:b391:e2e3:ca0d:6126","2001:40a8:4400:3::5266:982a","TCP","86","47056  >  443 [ACK] Seq=772 Ack=116698 Win=6942 Len=0 TSval=1343687338 TSecr=3079458862"
"51","1.405692697","2001:40a8:4400:3::5266:982a","2a0d:6fc7:505:6e3:b391:e2e3:ca0d:6126","TCP","2638","443  >  47056 [ACK] Seq=116698 Ack=772 Win=501 Len=2552 TSval=3079458863 TSecr=1343687224 [TCP segment of a reassembled PDU]"
"52","1.405755286","2a0d:6fc7:505:6e3:b391:e2e3:ca0d:6126","2001:40a8:4400:3::5266:982a","TCP","86","47056  >  443 [ACK] Seq=772 Ack=119250 Win=6942 Len=0 TSval=1343687343 TSecr=3079458863"
"53","1.409904884","2001:40a8:4400:3::5266:982a","2a0d:6fc7:505:6e3:b391:e2e3:ca0d:6126","TLSv1.2","3914","Application Data"
"54","1.410020743","2a0d:6fc7:505:6e3:b391:e2e3:ca0d:6126","2001:40a8:4400:3::5266:982a","TCP","86","47056  >  443 [ACK] Seq=772 Ack=123078 Win=6942 Len=0 TSval=1343687348 TSecr=3079458863"
"55","1.414451796","2001:40a8:4400:3::5266:982a","2a0d:6fc7:505:6e3:b391:e2e3:ca0d:6126","TCP","1362","443  >  47056 [ACK] Seq=123078 Ack=772 Win=501 Len=1276 TSval=3079458863 TSecr=1343687224 [TCP segment of a reassembled PDU]"
"56","1.428097898","2001:40a8:4400:3::5266:982a","2a0d:6fc7:505:6e3:b391:e2e3:ca0d:6126","TCP","1362","443  >  47056 [ACK] Seq=124354 Ack=772 Win=501 Len=1276 TSval=3079458863 TSecr=1343687224 [TCP segment of a reassembled PDU]"
"57","1.428134134","2a0d:6fc7:505:6e3:b391:e2e3:ca0d:6126","2001:40a8:4400:3::5266:982a","TCP","86","47056  >  443 [ACK] Seq=772 Ack=125630 Win=6942 Len=0 TSval=1343687366 TSecr=3079458863"
"58","1.434013177","2001:40a8:4400:3::5266:982a","2a0d:6fc7:505:6e3:b391:e2e3:ca0d:6126","TCP","2638","443  >  47056 [ACK] Seq=125630 Ack=772 Win=501 Len=2552 TSval=3079458863 TSecr=1343687224 [TCP segment of a reassembled PDU]"
"59","1.434167625","2a0d:6fc7:505:6e3:b391:e2e3:ca0d:6126","2001:40a8:4400:3::5266:982a","TCP","86","47056  >  443 [ACK] Seq=772 Ack=128182 Win=6942 Len=0 TSval=1343687372 TSecr=3079458863"
"60","1.458875864","2001:40a8:4400:3::5266:982a","2a0d:6fc7:505:6e3:b391:e2e3:ca0d:6126","TCP","1362","443  >  47056 [PSH, ACK] Seq=128182 Ack=772 Win=501 Len=1276 TSval=3079458863 TSecr=1343687224 [TCP segment of a reassembled PDU]"
"61","1.459072777","2a0d:6fc7:505:6e3:b391:e2e3:ca0d:6126","2001:40a8:4400:3::5266:982a","TCP","86","47056  >  443 [ACK] Seq=772 Ack=129458 Win=6942 Len=0 TSval=1343687397 TSecr=3079458863"
"62","1.460092572","2001:40a8:4400:3::5266:982a","2a0d:6fc7:505:6e3:b391:e2e3:ca0d:6126","TCP","2638","443  >  47056 [ACK] Seq=129458 Ack=772 Win=501 Len=2552 TSval=3079458864 TSecr=1343687224 [TCP segment of a reassembled PDU]"
"63","1.460174541","2a0d:6fc7:505:6e3:b391:e2e3:ca0d:6126","2001:40a8:4400:3::5266:982a","TCP","86","47056  >  443 [ACK] Seq=772 Ack=132010 Win=6942 Len=0 TSval=1343687398 TSecr=3079458864"
"64","1.463946007","2001:40a8:4400:3::5266:982a","2a0d:6fc7:505:6e3:b391:e2e3:ca0d:6126","TCP","2638","443  >  47056 [ACK] Seq=132010 Ack=772 Win=501 Len=2552 TSval=3079458864 TSecr=1343687224 [TCP segment of a reassembled PDU]"
"65","1.464043062","2a0d:6fc7:505:6e3:b391:e2e3:ca0d:6126","2001:40a8:4400:3::5266:982a","TCP","86","47056  >  443 [ACK] Seq=772 Ack=134562 Win=6942 Len=0 TSval=1343687402 TSecr=3079458864"
"66","1.549208742","2001:40a8:4400:3::5266:982a","2a0d:6fc7:505:6e3:b391:e2e3:ca0d:6126","TLSv1.2","1362","Application Data"
"67","1.549208901","2001:40a8:4400:3::5266:982a","2a0d:6fc7:505:6e3:b391:e2e3:ca0d:6126","TCP","6466","443  >  47056 [PSH, ACK] Seq=135838 Ack=772 Win=501 Len=6380 TSval=3079458865 TSecr=1343687224 [TCP segment of a reassembled PDU]"
"68","1.549208928","2001:40a8:4400:3::5266:982a","2a0d:6fc7:505:6e3:b391:e2e3:ca0d:6126","TCP","3914","443  >  47056 [ACK] Seq=142218 Ack=772 Win=501 Len=3828 TSval=3079458866 TSecr=1343687224 [TCP segment of a reassembled PDU]"
"69","1.549309412","2a0d:6fc7:505:6e3:b391:e2e3:ca0d:6126","2001:40a8:4400:3::5266:982a","TCP","86","47056  >  443 [ACK] Seq=772 Ack=146046 Win=6942 Len=0 TSval=1343687487 TSecr=3079458864"
"70","1.556627588","2001:40a8:4400:3::5266:982a","2a0d:6fc7:505:6e3:b391:e2e3:ca0d:6126","TCP","2638","443  >  47056 [PSH, ACK] Seq=146046 Ack=772 Win=501 Len=2552 TSval=3079458866 TSecr=1343687224 [TCP segment of a reassembled PDU]"
"71","1.556732713","2a0d:6fc7:505:6e3:b391:e2e3:ca0d:6126","2001:40a8:4400:3::5266:982a","TCP","86","47056  >  443 [ACK] Seq=772 Ack=148598 Win=6942 Len=0 TSval=1343687494 TSecr=3079458866"
"72","1.558813097","2001:40a8:4400:3::5266:982a","2a0d:6fc7:505:6e3:b391:e2e3:ca0d:6126","TCP","1362","443  >  47056 [ACK] Seq=148598 Ack=772 Win=501 Len=1276 TSval=3079458867 TSecr=1343687224 [TCP segment of a reassembled PDU]"
"73","1.562403456","2001:40a8:4400:3::5266:982a","2a0d:6fc7:505:6e3:b391:e2e3:ca0d:6126","TLSv1.2","4546","Application Data"
"74","1.562544270","2a0d:6fc7:505:6e3:b391:e2e3:ca0d:6126","2001:40a8:4400:3::5266:982a","TCP","86","47056  >  443 [ACK] Seq=772 Ack=154334 Win=6942 Len=0 TSval=1343687500 TSecr=3079458867"
"75","1.564511901","2001:40a8:4400:3::5266:982a","2a0d:6fc7:505:6e3:b391:e2e3:ca0d:6126","TCP","2638","443  >  47056 [ACK] Seq=154334 Ack=772 Win=501 Len=2552 TSval=3079458868 TSecr=1343687224 [TCP segment of a reassembled PDU]"
"76","1.564556686","2a0d:6fc7:505:6e3:b391:e2e3:ca0d:6126","2001:40a8:4400:3::5266:982a","TCP","86","47056  >  443 [ACK] Seq=772 Ack=156886 Win=6942 Len=0 TSval=1343687502 TSecr=3079458868"
"77","1.589017174","2001:40a8:4400:3::5266:982a","2a0d:6fc7:505:6e3:b391:e2e3:ca0d:6126","TCP","2638","443  >  47056 [ACK] Seq=156886 Ack=772 Win=501 Len=2552 TSval=3079458868 TSecr=1343687224 [TCP segment of a reassembled PDU]"
"78","1.589247896","2a0d:6fc7:505:6e3:b391:e2e3:ca0d:6126","2001:40a8:4400:3::5266:982a","TCP","86","47056  >  443 [ACK] Seq=772 Ack=159438 Win=6942 Len=0 TSval=1343687527 TSecr=3079458868"
"79","1.590345262","2001:40a8:4400:3::5266:982a","2a0d:6fc7:505:6e3:b391:e2e3:ca0d:6126","TCP","1362","443  >  47056 [PSH, ACK] Seq=159438 Ack=772 Win=501 Len=1276 TSval=3079458868 TSecr=1343687224 [TCP segment of a reassembled PDU]"
"80","1.590429914","2a0d:6fc7:505:6e3:b391:e2e3:ca0d:6126","2001:40a8:4400:3::5266:982a","TCP","86","47056  >  443 [ACK] Seq=772 Ack=160714 Win=6942 Len=0 TSval=1343687528 TSecr=3079458868"
"81","1.593046026","2001:40a8:4400:3::5266:982a","2a0d:6fc7:505:6e3:b391:e2e3:ca0d:6126","TCP","2638","443  >  47056 [ACK] Seq=160714 Ack=772 Win=501 Len=2552 TSval=3079458869 TSecr=1343687224 [TCP segment of a reassembled PDU]"
"82","1.593122695","2a0d:6fc7:505:6e3:b391:e2e3:ca0d:6126","2001:40a8:4400:3::5266:982a","TCP","86","47056  >  443 [ACK] Seq=772 Ack=163266 Win=6942 Len=0 TSval=1343687531 TSecr=3079458869"
"83","1.733444506","2001:40a8:4400:3::5266:982a","2a0d:6fc7:505:6e3:b391:e2e3:ca0d:6126","TCP","1362","443  >  47056 [ACK] Seq=163266 Ack=772 Win=501 Len=1276 TSval=3079458869 TSecr=1343687224 [TCP segment of a reassembled PDU]"
"84","1.733444770","2001:40a8:4400:3::5266:982a","2a0d:6fc7:505:6e3:b391:e2e3:ca0d:6126","TCP","1362","[TCP Previous segment not captured] 443  >  47056 [PSH, ACK] Seq=165818 Ack=772 Win=501 Len=1276 TSval=3079458869 TSecr=1343687224 [TCP segment of a reassembled PDU]"
"85","1.733444788","2001:40a8:4400:3::5266:982a","2a0d:6fc7:505:6e3:b391:e2e3:ca0d:6126","TCP","6466","443  >  47056 [PSH, ACK] Seq=167094 Ack=772 Win=501 Len=6380 TSval=3079458870 TSecr=1343687224 [TCP segment of a reassembled PDU]"
"86","1.733444806","2001:40a8:4400:3::5266:982a","2a0d:6fc7:505:6e3:b391:e2e3:ca0d:6126","TLSv1.2","3914","Application Data"
"87","1.733487874","2a0d:6fc7:505:6e3:b391:e2e3:ca0d:6126","2001:40a8:4400:3::5266:982a","TCP","98","47056  >  443 [ACK] Seq=772 Ack=164542 Win=6933 Len=0 TSval=1343687671 TSecr=3079458869 SLE=165818 SRE=167094"
"88","1.733574922","2a0d:6fc7:505:6e3:b391:e2e3:ca0d:6126","2001:40a8:4400:3::5266:982a","TCP","98","[TCP Dup ACK 87#1] 47056  >  443 [ACK] Seq=772 Ack=164542 Win=6933 Len=0 TSval=1343687671 TSecr=3079458869 SLE=165818 SRE=173474"
"89","1.733597072","2a0d:6fc7:505:6e3:b391:e2e3:ca0d:6126","2001:40a8:4400:3::5266:982a","TCP","98","[TCP Dup ACK 87#2] 47056  >  443 [ACK] Seq=772 Ack=164542 Win=6933 Len=0 TSval=1343687671 TSecr=3079458869 SLE=165818 SRE=177302"
"90","1.776699032","2001:40a8:4400:3::5266:982a","2a0d:6fc7:505:6e3:b391:e2e3:ca0d:6126","TCP","2638","443  >  47056 [PSH, ACK] Seq=177302 Ack=772 Win=501 Len=2552 TSval=3079458871 TSecr=1343687224 [TCP segment of a reassembled PDU]"
"91","1.776699342","2001:40a8:4400:3::5266:982a","2a0d:6fc7:505:6e3:b391:e2e3:ca0d:6126","TCP","6466","443  >  47056 [PSH, ACK] Seq=179854 Ack=772 Win=501 Len=6380 TSval=3079458871 TSecr=1343687260 [TCP segment of a reassembled PDU]"
"92","1.777910157","2a0d:6fc7:505:6e3:b391:e2e3:ca0d:6126","2001:40a8:4400:3::5266:982a","TCP","98","[TCP Dup ACK 87#3] 47056  >  443 [ACK] Seq=772 Ack=164542 Win=6933 Len=0 TSval=1343687714 TSecr=3079458869 SLE=165818 SRE=186234"
"93","1.786998439","2001:40a8:4400:3::5266:982a","2a0d:6fc7:505:6e3:b391:e2e3:ca0d:6126","TCP","3914","443  >  47056 [ACK] Seq=186234 Ack=772 Win=501 Len=3828 TSval=3079458872 TSecr=1343687260 [TCP segment of a reassembled PDU]"
"94","1.787186907","2001:40a8:4400:3::5266:982a","2a0d:6fc7:505:6e3:b391:e2e3:ca0d:6126","TCP","1362","443  >  47056 [ACK] Seq=190062 Ack=772 Win=501 Len=1276 TSval=3079458872 TSecr=1343687260 [TCP segment of a reassembled PDU]"
"95","1.787669873","2001:40a8:4400:3::5266:982a","2a0d:6fc7:505:6e3:b391:e2e3:ca0d:6126","TLSv1.2","1362","Application Data"
"96","1.788132365","2a0d:6fc7:505:6e3:b391:e2e3:ca0d:6126","2001:40a8:4400:3::5266:982a","TCP","98","[TCP Dup ACK 87#4] 47056  >  443 [ACK] Seq=772 Ack=164542 Win=6933 Len=0 TSval=1343687725 TSecr=3079458869 SLE=165818 SRE=192614"
"97","1.791197747","2001:40a8:4400:3::5266:982a","2a0d:6fc7:505:6e3:b391:e2e3:ca0d:6126","TCP","1362","443  >  47056 [ACK] Seq=192614 Ack=772 Win=501 Len=1276 TSval=3079458873 TSecr=1343687260 [TCP segment of a reassembled PDU]"
"98","1.792315128","2a0d:6fc7:505:6e3:b391:e2e3:ca0d:6126","2001:40a8:4400:3::5266:982a","TCP","98","[TCP Dup ACK 87#5] 47056  >  443 [ACK] Seq=772 Ack=164542 Win=6933 Len=0 TSval=1343687729 TSecr=3079458869 SLE=165818 SRE=193890"
"99","1.802606607","2001:40a8:4400:3::5266:982a","2a0d:6fc7:505:6e3:b391:e2e3:ca0d:6126","TCP","1362","443  >  47056 [ACK] Seq=193890 Ack=772 Win=501 Len=1276 TSval=3079458873 TSecr=1343687260 [TCP segment of a reassembled PDU]"
"100","1.803757869","2a0d:6fc7:505:6e3:b391:e2e3:ca0d:6126","2001:40a8:4400:3::5266:982a","TCP","98","[TCP Dup ACK 87#6] 47056  >  443 [ACK] Seq=772 Ack=164542 Win=6933 Len=0 TSval=1343687740 TSecr=3079458869 SLE=165818 SRE=195166"
"101","1.806032740","2001:40a8:4400:3::5266:982a","2a0d:6fc7:505:6e3:b391:e2e3:ca0d:6126","TCP","1362","443  >  47056 [ACK] Seq=195166 Ack=772 Win=501 Len=1276 TSval=3079458873 TSecr=1343687260 [TCP segment of a reassembled PDU]"
"102","1.807180304","2a0d:6fc7:505:6e3:b391:e2e3:ca0d:6126","2001:40a8:4400:3::5266:982a","TCP","98","[TCP Dup ACK 87#7] 47056  >  443 [ACK] Seq=772 Ack=164542 Win=6933 Len=0 TSval=1343687744 TSecr=3079458869 SLE=165818 SRE=196442"
"103","1.815810843","2001:40a8:4400:3::5266:982a","2a0d:6fc7:505:6e3:b391:e2e3:ca0d:6126","TCP","2638","443  >  47056 [PSH, ACK] Seq=196442 Ack=772 Win=501 Len=2552 TSval=3079458873 TSecr=1343687260 [TCP segment of a reassembled PDU]"
"104","1.816284032","2001:40a8:4400:3::5266:982a","2a0d:6fc7:505:6e3:b391:e2e3:ca0d:6126","TCP","5190","443  >  47056 [ACK] Seq=198994 Ack=772 Win=501 Len=5104 TSval=3079458874 TSecr=1343687260 [TCP segment of a reassembled PDU]"
"105","1.816745250","2001:40a8:4400:3::5266:982a","2a0d:6fc7:505:6e3:b391:e2e3:ca0d:6126","TCP","1362","443  >  47056 [PSH, ACK] Seq=204098 Ack=772 Win=501 Len=1276 TSval=3079458874 TSecr=1343687260 [TCP segment of a reassembled PDU]"
"106","1.816954527","2a0d:6fc7:505:6e3:b391:e2e3:ca0d:6126","2001:40a8:4400:3::5266:982a","TCP","98","[TCP Dup ACK 87#8] 47056  >  443 [ACK] Seq=772 Ack=164542 Win=6933 Len=0 TSval=1343687754 TSecr=3079458869 SLE=165818 SRE=205374"
"107","1.822472897","2001:40a8:4400:3::5266:982a","2a0d:6fc7:505:6e3:b391:e2e3:ca0d:6126","TCP","2638","443  >  47056 [ACK] Seq=205374 Ack=772 Win=501 Len=2552 TSval=3079458875 TSecr=1343687260 [TCP segment of a reassembled PDU]"
"108","1.823667170","2a0d:6fc7:505:6e3:b391:e2e3:ca0d:6126","2001:40a8:4400:3::5266:982a","TCP","98","[TCP Dup ACK 87#9] 47056  >  443 [ACK] Seq=772 Ack=164542 Win=6933 Len=0 TSval=1343687760 TSecr=3079458869 SLE=165818 SRE=207926"
"109","1.827757370","2001:40a8:4400:3::5266:982a","2a0d:6fc7:505:6e3:b391:e2e3:ca0d:6126","TLSv1.2","2638","Application Data"
"110","1.828404974","2001:40a8:4400:3::5266:982a","2a0d:6fc7:505:6e3:b391:e2e3:ca0d:6126","TCP","1362","443  >  47056 [PSH, ACK] Seq=210478 Ack=772 Win=501 Len=1276 TSval=3079458875 TSecr=1343687260 [TCP segment of a reassembled PDU]"
"111","1.829039516","2a0d:6fc7:505:6e3:b391:e2e3:ca0d:6126","2001:40a8:4400:3::5266:982a","TCP","98","[TCP Dup ACK 87#10] 47056  >  443 [ACK] Seq=772 Ack=164542 Win=6933 Len=0 TSval=1343687766 TSecr=3079458869 SLE=165818 SRE=211754"
"112","1.835886583","2001:40a8:4400:3::5266:982a","2a0d:6fc7:505:6e3:b391:e2e3:ca0d:6126","TCP","2638","443  >  47056 [ACK] Seq=211754 Ack=772 Win=501 Len=2552 TSval=3079458876 TSecr=1343687260 [TCP segment of a reassembled PDU]"
"113","1.837229791","2a0d:6fc7:505:6e3:b391:e2e3:ca0d:6126","2001:40a8:4400:3::5266:982a","TCP","98","[TCP Dup ACK 87#11] 47056  >  443 [ACK] Seq=772 Ack=164542 Win=6933 Len=0 TSval=1343687774 TSecr=3079458869 SLE=165818 SRE=214306"
"114","1.843000450","2001:40a8:4400:3::5266:982a","2a0d:6fc7:505:6e3:b391:e2e3:ca0d:6126","TLSv1.2","2638","Application Data"
"115","1.843351732","2001:40a8:4400:3::5266:982a","2a0d:6fc7:505:6e3:b391:e2e3:ca0d:6126","TCP","1362","443  >  47056 [PSH, ACK] Seq=216858 Ack=772 Win=501 Len=1276 TSval=3079458876 TSecr=1343687260 [TCP segment of a reassembled PDU]"
"116","1.844200253","2a0d:6fc7:505:6e3:b391:e2e3:ca0d:6126","2001:40a8:4400:3::5266:982a","TCP","98","[TCP Dup ACK 87#12] 47056  >  443 [ACK] Seq=772 Ack=164542 Win=6933 Len=0 TSval=1343687781 TSecr=3079458869 SLE=165818 SRE=218134"
"117","1.845687044","2001:40a8:4400:3::5266:982a","2a0d:6fc7:505:6e3:b391:e2e3:ca0d:6126","TCP","2638","443  >  47056 [ACK] Seq=218134 Ack=772 Win=501 Len=2552 TSval=3079458877 TSecr=1343687260 [TCP segment of a reassembled PDU]"
"118","1.846830991","2a0d:6fc7:505:6e3:b391:e2e3:ca0d:6126","2001:40a8:4400:3::5266:982a","TCP","98","[TCP Dup ACK 87#13] 47056  >  443 [ACK] Seq=772 Ack=164542 Win=6933 Len=0 TSval=1343687783 TSecr=3079458869 SLE=165818 SRE=220686"
"119","1.922198515","2001:40a8:4400:3::5266:982a","2a0d:6fc7:505:6e3:b391:e2e3:ca0d:6126","TCP","5190","443  >  47056 [PSH, ACK] Seq=220686 Ack=772 Win=501 Len=5104 TSval=3079458877 TSecr=1343687260 [TCP segment of a reassembled PDU]"
"120","1.922198811","2001:40a8:4400:3::5266:982a","2a0d:6fc7:505:6e3:b391:e2e3:ca0d:6126","TCP","6466","443  >  47056 [PSH, ACK] Seq=225790 Ack=772 Win=501 Len=6380 TSval=3079458878 TSecr=1343687260 [TCP segment of a reassembled PDU]"
"121","1.922237484","2001:40a8:4400:3::5266:982a","2a0d:6fc7:505:6e3:b391:e2e3:ca0d:6126","TLSv1.2","1362","Application Data"
"122","1.922237511","2001:40a8:4400:3::5266:982a","2a0d:6fc7:505:6e3:b391:e2e3:ca0d:6126","TCP","6466","443  >  47056 [PSH, ACK] Seq=233446 Ack=772 Win=501 Len=6380 TSval=3079458939 TSecr=1343687328 [TCP segment of a reassembled PDU]"
"123","1.922237539","192.168.56.210","34.193.180.58","TCP","1514","[TCP Previous segment not captured] 59958  >  443 [ACK] Seq=2161 Ack=4282 Win=255 Len=1460 [TCP segment of a reassembled PDU]"
"124","1.922237557","192.168.56.210","34.193.180.58","TLSv1.2","441","Application Data"
"125","1.922246020","192.168.56.210","34.193.180.58","TCP","1514","59958  >  443 [ACK] Seq=4008 Ack=4282 Win=255 Len=1460 [TCP segment of a reassembled PDU]"
"126","1.922246048","192.168.56.210","34.193.180.58","TLSv1.2","10098","Application Data"
"127","1.922260129","2001:40a8:4400:3::5266:982a","2a0d:6fc7:505:6e3:b391:e2e3:ca0d:6126","TCP","6466","443  >  47056 [PSH, ACK] Seq=239826 Ack=772 Win=501 Len=6380 TSval=3079458947 TSecr=1343687328 [TCP segment of a reassembled PDU]"
"128","1.922260147","2001:40a8:4400:3::5266:982a","2a0d:6fc7:505:6e3:b391:e2e3:ca0d:6126","TLSv1.2","6466","Application Data"
"129","1.922270110","2001:40a8:4400:3::5266:982a","2a0d:6fc7:505:6e3:b391:e2e3:ca0d:6126","TLSv1.2","6466","Application Data"
"130","1.923480204","2a0d:6fc7:505:6e3:b391:e2e3:ca0d:6126","2001:40a8:4400:3::5266:982a","TCP","98","[TCP Dup ACK 87#14] 47056  >  443 [ACK] Seq=772 Ack=164542 Win=6933 Len=0 TSval=1343687860 TSecr=3079458869 SLE=165818 SRE=258966"
"131","1.923724035","2001:40a8:4400:3::5266:982a","2a0d:6fc7:505:6e3:b391:e2e3:ca0d:6126","TCP","2638","443  >  47056 [ACK] Seq=258966 Ack=772 Win=501 Len=2552 TSval=3079458949 TSecr=1343687343 [TCP segment of a reassembled PDU]"
"132","1.924972819","2a0d:6fc7:505:6e3:b391:e2e3:ca0d:6126","2001:40a8:4400:3::5266:982a","TCP","98","[TCP Dup ACK 87#15] 47056  >  443 [ACK] Seq=772 Ack=164542 Win=6933 Len=0 TSval=1343687861 TSecr=3079458869 SLE=165818 SRE=261518"
"133","1.927321889","2001:40a8:4400:3::5266:982a","2a0d:6fc7:505:6e3:b391:e2e3:ca0d:6126","TCP","2638","443  >  47056 [ACK] Seq=261518 Ack=772 Win=501 Len=2552 TSval=3079458949 TSecr=1343687343 [TCP segment of a reassembled PDU]"
"134","1.928546384","2a0d:6fc7:505:6e3:b391:e2e3:ca0d:6126","2001:40a8:4400:3::5266:982a","TCP","98","[TCP Dup ACK 87#16] 47056  >  443 [ACK] Seq=772 Ack=164542 Win=6933 Len=0 TSval=1343687865 TSecr=3079458869 SLE=165818 SRE=264070"
"135","1.930433733","2001:40a8:4400:3::5266:982a","2a0d:6fc7:505:6e3:b391:e2e3:ca0d:6126","TCP","1362","443  >  47056 [PSH, ACK] Seq=264070 Ack=772 Win=501 Len=1276 TSval=3079458949 TSecr=1343687343 [TCP segment of a reassembled PDU]"
"136","1.931589205","2a0d:6fc7:505:6e3:b391:e2e3:ca0d:6126","2001:40a8:4400:3::5266:982a","TCP","98","[TCP Dup ACK 87#17] 47056  >  443 [ACK] Seq=772 Ack=164542 Win=6933 Len=0 TSval=1343687868 TSecr=3079458869 SLE=165818 SRE=265346"
"137","1.941472658","2001:40a8:4400:3::5266:982a","2a0d:6fc7:505:6e3:b391:e2e3:ca0d:6126","TCP","1362","443  >  47056 [ACK] Seq=265346 Ack=772 Win=501 Len=1276 TSval=3079458950 TSecr=1343687343 [TCP segment of a reassembled PDU]"
"138","1.942733184","2a0d:6fc7:505:6e3:b391:e2e3:ca0d:6126","2001:40a8:4400:3::5266:982a","TCP","98","[TCP Dup ACK 87#18] 47056  >  443 [ACK] Seq=772 Ack=164542 Win=6933 Len=0 TSval=1343687879 TSecr=3079458869 SLE=165818 SRE=266622"
"139","1.946125101","2001:40a8:4400:3::5266:982a","2a0d:6fc7:505:6e3:b391:e2e3:ca0d:6126","TCP","1362","443  >  47056 [ACK] Seq=266622 Ack=772 Win=501 Len=1276 TSval=3079458950 TSecr=1343687343 [TCP segment of a reassembled PDU]"
"140","1.947299590","2a0d:6fc7:505:6e3:b391:e2e3:ca0d:6126","2001:40a8:4400:3::5266:982a","TCP","98","[TCP Dup ACK 87#19] 47056  >  443 [ACK] Seq=772 Ack=164542 Win=6933 Len=0 TSval=1343687884 TSecr=3079458869 SLE=165818 SRE=267898"
"141","1.976599743","2001:40a8:4400:3::5266:982a","2a0d:6fc7:505:6e3:b391:e2e3:ca0d:6126","TLSv1.2","3914","Application Data"
"142","1.976600548","2001:40a8:4400:3::5266:982a","2a0d:6fc7:505:6e3:b391:e2e3:ca0d:6126","TCP","2638","443  >  47056 [ACK] Seq=271726 Ack=772 Win=501 Len=2552 TSval=3079458951 TSecr=1343687343 [TCP segment of a reassembled PDU]"
"143","1.977834347","2a0d:6fc7:505:6e3:b391:e2e3:ca0d:6126","2001:40a8:4400:3::5266:982a","TCP","98","[TCP Dup ACK 87#20] 47056  >  443 [ACK] Seq=772 Ack=164542 Win=6933 Len=0 TSval=1343687914 TSecr=3079458869 SLE=165818 SRE=274278"
"144","1.983333335","2001:40a8:4400:3::5266:982a","2a0d:6fc7:505:6e3:b391:e2e3:ca0d:6126","TCP","3914","443  >  47056 [PSH, ACK] Seq=274278 Ack=772 Win=501 Len=3828 TSval=3079458951 TSecr=1343687343 [TCP segment of a reassembled PDU]"
"145","1.984568209","2a0d:6fc7:505:6e3:b391:e2e3:ca0d:6126","2001:40a8:4400:3::5266:982a","TCP","98","[TCP Dup ACK 87#21] 47056  >  443 [ACK] Seq=772 Ack=164542 Win=6933 Len=0 TSval=1343687921 TSecr=3079458869 SLE=165818 SRE=278106"
"146","1.986638576","2001:40a8:4400:3::5266:982a","2a0d:6fc7:505:6e3:b391:e2e3:ca0d:6126","TCP","6466","443  >  47056 [PSH, ACK] Seq=278106 Ack=772 Win=501 Len=6380 TSval=3079458951 TSecr=1343687343 [TCP segment of a reassembled PDU]"
"147","1.987552528","2001:40a8:4400:3::5266:982a","2a0d:6fc7:505:6e3:b391:e2e3:ca0d:6126","TLSv1.2","2638","Application Data"
"148","1.987827497","2a0d:6fc7:505:6e3:b391:e2e3:ca0d:6126","2001:40a8:4400:3::5266:982a","TCP","98","[TCP Dup ACK 87#22] 47056  >  443 [ACK] Seq=772 Ack=164542 Win=6933 Len=0 TSval=1343687925 TSecr=3079458869 SLE=165818 SRE=287038"
"149","1.993467983","2001:40a8:4400:3::5266:982a","2a0d:6fc7:505:6e3:b391:e2e3:ca0d:6126","TCP","3914","443  >  47056 [PSH, ACK] Seq=287038 Ack=772 Win=501 Len=3828 TSval=3079458952 TSecr=1343687343 [TCP segment of a reassembled PDU]"
"150","1.994169095","2001:40a8:4400:3::5266:982a","2a0d:6fc7:505:6e3:b391:e2e3:ca0d:6126","TCP","6466","443  >  47056 [PSH, ACK] Seq=290866 Ack=772 Win=501 Len=6380 TSval=3079458953 TSecr=1343687343 [TCP segment of a reassembled PDU]"
"151","1.994699085","2a0d:6fc7:505:6e3:b391:e2e3:ca0d:6126","2001:40a8:4400:3::5266:982a","TCP","98","[TCP Dup ACK 87#23] 47056  >  443 [ACK] Seq=772 Ack=164542 Win=6933 Len=0 TSval=1343687932 TSecr=3079458869 SLE=165818 SRE=297246"
"152","1.997019806","2001:40a8:4400:3::5266:982a","2a0d:6fc7:505:6e3:b391:e2e3:ca0d:6126","TLSv1.2","6466","Application Data"
"153","1.998180876","2001:40a8:4400:3::5266:982a","2a0d:6fc7:505:6e3:b391:e2e3:ca0d:6126","TLSv1.2","6466","Application Data"
"154","1.998237747","2a0d:6fc7:505:6e3:b391:e2e3:ca0d:6126","2001:40a8:4400:3::5266:982a","TCP","98","[TCP Dup ACK 87#24] 47056  >  443 [ACK] Seq=772 Ack=164542 Win=6933 Len=0 TSval=1343687936 TSecr=3079458869 SLE=165818 SRE=310006"
"155","1.999996886","2001:40a8:4400:3::5266:982a","2a0d:6fc7:505:6e3:b391:e2e3:ca0d:6126","TCP","3914","443  >  47056 [ACK] Seq=310006 Ack=772 Win=501 Len=3828 TSval=3079458956 TSecr=1343687343 [TCP segment of a reassembled PDU]"
"156","2.001220823","2a0d:6fc7:505:6e3:b391:e2e3:ca0d:6126","2001:40a8:4400:3::5266:982a","TCP","98","[TCP Dup ACK 87#25] 47056  >  443 [ACK] Seq=772 Ack=164542 Win=6933 Len=0 TSval=1343687938 TSecr=3079458869 SLE=165818 SRE=313834"
"157","2.001677625","2001:40a8:4400:3::5266:982a","2a0d:6fc7:505:6e3:b391:e2e3:ca0d:6126","TCP","2638","443  >  47056 [PSH, ACK] Seq=313834 Ack=772 Win=501 Len=2552 TSval=3079458956 TSecr=1343687343 [TCP segment of a reassembled PDU]"
"158","2.002885129","2a0d:6fc7:505:6e3:b391:e2e3:ca0d:6126","2001:40a8:4400:3::5266:982a","TCP","98","[TCP Dup ACK 87#26] 47056  >  443 [ACK] Seq=772 Ack=164542 Win=6933 Len=0 TSval=1343687939 TSecr=3079458869 SLE=165818 SRE=316386"
"159","2.003153313","2001:40a8:4400:3::5266:982a","2a0d:6fc7:505:6e3:b391:e2e3:ca0d:6126","TCP","6466","443  >  47056 [PSH, ACK] Seq=316386 Ack=772 Win=501 Len=6380 TSval=3079458957 TSecr=1343687343 [TCP segment of a reassembled PDU]"
"160","2.004345808","2a0d:6fc7:505:6e3:b391:e2e3:ca0d:6126","2001:40a8:4400:3::5266:982a","TCP","98","[TCP Dup ACK 87#27] 47056  >  443 [ACK] Seq=772 Ack=164542 Win=6933 Len=0 TSval=1343687941 TSecr=3079458869 SLE=165818 SRE=322766"
"161","2.004765809","2001:40a8:4400:3::5266:982a","2a0d:6fc7:505:6e3:b391:e2e3:ca0d:6126","TLSv1.2","3414","Application Data"
"162","2.005957356","2a0d:6fc7:505:6e3:b391:e2e3:ca0d:6126","2001:40a8:4400:3::5266:982a","TCP","98","[TCP Dup ACK 87#28] 47056  >  443 [ACK] Seq=772 Ack=164542 Win=6933 Len=0 TSval=1343687942 TSecr=3079458869 SLE=165818 SRE=326094"
"163","2.006462318","2001:40a8:4400:3::5266:982a","2a0d:6fc7:505:6e3:b391:e2e3:ca0d:6126","TLSv1.2","1362","[TCP Fast Retransmission] , Application Data"
"164","2.006518833","2a0d:6fc7:505:6e3:b391:e2e3:ca0d:6126","2001:40a8:4400:3::5266:982a","TCP","86","47056  >  443 [ACK] Seq=772 Ack=326094 Win=5759 Len=0 TSval=1343687944 TSecr=3079459326"
"165","2.437150610","192.168.56.210","107.23.148.39","TCP","1514","59960  >  443 [ACK] Seq=1 Ack=1 Win=255 Len=1460 [TCP segment of a reassembled PDU]"
"166","2.437150812","192.168.56.210","107.23.148.39","TLSv1.2","322","Client Hello (SNI=data.grammarly.com)"
"167","2.607736222","192.168.56.210","107.23.148.39","TCP","1514","[TCP Previous segment not captured] 59960  >  443 [ACK] Seq=1954 Ack=5419 Win=255 Len=1460 [TCP segment of a reassembled PDU]"
"168","2.607736463","192.168.56.210","107.23.148.39","TLSv1.2","381","Application Data"
"169","3.039461716","192.168.56.210","52.21.83.164","TLSv1.2","2031","Client Hello (SNI=capi.grammarly.com)"
"170","3.315501861","192.168.56.210","52.21.83.164","TLSv1.2","1901","[TCP Previous segment not captured] , Application Data"
"171","3.686934337","192.168.56.210","98.83.80.154","TCP","1514","59962  >  443 [ACK] Seq=1 Ack=1 Win=255 Len=1460 [TCP segment of a reassembled PDU]"
"172","3.686934610","192.168.56.210","98.83.80.154","TLSv1.2","424","Client Hello (SNI=goldengate.grammarly.com)"
"173","3.780229358","fe80::18b5:cff:feee:8145","ff02::1","ICMPv6","142","Router Advertisement from 1a:b5:0c:ee:81:45"
"174","3.791179157","fe80::20c:29ff:fe2c:8247","ff02::16","ICMPv6","110","Multicast Listener Report Message v2"
"175","3.879610097","192.168.56.210","98.83.80.154","TCP","1514","[TCP Previous segment not captured] 59962  >  443 [ACK] Seq=2056 Ack=4280 Win=255 Len=1460 [TCP segment of a reassembled PDU]"
"176","3.879610667","192.168.56.210","98.83.80.154","TLSv1.2","423","Application Data"
"177","4.732249672","fe80::20c:29ff:fe2c:8247","ff02::16","ICMPv6","110","Multicast Listener Report Message v2"
"178","9.499028089","2a0d:6fc7:505:6e3:b391:e2e3:ca0d:6126","2a00:1450:4028:806::200e","TCP","86","41598  >  443 [ACK] Seq=1 Ack=1 Win=249 Len=0 TSval=871215979 TSecr=3013236981"
"179","9.499590087","2a0d:6fc7:505:6e3:b391:e2e3:ca0d:6126","2a00:1450:4028:80a::2003","TCP","86","60444  >  443 [ACK] Seq=1 Ack=1 Win=249 Len=0 TSval=254226494 TSecr=1421691803"
"180","9.530906455","2a0d:6fc7:505:6e3:b391:e2e3:ca0d:6126","2a00:1450:400c:c0c::bc","TCP","86","34542  >  5228 [ACK] Seq=1 Ack=1 Win=249 Len=0 TSval=3016229894 TSecr=3636134567"
"181","9.563116907","2a00:1450:4028:80a::2003","2a0d:6fc7:505:6e3:b391:e2e3:ca0d:6126","TCP","86","[TCP ACKed unseen segment] 443  >  60444 [ACK] Seq=1 Ack=2 Win=1042 Len=0 TSval=1421736873 TSecr=254134923"
"182","9.563117140","2a00:1450:4028:806::200e","2a0d:6fc7:505:6e3:b391:e2e3:ca0d:6126","TCP","86","[TCP ACKed unseen segment] 443  >  41598 [ACK] Seq=1 Ack=2 Win=1039 Len=0 TSval=3013282035 TSecr=871124358"
"183","9.645752673","2a00:1450:400c:c0c::bc","2a0d:6fc7:505:6e3:b391:e2e3:ca0d:6126","TCP","86","[TCP ACKed unseen segment] 5228  >  34542 [ACK] Seq=1 Ack=2 Win=1049 Len=0 TSval=3636179687 TSecr=3016138314"
"184","10.745892589","0.0.0.0","255.255.255.255","DHCP","336","DHCP Request  - Transaction ID 0x6248e450"
"185","11.169744492","2a0d:6fc7:505:6e3:b391:e2e3:ca0d:6126","2600:1901:1:5a5::","TLSv1.2","203","Application Data"
"186","11.170189162","2a0d:6fc7:505:6e3:b391:e2e3:ca0d:6126","2600:1901:1:5a5::","TLSv1.2","512","Application Data, Application Data"
"187","11.223187950","2600:1901:1:5a5::","2a0d:6fc7:505:6e3:b391:e2e3:ca0d:6126","TCP","86","443  >  42534 [ACK] Seq=1 Ack=118 Win=572 Len=0 TSval=1349637082 TSecr=3483742360"
"188","11.224234202","2600:1901:1:5a5::","2a0d:6fc7:505:6e3:b391:e2e3:ca0d:6126","TCP","86","443  >  42534 [ACK] Seq=1 Ack=544 Win=571 Len=0 TSval=1349637082 TSecr=3483742361"
"189","11.225403862","2600:1901:1:5a5::","2a0d:6fc7:505:6e3:b391:e2e3:ca0d:6126","TLSv1.2","125","Application Data"
"190","11.267071447","2a0d:6fc7:505:6e3:b391:e2e3:ca0d:6126","2600:1901:1:5a5::","TCP","86","42534  >  443 [ACK] Seq=544 Ack=40 Win=557 Len=0 TSval=3483742458 TSecr=1349637082"
"191","11.435101457","2600:1901:1:5a5::","2a0d:6fc7:505:6e3:b391:e2e3:ca0d:6126","TLSv1.2","160","Application Data"
"192","11.435101993","2600:1901:1:5a5::","2a0d:6fc7:505:6e3:b391:e2e3:ca0d:6126","TLSv1.2","1294","Application Data"
"193","11.435201111","2a0d:6fc7:505:6e3:b391:e2e3:ca0d:6126","2600:1901:1:5a5::","TCP","86","42534  >  443 [ACK] Seq=544 Ack=114 Win=557 Len=0 TSval=3483742626 TSecr=1349637291"
"194","11.435463271","2a0d:6fc7:505:6e3:b391:e2e3:ca0d:6126","2600:1901:1:5a5::","TCP","86","42534  >  443 [ACK] Seq=544 Ack=1322 Win=580 Len=0 TSval=3483742626 TSecr=1349637291"
"195","11.436424888","2a0d:6fc7:505:6e3:b391:e2e3:ca0d:6126","2600:1901:1:5a5::","TLSv1.2","121","Application Data"
"196","11.517465804","2600:1901:1:5a5::","2a0d:6fc7:505:6e3:b391:e2e3:ca0d:6126","TLSv1.2","1294","Application Data"
"197","11.517466323","2600:1901:1:5a5::","2a0d:6fc7:505:6e3:b391:e2e3:ca0d:6126","TLSv1.2","1896","Application Data, Application Data"
"198","11.517466351","2600:1901:1:5a5::","2a0d:6fc7:505:6e3:b391:e2e3:ca0d:6126","TLSv1.2","125","Application Data"
"199","11.517466370","2600:1901:1:194::","2a0d:6fc7:505:6e3:b391:e2e3:ca0d:6126","TLSv1.2","1294","Application Data"
"200","11.517466388","2600:1901:1:194::","2a0d:6fc7:505:6e3:b391:e2e3:ca0d:6126","TLSv1.2","1294","Application Data"
"201","11.517466408","2600:1901:1:194::","2a0d:6fc7:505:6e3:b391:e2e3:ca0d:6126","TLSv1.2","2502","Application Data, Application Data"
"202","11.517497209","2a0d:6fc7:505:6e3:b391:e2e3:ca0d:6126","2600:1901:1:5a5::","TCP","86","42534  >  443 [ACK] Seq=579 Ack=4340 Win=630 Len=0 TSval=3483742708 TSecr=1349637292"
"203","11.517802758","2a0d:6fc7:505:6e3:b391:e2e3:ca0d:6126","2600:1901:1:194::","TCP","86","33548  >  443 [ACK] Seq=1 Ack=1209 Win=3393 Len=0 TSval=195308905 TSecr=2117587263"
"204","11.517877093","2a0d:6fc7:505:6e3:b391:e2e3:ca0d:6126","2600:1901:1:194::","TCP","86","33548  >  443 [ACK] Seq=1 Ack=2417 Win=3411 Len=0 TSval=195308906 TSecr=2117587263"
"205","11.517900457","2a0d:6fc7:505:6e3:b391:e2e3:ca0d:6126","2600:1901:1:194::","TCP","86","33548  >  443 [ACK] Seq=1 Ack=4833 Win=3449 Len=0 TSval=195308906 TSecr=2117587263"
"206","11.517924198","2600:1901:1:194::","2a0d:6fc7:505:6e3:b391:e2e3:ca0d:6126","TLSv1.2","2426","Application Data, Application Data"
"207","11.517924258","2600:1901:1:194::","2a0d:6fc7:505:6e3:b391:e2e3:ca0d:6126","TLSv1.2","1294","Application Data"
"208","11.517924277","2600:1901:1:194::","2a0d:6fc7:505:6e3:b391:e2e3:ca0d:6126","TLSv1.2","1294","Application Data"
"209","11.517924294","2600:1901:1:194::","2a0d:6fc7:505:6e3:b391:e2e3:ca0d:6126","TLSv1.2","2502","Application Data, Application Data"
"210","11.517924313","2600:1901:1:194::","2a0d:6fc7:505:6e3:b391:e2e3:ca0d:6126","TLSv1.2","2426","Application Data, Application Data"
"211","11.517927878","2a0d:6fc7:505:6e3:b391:e2e3:ca0d:6126","2600:1901:1:194::","TCP","86","33548  >  443 [ACK] Seq=1 Ack=7173 Win=3486 Len=0 TSval=195308906 TSecr=2117587264"
"212","11.517945748","2a0d:6fc7:505:6e3:b391:e2e3:ca0d:6126","2600:1901:1:194::","TCP","86","33548  >  443 [ACK] Seq=1 Ack=8381 Win=3505 Len=0 TSval=195308906 TSecr=2117587268"
