"No.","Time","Source","Destination","Protocol","Length","Info"
"1","0.000000000","192.168.1.93","159.124.21.96","TCP","74","45230  >  443 [SYN] Seq=0 Win=64240 Len=0 MSS=1460 SACK_PERM TSval=1495220937 TSecr=0 WS=128"
"2","0.081464633","159.124.21.96","192.168.1.93","TCP","74","443  >  45230 [SYN, ACK] Seq=0 Ack=1 Win=65160 Len=0 MSS=1460 SACK_PERM TSval=4109506945 TSecr=1495220937 WS=128"
"3","0.089141801","192.168.1.93","159.124.21.96","TCP","66","45230  >  443 [ACK] Seq=1 Ack=1 Win=64256 Len=0 TSval=1495221022 TSecr=4109506945"
"4","0.100092812","192.168.1.93","159.124.21.96","TLSv1.3","583","Client Hello (SNI=zoomams1591242196rwg.ams.zoom.us)"
"5","0.235067641","159.124.21.96","192.168.1.93","TCP","66","443  >  45230 [ACK] Seq=1 Ack=518 Win=64768 Len=0 TSval=4109507087 TSecr=1495221037"
"6","0.235067980","159.124.21.96","192.168.1.93","TLSv1.3","2962","Server Hello, Change Cipher Spec, Application Data"
"7","0.235068001","159.124.21.96","192.168.1.93","TCP","1266","443  >  45230 [PSH, ACK] Seq=2897 Ack=518 Win=64768 Len=1200 TSval=4109507087 TSecr=1495221037 [TCP PDU reassembled in 8]"
"8","0.235068089","159.124.21.96","192.168.1.93","TLSv1.3","466","Application Data, Application Data, Application Data"
"9","0.236492796","192.168.1.93","159.124.21.96","TCP","66","45230  >  443 [ACK] Seq=518 Ack=2897 Win=69888 Len=0 TSval=1495221172 TSecr=4109507087"
"10","0.236675065","192.168.1.93","159.124.21.96","TCP","66","45230  >  443 [ACK] Seq=518 Ack=4097 Win=72832 Len=0 TSval=1495221174 TSecr=4109507087"
"11","0.236762009","192.168.1.93","159.124.21.96","TCP","66","45230  >  443 [ACK] Seq=518 Ack=4497 Win=75776 Len=0 TSval=1495221174 TSecr=4109507088"
"12","0.258854296","192.168.1.93","159.124.21.96","TLSv1.3","146","Change Cipher Spec, Application Data"
"13","0.262655924","192.168.1.93","159.124.21.96","TCP","2962","45230  >  443 [PSH, ACK] Seq=598 Ack=4497 Win=75776 Len=2896 TSval=1495221200 TSecr=4109507088 [TCP PDU reassembled in 14]"
"14","0.263280913","192.168.1.93","159.124.21.96","TLSv1.3","1917","Application Data"
"15","0.353665162","159.124.21.96","192.168.1.93","TCP","66","443  >  45230 [ACK] Seq=4497 Ack=2046 Win=64128 Len=0 TSval=4109507223 TSecr=1495221196"
"16","0.354516049","159.124.21.96","192.168.1.93","TCP","66","443  >  45230 [ACK] Seq=4497 Ack=4942 Win=64128 Len=0 TSval=4109507223 TSecr=1495221200"
"17","0.354516233","159.124.21.96","192.168.1.93","TLSv1.3","145","Application Data"
"18","0.354516254","159.124.21.96","192.168.1.93","TLSv1.3","145","Application Data"
"19","0.362389085","192.168.1.93","159.124.21.96","TCP","66","45230  >  443 [ACK] Seq=5345 Ack=4655 Win=75776 Len=0 TSval=1495221300 TSecr=4109507223"
"20","0.419294889","159.124.21.96","192.168.1.93","TLSv1.3","533","Application Data"
"21","0.419295507","159.124.21.96","192.168.1.93","TLSv1.3","831","Application Data"
"22","0.459465811","192.168.1.93","159.124.21.96","TCP","66","45230  >  443 [ACK] Seq=5345 Ack=5887 Win=81536 Len=0 TSval=1495221397 TSecr=4109507270"
"23","0.536909033","192.168.1.93","159.124.21.96","TLSv1.3","111","Application Data"
"24","0.652385941","159.124.21.96","192.168.1.93","TLSv1.3","107","Application Data"
"25","0.652512647","192.168.1.93","159.124.21.96","TCP","66","45230  >  443 [ACK] Seq=5390 Ack=5928 Win=81536 Len=0 TSval=1495221590 TSecr=4109507513"
"26","1.352307859","192.168.1.93","159.124.21.96","TLSv1.3","713","Application Data"
"27","1.352760497","192.168.1.93","159.124.21.96","TLSv1.3","713","Application Data"
"28","1.429566632","159.124.21.96","192.168.1.93","TCP","66","443  >  45230 [ACK] Seq=5928 Ack=6684 Win=64128 Len=0 TSval=4109508299 TSecr=1495222289"
"29","1.429566972","159.124.21.96","192.168.1.93","TLSv1.3","807","Application Data"
"30","1.429636657","192.168.1.93","159.124.21.96","TCP","66","45230  >  443 [ACK] Seq=6684 Ack=6669 Win=84480 Len=0 TSval=1495222367 TSecr=4109508299"
"31","1.451885388","159.124.21.96","192.168.1.93","TLSv1.3","808","Application Data"
"32","1.451907778","192.168.1.93","159.124.21.96","TCP","66","45230  >  443 [ACK] Seq=6684 Ack=7411 Win=87296 Len=0 TSval=1495222389 TSecr=4109508319"
"33","1.465770533","192.168.1.93","159.124.21.96","STUN","198","Binding Request user: 4D4E1327-1ADF-8C9D-33B1-B59FB236C0B7:4541BB66-D689-8DE7-07EF-2C88144219B5"
"34","1.541915553","159.124.21.96","192.168.1.93","STUN","106","Binding Success Response XOR-MAPPED-ADDRESS: 5.29.51.201:8466"
"35","1.543359929","192.168.1.93","159.124.21.96","STUN","198","Binding Request user: 4D4E1327-1ADF-8C9D-33B1-B59FB236C0B7:4541BB66-D689-8DE7-07EF-2C88144219B5"
"36","1.543942677","192.168.1.93","159.124.21.96","DTLSv1.2","231","Client Hello"
"37","1.582269058","192.168.1.93","159.124.21.96","STUN","198","Binding Request user: 6F4AA7FD-78DF-FCC4-F05B-958B6A09AE9D:4541BB66-D689-8DE7-07EF-2C88144219B5"
"38","1.601655268","192.168.1.93","159.124.21.96","DTLSv1.2","231","Client Hello"
"39","1.614033586","159.124.21.96","192.168.1.93","STUN","106","Binding Success Response XOR-MAPPED-ADDRESS: 5.29.51.201:8466"
"40","1.614033830","159.124.21.96","192.168.1.93","DTLSv1.2","1094","Server Hello, Certificate (Fragment)"
"41","1.614033873","159.124.21.96","192.168.1.93","DTLSv1.2","1094","Certificate (Fragment)"
"42","1.614033925","159.124.21.96","192.168.1.93","DTLSv1.2","1094","Certificate (Fragment)"
"43","1.617040530","159.124.21.96","192.168.1.93","DTLSv1.2","1094","Certificate (Reassembled), Server Key Exchange (Fragment)"
"44","1.617040793","159.124.21.96","192.168.1.93","DTLSv1.2","492","Server Key Exchange (Reassembled), Certificate Request, Server Hello Done"
"45","1.623399872","192.168.1.93","159.124.21.96","DTLSv1.2","659","Certificate, Client Key Exchange, Certificate Verify, Change Cipher Spec, Encrypted Handshake Message"
"46","1.653749255","159.124.21.96","192.168.1.93","STUN","106","Binding Success Response XOR-MAPPED-ADDRESS: 5.29.51.201:8466"
"47","1.655296626","192.168.1.93","159.124.21.96","STUN","198","Binding Request user: 6F4AA7FD-78DF-FCC4-F05B-958B6A09AE9D:4541BB66-D689-8DE7-07EF-2C88144219B5"
"48","1.671657616","192.168.1.93","159.124.21.96","DTLSv1.2","231","Client Hello"
"49","1.673499660","159.124.21.96","192.168.1.93","DTLSv1.2","156","Server Hello"
"50","1.673499915","159.124.21.96","192.168.1.93","DTLSv1.2","1094","Certificate (Fragment)"
"51","1.673499950","159.124.21.96","192.168.1.93","DTLSv1.2","1094","Certificate (Fragment)"
"52","1.673499972","159.124.21.96","192.168.1.93","DTLSv1.2","1094","Certificate (Fragment)"
"53","1.673499993","159.124.21.96","192.168.1.93","DTLSv1.2","953","Certificate (Reassembled)"
"54","1.673500013","159.124.21.96","192.168.1.93","DTLSv1.2","396","Server Key Exchange"
"55","1.673500033","159.124.21.96","192.168.1.93","DTLSv1.2","115","Certificate Request"
"56","1.673500054","159.124.21.96","192.168.1.93","DTLSv1.2","67","Server Hello Done"
"57","1.678264658","192.168.1.93","159.124.21.96","DTLSv1.2","659","Certificate, Client Key Exchange, Certificate Verify, Change Cipher Spec, Encrypted Handshake Message"
"58","1.701800244","159.124.21.96","192.168.1.93","DTLSv1.2","109","Change Cipher Spec, Encrypted Handshake Message"
"59","1.710025153","192.168.1.93","159.124.21.96","DTLSv1.2","115","Application Data"
"60","1.729014384","192.168.1.93","159.124.21.96","DTLSv1.2","231","Client Hello"
"61","1.730653729","159.124.21.96","192.168.1.93","STUN","106","Binding Success Response XOR-MAPPED-ADDRESS: 5.29.51.201:8466"
"62","1.752385409","159.124.21.96","192.168.1.93","DTLSv1.2","1094","Server Hello, Certificate (Fragment)"
"63","1.752385777","159.124.21.96","192.168.1.93","DTLSv1.2","1094","Certificate (Fragment)"
"64","1.752385845","159.124.21.96","192.168.1.93","DTLSv1.2","1094","Certificate (Fragment)"
"65","1.752385863","159.124.21.96","192.168.1.93","DTLSv1.2","1094","Certificate (Reassembled), Server Key Exchange (Fragment)"
"66","1.752385884","159.124.21.96","192.168.1.93","DTLSv1.2","492","Server Key Exchange (Reassembled), Certificate Request, Server Hello Done"
"67","1.752385940","159.124.21.96","192.168.1.93","DTLSv1.2","60","Change Cipher Spec"
"68","1.752385960","159.124.21.96","192.168.1.93","DTLSv1.2","95","Encrypted Handshake Message"
"69","1.771379680","192.168.1.93","159.124.21.96","DTLSv1.2","659","Certificate, Client Key Exchange, Certificate Verify, Change Cipher Spec, Encrypted Handshake Message"
"70","1.778383746","159.124.21.96","192.168.1.93","DTLSv1.2","115","Application Data"
"71","1.780895327","192.168.1.93","159.124.21.96","DTLSv1.2","91","Application Data"
"72","1.802665082","159.124.21.96","192.168.1.93","DTLSv1.2","156","Server Hello"
"73","1.802665374","159.124.21.96","192.168.1.93","DTLSv1.2","1094","Certificate (Fragment)"
"74","1.802665403","159.124.21.96","192.168.1.93","DTLSv1.2","1094","Certificate (Fragment)"
"75","1.802665424","159.124.21.96","192.168.1.93","DTLSv1.2","1094","Certificate (Fragment)"
"76","1.802665445","159.124.21.96","192.168.1.93","DTLSv1.2","953","Certificate (Reassembled)"
"77","1.802665465","159.124.21.96","192.168.1.93","DTLSv1.2","396","Server Key Exchange"
"78","1.802665489","159.124.21.96","192.168.1.93","DTLSv1.2","115","Certificate Request"
"79","1.802665509","159.124.21.96","192.168.1.93","DTLSv1.2","67","Server Hello Done"
"80","1.805600955","192.168.1.93","159.124.21.96","DTLSv1.2","659","Certificate, Client Key Exchange, Certificate Verify, Change Cipher Spec, Encrypted Handshake Message"
"81","1.849034782","159.124.21.96","192.168.1.93","DTLSv1.2","109","Change Cipher Spec, Encrypted Handshake Message"
"82","1.850135554","159.124.21.96","192.168.1.93","DTLSv1.2","87","Application Data"
"83","1.850754356","192.168.1.93","159.124.21.96","DTLSv1.2","115","Application Data"
"84","1.851938689","192.168.1.93","159.124.21.96","DTLSv1.2","143","Application Data"
"85","1.887074183","159.124.21.96","192.168.1.93","DTLSv1.2","60","Change Cipher Spec"
"86","1.887074619","159.124.21.96","192.168.1.93","DTLSv1.2","95","Encrypted Handshake Message"
"87","1.920080067","159.124.21.96","192.168.1.93","DTLSv1.2","103","Application Data"
"88","1.920080563","159.124.21.96","192.168.1.93","DTLSv1.2","99","Application Data"
"89","1.923191237","159.124.21.96","192.168.1.93","DTLSv1.2","115","Application Data"
"90","1.929292783","192.168.1.93","159.124.21.96","DTLSv1.2","99","Application Data"
"91","1.932617333","192.168.1.93","159.124.21.96","DTLSv1.2","91","Application Data"
"92","2.012997837","159.124.21.96","192.168.1.93","DTLSv1.2","87","Application Data"
"93","2.021541529","192.168.1.93","159.124.21.96","DTLSv1.2","143","Application Data"
"94","2.094996366","159.124.21.96","192.168.1.93","DTLSv1.2","103","Application Data"
"95","2.094996677","159.124.21.96","192.168.1.93","DTLSv1.2","99","Application Data"
"96","2.095885796","192.168.1.93","159.124.21.96","DTLSv1.2","99","Application Data"
"97","4.534666758","159.124.21.96","192.168.1.93","DTLSv1.2","103","Application Data"
"98","4.536713171","192.168.1.93","159.124.21.96","DTLSv1.2","103","Application Data"
"99","4.652845794","159.124.21.96","192.168.1.93","DTLSv1.2","103","Application Data"
"100","4.653834586","192.168.1.93","159.124.21.96","DTLSv1.2","103","Application Data"
"101","5.740606852","159.124.21.96","192.168.1.93","TLSv1.3","106","Application Data"
"102","5.740733581","192.168.1.93","159.124.21.96","TCP","66","45230  >  443 [ACK] Seq=6684 Ack=7451 Win=87296 Len=0 TSval=1495226678 TSecr=4109512600"
"103","5.742404866","192.168.1.93","159.124.21.96","TLSv1.3","110","Application Data"
"104","5.865516429","159.124.21.96","192.168.1.93","TCP","66","443  >  45230 [ACK] Seq=7451 Ack=6728 Win=64128 Len=0 TSval=4109512726 TSecr=1495226680"
"105","6.092359378","192.168.1.93","159.124.21.96","TLSv1.3","209","Application Data"
"106","6.168678043","159.124.21.96","192.168.1.93","TCP","66","443  >  45230 [ACK] Seq=7451 Ack=6871 Win=64128 Len=0 TSval=4109513037 TSecr=1495227029"
"107","6.195661747","192.168.1.93","159.124.21.96","STUN","194","Binding Request user: 4D4E1327-1ADF-8C9D-33B1-B59FB236C0B7:4541BB66-D689-8DE7-07EF-2C88144219B5"
"108","6.265015658","159.124.21.96","192.168.1.93","STUN","106","Binding Success Response XOR-MAPPED-ADDRESS: 5.29.51.201:8466"
"109","6.963156951","159.124.21.96","192.168.1.93","TLSv1.3","1026","Application Data"
"110","7.009706587","192.168.1.93","159.124.21.96","TCP","66","45230  >  443 [ACK] Seq=6871 Ack=8411 Win=90240 Len=0 TSval=1495227947 TSecr=4109513833"
"111","7.095289792","159.124.21.96","192.168.1.93","TLSv1.3","1278","Application Data"
"112","7.095354926","192.168.1.93","159.124.21.96","TCP","66","45230  >  443 [ACK] Seq=6871 Ack=9623 Win=91136 Len=0 TSval=1495228032 TSecr=4109513965"
"113","7.129515886","159.124.21.96","192.168.1.93","TCP","2962","443  >  45230 [PSH, ACK] Seq=9623 Ack=6871 Win=64128 Len=2896 TSval=4109513986 TSecr=1495227947 [TCP PDU reassembled in 114]"
"114","7.129516183","159.124.21.96","192.168.1.93","TLSv1.3","1288","Application Data"
"115","7.129516362","159.124.21.96","192.168.1.93","TCP","2962","443  >  45230 [PSH, ACK] Seq=13741 Ack=6871 Win=64128 Len=2896 TSval=4109513991 TSecr=1495227947 [TCP PDU reassembled in 116]"
"116","7.129516384","159.124.21.96","192.168.1.93","TLSv1.3","2962","Application Data"
"117","7.129546758","192.168.1.93","159.124.21.96","TCP","66","45230  >  443 [ACK] Seq=6871 Ack=12519 Win=89856 Len=0 TSval=1495228067 TSecr=4109513986"
"118","7.130471021","192.168.1.93","159.124.21.96","TCP","66","45230  >  443 [ACK] Seq=6871 Ack=13741 Win=88704 Len=0 TSval=1495228068 TSecr=4109513989"
"119","7.130550921","192.168.1.93","159.124.21.96","TCP","66","45230  >  443 [ACK] Seq=6871 Ack=16637 Win=85888 Len=0 TSval=1495228068 TSecr=4109513991"
"120","7.130616291","192.168.1.93","159.124.21.96","TCP","66","45230  >  443 [ACK] Seq=6871 Ack=19533 Win=83072 Len=0 TSval=1495228068 TSecr=4109513998"
"121","7.137615412","159.124.21.96","192.168.1.93","TLSv1.3","2962","Application Data"
"122","7.137638424","192.168.1.93","159.124.21.96","TCP","66","45230  >  443 [ACK] Seq=6871 Ack=22429 Win=89856 Len=0 TSval=1495228075 TSecr=4109514004"
"123","7.142623074","159.124.21.96","192.168.1.93","TCP","2962","443  >  45230 [PSH, ACK] Seq=22429 Ack=6871 Win=64128 Len=2896 TSval=4109514010 TSecr=1495227947 [TCP PDU reassembled in 125]"
"124","7.142648654","192.168.1.93","159.124.21.96","TCP","66","45230  >  443 [ACK] Seq=6871 Ack=25325 Win=89856 Len=0 TSval=1495228080 TSecr=4109514010"
"125","7.151625447","159.124.21.96","192.168.1.93","TLSv1.3","2962","Application Data"
"126","7.151657889","192.168.1.93","159.124.21.96","TCP","66","45230  >  443 [ACK] Seq=6871 Ack=28221 Win=89856 Len=0 TSval=1495228089 TSecr=4109514016"
"127","7.154476512","159.124.21.96","192.168.1.93","TLSv1.3","2962","Application Data"
"128","7.154498986","192.168.1.93","159.124.21.96","TCP","66","45230  >  443 [ACK] Seq=6871 Ack=31117 Win=89856 Len=0 TSval=1495228092 TSecr=4109514022"
"129","7.161150903","159.124.21.96","192.168.1.93","TCP","2962","443  >  45230 [PSH, ACK] Seq=31117 Ack=6871 Win=64128 Len=2896 TSval=4109514029 TSecr=1495227947 [TCP PDU reassembled in 131]"
"130","7.161184833","192.168.1.93","159.124.21.96","TCP","66","45230  >  443 [ACK] Seq=6871 Ack=34013 Win=89856 Len=0 TSval=1495228098 TSecr=4109514029"
"131","7.172348750","159.124.21.96","192.168.1.93","TLSv1.3","1514","Application Data"
"132","7.172382376","192.168.1.93","159.124.21.96","TCP","66","45230  >  443 [ACK] Seq=6871 Ack=35461 Win=91136 Len=0 TSval=1495228110 TSecr=4109514039"
"133","7.211548118","159.124.21.96","192.168.1.93","TCP","2962","443  >  45230 [PSH, ACK] Seq=35461 Ack=6871 Win=64128 Len=2896 TSval=4109514073 TSecr=1495228067 [TCP PDU reassembled in 134]"
"134","7.211548463","159.124.21.96","192.168.1.93","TLSv1.3","2962","Application Data"
"135","7.211601357","192.168.1.93","159.124.21.96","TCP","66","45230  >  443 [ACK] Seq=6871 Ack=38357 Win=97024 Len=0 TSval=1495228149 TSecr=4109514073"
"136","7.211751854","192.168.1.93","159.124.21.96","TCP","66","45230  >  443 [ACK] Seq=6871 Ack=41253 Win=102784 Len=0 TSval=1495228149 TSecr=4109514076"
"137","7.217323775","159.124.21.96","192.168.1.93","TLSv1.3","2962","Application Data"
"138","7.217349098","192.168.1.93","159.124.21.96","TCP","66","45230  >  443 [ACK] Seq=6871 Ack=44149 Win=108544 Len=0 TSval=1495228154 TSecr=4109514082"
"139","7.219870595","159.124.21.96","192.168.1.93","TLSv1.3","2962","Application Data"
"140","7.219895744","192.168.1.93","159.124.21.96","TCP","66","45230  >  443 [ACK] Seq=6871 Ack=47045 Win=114304 Len=0 TSval=1495228157 TSecr=4109514089"
"141","7.227400816","159.124.21.96","192.168.1.93","TCP","2962","443  >  45230 [PSH, ACK] Seq=47045 Ack=6871 Win=64128 Len=2896 TSval=4109514095 TSecr=1495228075 [TCP PDU reassembled in 143]"
"142","7.227429453","192.168.1.93","159.124.21.96","TCP","66","45230  >  443 [ACK] Seq=6871 Ack=49941 Win=120192 Len=0 TSval=1495228165 TSecr=4109514095"
"143","7.232164124","159.124.21.96","192.168.1.93","TLSv1.3","2962","Application Data"
"144","7.232187929","192.168.1.93","159.124.21.96","TCP","66","45230  >  443 [ACK] Seq=6871 Ack=52837 Win=125952 Len=0 TSval=1495228169 TSecr=4109514101"
"145","7.238770095","159.124.21.96","192.168.1.93","TLSv1.3","2962","Application Data"
"146","7.238849148","192.168.1.93","159.124.21.96","TCP","66","45230  >  443 [ACK] Seq=6871 Ack=55733 Win=131712 Len=0 TSval=1495228176 TSecr=4109514107"
"147","7.252972661","159.124.21.96","192.168.1.93","TCP","2962","443  >  45230 [PSH, ACK] Seq=55733 Ack=6871 Win=64128 Len=2896 TSval=4109514113 TSecr=1495228092 [TCP PDU reassembled in 148]"
"148","7.252972962","159.124.21.96","192.168.1.93","TLSv1.3","2962","Application Data"
"149","7.253003035","192.168.1.93","159.124.21.96","TCP","66","45230  >  443 [ACK] Seq=6871 Ack=58629 Win=137472 Len=0 TSval=1495228190 TSecr=4109514113"
"150","7.253333923","192.168.1.93","159.124.21.96","TCP","66","45230  >  443 [ACK] Seq=6871 Ack=61525 Win=143360 Len=0 TSval=1495228190 TSecr=4109514119"
"151","7.259711711","159.124.21.96","192.168.1.93","TLSv1.3","2962","Application Data"
"152","7.259737122","192.168.1.93","159.124.21.96","TCP","66","45230  >  443 [ACK] Seq=6871 Ack=64421 Win=149120 Len=0 TSval=1495228197 TSecr=4109514124"
"153","7.260074290","159.124.21.96","192.168.1.93","TLSv1.3","2962","Application Data"
"154","7.260083660","192.168.1.93","159.124.21.96","TCP","66","45230  >  443 [ACK] Seq=6871 Ack=67317 Win=154880 Len=0 TSval=1495228197 TSecr=4109514130"
"155","7.263856944","159.124.21.96","192.168.1.93","TCP","2962","443  >  45230 [PSH, ACK] Seq=67317 Ack=6871 Win=64128 Len=2896 TSval=4109514133 TSecr=1495228110 [TCP PDU reassembled in 157]"
"156","7.263880775","192.168.1.93","159.124.21.96","TCP","66","45230  >  443 [ACK] Seq=6871 Ack=70213 Win=160640 Len=0 TSval=1495228201 TSecr=4109514133"
"157","7.265760227","159.124.21.96","192.168.1.93","TLSv1.3","2962","Application Data"
"158","7.265779114","192.168.1.93","159.124.21.96","TCP","66","45230  >  443 [ACK] Seq=6871 Ack=73109 Win=166528 Len=0 TSval=1495228203 TSecr=4109514136"
"159","7.269746866","159.124.21.96","192.168.1.93","TLSv1.3","2962","Application Data"
"160","7.269767356","192.168.1.93","159.124.21.96","TCP","66","45230  >  443 [ACK] Seq=6871 Ack=76005 Win=172288 Len=0 TSval=1495228207 TSecr=4109514139"
"161","7.277617885","159.124.21.96","192.168.1.93","TCP","2962","443  >  45230 [PSH, ACK] Seq=76005 Ack=6871 Win=64128 Len=2896 TSval=4109514142 TSecr=1495228110 [TCP PDU reassembled in 163]"
"162","7.277654091","192.168.1.93","159.124.21.96","TCP","66","45230  >  443 [ACK] Seq=6871 Ack=78901 Win=178048 Len=0 TSval=1495228215 TSecr=4109514142"
"163","7.288559331","159.124.21.96","192.168.1.93","TLSv1.3","2962","Application Data"
"164","7.288559814","159.124.21.96","192.168.1.93","TLSv1.3","2962","Application Data"
"165","7.288593984","192.168.1.93","159.124.21.96","TCP","66","45230  >  443 [ACK] Seq=6871 Ack=81797 Win=183808 Len=0 TSval=1495228226 TSecr=4109514155"
"166","7.291323390","192.168.1.93","159.124.21.96","TCP","66","45230  >  443 [ACK] Seq=6871 Ack=84693 Win=189696 Len=0 TSval=1495228228 TSecr=4109514156"
"167","7.292305254","159.124.21.96","192.168.1.93","TCP","2962","443  >  45230 [PSH, ACK] Seq=84693 Ack=6871 Win=64128 Len=2896 TSval=4109514159 TSecr=1495228149 [TCP PDU reassembled in 169]"
"168","7.292331923","192.168.1.93","159.124.21.96","TCP","66","45230  >  443 [ACK] Seq=6871 Ack=87589 Win=195456 Len=0 TSval=1495228229 TSecr=4109514159"
"169","7.294041751","159.124.21.96","192.168.1.93","TLSv1.3","2962","Application Data"
"170","7.294061781","192.168.1.93","159.124.21.96","TCP","66","45230  >  443 [ACK] Seq=6871 Ack=90485 Win=201216 Len=0 TSval=1495228231 TSecr=4109514162"
"171","7.296590557","159.124.21.96","192.168.1.93","TLSv1.3","2962","Application Data"
"172","7.296610302","192.168.1.93","159.124.21.96","TCP","66","45230  >  443 [ACK] Seq=6871 Ack=93381 Win=206976 Len=0 TSval=1495228234 TSecr=4109514165"
"173","7.299606449","159.124.21.96","192.168.1.93","TLSv1.3","2962","Application Data"
"174","7.299670987","192.168.1.93","159.124.21.96","TCP","66","45230  >  443 [ACK] Seq=6871 Ack=96277 Win=212864 Len=0 TSval=1495228237 TSecr=4109514168"
"175","7.303264803","159.124.21.96","192.168.1.93","TCP","2962","443  >  45230 [PSH, ACK] Seq=96277 Ack=6871 Win=64128 Len=2896 TSval=4109514171 TSecr=1495228157 [TCP PDU reassembled in 177]"
"176","7.303382461","192.168.1.93","159.124.21.96","TCP","66","45230  >  443 [ACK] Seq=6871 Ack=99173 Win=218624 Len=0 TSval=1495228240 TSecr=4109514171"
"177","7.305930023","159.124.21.96","192.168.1.93","TLSv1.3","2962","Application Data"
"178","7.306048785","192.168.1.93","159.124.21.96","TCP","66","45230  >  443 [ACK] Seq=6871 Ack=102069 Win=224384 Len=0 TSval=1495228243 TSecr=4109514174"
"179","7.307858469","159.124.21.96","192.168.1.93","TLSv1.3","2962","Application Data"
"180","7.307881418","192.168.1.93","159.124.21.96","TCP","66","45230  >  443 [ACK] Seq=6871 Ack=104965 Win=230144 Len=0 TSval=1495228245 TSecr=4109514177"
"181","7.310580858","159.124.21.96","192.168.1.93","TCP","2962","443  >  45230 [PSH, ACK] Seq=104965 Ack=6871 Win=64128 Len=2896 TSval=4109514180 TSecr=1495228165 [TCP PDU reassembled in 183]"
"182","7.310599751","192.168.1.93","159.124.21.96","TCP","66","45230  >  443 [ACK] Seq=6871 Ack=107861 Win=236032 Len=0 TSval=1495228248 TSecr=4109514180"
"183","7.313683641","159.124.21.96","192.168.1.93","TLSv1.3","2962","Application Data"
"184","7.313741472","192.168.1.93","159.124.21.96","TCP","66","45230  >  443 [ACK] Seq=6871 Ack=110757 Win=241792 Len=0 TSval=1495228251 TSecr=4109514183"
"185","7.315805222","159.124.21.96","192.168.1.93","TCP","1514","443  >  45230 [ACK] Seq=110757 Ack=6871 Win=64128 Len=1448 TSval=4109514186 TSecr=1495228169 [TCP PDU reassembled in 187]"
"186","7.315860657","192.168.1.93","159.124.21.96","TCP","66","45230  >  443 [ACK] Seq=6871 Ack=112205 Win=244736 Len=0 TSval=1495228253 TSecr=4109514186"
"187","7.317677954","159.124.21.96","192.168.1.93","TLSv1.3","2962","Application Data"
"188","7.317735908","192.168.1.93","159.124.21.96","TCP","66","45230  >  443 [ACK] Seq=6871 Ack=115101 Win=250496 Len=0 TSval=1495228255 TSecr=4109514187"
"189","7.321733231","159.124.21.96","192.168.1.93","TLSv1.3","2962","Application Data"
"190","7.321800622","192.168.1.93","159.124.21.96","TCP","66","45230  >  443 [ACK] Seq=6871 Ack=117997 Win=256256 Len=0 TSval=1495228259 TSecr=4109514190"
"191","7.324394167","159.124.21.96","192.168.1.93","TLSv1.3","2962","Application Data"
"192","7.324451168","192.168.1.93","159.124.21.96","TCP","66","45230  >  443 [ACK] Seq=6871 Ack=120893 Win=262016 Len=0 TSval=1495228262 TSecr=4109514193"
"193","7.327714623","159.124.21.96","192.168.1.93","TLSv1.3","2962","Application Data, Application Data"
"194","7.327765546","192.168.1.93","159.124.21.96","TCP","66","45230  >  443 [ACK] Seq=6871 Ack=123789 Win=267904 Len=0 TSval=1495228265 TSecr=4109514196"
"195","7.329584829","159.124.21.96","192.168.1.93","TLSv1.3","125","Application Data"
"196","7.329600874","192.168.1.93","159.124.21.96","TCP","66","45230  >  443 [ACK] Seq=6871 Ack=123848 Win=267904 Len=0 TSval=1495228267 TSecr=4109514199"
"197","7.535361823","159.124.21.96","192.168.1.93","DTLSv1.2","103","Application Data"
"198","7.539635465","192.168.1.93","159.124.21.96","DTLSv1.2","103","Application Data"
"199","7.609874455","159.124.21.96","192.168.1.93","DTLSv1.2","111","Application Data"
"200","7.618726082","192.168.1.93","159.124.21.96","STUN","194","Binding Request user: 6F4AA7FD-78DF-FCC4-F05B-958B6A09AE9D:4541BB66-D689-8DE7-07EF-2C88144219B5"
"201","7.660299362","159.124.21.96","192.168.1.93","DTLSv1.2","103","Application Data"
"202","7.661853776","192.168.1.93","159.124.21.96","DTLSv1.2","103","Application Data"
"203","7.692193856","159.124.21.96","192.168.1.93","STUN","106","Binding Success Response XOR-MAPPED-ADDRESS: 5.29.51.201:8466"
"204","7.830271688","192.168.1.93","159.124.21.96","DTLSv1.2","99","Application Data"
"205","8.140943083","192.168.1.93","159.124.21.96","TLSv1.3","163","Application Data"
"206","8.148561580","192.168.1.93","159.124.21.96","TLSv1.3","181","Application Data"
"207","8.158130698","192.168.1.93","159.124.21.96","TLSv1.3","143","Application Data"
"208","8.158828761","192.168.1.93","159.124.21.96","TLSv1.3","233","Application Data"
"209","8.214239486","159.124.21.96","192.168.1.93","TCP","66","443  >  45230 [ACK] Seq=123848 Ack=6968 Win=64128 Len=0 TSval=4109515083 TSecr=1495229078"
"210","8.220240646","159.124.21.96","192.168.1.93","TCP","66","443  >  45230 [ACK] Seq=123848 Ack=7083 Win=64128 Len=0 TSval=4109515091 TSecr=1495229086"
"211","8.225835086","192.168.1.93","159.124.21.96","TLSv1.3","96","Application Data"
"212","8.228106297","192.168.1.93","159.124.21.96","TLSv1.3","2115","Application Data"
"213","8.230267633","159.124.21.96","192.168.1.93","TCP","66","443  >  45230 [ACK] Seq=123848 Ack=7160 Win=64128 Len=0 TSval=4109515101 TSecr=1495229095"
"214","8.232328326","159.124.21.96","192.168.1.93","TCP","66","443  >  45230 [ACK] Seq=123848 Ack=7327 Win=64128 Len=0 TSval=4109515101 TSecr=1495229096"
"215","8.243286144","192.168.1.93","159.124.21.96","TLSv1.3","96","Application Data"
"216","8.243640704","192.168.1.93","159.124.21.96","TLSv1.3","1320","Application Data"
"217","8.243897933","192.168.1.93","159.124.21.96","TLSv1.3","225","Application Data"
"218","8.244138167","192.168.1.93","159.124.21.96","TLSv1.3","225","Application Data"
"219","8.298345814","159.124.21.96","192.168.1.93","TCP","66","443  >  45230 [ACK] Seq=123848 Ack=7357 Win=64128 Len=0 TSval=4109515169 TSecr=1495229163"
"220","8.301092123","159.124.21.96","192.168.1.93","TCP","66","443  >  45230 [ACK] Seq=123848 Ack=8805 Win=64128 Len=0 TSval=4109515171 TSecr=1495229165"
"221","8.301092166","159.124.21.96","192.168.1.93","TCP","66","443  >  45230 [ACK] Seq=123848 Ack=9406 Win=63616 Len=0 TSval=4109515171 TSecr=1495229165"
"222","8.318721946","159.124.21.96","192.168.1.93","TCP","66","443  >  45230 [ACK] Seq=123848 Ack=9436 Win=64128 Len=0 TSval=4109515185 TSecr=1495229180"
"223","8.331026278","159.124.21.96","192.168.1.93","TCP","66","443  >  45230 [ACK] Seq=123848 Ack=10690 Win=64128 Len=0 TSval=4109515187 TSecr=1495229181"
"224","8.331026646","159.124.21.96","192.168.1.93","TCP","66","443  >  45230 [ACK] Seq=123848 Ack=10849 Win=64128 Len=0 TSval=4109515187 TSecr=1495229181"
"225","8.331026688","159.124.21.96","192.168.1.93","TCP","66","443  >  45230 [ACK] Seq=123848 Ack=11008 Win=64000 Len=0 TSval=4109515187 TSecr=1495229181"
"226","9.398347131","192.168.1.93","159.124.21.96","TLSv1.3","802","Application Data"
"227","9.400271884","192.168.1.93","159.124.21.96","TLSv1.3","189","Application Data"
"228","9.473316141","159.124.21.96","192.168.1.93","TCP","66","443  >  45230 [ACK] Seq=123848 Ack=11744 Win=64128 Len=0 TSval=4109516343 TSecr=1495230335"
"229","9.475746648","159.124.21.96","192.168.1.93","TCP","66","443  >  45230 [ACK] Seq=123848 Ack=11867 Win=64128 Len=0 TSval=4109516345 TSecr=1495230337"
"230","9.880903716","192.168.1.93","159.124.21.96","TLSv1.3","189","Application Data"
"231","9.963086983","159.124.21.96","192.168.1.93","TCP","66","443  >  45230 [ACK] Seq=123848 Ack=11990 Win=64128 Len=0 TSval=4109516825 TSecr=1495230818"
"232","10.539702717","159.124.21.96","192.168.1.93","DTLSv1.2","103","Application Data"
"233","10.541013992","192.168.1.93","159.124.21.96","DTLSv1.2","103","Application Data"
"234","10.611517938","159.124.21.96","192.168.1.93","DTLSv1.2","111","Application Data"
"235","10.658713407","159.124.21.96","192.168.1.93","DTLSv1.2","103","Application Data"
"236","10.697859629","192.168.1.93","159.124.21.96","DTLSv1.2","103","Application Data"
"237","10.871659090","192.168.1.93","159.124.21.96","DTLSv1.2","99","Application Data"
"238","11.737847414","159.124.21.96","192.168.1.93","TLSv1.3","106","Application Data"
"239","11.737908579","192.168.1.93","159.124.21.96","TCP","66","45230  >  443 [ACK] Seq=11990 Ack=123888 Win=267904 Len=0 TSval=1495232675 TSecr=4109518607"
"240","11.755330994","192.168.1.93","159.124.21.96","TLSv1.3","110","Application Data"
"241","11.832926250","159.124.21.96","192.168.1.93","TCP","66","443  >  45230 [ACK] Seq=123888 Ack=12034 Win=64128 Len=0 TSval=4109518699 TSecr=1495232692"
"242","12.053607699","192.168.1.93","159.124.21.96","STUN","194","Binding Request user: 4D4E1327-1ADF-8C9D-33B1-B59FB236C0B7:4541BB66-D689-8DE7-07EF-2C88144219B5"
"243","12.122161773","159.124.21.96","192.168.1.93","STUN","106","Binding Success Response XOR-MAPPED-ADDRESS: 5.29.51.201:8466"
"244","12.549013422","159.124.21.96","192.168.1.93","TLSv1.3","151","Application Data"
"245","12.590270905","192.168.1.93","159.124.21.96","TCP","66","45230  >  443 [ACK] Seq=12034 Ack=123973 Win=267904 Len=0 TSval=1495233527 TSecr=4109519418"
"246","13.539466413","159.124.21.96","192.168.1.93","DTLSv1.2","103","Application Data"
"247","13.539819764","192.168.1.93","159.124.21.96","DTLSv1.2","103","Application Data"
"248","13.609934936","159.124.21.96","192.168.1.93","DTLSv1.2","111","Application Data"
"249","13.663826350","159.124.21.96","192.168.1.93","DTLSv1.2","103","Application Data"
"250","13.664417950","192.168.1.93","159.124.21.96","DTLSv1.2","103","Application Data"
"251","13.815979862","192.168.1.93","159.124.21.96","DTLSv1.2","99","Application Data"
"252","14.054511828","192.168.1.93","159.124.21.96","STUN","194","Binding Request user: 6F4AA7FD-78DF-FCC4-F05B-958B6A09AE9D:4541BB66-D689-8DE7-07EF-2C88144219B5"
"253","14.126523786","159.124.21.96","192.168.1.93","STUN","106","Binding Success Response XOR-MAPPED-ADDRESS: 5.29.51.201:8466"
"254","14.933835016","192.168.1.93","159.124.21.96","TLSv1.3","192","Application Data"
"255","14.939179118","192.168.1.93","159.124.21.96","TLSv1.3","188","Application Data"
"256","15.021258186","159.124.21.96","192.168.1.93","TCP","66","443  >  45230 [ACK] Seq=123973 Ack=12160 Win=64128 Len=0 TSval=4109521880 TSecr=1495235871"
"257","15.021258481","159.124.21.96","192.168.1.93","TCP","66","443  >  45230 [ACK] Seq=123973 Ack=12282 Win=64128 Len=0 TSval=4109521881 TSecr=1495235876"
"258","16.467643076","192.168.1.93","159.124.21.96","STUN","194","Binding Request user: 4D4E1327-1ADF-8C9D-33B1-B59FB236C0B7:4541BB66-D689-8DE7-07EF-2C88144219B5"
"259","16.536323463","159.124.21.96","192.168.1.93","STUN","106","Binding Success Response XOR-MAPPED-ADDRESS: 5.29.51.201:8466"
"260","16.540620144","159.124.21.96","192.168.1.93","DTLSv1.2","103","Application Data"
"261","16.541797302","192.168.1.93","159.124.21.96","DTLSv1.2","103","Application Data"
"262","16.611060052","159.124.21.96","192.168.1.93","DTLSv1.2","111","Application Data"
"263","16.676407499","159.124.21.96","192.168.1.93","DTLSv1.2","103","Application Data"
"264","16.682907988","192.168.1.93","159.124.21.96","DTLSv1.2","103","Application Data"
"265","16.863799305","192.168.1.93","159.124.21.96","DTLSv1.2","99","Application Data"
"266","17.733402155","159.124.21.96","192.168.1.93","TLSv1.3","106","Application Data"
"267","17.733566423","192.168.1.93","159.124.21.96","TCP","66","45230  >  443 [ACK] Seq=12282 Ack=124013 Win=267904 Len=0 TSval=1495238671 TSecr=4109524604"
"268","17.733750080","192.168.1.93","159.124.21.96","TLSv1.3","110","Application Data"
"269","17.808577915","159.124.21.96","192.168.1.93","TCP","66","443  >  45230 [ACK] Seq=124013 Ack=12326 Win=64128 Len=0 TSval=4109524677 TSecr=1495238671"
"270","18.921582777","192.168.1.93","159.124.21.96","STUN","194","Binding Request user: 6F4AA7FD-78DF-FCC4-F05B-958B6A09AE9D:4541BB66-D689-8DE7-07EF-2C88144219B5"
"271","19.003348600","159.124.21.96","192.168.1.93","STUN","106","Binding Success Response XOR-MAPPED-ADDRESS: 5.29.51.201:8466"
"272","19.543671059","159.124.21.96","192.168.1.93","DTLSv1.2","103","Application Data"
"273","19.544988913","192.168.1.93","159.124.21.96","DTLSv1.2","103","Application Data"
"274","19.613610336","159.124.21.96","192.168.1.93","DTLSv1.2","111","Application Data"
"275","19.651507475","159.124.21.96","192.168.1.93","TLSv1.3","186","Application Data"
"276","19.667729453","159.124.21.96","192.168.1.93","DTLSv1.2","103","Application Data"
"277","19.669554625","192.168.1.93","159.124.21.96","DTLSv1.2","103","Application Data"
"278","19.699013487","192.168.1.93","159.124.21.96","TCP","66","45230  >  443 [ACK] Seq=12326 Ack=124133 Win=267904 Len=0 TSval=1495240636 TSecr=4109526521"
"279","19.830575622","192.168.1.93","159.124.21.96","DTLSv1.2","99","Application Data"
"280","20.223355464","192.168.1.93","159.124.21.96","TLSv1.3","937","Application Data"
"281","20.300184259","159.124.21.96","192.168.1.93","TCP","66","443  >  45230 [ACK] Seq=124133 Ack=13197 Win=64128 Len=0 TSval=4109527170 TSecr=1495241160"
"282","20.995087080","192.168.1.93","159.124.21.96","STUN","194","Binding Request user: 4D4E1327-1ADF-8C9D-33B1-B59FB236C0B7:4541BB66-D689-8DE7-07EF-2C88144219B5"
"283","21.064805554","159.124.21.96","192.168.1.93","STUN","106","Binding Success Response XOR-MAPPED-ADDRESS: 5.29.51.201:8466"
"284","21.656503617","159.124.21.96","192.168.1.93","TLSv1.3","125","Application Data"
"285","21.656530530","192.168.1.93","159.124.21.96","TCP","66","45230  >  443 [ACK] Seq=13197 Ack=124192 Win=267904 Len=0 TSval=1495242594 TSecr=4109528524"
"286","22.105464768","192.168.1.93","159.124.21.96","TCP","74","45806  >  443 [SYN] Seq=0 Win=64240 Len=0 MSS=1460 SACK_PERM TSval=1495243043 TSecr=0 WS=128"
"287","22.182905672","159.124.21.96","192.168.1.93","TCP","74","443  >  45806 [SYN, ACK] Seq=0 Ack=1 Win=65160 Len=0 MSS=1460 SACK_PERM TSval=4109529049 TSecr=1495243043 WS=128"
"288","22.182935602","192.168.1.93","159.124.21.96","TCP","66","45806  >  443 [ACK] Seq=1 Ack=1 Win=64256 Len=0 TSval=1495243120 TSecr=4109529049"
"289","22.185050513","192.168.1.93","159.124.21.96","TLSv1.3","583","Client Hello (SNI=zoomams1591242196rwg.ams.zoom.us)"
"290","22.262704154","159.124.21.96","192.168.1.93","TCP","66","443  >  45806 [ACK] Seq=1 Ack=518 Win=64768 Len=0 TSval=4109529129 TSecr=1495243122"
"291","22.264644053","159.124.21.96","192.168.1.93","TLSv1.3","326","Server Hello, Change Cipher Spec, Application Data, Application Data"
"292","22.264663519","192.168.1.93","159.124.21.96","TCP","66","45806  >  443 [ACK] Seq=518 Ack=261 Win=64128 Len=0 TSval=1495243202 TSecr=4109529131"
"293","22.265240927","192.168.1.93","159.124.21.96","TLSv1.3","146","Change Cipher Spec, Application Data"
"294","22.265894851","192.168.1.93","159.124.21.96","TCP","2962","45806  >  443 [PSH, ACK] Seq=598 Ack=261 Win=64128 Len=2896 TSval=1495243203 TSecr=4109529131 [TCP PDU reassembled in 295]"
"295","22.266146704","192.168.1.93","159.124.21.96","TLSv1.3","1172","Application Data"
"296","22.340205101","159.124.21.96","192.168.1.93","TLSv1.3","145","Application Data"
"297","22.345204522","159.124.21.96","192.168.1.93","TCP","66","443  >  45806 [ACK] Seq=340 Ack=3494 Win=64128 Len=0 TSval=4109529211 TSecr=1495243203"
"298","22.381008553","192.168.1.93","159.124.21.96","TCP","66","45806  >  443 [ACK] Seq=4600 Ack=340 Win=64128 Len=0 TSval=1495243318 TSecr=4109529208"
"299","22.386200188","159.124.21.96","192.168.1.93","TCP","66","443  >  45806 [ACK] Seq=340 Ack=4600 Win=64128 Len=0 TSval=4109529254 TSecr=1495243203"
"300","22.390371237","159.124.21.96","192.168.1.93","TLSv1.3","533","Application Data"
"301","22.390394407","192.168.1.93","159.124.21.96","TCP","66","45806  >  443 [ACK] Seq=4600 Ack=807 Win=64128 Len=0 TSval=1495243328 TSecr=4109529258"
"302","22.392232046","159.124.21.96","192.168.1.93","TLSv1.3","236","Application Data"
"303","22.392254789","192.168.1.93","159.124.21.96","TCP","66","45806  >  443 [ACK] Seq=4600 Ack=977 Win=64128 Len=0 TSval=1495243329 TSecr=4109529258"
"304","22.395834193","192.168.1.93","159.124.21.96","TCP","74","45810  >  443 [SYN] Seq=0 Win=64240 Len=0 MSS=1460 SACK_PERM TSval=1495243333 TSecr=0 WS=128"
"305","22.465447459","159.124.21.96","192.168.1.93","TCP","74","443  >  45810 [SYN, ACK] Seq=0 Ack=1 Win=65160 Len=0 MSS=1460 SACK_PERM TSval=4109529335 TSecr=1495243333 WS=128"
"306","22.465666064","192.168.1.93","159.124.21.96","TCP","66","45810  >  443 [ACK] Seq=1 Ack=1 Win=64256 Len=0 TSval=1495243403 TSecr=4109529335"
"307","22.467371359","192.168.1.93","159.124.21.96","TLSv1.3","583","Client Hello (SNI=zoomams1591242196rwg.ams.zoom.us)"
"308","22.536427341","159.124.21.96","192.168.1.93","TCP","66","443  >  45810 [ACK] Seq=1 Ack=518 Win=64768 Len=0 TSval=4109529406 TSecr=1495243405"
"309","22.536427631","159.124.21.96","192.168.1.93","TLSv1.3","326","Server Hello, Change Cipher Spec, Application Data, Application Data"
"310","22.536508539","192.168.1.93","159.124.21.96","TCP","66","45810  >  443 [ACK] Seq=518 Ack=261 Win=64128 Len=0 TSval=1495243474 TSecr=4109529408"
"311","22.537222287","192.168.1.93","159.124.21.96","TLSv1.3","146","Change Cipher Spec, Application Data"
"312","22.537775660","192.168.1.93","159.124.21.96","TCP","2962","45810  >  443 [PSH, ACK] Seq=598 Ack=261 Win=64128 Len=2896 TSval=1495243475 TSecr=4109529408 [TCP PDU reassembled in 313]"
"313","22.537855787","192.168.1.93","159.124.21.96","TLSv1.3","1172","Application Data"
"314","22.544317229","159.124.21.96","192.168.1.93","DTLSv1.2","103","Application Data"
"315","22.545518766","192.168.1.93","159.124.21.96","DTLSv1.2","103","Application Data"
"316","22.604791821","159.124.21.96","192.168.1.93","TCP","66","443  >  45810 [ACK] Seq=261 Ack=2046 Win=64128 Len=0 TSval=4109529476 TSecr=1495243474"
"317","22.604792117","159.124.21.96","192.168.1.93","TLSv1.3","145","Application Data"
"318","22.608741066","159.124.21.96","192.168.1.93","TCP","66","443  >  45810 [ACK] Seq=340 Ack=4600 Win=64128 Len=0 TSval=4109529479 TSecr=1495243475"
"319","22.614871904","159.124.21.96","192.168.1.93","DTLSv1.2","111","Application Data"
"320","22.643947953","159.124.21.96","192.168.1.93","DTLSv1.2","1131","Application Data"
"321","22.645194526","192.168.1.93","159.124.21.96","DTLSv1.2","99","Application Data"
"322","22.645657493","192.168.1.93","159.124.21.96","TCP","66","45810  >  443 [ACK] Seq=4600 Ack=340 Win=64128 Len=0 TSval=1495243583 TSecr=4109529477"
"323","22.654327808","159.124.21.96","192.168.1.93","DTLSv1.2","1131","Application Data"
"324","22.659852657","159.124.21.96","192.168.1.93","TLSv1.3","533","Application Data"
"325","22.659853017","159.124.21.96","192.168.1.93","TLSv1.3","271","Application Data"
"326","22.659940202","192.168.1.93","159.124.21.96","TCP","66","45810  >  443 [ACK] Seq=4600 Ack=807 Win=64128 Len=0 TSval=1495243597 TSecr=4109529530"
"327","22.660134049","192.168.1.93","159.124.21.96","TCP","66","45810  >  443 [ACK] Seq=4600 Ack=1012 Win=64128 Len=0 TSval=1495243597 TSecr=4109529530"
