"No.","Time","Source","Destination","Protocol","Length","Info"
"1","0.000000000","2a0d:6fc7:213:782a::a3","fe80::20c:29ff:fe2c:8247","ICMPv6","78","Neighbor Advertisement 2a0d:6fc7:213:782a::a3 (rtr, sol)"
"2","0.000097799","2a0d:6fc7:213:782a:39d4:d935:834:ddaa","fe80::18b5:cff:feee:8145","ICMPv6","78","Neighbor Advertisement 2a0d:6fc7:213:782a:39d4:d935:834:ddaa (sol)"
"3","0.173667277","2a0d:6fc7:213:782a:39d4:d935:834:ddaa","2a00:1450:4028:806::200e","TCP","1374","38082  >  443 [ACK] Seq=1 Ack=1 Win=3576 Len=1288 TSval=1036660598 TSecr=598789142 [TCP PDU reassembled in 6]"
"4","0.173685777","2a0d:6fc7:213:782a:39d4:d935:834:ddaa","2a00:1450:4028:806::200e","TCP","1374","38082  >  443 [PSH, ACK] Seq=1289 Ack=1 Win=3576 Len=1288 TSval=1036660598 TSecr=598789142 [TCP PDU reassembled in 6]"
"5","0.426645453","2a0d:6fc7:213:782a:39d4:d935:834:ddaa","2a00:1450:4028:806::200e","TCP","1374","38082  >  443 [ACK] Seq=2577 Ack=1 Win=3576 Len=1288 TSval=1036660598 TSecr=598789142 [TCP PDU reassembled in 6]"
"6","0.426665953","2a0d:6fc7:213:782a:39d4:d935:834:ddaa","2a00:1450:4028:806::200e","TLSv1.2","913","Application Data"
"7","0.429702808","2a0d:6fc7:213:782a:39d4:d935:834:ddaa","2a00:1450:4028:806::200e","TCP","1374","38082  >  443 [ACK] Seq=4692 Ack=1 Win=3576 Len=1288 TSval=1036660854 TSecr=598789142 [TCP PDU reassembled in 9]"
"8","0.429718807","2a0d:6fc7:213:782a:39d4:d935:834:ddaa","2a00:1450:4028:806::200e","TCP","1374","38082  >  443 [PSH, ACK] Seq=5980 Ack=1 Win=3576 Len=1288 TSval=1036660854 TSecr=598789142 [TCP PDU reassembled in 9]"
"9","0.429920104","2a0d:6fc7:213:782a:39d4:d935:834:ddaa","2a00:1450:4028:806::200e","TLSv1.2","879","Application Data"
"10","0.434804430","2a0d:6fc7:213:782a:39d4:d935:834:ddaa","2a00:1450:4028:804::2016","TLSv1.2","255","Application Data"
"11","0.513687438","2a00:1450:4028:806::200e","2a0d:6fc7:213:782a:39d4:d935:834:ddaa","TCP","86","443  >  38082 [ACK] Seq=1 Ack=2577 Win=733 Len=0 TSval=598790927 TSecr=1036660598"
"12","0.513696538","2a00:1450:4028:806::200e","2a0d:6fc7:213:782a:39d4:d935:834:ddaa","TCP","98","[TCP Dup ACK 11#1] 443  >  38082 [ACK] Seq=1 Ack=2577 Win=733 Len=0 TSval=598790927 TSecr=1036660598 SLE=3865 SRE=4692"
"13","0.513704438","2a00:1450:4028:806::200e","2a0d:6fc7:213:782a:39d4:d935:834:ddaa","TCP","86","443  >  38082 [ACK] Seq=1 Ack=4692 Win=725 Len=0 TSval=598790927 TSecr=1036660598"
"14","0.513711738","2a00:1450:4028:806::200e","2a0d:6fc7:213:782a:39d4:d935:834:ddaa","TCP","86","443  >  38082 [ACK] Seq=1 Ack=8061 Win=712 Len=0 TSval=598790927 TSecr=1036660854"
"15","0.513720138","2a00:1450:4028:804::2016","2a0d:6fc7:213:782a:39d4:d935:834:ddaa","TCP","86","443  >  44958 [ACK] Seq=1 Ack=170 Win=1045 Len=0 TSval=3733132363 TSecr=2802020554"
"16","0.513728138","2a00:1450:4028:804::2016","2a0d:6fc7:213:782a:39d4:d935:834:ddaa","TLSv1.2","190","Application Data"
"17","0.513736038","2a00:1450:4028:804::2016","2a0d:6fc7:213:782a:39d4:d935:834:ddaa","TLSv1.2","1294","Application Data"
"18","0.513743837","2a00:1450:4028:804::2016","2a0d:6fc7:213:782a:39d4:d935:834:ddaa","TLSv1.2","1294","Application Data"
"19","0.513953234","2a0d:6fc7:213:782a:39d4:d935:834:ddaa","2a00:1450:4028:804::2016","TCP","86","44958  >  443 [ACK] Seq=170 Ack=1313 Win=1886 Len=0 TSval=2802020633 TSecr=3733132364"
"20","0.514320529","2a00:1450:4028:804::2016","2a0d:6fc7:213:782a:39d4:d935:834:ddaa","TLSv1.2","2373","Application Data, Application Data"
"21","0.514348829","2a0d:6fc7:213:782a:39d4:d935:834:ddaa","2a00:1450:4028:804::2016","TCP","86","44958  >  443 [ACK] Seq=170 Ack=4808 Win=1903 Len=0 TSval=2802020633 TSecr=3733132366"
"22","0.821190991","2a0d:6fc7:213:782a:39d4:d935:834:ddaa","2a00:1450:4028:80a::2006","TCP","86","45704  >  443 [ACK] Seq=1 Ack=1 Win=249 Len=0 TSval=1712542679 TSecr=1261072371"
"23","0.821627784","2a00:1450:4028:806::200e","2a0d:6fc7:213:782a:39d4:d935:834:ddaa","TLSv1.2","156","Application Data"
"24","0.821635284","2a00:1450:4028:804::2016","2a0d:6fc7:213:782a:39d4:d935:834:ddaa","TLSv1.2","125","Application Data"
"25","0.821642584","2a00:1450:4028:806::200e","2a0d:6fc7:213:782a:39d4:d935:834:ddaa","TLSv1.2","117","Application Data"
"26","0.821650084","2a00:1450:4028:806::200e","2a0d:6fc7:213:782a:39d4:d935:834:ddaa","TLSv1.2","125","Application Data"
"27","0.821656584","2a00:1450:4028:806::200e","2a0d:6fc7:213:782a:39d4:d935:834:ddaa","TLSv1.2","156","Application Data"
"28","0.821663884","2a00:1450:4028:806::200e","2a0d:6fc7:213:782a:39d4:d935:834:ddaa","TLSv1.2","117","Application Data"
"29","0.821744682","2a0d:6fc7:213:782a:39d4:d935:834:ddaa","2a00:1450:4028:806::200e","TCP","86","38082  >  443 [ACK] Seq=8061 Ack=71 Win=3576 Len=0 TSval=1036661246 TSecr=598790995"
"30","0.821871881","2a0d:6fc7:213:782a:39d4:d935:834:ddaa","2a00:1450:4028:806::200e","TCP","86","38082  >  443 [ACK] Seq=8061 Ack=102 Win=3576 Len=0 TSval=1036661246 TSecr=598790995"
"31","0.821929880","2a0d:6fc7:213:782a:39d4:d935:834:ddaa","2a00:1450:4028:806::200e","TCP","86","38082  >  443 [ACK] Seq=8061 Ack=141 Win=3576 Len=0 TSval=1036661246 TSecr=598790996"
"32","0.821976879","2a0d:6fc7:213:782a:39d4:d935:834:ddaa","2a00:1450:4028:806::200e","TCP","86","38082  >  443 [ACK] Seq=8061 Ack=211 Win=3576 Len=0 TSval=1036661246 TSecr=598790996"
"33","0.822021878","2a0d:6fc7:213:782a:39d4:d935:834:ddaa","2a00:1450:4028:806::200e","TCP","86","38082  >  443 [ACK] Seq=8061 Ack=242 Win=3576 Len=0 TSval=1036661246 TSecr=598790996"
"34","0.827020403","2a0d:6fc7:213:782a:39d4:d935:834:ddaa","2a00:1450:4028:806::200e","TLSv1.2","125","Application Data"
"35","0.834119396","2a0d:6fc7:213:782a:39d4:d935:834:ddaa","2a00:1450:4028:804::2016","TLSv1.2","125","Application Data"
"36","0.837435945","2a00:1450:4028:806::200e","2a0d:6fc7:213:782a:39d4:d935:834:ddaa","TCP","117","[TCP Spurious Retransmission] 443  >  38082 [PSH, ACK] Seq=211 Ack=8061 Win=712 Len=31 TSval=598791219 TSecr=1036660854"
"37","0.837548244","2a0d:6fc7:213:782a:39d4:d935:834:ddaa","2a00:1450:4028:806::200e","TCP","98","[TCP Dup ACK 33#1] 38082  >  443 [ACK] Seq=8100 Ack=242 Win=3576 Len=0 TSval=1036661261 TSecr=598791219 SLE=211 SRE=242"
"38","0.868661274","2a00:1450:4028:80a::2006","2a0d:6fc7:213:782a:39d4:d935:834:ddaa","TCP","86","[TCP ACKed unseen segment] 443  >  45704 [ACK] Seq=1 Ack=2 Win=1045 Len=0 TSval=1261117482 TSecr=1712406622"
"39","0.874860079","2a00:1450:4028:806::200e","2a0d:6fc7:213:782a:39d4:d935:834:ddaa","TCP","86","443  >  38082 [ACK] Seq=242 Ack=8100 Win=712 Len=0 TSval=598791290 TSecr=1036661251"
"40","0.879894404","2a00:1450:4028:804::2016","2a0d:6fc7:213:782a:39d4:d935:834:ddaa","TCP","86","443  >  44958 [ACK] Seq=4847 Ack=209 Win=1045 Len=0 TSval=3733132731 TSecr=2802020953"
"41","1.808379270","2a0d:6fc7:213:782a:39d4:d935:834:ddaa","2a00:1450:4028:806::200e","TCP","1374","38082  >  443 [ACK] Seq=8100 Ack=242 Win=3576 Len=1288 TSval=1036662232 TSecr=598791290 [TCP PDU reassembled in 43]"
"42","1.808402070","2a0d:6fc7:213:782a:39d4:d935:834:ddaa","2a00:1450:4028:806::200e","TCP","1374","38082  >  443 [PSH, ACK] Seq=9388 Ack=242 Win=3576 Len=1288 TSval=1036662232 TSecr=598791290 [TCP PDU reassembled in 43]"
"43","2.078250392","2a0d:6fc7:213:782a:39d4:d935:834:ddaa","2a00:1450:4028:806::200e","TLSv1.2","1135","Application Data"
"44","2.082915921","2a0d:6fc7:213:782a:39d4:d935:834:ddaa","2a00:1450:4028:806::200e","TCP","1374","38082  >  443 [ACK] Seq=11725 Ack=242 Win=3576 Len=1288 TSval=1036662507 TSecr=598791290 [TCP PDU reassembled in 45]"
"45","2.082933521","2a0d:6fc7:213:782a:39d4:d935:834:ddaa","2a00:1450:4028:806::200e","TLSv1.2","1368","Application Data"
"46","2.120956446","2a0d:6fc7:213:782a:39d4:d935:834:ddaa","2a00:1450:4028:804::200e","TLSv1.2","391","Application Data"
"47","2.121444140","2a0d:6fc7:213:782a:39d4:d935:834:ddaa","2a00:1450:4028:804::200e","TLSv1.2","125","Application Data"
"48","2.121837733","2a0d:6fc7:213:782a:39d4:d935:834:ddaa","2a00:1450:4028:804::200e","TCP","1374","57164  >  443 [ACK] Seq=345 Ack=1 Win=249 Len=1288 TSval=2360607967 TSecr=2492259838 [TCP PDU reassembled in 49]"
"49","2.121858033","2a0d:6fc7:213:782a:39d4:d935:834:ddaa","2a00:1450:4028:804::200e","TLSv1.2","633","Application Data"
"50","2.133669254","2a00:1450:4028:806::200e","2a0d:6fc7:213:782a:39d4:d935:834:ddaa","TCP","86","443  >  38082 [ACK] Seq=242 Ack=9388 Win=707 Len=0 TSval=598792544 TSecr=1036662232"
"51","2.134143947","2a00:1450:4028:806::200e","2a0d:6fc7:213:782a:39d4:d935:834:ddaa","TCP","86","443  >  38082 [ACK] Seq=242 Ack=10676 Win=702 Len=0 TSval=598792544 TSecr=1036662232"
"52","2.136747508","2a00:1450:4028:806::200e","2a0d:6fc7:213:782a:39d4:d935:834:ddaa","TCP","86","443  >  38082 [ACK] Seq=242 Ack=11725 Win=698 Len=0 TSval=598792544 TSecr=1036662232"
"53","2.136753408","2a00:1450:4028:806::200e","2a0d:6fc7:213:782a:39d4:d935:834:ddaa","TCP","86","443  >  38082 [ACK] Seq=242 Ack=14295 Win=688 Len=0 TSval=598792544 TSecr=1036662507"
"54","2.166631057","2a00:1450:4028:804::200e","2a0d:6fc7:213:782a:39d4:d935:834:ddaa","TCP","86","443  >  57164 [ACK] Seq=1 Ack=345 Win=1021 Len=0 TSval=2492277206 TSecr=2360607966"
"55","2.166638657","2a00:1450:4028:804::200e","2a0d:6fc7:213:782a:39d4:d935:834:ddaa","TCP","98","[TCP Dup ACK 54#1] 443  >  57164 [ACK] Seq=1 Ack=345 Win=1021 Len=0 TSval=2492277207 TSecr=2360607966 SLE=1633 SRE=2180"
"56","2.166646656","2a00:1450:4028:804::200e","2a0d:6fc7:213:782a:39d4:d935:834:ddaa","TCP","86","443  >  57164 [ACK] Seq=1 Ack=2180 Win=1014 Len=0 TSval=2492277207 TSecr=2360607967"
"57","2.167322646","2a00:1450:4028:804::200e","2a0d:6fc7:213:782a:39d4:d935:834:ddaa","TLSv1.2","125","Application Data"
"58","2.214627131","2a0d:6fc7:213:782a:39d4:d935:834:ddaa","2a00:1450:4028:804::200e","TCP","86","57164  >  443 [ACK] Seq=2180 Ack=40 Win=249 Len=0 TSval=2360608060 TSecr=2492277207"
"59","2.452754833","2a00:1450:4028:806::200e","2a0d:6fc7:213:782a:39d4:d935:834:ddaa","TLSv1.2","158","Application Data"
"60","2.452760633","2a00:1450:4028:806::200e","2a0d:6fc7:213:782a:39d4:d935:834:ddaa","TLSv1.2","117","Application Data"
"61","2.452766232","2a00:1450:4028:806::200e","2a0d:6fc7:213:782a:39d4:d935:834:ddaa","TLSv1.2","125","Application Data"
"62","2.452771832","2a00:1450:4028:804::200e","2a0d:6fc7:213:782a:39d4:d935:834:ddaa","TLSv1.2","341","Application Data"
"63","2.452777332","2a00:1450:4028:804::200e","2a0d:6fc7:213:782a:39d4:d935:834:ddaa","TLSv1.2","479","Application Data"
"64","2.452782832","2a00:1450:4028:804::200e","2a0d:6fc7:213:782a:39d4:d935:834:ddaa","TLSv1.2","117","Application Data"
"65","2.452788432","2a00:1450:4028:804::200e","2a0d:6fc7:213:782a:39d4:d935:834:ddaa","TLSv1.2","125","Application Data"
"66","2.452861431","2a0d:6fc7:213:782a:39d4:d935:834:ddaa","2a00:1450:4028:806::200e","TCP","86","38082  >  443 [ACK] Seq=14295 Ack=314 Win=3576 Len=0 TSval=1036662877 TSecr=598792619"
"67","2.452944430","2a0d:6fc7:213:782a:39d4:d935:834:ddaa","2a00:1450:4028:806::200e","TCP","86","38082  >  443 [ACK] Seq=14295 Ack=345 Win=3576 Len=0 TSval=1036662877 TSecr=598792619"
"68","2.452983029","2a0d:6fc7:213:782a:39d4:d935:834:ddaa","2a00:1450:4028:806::200e","TCP","86","38082  >  443 [ACK] Seq=14295 Ack=384 Win=3576 Len=0 TSval=1036662877 TSecr=598792619"
"69","2.453017929","2a0d:6fc7:213:782a:39d4:d935:834:ddaa","2a00:1450:4028:804::200e","TCP","86","57164  >  443 [ACK] Seq=2180 Ack=295 Win=249 Len=0 TSval=2360608298 TSecr=2492277271"
"70","2.453051228","2a0d:6fc7:213:782a:39d4:d935:834:ddaa","2a00:1450:4028:804::200e","TCP","86","57164  >  443 [ACK] Seq=2180 Ack=688 Win=249 Len=0 TSval=2360608298 TSecr=2492277271"
"71","2.453084127","2a0d:6fc7:213:782a:39d4:d935:834:ddaa","2a00:1450:4028:804::200e","TCP","86","57164  >  443 [ACK] Seq=2180 Ack=719 Win=249 Len=0 TSval=2360608298 TSecr=2492277272"
"72","2.453116827","2a0d:6fc7:213:782a:39d4:d935:834:ddaa","2a00:1450:4028:804::200e","TCP","86","57164  >  443 [ACK] Seq=2180 Ack=758 Win=249 Len=0 TSval=2360608298 TSecr=2492277272"
"73","2.459455030","2a0d:6fc7:213:782a:39d4:d935:834:ddaa","2a00:1450:4028:806::200e","TLSv1.2","125","Application Data"
"74","2.459827825","2a0d:6fc7:213:782a:39d4:d935:834:ddaa","2a00:1450:4028:804::200e","TLSv1.2","121","Application Data"
"75","2.459942323","2a0d:6fc7:213:782a:39d4:d935:834:ddaa","2a00:1450:4028:804::200e","TLSv1.2","125","Application Data"
"76","2.462246288","2a00:1450:4028:804::200e","2a0d:6fc7:213:782a:39d4:d935:834:ddaa","TCP","125","[TCP Spurious Retransmission] 443  >  57164 [PSH, ACK] Seq=719 Ack=2180 Win=1014 Len=39 TSval=2492277430 TSecr=2360607967"
"77","2.462275488","2a0d:6fc7:213:782a:39d4:d935:834:ddaa","2a00:1450:4028:804::200e","TCP","98","[TCP Dup ACK 72#1] 57164  >  443 [ACK] Seq=2254 Ack=758 Win=249 Len=0 TSval=2360608307 TSecr=2492277430 SLE=719 SRE=758"
"78","2.534413398","2a00:1450:4028:806::200e","2a0d:6fc7:213:782a:39d4:d935:834:ddaa","TCP","86","443  >  38082 [ACK] Seq=384 Ack=14334 Win=688 Len=0 TSval=598792928 TSecr=1036662883"
"79","2.534420798","2a00:1450:4028:804::200e","2a0d:6fc7:213:782a:39d4:d935:834:ddaa","TCP","86","443  >  57164 [ACK] Seq=758 Ack=2254 Win=1014 Len=0 TSval=2492277552 TSecr=2360608305"
"80","2.849157841","2a0d:6fc7:213:782a:39d4:d935:834:ddaa","2a00:1450:4028:805::200e","TCP","86","42660  >  443 [ACK] Seq=1 Ack=1 Win=249 Len=0 TSval=1897084468 TSecr=865116321"
"81","2.864795304","2a0d:6fc7:213:782a:39d4:d935:834:ddaa","2a00:1450:4028:806::200e","TCP","1374","38082  >  443 [ACK] Seq=14334 Ack=384 Win=3576 Len=1288 TSval=1036663289 TSecr=598792928 [TCP PDU reassembled in 83]"
"82","2.864814204","2a0d:6fc7:213:782a:39d4:d935:834:ddaa","2a00:1450:4028:806::200e","TCP","1374","38082  >  443 [PSH, ACK] Seq=15622 Ack=384 Win=3576 Len=1288 TSval=1036663289 TSecr=598792928 [TCP PDU reassembled in 83]"
"83","2.865118800","2a0d:6fc7:213:782a:39d4:d935:834:ddaa","2a00:1450:4028:806::200e","TLSv1.2","861","Application Data"
"84","2.900946758","2a00:1450:4028:805::200e","2a0d:6fc7:213:782a:39d4:d935:834:ddaa","TCP","86","[TCP ACKed unseen segment] 443  >  42660 [ACK] Seq=1 Ack=2 Win=1030 Len=0 TSval=865161450 TSecr=1896948016"
"85","2.912035691","2a00:1450:4028:806::200e","2a0d:6fc7:213:782a:39d4:d935:834:ddaa","TCP","86","443  >  38082 [ACK] Seq=384 Ack=16910 Win=678 Len=0 TSval=598793330 TSecr=1036663289"
"86","2.912041691","2a00:1450:4028:806::200e","2a0d:6fc7:213:782a:39d4:d935:834:ddaa","TCP","86","443  >  38082 [ACK] Seq=384 Ack=17685 Win=675 Len=0 TSval=598793330 TSecr=1036663289"
"87","2.978332589","2a00:1450:4028:806::200e","2a0d:6fc7:213:782a:39d4:d935:834:ddaa","TLSv1.2","156","Application Data"
"88","2.988895329","2a00:1450:4028:806::200e","2a0d:6fc7:213:782a:39d4:d935:834:ddaa","TLSv1.2","117","Application Data"
"89","2.988901929","2a00:1450:4028:806::200e","2a0d:6fc7:213:782a:39d4:d935:834:ddaa","TLSv1.2","125","Application Data"
"90","2.991161795","2a0d:6fc7:213:782a:39d4:d935:834:ddaa","2a00:1450:4028:806::200e","TCP","86","38082  >  443 [ACK] Seq=17685 Ack=524 Win=3576 Len=0 TSval=1036663415 TSecr=598793398"
"91","3.292217045","192.168.183.42","129.159.140.221","NTP","90","NTP Version 4, client"
"92","3.300554719","2a0d:6fc7:213:782a:39d4:d935:834:ddaa","2a00:1450:4028:806::200e","TLSv1.2","125","Application Data"
"93","3.333219025","129.159.140.221","192.168.183.42","NTP","90","NTP Version 4, server"
"94","3.336046387","2a00:1450:4028:806::200e","2a0d:6fc7:213:782a:39d4:d935:834:ddaa","TCP","86","443  >  38082 [ACK] Seq=524 Ack=17724 Win=675 Len=0 TSval=598793750 TSecr=1036663725"
"95","4.114065145","1a:b5:0c:ee:81:45","VMware_2c:82:47","ARP","60","Who has 192.168.183.42? Tell 192.168.183.67"
"96","4.114092344","VMware_2c:82:47","1a:b5:0c:ee:81:45","ARP","42","192.168.183.42 is at 00:0c:29:2c:82:47"
"97","4.676725595","2a0d:6fc7:213:782a:39d4:d935:834:ddaa","2a00:1450:4028:805::2002","TLSv1.2","159","Application Data"
"98","4.927978752","2a0d:6fc7:213:782a:39d4:d935:834:ddaa","2a00:1450:4028:805::2002","TLSv1.2","125","Application Data"
"99","4.953417902","2a00:1450:4028:805::2002","2a0d:6fc7:213:782a:39d4:d935:834:ddaa","TCP","86","443  >  37044 [ACK] Seq=1 Ack=74 Win=1050 Len=0 TSval=3116020857 TSecr=2320581761"
"100","4.962918532","2a00:1450:4028:805::2002","2a0d:6fc7:213:782a:39d4:d935:834:ddaa","TCP","86","443  >  37044 [ACK] Seq=1 Ack=113 Win=1050 Len=0 TSval=3116020859 TSecr=2320582012"
"101","4.962927132","2a00:1450:4028:805::2002","2a0d:6fc7:213:782a:39d4:d935:834:ddaa","TLSv1.2","125","Application Data"
"102","5.006944522","2a0d:6fc7:213:782a:39d4:d935:834:ddaa","2a00:1450:4028:805::2002","TCP","86","37044  >  443 [ACK] Seq=113 Ack=40 Win=249 Len=0 TSval=2320582091 TSecr=3116020859"
"103","5.029533243","2a00:1450:4028:805::2002","2a0d:6fc7:213:782a:39d4:d935:834:ddaa","TLSv1.2","159","Application Data"
"104","5.029541343","2a00:1450:4028:805::2002","2a0d:6fc7:213:782a:39d4:d935:834:ddaa","TLSv1.2","384","Application Data"
"105","5.029548944","2a00:1450:4028:805::2002","2a0d:6fc7:213:782a:39d4:d935:834:ddaa","TLSv1.2","117","Application Data"
"106","5.029556044","2a00:1450:4028:805::2002","2a0d:6fc7:213:782a:39d4:d935:834:ddaa","TLSv1.2","125","Application Data"
"107","5.029638748","2a0d:6fc7:213:782a:39d4:d935:834:ddaa","2a00:1450:4028:805::2002","TCP","86","37044  >  443 [ACK] Seq=113 Ack=113 Win=249 Len=0 TSval=2320582114 TSecr=3116020913"
"108","5.029764454","2a0d:6fc7:213:782a:39d4:d935:834:ddaa","2a00:1450:4028:805::2002","TCP","86","37044  >  443 [ACK] Seq=113 Ack=411 Win=249 Len=0 TSval=2320582114 TSecr=3116020913"
"109","5.029826757","2a0d:6fc7:213:782a:39d4:d935:834:ddaa","2a00:1450:4028:805::2002","TCP","86","37044  >  443 [ACK] Seq=113 Ack=442 Win=249 Len=0 TSval=2320582114 TSecr=3116020915"
"110","5.029877059","2a0d:6fc7:213:782a:39d4:d935:834:ddaa","2a00:1450:4028:805::2002","TCP","86","37044  >  443 [ACK] Seq=113 Ack=481 Win=249 Len=0 TSval=2320582114 TSecr=3116020915"
"111","5.031401928","2a0d:6fc7:213:782a:39d4:d935:834:ddaa","2a00:1450:4028:805::2002","TLSv1.2","121","Application Data"
"112","5.031691441","2a0d:6fc7:213:782a:39d4:d935:834:ddaa","2a00:1450:4028:805::2002","TLSv1.2","125","Application Data"
"113","5.246641832","2a0d:6fc7:213:782a:39d4:d935:834:ddaa","2a00:1450:4028:805::2002","TCP","125","[TCP Retransmission] 37044  >  443 [PSH, ACK] Seq=148 Ack=481 Win=249 Len=39 TSval=2320582331 TSecr=3116020915"
"114","5.312079465","2a00:1450:4028:805::2002","2a0d:6fc7:213:782a:39d4:d935:834:ddaa","TCP","86","443  >  37044 [ACK] Seq=481 Ack=187 Win=1050 Len=0 TSval=3116020986 TSecr=2320582115"
"115","5.312087065","fe80::18b5:cff:feee:8145","fe80::20c:29ff:fe2c:8247","ICMPv6","86","Neighbor Solicitation for fe80::20c:29ff:fe2c:8247 from 1a:b5:0c:ee:81:45"
"116","5.312164969","fe80::20c:29ff:fe2c:8247","fe80::18b5:cff:feee:8145","ICMPv6","78","Neighbor Advertisement fe80::20c:29ff:fe2c:8247 (sol)"
"117","5.346003984","2a0d:6fc7:213:782a:39d4:d935:834:ddaa","2a00:1450:4028:806::200e","TCP","1374","38082  >  443 [ACK] Seq=17724 Ack=524 Win=3576 Len=1288 TSval=1036665770 TSecr=598793750 [TCP PDU reassembled in 119]"
"118","5.346021285","2a0d:6fc7:213:782a:39d4:d935:834:ddaa","2a00:1450:4028:806::200e","TCP","1374","38082  >  443 [PSH, ACK] Seq=19012 Ack=524 Win=3576 Len=1288 TSval=1036665770 TSecr=598793750 [TCP PDU reassembled in 119]"
"119","5.346336999","2a0d:6fc7:213:782a:39d4:d935:834:ddaa","2a00:1450:4028:806::200e","TLSv1.2","551","Application Data"
"120","5.346674414","2a0d:6fc7:213:782a:39d4:d935:834:ddaa","2a00:1450:4028:806::200e","TCP","1374","38082  >  443 [ACK] Seq=20765 Ack=524 Win=3576 Len=1288 TSval=1036665771 TSecr=598793750 [TCP PDU reassembled in 125]"
"121","5.346686215","2a0d:6fc7:213:782a:39d4:d935:834:ddaa","2a00:1450:4028:806::200e","TCP","1374","38082  >  443 [PSH, ACK] Seq=22053 Ack=524 Win=3576 Len=1288 TSval=1036665771 TSecr=598793750 [TCP PDU reassembled in 125]"
"122","5.346829621","2a0d:6fc7:213:782a:39d4:d935:834:ddaa","2a00:1450:4028:806::200e","TCP","1374","38082  >  443 [ACK] Seq=23341 Ack=524 Win=3576 Len=1288 TSval=1036665771 TSecr=598793750 [TCP PDU reassembled in 125]"
"123","5.346839822","2a0d:6fc7:213:782a:39d4:d935:834:ddaa","2a00:1450:4028:806::200e","TCP","1374","38082  >  443 [PSH, ACK] Seq=24629 Ack=524 Win=3576 Len=1288 TSval=1036665771 TSecr=598793750 [TCP PDU reassembled in 125]"
"124","5.346960727","2a0d:6fc7:213:782a:39d4:d935:834:ddaa","2a00:1450:4028:806::200e","TCP","1374","38082  >  443 [ACK] Seq=25917 Ack=524 Win=3576 Len=1288 TSval=1036665771 TSecr=598793750 [TCP PDU reassembled in 125]"
"125","5.346969827","2a0d:6fc7:213:782a:39d4:d935:834:ddaa","2a00:1450:4028:806::200e","TLSv1.2","789","Application Data"
"126","5.365561960","2a00:1450:4028:805::2002","2a0d:6fc7:213:782a:39d4:d935:834:ddaa","TCP","98","[TCP Dup ACK 114#1] 443  >  37044 [ACK] Seq=481 Ack=187 Win=1050 Len=0 TSval=3116021270 TSecr=2320582331 SLE=148 SRE=187"
"127","5.382883636","2a00:1450:4028:806::200e","2a0d:6fc7:213:782a:39d4:d935:834:ddaa","TCP","86","443  >  38082 [ACK] Seq=524 Ack=19012 Win=670 Len=0 TSval=598795802 TSecr=1036665770"
"128","5.384909327","2a00:1450:4028:806::200e","2a0d:6fc7:213:782a:39d4:d935:834:ddaa","TCP","86","443  >  38082 [ACK] Seq=524 Ack=20300 Win=665 Len=0 TSval=598795804 TSecr=1036665770"
"129","5.384916027","2a00:1450:4028:806::200e","2a0d:6fc7:213:782a:39d4:d935:834:ddaa","TCP","86","443  >  38082 [ACK] Seq=524 Ack=20765 Win=664 Len=0 TSval=598795804 TSecr=1036665770"
"130","5.385576457","2a00:1450:4028:806::200e","2a0d:6fc7:213:782a:39d4:d935:834:ddaa","TCP","86","443  >  38082 [ACK] Seq=524 Ack=22053 Win=659 Len=0 TSval=598795804 TSecr=1036665771"
"131","5.406449691","2a00:1450:4028:806::200e","2a0d:6fc7:213:782a:39d4:d935:834:ddaa","TCP","86","443  >  38082 [ACK] Seq=524 Ack=23341 Win=654 Len=0 TSval=598795812 TSecr=1036665771"
"132","5.406458391","2a00:1450:4028:806::200e","2a0d:6fc7:213:782a:39d4:d935:834:ddaa","TCP","86","443  >  38082 [ACK] Seq=524 Ack=25917 Win=644 Len=0 TSval=598795812 TSecr=1036665771"
"133","5.406465991","2a00:1450:4028:806::200e","2a0d:6fc7:213:782a:39d4:d935:834:ddaa","TCP","86","443  >  38082 [ACK] Seq=524 Ack=27205 Win=639 Len=0 TSval=598795812 TSecr=1036665771"
"134","5.406473392","2a00:1450:4028:806::200e","2a0d:6fc7:213:782a:39d4:d935:834:ddaa","TCP","86","443  >  38082 [ACK] Seq=524 Ack=27908 Win=637 Len=0 TSval=598795812 TSecr=1036665771"
"135","5.691771271","2a00:1450:4028:806::200e","2a0d:6fc7:213:782a:39d4:d935:834:ddaa","TLSv1.2","628","Application Data"
"136","5.691778871","2a00:1450:4028:806::200e","2a0d:6fc7:213:782a:39d4:d935:834:ddaa","TLSv1.2","148","Application Data"
"137","5.691786372","2a00:1450:4028:806::200e","2a0d:6fc7:213:782a:39d4:d935:834:ddaa","TLSv1.2","117","Application Data"
"138","5.691793872","2a00:1450:4028:806::200e","2a0d:6fc7:213:782a:39d4:d935:834:ddaa","TLSv1.2","125","Application Data"
"139","5.695689347","2a0d:6fc7:213:782a:39d4:d935:834:ddaa","2a00:1450:4028:806::200e","TCP","86","38082  >  443 [ACK] Seq=27908 Ack=1198 Win=3594 Len=0 TSval=1036666120 TSecr=598795881"
"140","5.701008385","2a0d:6fc7:213:782a:39d4:d935:834:ddaa","2a00:1450:4028:806::200e","TLSv1.2","125","Application Data"
"141","5.709352158","2a0d:6fc7:213:782a:39d4:d935:834:ddaa","2a00:1450:4028:806::200e","TLSv1.2","121","Application Data"
"142","5.743750899","2a00:1450:4028:806::200e","2a0d:6fc7:213:782a:39d4:d935:834:ddaa","TCP","86","443  >  38082 [ACK] Seq=1198 Ack=27947 Win=637 Len=0 TSval=598796160 TSecr=1036666125"
"143","5.760160733","2a00:1450:4028:806::200e","2a0d:6fc7:213:782a:39d4:d935:834:ddaa","TCP","86","443  >  38082 [ACK] Seq=1198 Ack=27982 Win=637 Len=0 TSval=598796169 TSecr=1036666133"
"144","6.614234705","2a0d:6fc7:213:782a:39d4:d935:834:ddaa","2600:1901:1:194::","TLSv1.2","129","Application Data"
"145","6.627656001","2a0d:6fc7:213:782a:39d4:d935:834:ddaa","2a00:1450:4028:806::200e","TCP","1374","38082  >  443 [ACK] Seq=27982 Ack=1198 Win=3594 Len=1288 TSval=1036667052 TSecr=598796169 [TCP PDU reassembled in 147]"
"146","6.627673402","2a0d:6fc7:213:782a:39d4:d935:834:ddaa","2a00:1450:4028:806::200e","TCP","1374","38082  >  443 [PSH, ACK] Seq=29270 Ack=1198 Win=3594 Len=1288 TSval=1036667052 TSecr=598796169 [TCP PDU reassembled in 147]"
"147","6.627943514","2a0d:6fc7:213:782a:39d4:d935:834:ddaa","2a00:1450:4028:806::200e","TLSv1.2","508","Application Data"
"148","6.628238827","2a0d:6fc7:213:782a:39d4:d935:834:ddaa","2a00:1450:4028:806::200e","TLSv1.2","343","Application Data"
"149","6.649513171","2600:1901:1:194::","2a0d:6fc7:213:782a:39d4:d935:834:ddaa","TCP","86","443  >  55236 [ACK] Seq=1 Ack=44 Win=1042 Len=0 TSval=2598646440 TSecr=365718160"
"150","6.675586728","2a00:1450:4028:806::200e","2a0d:6fc7:213:782a:39d4:d935:834:ddaa","TCP","86","443  >  38082 [ACK] Seq=1198 Ack=30558 Win=627 Len=0 TSval=598797084 TSecr=1036667052"
"151","6.675594728","2a00:1450:4028:806::200e","2a0d:6fc7:213:782a:39d4:d935:834:ddaa","TCP","86","443  >  38082 [ACK] Seq=1198 Ack=30980 Win=626 Len=0 TSval=598797084 TSecr=1036667052"
"152","6.675601928","2a00:1450:4028:806::200e","2a0d:6fc7:213:782a:39d4:d935:834:ddaa","TCP","86","443  >  38082 [ACK] Seq=1198 Ack=31237 Win=625 Len=0 TSval=598797084 TSecr=1036667052"
"153","6.699157274","2600:1901:1:194::","2a0d:6fc7:213:782a:39d4:d935:834:ddaa","TLSv1.2","126","Application Data"
"154","6.699314281","2a0d:6fc7:213:782a:39d4:d935:834:ddaa","2600:1901:1:194::","TCP","86","55236  >  443 [ACK] Seq=44 Ack=41 Win=7223 Len=0 TSval=365718245 TSecr=2598646493"
"155","6.730719775","2a00:1450:4028:806::200e","2a0d:6fc7:213:782a:39d4:d935:834:ddaa","TLSv1.2","158","Application Data"
"156","6.733048577","2a00:1450:4028:806::200e","2a0d:6fc7:213:782a:39d4:d935:834:ddaa","TLSv1.2","117","Application Data"
"157","6.733056178","2a00:1450:4028:806::200e","2a0d:6fc7:213:782a:39d4:d935:834:ddaa","TLSv1.2","125","Application Data"
"158","6.733211385","2a0d:6fc7:213:782a:39d4:d935:834:ddaa","2a00:1450:4028:806::200e","TCP","86","38082  >  443 [ACK] Seq=31237 Ack=1340 Win=3594 Len=0 TSval=1036667157 TSecr=598797150"
"159","6.734120825","2a0d:6fc7:213:782a:39d4:d935:834:ddaa","2a00:1450:4028:806::200e","TLSv1.2","125","Application Data"
"160","7.025296345","2a00:1450:4028:806::200e","2a0d:6fc7:213:782a:39d4:d935:834:ddaa","TCP","86","443  >  38082 [ACK] Seq=1340 Ack=31276 Win=625 Len=0 TSval=598797200 TSecr=1036667158"
"161","8.910947011","2a0d:6fc7:213:782a:39d4:d935:834:ddaa","2600:1901:1:7c5::","TCP","86","33268  >  443 [ACK] Seq=1 Ack=1 Win=249 Len=0 TSval=326462211 TSecr=2876960573"
"162","9.157181735","2600:1901:1:7c5::","2a0d:6fc7:213:782a:39d4:d935:834:ddaa","TCP","86","[TCP ACKed unseen segment] 443  >  33268 [ACK] Seq=1 Ack=2 Win=1045 Len=0 TSval=2877007207 TSecr=326415772"
"163","9.888212089","2407:30c0:182::aa72:344a","2a0d:6fc7:213:782a:39d4:d935:834:ddaa","TCP","86","443  >  35650 [ACK] Seq=1 Ack=1 Win=12 Len=0 TSval=1516474950 TSecr=2966952505"
"164","9.888277292","2a0d:6fc7:213:782a:39d4:d935:834:ddaa","2407:30c0:182::aa72:344a","TCP","86","[TCP ACKed unseen segment] 35650  >  443 [ACK] Seq=1 Ack=2 Win=249 Len=0 TSval=2966968067 TSecr=1516441533"
"165","10.268607970","192.168.183.67","192.168.183.255","UDP","82","57621  >  57621 Len=40"
"166","10.958929875","2a0d:6fc7:213:782a:39d4:d935:834:ddaa","2a04:4e42:8e::760","TCP","86","38734  >  443 [ACK] Seq=1 Ack=1 Win=249 Len=0 TSval=4117193193 TSecr=3759166007"
"167","11.137863129","2a0d:6fc7:213:782a:39d4:d935:834:ddaa","2001:40a8:4400:3::5266:983a","TLSv1.2","855","Application Data"
"168","11.492289751","2a04:4e42:8e::760","2a0d:6fc7:213:782a:39d4:d935:834:ddaa","TCP","86","[TCP ACKed unseen segment] 443  >  38734 [ACK] Seq=1 Ack=2 Win=292 Len=0 TSval=3759211648 TSecr=4117147817"
"169","11.492297751","2001:40a8:4400:3::5266:983a","2a0d:6fc7:213:782a:39d4:d935:834:ddaa","TLSv1.2","683","Application Data"
"170","11.492305251","2001:40a8:4400:3::5266:983a","2a0d:6fc7:213:782a:39d4:d935:834:ddaa","TCP","2662","443  >  39004 [PSH, ACK] Seq=598 Ack=770 Win=501 Len=2576 TSval=1690338591 TSecr=3861367000 [TCP PDU reassembled in 180]"
"171","11.492312352","2001:40a8:4400:3::5266:983a","2a0d:6fc7:213:782a:39d4:d935:834:ddaa","TCP","2662","443  >  39004 [PSH, ACK] Seq=3174 Ack=770 Win=501 Len=2576 TSval=1690338593 TSecr=3861367000 [TCP PDU reassembled in 180]"
"172","11.492319152","2001:40a8:4400:3::5266:983a","2a0d:6fc7:213:782a:39d4:d935:834:ddaa","TCP","2662","443  >  39004 [PSH, ACK] Seq=5750 Ack=770 Win=501 Len=2576 TSval=1690338596 TSecr=3861367000 [TCP PDU reassembled in 180]"
"173","11.492375855","2a0d:6fc7:213:782a:39d4:d935:834:ddaa","2001:40a8:4400:3::5266:983a","TCP","86","39004  >  443 [ACK] Seq=770 Ack=598 Win=8707 Len=0 TSval=3861367354 TSecr=1690338590"
"174","11.492561762","2a0d:6fc7:213:782a:39d4:d935:834:ddaa","2001:40a8:4400:3::5266:983a","TCP","86","39004  >  443 [ACK] Seq=770 Ack=3174 Win=8689 Len=0 TSval=3861367355 TSecr=1690338591"
"175","11.492623565","2a0d:6fc7:213:782a:39d4:d935:834:ddaa","2001:40a8:4400:3::5266:983a","TCP","86","39004  >  443 [ACK] Seq=770 Ack=5750 Win=8670 Len=0 TSval=3861367355 TSecr=1690338593"
"176","11.492671367","2a0d:6fc7:213:782a:39d4:d935:834:ddaa","2001:40a8:4400:3::5266:983a","TCP","86","39004  >  443 [ACK] Seq=770 Ack=8326 Win=8651 Len=0 TSval=3861367355 TSecr=1690338596"
"177","11.492713269","2001:40a8:4400:3::5266:983a","2a0d:6fc7:213:782a:39d4:d935:834:ddaa","TCP","2662","443  >  39004 [PSH, ACK] Seq=8326 Ack=770 Win=501 Len=2576 TSval=1690338599 TSecr=3861367000 [TCP PDU reassembled in 180]"
"178","11.492720569","2001:40a8:4400:3::5266:983a","2a0d:6fc7:213:782a:39d4:d935:834:ddaa","TCP","2662","443  >  39004 [PSH, ACK] Seq=10902 Ack=770 Win=501 Len=2576 TSval=1690338601 TSecr=3861367000 [TCP PDU reassembled in 180]"
"179","11.492727770","2001:40a8:4400:3::5266:983a","2a0d:6fc7:213:782a:39d4:d935:834:ddaa","TCP","2662","443  >  39004 [PSH, ACK] Seq=13478 Ack=770 Win=501 Len=2576 TSval=1690338604 TSecr=3861367000 [TCP PDU reassembled in 180]"
"180","11.492734870","2001:40a8:4400:3::5266:983a","2a0d:6fc7:213:782a:39d4:d935:834:ddaa","TLSv1.2","2662","Application Data"
"181","11.492755670","2a0d:6fc7:213:782a:39d4:d935:834:ddaa","2001:40a8:4400:3::5266:983a","TCP","86","39004  >  443 [ACK] Seq=770 Ack=10902 Win=8632 Len=0 TSval=3861367355 TSecr=1690338599"
"182","11.492800572","2a0d:6fc7:213:782a:39d4:d935:834:ddaa","2001:40a8:4400:3::5266:983a","TCP","86","39004  >  443 [ACK] Seq=770 Ack=13478 Win=8613 Len=0 TSval=3861367355 TSecr=1690338601"
"183","11.492843674","2a0d:6fc7:213:782a:39d4:d935:834:ddaa","2001:40a8:4400:3::5266:983a","TCP","86","39004  >  443 [ACK] Seq=770 Ack=16054 Win=8594 Len=0 TSval=3861367355 TSecr=1690338604"
"184","11.492887876","2a0d:6fc7:213:782a:39d4:d935:834:ddaa","2001:40a8:4400:3::5266:983a","TCP","86","39004  >  443 [ACK] Seq=770 Ack=18630 Win=8575 Len=0 TSval=3861367355 TSecr=1690338607"
"185","11.492946679","2001:40a8:4400:3::5266:983a","2a0d:6fc7:213:782a:39d4:d935:834:ddaa","TCP","2662","443  >  39004 [PSH, ACK] Seq=18630 Ack=770 Win=501 Len=2576 TSval=1690338610 TSecr=3861367000 [TCP PDU reassembled in 194]"
"186","11.492954179","2001:40a8:4400:3::5266:983a","2a0d:6fc7:213:782a:39d4:d935:834:ddaa","TCP","2662","443  >  39004 [PSH, ACK] Seq=21206 Ack=770 Win=501 Len=2576 TSval=1690338613 TSecr=3861367000 [TCP PDU reassembled in 194]"
"187","11.492961279","2001:40a8:4400:3::5266:983a","2a0d:6fc7:213:782a:39d4:d935:834:ddaa","TCP","2662","443  >  39004 [PSH, ACK] Seq=23782 Ack=770 Win=501 Len=2576 TSval=1690338616 TSecr=3861367000 [TCP PDU reassembled in 194]"
"188","11.492968580","2001:40a8:4400:3::5266:983a","2a0d:6fc7:213:782a:39d4:d935:834:ddaa","TCP","2662","443  >  39004 [PSH, ACK] Seq=26358 Ack=770 Win=501 Len=2576 TSval=1690338619 TSecr=3861367000 [TCP PDU reassembled in 194]"
"189","11.492989381","2a0d:6fc7:213:782a:39d4:d935:834:ddaa","2001:40a8:4400:3::5266:983a","TCP","86","39004  >  443 [ACK] Seq=770 Ack=21206 Win=8557 Len=0 TSval=3861367355 TSecr=1690338610"
"190","11.493038282","2a0d:6fc7:213:782a:39d4:d935:834:ddaa","2001:40a8:4400:3::5266:983a","TCP","86","39004  >  443 [ACK] Seq=770 Ack=23782 Win=8537 Len=0 TSval=3861367355 TSecr=1690338613"
"191","11.493081684","2a0d:6fc7:213:782a:39d4:d935:834:ddaa","2001:40a8:4400:3::5266:983a","TCP","86","39004  >  443 [ACK] Seq=770 Ack=26358 Win=8518 Len=0 TSval=3861367355 TSecr=1690338616"
"192","11.493126386","2a0d:6fc7:213:782a:39d4:d935:834:ddaa","2001:40a8:4400:3::5266:983a","TCP","86","39004  >  443 [ACK] Seq=770 Ack=28934 Win=8499 Len=0 TSval=3861367355 TSecr=1690338619"
"193","11.493165388","2001:40a8:4400:3::5266:983a","2a0d:6fc7:213:782a:39d4:d935:834:ddaa","TCP","2662","443  >  39004 [PSH, ACK] Seq=28934 Ack=770 Win=501 Len=2576 TSval=1690338622 TSecr=3861367000 [TCP PDU reassembled in 194]"
"194","11.493172788","2001:40a8:4400:3::5266:983a","2a0d:6fc7:213:782a:39d4:d935:834:ddaa","TLSv1.2","2662","Application Data"
"195","11.493179789","2001:40a8:4400:3::5266:983a","2a0d:6fc7:213:782a:39d4:d935:834:ddaa","TCP","2662","443  >  39004 [PSH, ACK] Seq=34086 Ack=770 Win=501 Len=2576 TSval=1690338627 TSecr=3861367000 [TCP PDU reassembled in 196]"
"196","11.493187289","2001:40a8:4400:3::5266:983a","2a0d:6fc7:213:782a:39d4:d935:834:ddaa","TLSv1.2","2662","Application Data"
"197","11.493206790","2a0d:6fc7:213:782a:39d4:d935:834:ddaa","2001:40a8:4400:3::5266:983a","TCP","86","39004  >  443 [ACK] Seq=770 Ack=31510 Win=8480 Len=0 TSval=3861367355 TSecr=1690338622"
"198","11.493251992","2a0d:6fc7:213:782a:39d4:d935:834:ddaa","2001:40a8:4400:3::5266:983a","TCP","86","39004  >  443 [ACK] Seq=770 Ack=34086 Win=8461 Len=0 TSval=3861367355 TSecr=1690338624"
"199","11.493295193","2a0d:6fc7:213:782a:39d4:d935:834:ddaa","2001:40a8:4400:3::5266:983a","TCP","86","39004  >  443 [ACK] Seq=770 Ack=36662 Win=8442 Len=0 TSval=3861367355 TSecr=1690338627"
"200","11.493337295","2a0d:6fc7:213:782a:39d4:d935:834:ddaa","2001:40a8:4400:3::5266:983a","TCP","86","39004  >  443 [ACK] Seq=770 Ack=39238 Win=8423 Len=0 TSval=3861367355 TSecr=1690338630"
"201","11.493392498","2001:40a8:4400:3::5266:983a","2a0d:6fc7:213:782a:39d4:d935:834:ddaa","TCP","2662","443  >  39004 [PSH, ACK] Seq=39238 Ack=770 Win=501 Len=2576 TSval=1690338633 TSecr=3861367000 [TCP PDU reassembled in 207]"
"202","11.493399998","2001:40a8:4400:3::5266:983a","2a0d:6fc7:213:782a:39d4:d935:834:ddaa","TCP","2662","443  >  39004 [PSH, ACK] Seq=41814 Ack=770 Win=501 Len=2576 TSval=1690338636 TSecr=3861367000 [TCP PDU reassembled in 207]"
"203","11.493407298","2001:40a8:4400:3::5266:983a","2a0d:6fc7:213:782a:39d4:d935:834:ddaa","TCP","2662","443  >  39004 [PSH, ACK] Seq=44390 Ack=770 Win=501 Len=2576 TSval=1690338639 TSecr=3861367000 [TCP PDU reassembled in 207]"
"204","11.493414899","2001:40a8:4400:3::5266:983a","2a0d:6fc7:213:782a:39d4:d935:834:ddaa","TCP","2662","443  >  39004 [PSH, ACK] Seq=46966 Ack=770 Win=501 Len=2576 TSval=1690338642 TSecr=3861367000 [TCP PDU reassembled in 207]"
"205","11.493466401","2001:40a8:4400:3::5266:983a","2a0d:6fc7:213:782a:39d4:d935:834:ddaa","TCP","2662","443  >  39004 [PSH, ACK] Seq=49542 Ack=770 Win=501 Len=2576 TSval=1690338645 TSecr=3861367000 [TCP PDU reassembled in 207]"
"206","11.493473701","2001:40a8:4400:3::5266:983a","2a0d:6fc7:213:782a:39d4:d935:834:ddaa","TCP","2662","443  >  39004 [PSH, ACK] Seq=52118 Ack=770 Win=501 Len=2576 TSval=1690338647 TSecr=3861367000 [TCP PDU reassembled in 207]"
"207","11.493481001","2001:40a8:4400:3::5266:983a","2a0d:6fc7:213:782a:39d4:d935:834:ddaa","TLSv1.2","2662","Application Data"
"208","11.493488102","2001:40a8:4400:3::5266:983a","2a0d:6fc7:213:782a:39d4:d935:834:ddaa","TCP","2662","443  >  39004 [PSH, ACK] Seq=57270 Ack=770 Win=501 Len=2576 TSval=1690338653 TSecr=3861367000 [TCP PDU reassembled in 213]"
"209","11.493550904","2001:40a8:4400:3::5266:983a","2a0d:6fc7:213:782a:39d4:d935:834:ddaa","TCP","2662","443  >  39004 [PSH, ACK] Seq=59846 Ack=770 Win=501 Len=2576 TSval=1690338656 TSecr=3861367000 [TCP PDU reassembled in 213]"
"210","11.493558304","2001:40a8:4400:3::5266:983a","2a0d:6fc7:213:782a:39d4:d935:834:ddaa","TCP","2662","443  >  39004 [PSH, ACK] Seq=62422 Ack=770 Win=501 Len=2576 TSval=1690338659 TSecr=3861367000 [TCP PDU reassembled in 213]"
"211","11.493565505","2001:40a8:4400:3::5266:983a","2a0d:6fc7:213:782a:39d4:d935:834:ddaa","TCP","2662","443  >  39004 [PSH, ACK] Seq=64998 Ack=770 Win=501 Len=2576 TSval=1690338662 TSecr=3861367000 [TCP PDU reassembled in 213]"
"212","11.493572705","2001:40a8:4400:3::5266:983a","2a0d:6fc7:213:782a:39d4:d935:834:ddaa","TCP","2662","443  >  39004 [PSH, ACK] Seq=67574 Ack=770 Win=501 Len=2576 TSval=1690338665 TSecr=3861367000 [TCP PDU reassembled in 213]"
"213","11.493620507","2001:40a8:4400:3::5266:983a","2a0d:6fc7:213:782a:39d4:d935:834:ddaa","TLSv1.2","2662","Application Data"
"214","11.493627807","2001:40a8:4400:3::5266:983a","2a0d:6fc7:213:782a:39d4:d935:834:ddaa","TCP","2662","443  >  39004 [PSH, ACK] Seq=72726 Ack=770 Win=501 Len=2576 TSval=1690338670 TSecr=3861367000 [TCP PDU reassembled in 216]"
"215","11.493635508","2001:40a8:4400:3::5266:983a","2a0d:6fc7:213:782a:39d4:d935:834:ddaa","TCP","2662","443  >  39004 [PSH, ACK] Seq=75302 Ack=770 Win=501 Len=2576 TSval=1690338673 TSecr=3861367000 [TCP PDU reassembled in 216]"
"216","11.493642708","2001:40a8:4400:3::5266:983a","2a0d:6fc7:213:782a:39d4:d935:834:ddaa","TLSv1.2","2662","Application Data"
"217","11.493779214","2001:40a8:4400:3::5266:983a","2a0d:6fc7:213:782a:39d4:d935:834:ddaa","TCP","2662","443  >  39004 [PSH, ACK] Seq=80454 Ack=770 Win=501 Len=2576 TSval=1690338679 TSecr=3861367000 [TCP PDU reassembled in 222]"
"218","11.493786415","2001:40a8:4400:3::5266:983a","2a0d:6fc7:213:782a:39d4:d935:834:ddaa","TCP","2662","443  >  39004 [PSH, ACK] Seq=83030 Ack=770 Win=501 Len=2576 TSval=1690338682 TSecr=3861367000 [TCP PDU reassembled in 222]"
"219","11.493794015","2001:40a8:4400:3::5266:983a","2a0d:6fc7:213:782a:39d4:d935:834:ddaa","TCP","2662","443  >  39004 [PSH, ACK] Seq=85606 Ack=770 Win=501 Len=2576 TSval=1690338685 TSecr=3861367000 [TCP PDU reassembled in 222]"
"220","11.493801315","2001:40a8:4400:3::5266:983a","2a0d:6fc7:213:782a:39d4:d935:834:ddaa","TCP","2662","443  >  39004 [PSH, ACK] Seq=88182 Ack=770 Win=501 Len=2576 TSval=1690338688 TSecr=3861367000 [TCP PDU reassembled in 222]"
"221","11.493850517","2001:40a8:4400:3::5266:983a","2a0d:6fc7:213:782a:39d4:d935:834:ddaa","TCP","2662","443  >  39004 [PSH, ACK] Seq=90758 Ack=770 Win=501 Len=2576 TSval=1690338691 TSecr=3861367000 [TCP PDU reassembled in 222]"
"222","11.493857617","2001:40a8:4400:3::5266:983a","2a0d:6fc7:213:782a:39d4:d935:834:ddaa","TLSv1.2","2662","Application Data"
"223","11.493864818","2001:40a8:4400:3::5266:983a","2a0d:6fc7:213:782a:39d4:d935:834:ddaa","TCP","2662","443  >  39004 [PSH, ACK] Seq=95910 Ack=770 Win=501 Len=2576 TSval=1690338696 TSecr=3861367000 [TCP PDU reassembled in 229]"
"224","11.493872118","2001:40a8:4400:3::5266:983a","2a0d:6fc7:213:782a:39d4:d935:834:ddaa","TCP","2662","443  >  39004 [PSH, ACK] Seq=98486 Ack=770 Win=501 Len=2576 TSval=1690338699 TSecr=3861367000 [TCP PDU reassembled in 229]"
"225","11.493936021","2001:40a8:4400:3::5266:983a","2a0d:6fc7:213:782a:39d4:d935:834:ddaa","TCP","2662","443  >  39004 [PSH, ACK] Seq=101062 Ack=770 Win=501 Len=2576 TSval=1690338702 TSecr=3861367000 [TCP PDU reassembled in 229]"
"226","11.493943321","2001:40a8:4400:3::5266:983a","2a0d:6fc7:213:782a:39d4:d935:834:ddaa","TCP","2662","443  >  39004 [PSH, ACK] Seq=103638 Ack=770 Win=501 Len=2576 TSval=1690338705 TSecr=3861367000 [TCP PDU reassembled in 229]"
"227","11.493950521","2001:40a8:4400:3::5266:983a","2a0d:6fc7:213:782a:39d4:d935:834:ddaa","TCP","2662","443  >  39004 [PSH, ACK] Seq=106214 Ack=770 Win=501 Len=2576 TSval=1690338708 TSecr=3861367000 [TCP PDU reassembled in 229]"
"228","11.493957822","2001:40a8:4400:3::5266:983a","2a0d:6fc7:213:782a:39d4:d935:834:ddaa","TCP","2662","443  >  39004 [PSH, ACK] Seq=108790 Ack=770 Win=501 Len=2576 TSval=1690338711 TSecr=3861367000 [TCP PDU reassembled in 229]"
