"No.","Time","Source","Destination","Protocol","Length","Info"
"1","0.000000000","2a0d:6fc7:213:782a:39d4:d935:834:ddaa","2600:1901:1:7c5::","TCP","86","33260  >  443 [ACK] Seq=1 Ack=1 Win=249 Len=0 TSval=326170406 TSecr=1685327060"
"2","0.000152396","2a0d:6fc7:213:782a:39d4:d935:834:ddaa","2600:1901:1:7c5::","TCP","86","33260  >  443 [ACK] Seq=1 Ack=3625 Win=249 Len=0 TSval=326170406 TSecr=1685327065"
"3","0.000215495","2a0d:6fc7:213:782a:39d4:d935:834:ddaa","2600:1901:1:7c5::","TCP","86","33260  >  443 [ACK] Seq=1 Ack=6041 Win=249 Len=0 TSval=326170406 TSecr=1685327079"
"4","0.001240171","2a0d:6fc7:213:782a:39d4:d935:834:ddaa","2600:1901:1:7c5::","TLSv1.2","121","Application Data"
"5","0.001450666","2a0d:6fc7:213:782a:39d4:d935:834:ddaa","2600:1901:1:7c5::","TLSv1.2","125","Application Data"
"6","0.049335555","2600:1901:1:7c5::","2a0d:6fc7:213:782a:39d4:d935:834:ddaa","TCP","86","443  >  33260 [ACK] Seq=7203 Ack=36 Win=1018 Len=0 TSval=1685327198 TSecr=326170407"
"7","0.049354954","2600:1901:1:7c5::","2a0d:6fc7:213:782a:39d4:d935:834:ddaa","TCP","86","443  >  33260 [ACK] Seq=7203 Ack=75 Win=1018 Len=0 TSval=1685327198 TSecr=326170408"
"8","0.869295820","2a0d:6fc7:213:782a:39d4:d935:834:ddaa","2600:1901:1:5a5::","TLSv1.2","170","Application Data"
"9","0.869889706","2a0d:6fc7:213:782a:39d4:d935:834:ddaa","2600:1901:1:5a5::","TCP","1374","49120  >  443 [ACK] Seq=85 Ack=1 Win=249 Len=1288 TSval=1723592285 TSecr=3919664993 [TCP PDU reassembled in 14]"
"10","0.869905406","2a0d:6fc7:213:782a:39d4:d935:834:ddaa","2600:1901:1:5a5::","TCP","1374","49120  >  443 [PSH, ACK] Seq=1373 Ack=1 Win=249 Len=1288 TSval=1723592285 TSecr=3919664993 [TCP PDU reassembled in 14]"
"11","0.870124001","2a0d:6fc7:213:782a:39d4:d935:834:ddaa","2600:1901:1:5a5::","TCP","1374","49120  >  443 [ACK] Seq=2661 Ack=1 Win=249 Len=1288 TSval=1723592285 TSecr=3919664993 [TCP PDU reassembled in 14]"
"12","0.870135901","2a0d:6fc7:213:782a:39d4:d935:834:ddaa","2600:1901:1:5a5::","TCP","1374","49120  >  443 [PSH, ACK] Seq=3949 Ack=1 Win=249 Len=1288 TSval=1723592285 TSecr=3919664993 [TCP PDU reassembled in 14]"
"13","0.870412294","2a0d:6fc7:213:782a:39d4:d935:834:ddaa","2600:1901:1:5a5::","TCP","1374","49120  >  443 [ACK] Seq=5237 Ack=1 Win=249 Len=1288 TSval=1723592285 TSecr=3919664993 [TCP PDU reassembled in 14]"
"14","0.870423994","2a0d:6fc7:213:782a:39d4:d935:834:ddaa","2600:1901:1:5a5::","TLSv1.2","985","Application Data"
"15","0.899377629","2407:30c0:182::aa72:344a","2a0d:6fc7:213:782a:39d4:d935:834:ddaa","TCP","86","443  >  35650 [ACK] Seq=1 Ack=1 Win=12 Len=0 TSval=1516183110 TSecr=2966660739"
"16","0.899438128","2a0d:6fc7:213:782a:39d4:d935:834:ddaa","2407:30c0:182::aa72:344a","TCP","86","[TCP ACKed unseen segment] 35650  >  443 [ACK] Seq=1 Ack=2 Win=249 Len=0 TSval=2966676185 TSecr=1516166843"
"17","1.209110949","2a0d:6fc7:213:782a:39d4:d935:834:ddaa","2600:1901:1:5a5::","TCP","985","[TCP Retransmission] 49120  >  443 [PSH, ACK] Seq=6525 Ack=1 Win=249 Len=899 TSval=1723592624 TSecr=3919664993 [TCP PDU reassembled in 14]"
"18","1.224243105","2600:1901:1:5a5::","2a0d:6fc7:213:782a:39d4:d935:834:ddaa","TCP","86","443  >  49120 [ACK] Seq=1 Ack=85 Win=881 Len=0 TSval=3919670067 TSecr=1723592284"
"19","1.224250905","2600:1901:1:5a5::","2a0d:6fc7:213:782a:39d4:d935:834:ddaa","TCP","86","443  >  49120 [ACK] Seq=1 Ack=2661 Win=871 Len=0 TSval=3919670073 TSecr=1723592285"
"20","1.224258905","2600:1901:1:5a5::","2a0d:6fc7:213:782a:39d4:d935:834:ddaa","TCP","86","443  >  49120 [ACK] Seq=1 Ack=5237 Win=861 Len=0 TSval=3919670081 TSecr=1723592285"
"21","1.224266104","2600:1901:1:5a5::","2a0d:6fc7:213:782a:39d4:d935:834:ddaa","TCP","98","[TCP Dup ACK 20#1] 443  >  49120 [ACK] Seq=1 Ack=5237 Win=861 Len=0 TSval=3919670081 TSecr=1723592285 SLE=6525 SRE=7424"
"22","1.224273604","2600:1901:1:5a5::","2a0d:6fc7:213:782a:39d4:d935:834:ddaa","TCP","86","443  >  49120 [ACK] Seq=1 Ack=7424 Win=853 Len=0 TSval=3919670081 TSecr=1723592285"
"23","1.224281104","2600:1901:1:5a5::","2a0d:6fc7:213:782a:39d4:d935:834:ddaa","TLSv1.2","154","Application Data"
"24","1.224288604","2600:1901:1:5a5::","2a0d:6fc7:213:782a:39d4:d935:834:ddaa","TLSv1.2","274","Application Data"
"25","1.224296104","2600:1901:1:5a5::","2a0d:6fc7:213:782a:39d4:d935:834:ddaa","TLSv1.2","125","Application Data"
"26","1.230678959","2a0d:6fc7:213:782a:39d4:d935:834:ddaa","2600:1901:1:5a5::","TCP","86","49120  >  443 [ACK] Seq=7424 Ack=296 Win=249 Len=0 TSval=1723592646 TSecr=3919670152"
"27","1.259221010","2a0d:6fc7:213:782a:39d4:d935:834:ddaa","2600:1901:1:5a5::","TLSv1.2","121","Application Data"
"28","1.259474505","2a0d:6fc7:213:782a:39d4:d935:834:ddaa","2600:1901:1:5a5::","TLSv1.2","125","Application Data"
"29","1.262924426","2600:1901:1:5a5::","2a0d:6fc7:213:782a:39d4:d935:834:ddaa","TCP","98","[TCP Dup ACK 22#1] 443  >  49120 [ACK] Seq=296 Ack=7424 Win=853 Len=0 TSval=3919670403 TSecr=1723592624 SLE=6525 SRE=7424"
"30","1.297524941","2600:1901:1:5a5::","2a0d:6fc7:213:782a:39d4:d935:834:ddaa","TCP","86","443  >  49120 [ACK] Seq=296 Ack=7459 Win=853 Len=0 TSval=3919670436 TSecr=1723592674"
"31","1.605842436","2a0d:6fc7:213:782a:39d4:d935:834:ddaa","2600:9000:2600:8600:5:c033:1800:93a1","TCP","86","47312  >  443 [ACK] Seq=1 Ack=1 Win=5545 Len=0 TSval=3233563459 TSecr=862679731"
"32","1.606633019","2600:1901:1:5a5::","2a0d:6fc7:213:782a:39d4:d935:834:ddaa","TCP","86","443  >  49120 [ACK] Seq=296 Ack=7498 Win=853 Len=0 TSval=3919670453 TSecr=1723592675"
"33","1.695935290","2600:9000:2600:8600:5:c033:1800:93a1","2a0d:6fc7:213:782a:39d4:d935:834:ddaa","TCP","86","[TCP ACKed unseen segment] 443  >  47312 [ACK] Seq=1 Ack=2 Win=220 Len=0 TSval=862725044 TSecr=3233518248"
"34","1.756747109","2a0d:6fc7:213:782a:39d4:d935:834:ddaa","2600:9000:2600:8600:5:c033:1800:93a1","TCP","86","47296  >  443 [ACK] Seq=1 Ack=1 Win=3015 Len=0 TSval=3233563610 TSecr=1080292949"
"35","2.031712961","2a0d:6fc7:213:782a:39d4:d935:834:ddaa","2600:9000:2600:8600:5:c033:1800:93a1","TCP","86","47324  >  443 [ACK] Seq=1 Ack=1 Win=6157 Len=0 TSval=3233563885 TSecr=3575351670"
"36","2.032118552","2a0d:6fc7:213:782a:39d4:d935:834:ddaa","2600:9000:2600:8600:5:c033:1800:93a1","TCP","86","47348  >  443 [ACK] Seq=1 Ack=1 Win=3044 Len=0 TSval=3233563885 TSecr=2864459299"
"37","2.125249950","2600:9000:2600:8600:5:c033:1800:93a1","2a0d:6fc7:213:782a:39d4:d935:834:ddaa","TCP","86","[TCP ACKed unseen segment] 443  >  47324 [ACK] Seq=1 Ack=2 Win=234 Len=0 TSval=3575397400 TSecr=3233518559"
"38","2.127310804","2600:9000:2600:8600:5:c033:1800:93a1","2a0d:6fc7:213:782a:39d4:d935:834:ddaa","TCP","86","[TCP ACKed unseen segment] 443  >  47296 [ACK] Seq=1 Ack=2 Win=207 Len=0 TSval=1080338674 TSecr=3233518561"
"39","2.151764254","2600:9000:2600:8600:5:c033:1800:93a1","2a0d:6fc7:213:782a:39d4:d935:834:ddaa","TCP","86","[TCP ACKed unseen segment] 443  >  47348 [ACK] Seq=1 Ack=2 Win=206 Len=0 TSval=2864504644 TSecr=3233518663"
"40","2.472388646","2a0d:6fc7:213:782a:39d4:d935:834:ddaa","2600:9000:2600:8600:5:c033:1800:93a1","TCP","86","47338  >  443 [ACK] Seq=1 Ack=1 Win=5236 Len=0 TSval=3233564325 TSecr=2657590427"
"41","2.560229373","2600:9000:2600:8600:5:c033:1800:93a1","2a0d:6fc7:213:782a:39d4:d935:834:ddaa","TCP","86","[TCP ACKed unseen segment] 443  >  47338 [ACK] Seq=1 Ack=2 Win=220 Len=0 TSval=2657635905 TSecr=3233518978"
"42","3.773782353","2a0d:6fc7:213:782a:39d4:d935:834:ddaa","2600:1901:1:5a5::","TLSv1.2","170","Application Data"
"43","3.774822130","2a0d:6fc7:213:782a:39d4:d935:834:ddaa","2600:1901:1:5a5::","TLSv1.2","1029","Application Data"
"44","4.142219562","2600:1901:1:5a5::","2a0d:6fc7:213:782a:39d4:d935:834:ddaa","TCP","86","443  >  49120 [ACK] Seq=296 Ack=7582 Win=853 Len=0 TSval=3919673036 TSecr=1723595189"
"45","4.142227262","2600:1901:1:5a5::","2a0d:6fc7:213:782a:39d4:d935:834:ddaa","TCP","86","443  >  49120 [ACK] Seq=296 Ack=8525 Win=850 Len=0 TSval=3919673043 TSecr=1723595190"
"46","4.142234562","2600:1901:1:5a5::","2a0d:6fc7:213:782a:39d4:d935:834:ddaa","TLSv1.2","154","Application Data"
"47","4.142241762","2600:1901:1:5a5::","2a0d:6fc7:213:782a:39d4:d935:834:ddaa","TLSv1.2","237","Application Data"
"48","4.142249162","2600:1901:1:5a5::","2a0d:6fc7:213:782a:39d4:d935:834:ddaa","TLSv1.2","125","Application Data"
"49","4.163860686","2a0d:6fc7:213:782a:39d4:d935:834:ddaa","2600:1901:1:5a5::","TCP","86","49120  >  443 [ACK] Seq=8525 Ack=554 Win=249 Len=0 TSval=1723595579 TSecr=3919673117"
"50","4.200570178","2a0d:6fc7:213:782a:39d4:d935:834:ddaa","2600:1901:1:5a5::","TLSv1.2","125","Application Data"
"51","4.248344125","2600:1901:1:5a5::","2a0d:6fc7:213:782a:39d4:d935:834:ddaa","TCP","86","443  >  49120 [ACK] Seq=554 Ack=8564 Win=850 Len=0 TSval=3919673384 TSecr=1723595616"
"52","5.436864727","2407:30c0:182::aa72:3403","2a0d:6fc7:213:782a:39d4:d935:834:ddaa","TCP","86","443  >  52968 [ACK] Seq=1 Ack=1 Win=11 Len=0 TSval=3754269981 TSecr=3311620867"
"53","5.436909126","2a0d:6fc7:213:782a:39d4:d935:834:ddaa","2407:30c0:182::aa72:3403","TCP","86","[TCP ACKed unseen segment] 52968  >  443 [ACK] Seq=1 Ack=2 Win=4046 Len=0 TSval=3311636326 TSecr=3754253522"
"54","7.132505478","2a0d:6fc7:213:782a:39d4:d935:834:ddaa","2a04:4e42:8e::760","TCP","86","36754  >  443 [ACK] Seq=1 Ack=1 Win=249 Len=0 TSval=4116906473 TSecr=3107261284"
"55","7.411741201","2a0d:6fc7:213:782a:39d4:d935:834:ddaa","2001:40a8:4400:3::5266:9832","TCP","86","58698  >  443 [ACK] Seq=1 Ack=1 Win=11820 Len=0 TSval=2549236540 TSecr=252482274"
"56","7.417978968","192.168.183.42","104.244.42.3","TCP","66","37220  >  443 [ACK] Seq=1 Ack=1 Win=249 Len=0 TSval=3862304234 TSecr=2566126333"
"57","7.418065366","192.168.183.42","172.66.0.227","TCP","66","46494  >  443 [ACK] Seq=1 Ack=1 Win=249 Len=0 TSval=1291372506 TSecr=100387664"
"58","7.418128665","192.168.183.42","104.244.42.3","TCP","66","37234  >  443 [ACK] Seq=1 Ack=1 Win=249 Len=0 TSval=3862304234 TSecr=937782853"
"59","7.418185764","192.168.183.42","172.66.0.227","TCP","66","46506  >  443 [ACK] Seq=1 Ack=1 Win=249 Len=0 TSval=1291372506 TSecr=3540369620"
"60","7.529322886","2001:40a8:4400:3::5266:9832","2a0d:6fc7:213:782a:39d4:d935:834:ddaa","TCP","86","[TCP ACKed unseen segment] 443  >  58698 [ACK] Seq=1 Ack=2 Win=501 Len=0 TSval=252527675 TSecr=2549191295"
"61","7.529328986","172.66.0.227","192.168.183.42","TCP","66","[TCP ACKed unseen segment] 443  >  46506 [ACK] Seq=1 Ack=2 Win=8 Len=0 TSval=3540416341 TSecr=1291325906"
"62","7.529334586","172.66.0.227","192.168.183.42","TCP","66","[TCP ACKed unseen segment] 443  >  46494 [ACK] Seq=1 Ack=2 Win=9 Len=0 TSval=100434632 TSecr=1291325709"
"63","7.839898640","2a04:4e42:8e::760","2a0d:6fc7:213:782a:39d4:d935:834:ddaa","TCP","86","[TCP ACKed unseen segment] 443  >  36754 [ACK] Seq=1 Ack=2 Win=294 Len=0 TSval=3107307088 TSecr=4116861126"
"64","7.839906340","104.244.42.3","192.168.183.42","TCP","66","[TCP ACKed unseen segment] 443  >  37234 [ACK] Seq=1 Ack=2 Win=290 Len=0 TSval=937829544 TSecr=3862257761"
"65","7.839913540","104.244.42.3","192.168.183.42","TCP","66","[TCP ACKed unseen segment] 443  >  37220 [ACK] Seq=1 Ack=2 Win=278 Len=0 TSval=2566173050 TSecr=3862257557"
"66","11.229183182","2a0d:6fc7:213:782a:39d4:d935:834:ddaa","2001:40a8:4400:3::5266:9833","TCP","86","58550  >  443 [ACK] Seq=1 Ack=1 Win=249 Len=0 TSval=657080178 TSecr=1722789129"
"67","11.433564562","2a0d:6fc7:213:782a:39d4:d935:834:ddaa","2a00:1450:4028:805::2003","TCP","86","35230  >  443 [ACK] Seq=1 Ack=1 Win=249 Len=0 TSval=1005032104 TSecr=1537800495"
"68","11.569820549","2001:40a8:4400:3::5266:9833","2a0d:6fc7:213:782a:39d4:d935:834:ddaa","TCP","86","[TCP ACKed unseen segment] 443  >  58550 [ACK] Seq=1 Ack=2 Win=501 Len=0 TSval=1722834813 TSecr=657034925"
"69","11.569829048","2a00:1450:4028:805::2003","2a0d:6fc7:213:782a:39d4:d935:834:ddaa","TCP","86","[TCP ACKed unseen segment] 443  >  35230 [ACK] Seq=1 Ack=2 Win=1019 Len=0 TSval=1537847704 TSecr=1004939298"
"70","11.868500882","2a0d:6fc7:213:782a:39d4:d935:834:ddaa","2603:1027:1:108::a","TCP","74","42844  >  443 [ACK] Seq=1 Ack=1 Win=249 Len=0"
"71","12.036442313","192.168.183.42","192.168.183.67","DHCP","324","DHCP Request  - Transaction ID 0x320021e5"
"72","12.272961763","2603:1027:1:108::a","2a0d:6fc7:213:782a:39d4:d935:834:ddaa","TCP","74","[TCP ACKed unseen segment] 443  >  42844 [ACK] Seq=1 Ack=2 Win=16382 Len=0"
"73","13.460849106","2600:9000:2600:8600:5:c033:1800:93a1","2a0d:6fc7:213:782a:39d4:d935:834:ddaa","TCP","86","443  >  34310 [ACK] Seq=1 Ack=1 Win=150 Len=0 TSval=3546963457 TSecr=3233543381"
"74","13.460887905","2a0d:6fc7:213:782a:39d4:d935:834:ddaa","2600:9000:2600:8600:5:c033:1800:93a1","TCP","86","[TCP ZeroWindow] [TCP ACKed unseen segment] 34310  >  443 [ACK] Seq=1 Ack=2 Win=0 Len=0 TSval=3233575314 TSecr=3546946370"
"75","14.686124516","2a0d:6fc7:213:782a:39d4:d935:834:ddaa","2600:9000:2600:8600:5:c033:1800:93a1","TCP","86","[TCP Window Update] 34310  >  443 [ACK] Seq=1 Ack=2 Win=1845 Len=0 TSval=3233576539 TSecr=3546946370"
"76","14.691824702","2a0d:6fc7:213:782a:39d4:d935:834:ddaa","2600:9000:2600:8600:5:c033:1800:93a1","TCP","86","[TCP Window Update] 34310  >  443 [ACK] Seq=1 Ack=2 Win=3721 Len=0 TSval=3233576545 TSecr=3546946370"
"77","14.701964497","2a0d:6fc7:213:782a:39d4:d935:834:ddaa","2600:9000:2600:8600:5:c033:1800:93a1","TCP","86","[TCP Window Update] 34310  >  443 [ACK] Seq=1 Ack=2 Win=7504 Len=0 TSval=3233576555 TSecr=3546946370"
"78","15.048362520","2600:9000:2600:8600:5:c033:1800:93a1","2a0d:6fc7:213:782a:39d4:d935:834:ddaa","SSLv2","3710","[TCP Previous segment not captured] "
"79","15.048370220","2600:9000:2600:8600:5:c033:1800:93a1","2a0d:6fc7:213:782a:39d4:d935:834:ddaa","SSLv2","3710",""
"80","15.048377620","2600:9000:2600:8600:5:c033:1800:93a1","2a0d:6fc7:213:782a:39d4:d935:834:ddaa","SSLv2","3710",""
"81","15.048446018","2a0d:6fc7:213:782a:39d4:d935:834:ddaa","2600:9000:2600:8600:5:c033:1800:93a1","TCP","86","34310  >  443 [ACK] Seq=1 Ack=3626 Win=10786 Len=0 TSval=3233576902 TSecr=3546965212"
"82","15.048724712","192.168.183.67","192.168.183.255","UDP","82","57621  >  57621 Len=40"
"83","15.108490013","2a0d:6fc7:213:782a:39d4:d935:834:ddaa","2600:9000:2600:8600:5:c033:1800:93a1","TCP","86","34310  >  443 [ACK] Seq=1 Ack=10874 Win=10733 Len=0 TSval=3233576962 TSecr=3546965212"
"84","15.484491298","2600:9000:2600:8600:5:c033:1800:93a1","2a0d:6fc7:213:782a:39d4:d935:834:ddaa","SSLv2","2502",""
"85","15.484498898","2600:9000:2600:8600:5:c033:1800:93a1","2a0d:6fc7:213:782a:39d4:d935:834:ddaa","SSLv2","1262",""
"86","15.484505997","2600:9000:2600:8600:5:c033:1800:93a1","2a0d:6fc7:213:782a:39d4:d935:834:ddaa","SSLv2","1294",""
"87","15.548571817","2a0d:6fc7:213:782a:39d4:d935:834:ddaa","2600:9000:2600:8600:5:c033:1800:93a1","TCP","86","34310  >  443 [ACK] Seq=1 Ack=15674 Win=10696 Len=0 TSval=3233577402 TSecr=3546965610"
"88","15.931695057","2600:9000:2600:8600:5:c033:1800:93a1","2a0d:6fc7:213:782a:39d4:d935:834:ddaa","SSLv2","2502",""
"89","15.931703157","2600:9000:2600:8600:5:c033:1800:93a1","2a0d:6fc7:213:782a:39d4:d935:834:ddaa","SSLv2","2502",""
"90","15.931710457","2600:9000:2600:8600:5:c033:1800:93a1","2a0d:6fc7:213:782a:39d4:d935:834:ddaa","SSLv2","2502",""
"91","15.931717857","2600:9000:2600:8600:5:c033:1800:93a1","2a0d:6fc7:213:782a:39d4:d935:834:ddaa","SSLv2","2502",""
"92","15.931804755","2600:9000:2600:8600:5:c033:1800:93a1","2a0d:6fc7:213:782a:39d4:d935:834:ddaa","SSLv2","2502",""
"93","15.931811755","2600:9000:2600:8600:5:c033:1800:93a1","2a0d:6fc7:213:782a:39d4:d935:834:ddaa","SSLv2","2502",""
"94","15.931819155","2600:9000:2600:8600:5:c033:1800:93a1","2a0d:6fc7:213:782a:39d4:d935:834:ddaa","SSLv2","2502",""
"95","15.931826555","2600:9000:2600:8600:5:c033:1800:93a1","2a0d:6fc7:213:782a:39d4:d935:834:ddaa","SSLv2","2502",""
"96","15.931949852","2600:9000:2600:8600:5:c033:1800:93a1","2a0d:6fc7:213:782a:39d4:d935:834:ddaa","SSLv2","2502",""
"97","15.931957252","2600:9000:2600:8600:5:c033:1800:93a1","2a0d:6fc7:213:782a:39d4:d935:834:ddaa","SSLv2","2502",""
"98","15.931964652","2600:9000:2600:8600:5:c033:1800:93a1","2a0d:6fc7:213:782a:39d4:d935:834:ddaa","SSLv2","2502",""
"99","15.931971352","2600:9000:2600:8600:5:c033:1800:93a1","2a0d:6fc7:213:782a:39d4:d935:834:ddaa","SSLv2","2502",""
"100","15.932034451","2600:9000:2600:8600:5:c033:1800:93a1","2a0d:6fc7:213:782a:39d4:d935:834:ddaa","SSLv2","2502",""
"101","15.932042350","2600:9000:2600:8600:5:c033:1800:93a1","2a0d:6fc7:213:782a:39d4:d935:834:ddaa","SSLv2","2502","Encrypted Data"
"102","15.932049750","2600:9000:2600:8600:5:c033:1800:93a1","2a0d:6fc7:213:782a:39d4:d935:834:ddaa","SSLv2","2502",""
"103","15.932057050","2600:9000:2600:8600:5:c033:1800:93a1","2a0d:6fc7:213:782a:39d4:d935:834:ddaa","SSLv2","2502",""
"104","15.932196547","2600:9000:2600:8600:5:c033:1800:93a1","2a0d:6fc7:213:782a:39d4:d935:834:ddaa","SSLv2","2502",""
"105","15.932203947","2600:9000:2600:8600:5:c033:1800:93a1","2a0d:6fc7:213:782a:39d4:d935:834:ddaa","SSLv2","2502",""
"106","15.932211447","2600:9000:2600:8600:5:c033:1800:93a1","2a0d:6fc7:213:782a:39d4:d935:834:ddaa","SSLv2","2502",""
"107","15.932218947","2600:9000:2600:8600:5:c033:1800:93a1","2a0d:6fc7:213:782a:39d4:d935:834:ddaa","SSLv2","2502",""
"108","15.932272645","2600:9000:2600:8600:5:c033:1800:93a1","2a0d:6fc7:213:782a:39d4:d935:834:ddaa","SSLv2","2502",""
"109","15.932280345","2600:9000:2600:8600:5:c033:1800:93a1","2a0d:6fc7:213:782a:39d4:d935:834:ddaa","SSLv2","2502",""
"110","15.932287745","2600:9000:2600:8600:5:c033:1800:93a1","2a0d:6fc7:213:782a:39d4:d935:834:ddaa","SSLv2","2502",""
"111","15.932295145","2600:9000:2600:8600:5:c033:1800:93a1","2a0d:6fc7:213:782a:39d4:d935:834:ddaa","SSLv2","2502",""
"112","15.932447842","2600:9000:2600:8600:5:c033:1800:93a1","2a0d:6fc7:213:782a:39d4:d935:834:ddaa","SSLv2","2502",""
"113","15.932455242","2600:9000:2600:8600:5:c033:1800:93a1","2a0d:6fc7:213:782a:39d4:d935:834:ddaa","SSLv2","2502",""
"114","15.932462942","2600:9000:2600:8600:5:c033:1800:93a1","2a0d:6fc7:213:782a:39d4:d935:834:ddaa","SSLv2","3710",""
"115","15.932470042","2600:9000:2600:8600:5:c033:1800:93a1","2a0d:6fc7:213:782a:39d4:d935:834:ddaa","SSLv2","2502",""
"116","15.932611739","2600:9000:2600:8600:5:c033:1800:93a1","2a0d:6fc7:213:782a:39d4:d935:834:ddaa","SSLv2","2502",""
"117","15.932619139","2600:9000:2600:8600:5:c033:1800:93a1","2a0d:6fc7:213:782a:39d4:d935:834:ddaa","SSLv2","2502",""
"118","15.932626439","2600:9000:2600:8600:5:c033:1800:93a1","2a0d:6fc7:213:782a:39d4:d935:834:ddaa","SSLv2","2502",""
"119","15.932633739","2600:9000:2600:8600:5:c033:1800:93a1","2a0d:6fc7:213:782a:39d4:d935:834:ddaa","SSLv2","1294",""
"120","15.933085230","2600:9000:2600:8600:5:c033:1800:93a1","2a0d:6fc7:213:782a:39d4:d935:834:ddaa","SSLv2","1294",""
"121","15.933092530","2600:9000:2600:8600:5:c033:1800:93a1","2a0d:6fc7:213:782a:39d4:d935:834:ddaa","SSLv2","2502",""
"122","15.933099429","2600:9000:2600:8600:5:c033:1800:93a1","2a0d:6fc7:213:782a:39d4:d935:834:ddaa","SSLv2","2502",""
"123","15.933106729","2600:9000:2600:8600:5:c033:1800:93a1","2a0d:6fc7:213:782a:39d4:d935:834:ddaa","SSLv2","2502",""
"124","15.933114129","2600:9000:2600:8600:5:c033:1800:93a1","2a0d:6fc7:213:782a:39d4:d935:834:ddaa","SSLv2","2502",""
"125","15.933245927","2600:9000:2600:8600:5:c033:1800:93a1","2a0d:6fc7:213:782a:39d4:d935:834:ddaa","SSLv2","2502",""
"126","15.933253526","2600:9000:2600:8600:5:c033:1800:93a1","2a0d:6fc7:213:782a:39d4:d935:834:ddaa","SSLv2","2502",""
"127","15.933261126","2600:9000:2600:8600:5:c033:1800:93a1","2a0d:6fc7:213:782a:39d4:d935:834:ddaa","SSLv2","2502",""
"128","15.933268726","2600:9000:2600:8600:5:c033:1800:93a1","2a0d:6fc7:213:782a:39d4:d935:834:ddaa","SSLv2","2502","Encrypted Data"
"129","15.933319725","2600:9000:2600:8600:5:c033:1800:93a1","2a0d:6fc7:213:782a:39d4:d935:834:ddaa","SSLv2","2502",""
"130","15.933327425","2600:9000:2600:8600:5:c033:1800:93a1","2a0d:6fc7:213:782a:39d4:d935:834:ddaa","SSLv2","2502",""
"131","15.933334725","2600:9000:2600:8600:5:c033:1800:93a1","2a0d:6fc7:213:782a:39d4:d935:834:ddaa","SSLv2","2502","Encrypted Data"
"132","15.933342124","2600:9000:2600:8600:5:c033:1800:93a1","2a0d:6fc7:213:782a:39d4:d935:834:ddaa","SSLv2","2502",""
"133","15.933449622","2600:9000:2600:8600:5:c033:1800:93a1","2a0d:6fc7:213:782a:39d4:d935:834:ddaa","SSLv2","2502",""
"134","15.933457922","2600:9000:2600:8600:5:c033:1800:93a1","2a0d:6fc7:213:782a:39d4:d935:834:ddaa","SSLv2","2502",""
"135","15.933465622","2600:9000:2600:8600:5:c033:1800:93a1","2a0d:6fc7:213:782a:39d4:d935:834:ddaa","SSLv2","2502",""
"136","15.933473222","2600:9000:2600:8600:5:c033:1800:93a1","2a0d:6fc7:213:782a:39d4:d935:834:ddaa","SSLv2","2502",""
"137","15.933525521","2600:9000:2600:8600:5:c033:1800:93a1","2a0d:6fc7:213:782a:39d4:d935:834:ddaa","SSLv2","2502","Encrypted Data"
"138","15.933532821","2600:9000:2600:8600:5:c033:1800:93a1","2a0d:6fc7:213:782a:39d4:d935:834:ddaa","SSLv2","2502",""
"139","15.933540920","2600:9000:2600:8600:5:c033:1800:93a1","2a0d:6fc7:213:782a:39d4:d935:834:ddaa","SSLv2","2502",""
"140","15.933548620","2600:9000:2600:8600:5:c033:1800:93a1","2a0d:6fc7:213:782a:39d4:d935:834:ddaa","SSLv2","2502",""
"141","15.933696617","2600:9000:2600:8600:5:c033:1800:93a1","2a0d:6fc7:213:782a:39d4:d935:834:ddaa","SSLv2","2502",""
"142","15.933703517","2600:9000:2600:8600:5:c033:1800:93a1","2a0d:6fc7:213:782a:39d4:d935:834:ddaa","SSLv2","2502",""
"143","15.933711117","2600:9000:2600:8600:5:c033:1800:93a1","2a0d:6fc7:213:782a:39d4:d935:834:ddaa","SSLv2","2502",""
"144","15.933718417","2600:9000:2600:8600:5:c033:1800:93a1","2a0d:6fc7:213:782a:39d4:d935:834:ddaa","SSLv2","2502",""
"145","15.933773816","2600:9000:2600:8600:5:c033:1800:93a1","2a0d:6fc7:213:782a:39d4:d935:834:ddaa","SSLv2","2502",""
"146","15.933781716","2600:9000:2600:8600:5:c033:1800:93a1","2a0d:6fc7:213:782a:39d4:d935:834:ddaa","SSLv2","2502",""
"147","15.933788815","2600:9000:2600:8600:5:c033:1800:93a1","2a0d:6fc7:213:782a:39d4:d935:834:ddaa","SSLv2","2502","Encrypted Data"
"148","15.933796515","2600:9000:2600:8600:5:c033:1800:93a1","2a0d:6fc7:213:782a:39d4:d935:834:ddaa","SSLv2","2502",""
"149","15.933905013","2600:9000:2600:8600:5:c033:1800:93a1","2a0d:6fc7:213:782a:39d4:d935:834:ddaa","SSLv2","2502",""
"150","15.933912213","2600:9000:2600:8600:5:c033:1800:93a1","2a0d:6fc7:213:782a:39d4:d935:834:ddaa","SSLv2","2502",""
"151","15.933919713","2600:9000:2600:8600:5:c033:1800:93a1","2a0d:6fc7:213:782a:39d4:d935:834:ddaa","SSLv2","2502",""
"152","15.933927913","2600:9000:2600:8600:5:c033:1800:93a1","2a0d:6fc7:213:782a:39d4:d935:834:ddaa","TCP","1294","443  >  34310 [ACK] Seq=169090 Ack=1 Win=150 Len=1208 TSval=3546966126 TSecr=3233577402"
"153","15.933984611","2600:9000:2600:8600:5:c033:1800:93a1","2a0d:6fc7:213:782a:39d4:d935:834:ddaa","SSLv2","1294",""
"154","15.933992311","2600:9000:2600:8600:5:c033:1800:93a1","2a0d:6fc7:213:782a:39d4:d935:834:ddaa","SSLv2","2502",""
"155","15.933999211","2600:9000:2600:8600:5:c033:1800:93a1","2a0d:6fc7:213:782a:39d4:d935:834:ddaa","SSLv2","2502",""
"156","15.934006311","2600:9000:2600:8600:5:c033:1800:93a1","2a0d:6fc7:213:782a:39d4:d935:834:ddaa","SSLv2","2502",""
"157","15.934013711","2600:9000:2600:8600:5:c033:1800:93a1","2a0d:6fc7:213:782a:39d4:d935:834:ddaa","SSLv2","2502",""
"158","15.934156008","2600:9000:2600:8600:5:c033:1800:93a1","2a0d:6fc7:213:782a:39d4:d935:834:ddaa","SSLv2","2502",""
"159","15.934163008","2600:9000:2600:8600:5:c033:1800:93a1","2a0d:6fc7:213:782a:39d4:d935:834:ddaa","SSLv2","2502",""
"160","15.934169908","2600:9000:2600:8600:5:c033:1800:93a1","2a0d:6fc7:213:782a:39d4:d935:834:ddaa","SSLv2","2502",""
"161","15.934177508","2600:9000:2600:8600:5:c033:1800:93a1","2a0d:6fc7:213:782a:39d4:d935:834:ddaa","SSLv2","2502",""
"162","15.934241806","2600:9000:2600:8600:5:c033:1800:93a1","2a0d:6fc7:213:782a:39d4:d935:834:ddaa","SSLv2","2502",""
"163","15.934249706","2600:9000:2600:8600:5:c033:1800:93a1","2a0d:6fc7:213:782a:39d4:d935:834:ddaa","SSLv2","2502",""
"164","15.934256606","2600:9000:2600:8600:5:c033:1800:93a1","2a0d:6fc7:213:782a:39d4:d935:834:ddaa","SSLv2","2502",""
"165","15.934263606","2600:9000:2600:8600:5:c033:1800:93a1","2a0d:6fc7:213:782a:39d4:d935:834:ddaa","SSLv2","2502",""
"166","15.934367804","2600:9000:2600:8600:5:c033:1800:93a1","2a0d:6fc7:213:782a:39d4:d935:834:ddaa","TCP","2502","443  >  34310 [PSH, ACK] Seq=200498 Ack=1 Win=150 Len=2416 TSval=3546966136 TSecr=3233577402 [TCP PDU reassembled in 176]"
"167","15.934375103","2600:9000:2600:8600:5:c033:1800:93a1","2a0d:6fc7:213:782a:39d4:d935:834:ddaa","TCP","2502","443  >  34310 [PSH, ACK] Seq=202914 Ack=1 Win=150 Len=2416 TSval=3546966136 TSecr=3233577402 [TCP PDU reassembled in 176]"
"168","15.934382803","2600:9000:2600:8600:5:c033:1800:93a1","2a0d:6fc7:213:782a:39d4:d935:834:ddaa","TCP","2502","443  >  34310 [PSH, ACK] Seq=205330 Ack=1 Win=150 Len=2416 TSval=3546966137 TSecr=3233577402 [TCP PDU reassembled in 176]"
"169","15.934390603","2600:9000:2600:8600:5:c033:1800:93a1","2a0d:6fc7:213:782a:39d4:d935:834:ddaa","TCP","2502","443  >  34310 [PSH, ACK] Seq=207746 Ack=1 Win=150 Len=2416 TSval=3546966138 TSecr=3233577402 [TCP PDU reassembled in 176]"
"170","15.934444102","2600:9000:2600:8600:5:c033:1800:93a1","2a0d:6fc7:213:782a:39d4:d935:834:ddaa","TCP","2502","443  >  34310 [PSH, ACK] Seq=210162 Ack=1 Win=150 Len=2416 TSval=3546966139 TSecr=3233577402 [TCP PDU reassembled in 176]"
"171","15.934452802","2600:9000:2600:8600:5:c033:1800:93a1","2a0d:6fc7:213:782a:39d4:d935:834:ddaa","TCP","2502","443  >  34310 [PSH, ACK] Seq=212578 Ack=1 Win=150 Len=2416 TSval=3546966139 TSecr=3233577402 [TCP PDU reassembled in 176]"
"172","15.934460302","2600:9000:2600:8600:5:c033:1800:93a1","2a0d:6fc7:213:782a:39d4:d935:834:ddaa","TCP","2502","443  >  34310 [PSH, ACK] Seq=214994 Ack=1 Win=150 Len=2416 TSval=3546966140 TSecr=3233577402 [TCP PDU reassembled in 176]"
"173","15.934468202","2600:9000:2600:8600:5:c033:1800:93a1","2a0d:6fc7:213:782a:39d4:d935:834:ddaa","TCP","2502","443  >  34310 [PSH, ACK] Seq=217410 Ack=1 Win=150 Len=2416 TSval=3546966141 TSecr=3233577402 [TCP PDU reassembled in 176]"
"174","15.934599399","2600:9000:2600:8600:5:c033:1800:93a1","2a0d:6fc7:213:782a:39d4:d935:834:ddaa","TCP","2502","443  >  34310 [PSH, ACK] Seq=219826 Ack=1 Win=150 Len=2416 TSval=3546966142 TSecr=3233577402 [TCP PDU reassembled in 176]"
"175","15.934606499","2600:9000:2600:8600:5:c033:1800:93a1","2a0d:6fc7:213:782a:39d4:d935:834:ddaa","TCP","2502","443  >  34310 [PSH, ACK] Seq=222242 Ack=1 Win=150 Len=2416 TSval=3546966142 TSecr=3233577402 [TCP PDU reassembled in 176]"
"176","15.934613199","2600:9000:2600:8600:5:c033:1800:93a1","2a0d:6fc7:213:782a:39d4:d935:834:ddaa","SSLv2","2502","Encrypted Data"
"177","15.934619499","2600:9000:2600:8600:5:c033:1800:93a1","2a0d:6fc7:213:782a:39d4:d935:834:ddaa","TCP","2502","443  >  34310 [PSH, ACK] Seq=227074 Ack=1 Win=150 Len=2416 TSval=3546966144 TSecr=3233577402 [TCP PDU reassembled in 180]"
"178","15.934673298","2600:9000:2600:8600:5:c033:1800:93a1","2a0d:6fc7:213:782a:39d4:d935:834:ddaa","TCP","2502","443  >  34310 [PSH, ACK] Seq=229490 Ack=1 Win=150 Len=2416 TSval=3546966145 TSecr=3233577402 [TCP PDU reassembled in 180]"
"179","15.934680598","2600:9000:2600:8600:5:c033:1800:93a1","2a0d:6fc7:213:782a:39d4:d935:834:ddaa","TCP","2502","443  >  34310 [PSH, ACK] Seq=231906 Ack=1 Win=150 Len=2416 TSval=3546966145 TSecr=3233577402 [TCP PDU reassembled in 180]"
"180","15.934687197","2600:9000:2600:8600:5:c033:1800:93a1","2a0d:6fc7:213:782a:39d4:d935:834:ddaa","SSLv2","2502","Encrypted Data"
"181","15.934694498","2600:9000:2600:8600:5:c033:1800:93a1","2a0d:6fc7:213:782a:39d4:d935:834:ddaa","TCP","2502","443  >  34310 [PSH, ACK] Seq=236738 Ack=1 Win=150 Len=2416 TSval=3546966147 TSecr=3233577402 [TCP PDU reassembled in 191]"
"182","15.934800495","2600:9000:2600:8600:5:c033:1800:93a1","2a0d:6fc7:213:782a:39d4:d935:834:ddaa","TCP","2502","443  >  34310 [PSH, ACK] Seq=239154 Ack=1 Win=150 Len=2416 TSval=3546966148 TSecr=3233577402 [TCP PDU reassembled in 191]"
"183","15.934807895","2600:9000:2600:8600:5:c033:1800:93a1","2a0d:6fc7:213:782a:39d4:d935:834:ddaa","TCP","2502","443  >  34310 [PSH, ACK] Seq=241570 Ack=1 Win=150 Len=2416 TSval=3546966148 TSecr=3233577402 [TCP PDU reassembled in 191]"
"184","15.934815295","2600:9000:2600:8600:5:c033:1800:93a1","2a0d:6fc7:213:782a:39d4:d935:834:ddaa","TCP","2502","443  >  34310 [PSH, ACK] Seq=243986 Ack=1 Win=150 Len=2416 TSval=3546966149 TSecr=3233577402 [TCP PDU reassembled in 191]"
"185","15.934823295","2600:9000:2600:8600:5:c033:1800:93a1","2a0d:6fc7:213:782a:39d4:d935:834:ddaa","TCP","1294","443  >  34310 [ACK] Seq=246402 Ack=1 Win=150 Len=1208 TSval=3546966150 TSecr=3233577402 [TCP PDU reassembled in 191]"
"186","15.934880794","2600:9000:2600:8600:5:c033:1800:93a1","2a0d:6fc7:213:782a:39d4:d935:834:ddaa","TCP","1294","443  >  34310 [PSH, ACK] Seq=247610 Ack=1 Win=150 Len=1208 TSval=3546966150 TSecr=3233577402 [TCP PDU reassembled in 191]"
"187","15.934889093","2600:9000:2600:8600:5:c033:1800:93a1","2a0d:6fc7:213:782a:39d4:d935:834:ddaa","TCP","2502","443  >  34310 [PSH, ACK] Seq=248818 Ack=1 Win=150 Len=2416 TSval=3546966150 TSecr=3233577402 [TCP PDU reassembled in 191]"
"188","15.934896793","2600:9000:2600:8600:5:c033:1800:93a1","2a0d:6fc7:213:782a:39d4:d935:834:ddaa","TCP","2502","443  >  34310 [PSH, ACK] Seq=251234 Ack=1 Win=150 Len=2416 TSval=3546966151 TSecr=3233577402 [TCP PDU reassembled in 191]"
"189","15.934904693","2600:9000:2600:8600:5:c033:1800:93a1","2a0d:6fc7:213:782a:39d4:d935:834:ddaa","TCP","2502","443  >  34310 [PSH, ACK] Seq=253650 Ack=1 Win=150 Len=2416 TSval=3546966152 TSecr=3233577402 [TCP PDU reassembled in 191]"
"190","15.934912393","2600:9000:2600:8600:5:c033:1800:93a1","2a0d:6fc7:213:782a:39d4:d935:834:ddaa","TCP","2502","443  >  34310 [PSH, ACK] Seq=256066 Ack=1 Win=150 Len=2416 TSval=3546966153 TSecr=3233577402 [TCP PDU reassembled in 191]"
"191","15.935122089","2600:9000:2600:8600:5:c033:1800:93a1","2a0d:6fc7:213:782a:39d4:d935:834:ddaa","SSLv2","2502","Encrypted Data"
"192","15.935129689","2600:9000:2600:8600:5:c033:1800:93a1","2a0d:6fc7:213:782a:39d4:d935:834:ddaa","TCP","2502","443  >  34310 [PSH, ACK] Seq=260898 Ack=1 Win=150 Len=2416 TSval=3546966154 TSecr=3233577402 [TCP PDU reassembled in 197]"
"193","15.935137888","2600:9000:2600:8600:5:c033:1800:93a1","2a0d:6fc7:213:782a:39d4:d935:834:ddaa","TCP","2502","443  >  34310 [PSH, ACK] Seq=263314 Ack=1 Win=150 Len=2416 TSval=3546966155 TSecr=3233577402 [TCP PDU reassembled in 197]"
"194","15.935146489","2600:9000:2600:8600:5:c033:1800:93a1","2a0d:6fc7:213:782a:39d4:d935:834:ddaa","TCP","2502","443  >  34310 [PSH, ACK] Seq=265730 Ack=1 Win=150 Len=2416 TSval=3546966156 TSecr=3233577402 [TCP PDU reassembled in 197]"
"195","15.935214487","2600:9000:2600:8600:5:c033:1800:93a1","2a0d:6fc7:213:782a:39d4:d935:834:ddaa","TCP","2502","443  >  34310 [PSH, ACK] Seq=268146 Ack=1 Win=150 Len=2416 TSval=3546966156 TSecr=3233577402 [TCP PDU reassembled in 197]"
"196","15.935221587","2600:9000:2600:8600:5:c033:1800:93a1","2a0d:6fc7:213:782a:39d4:d935:834:ddaa","TCP","2502","443  >  34310 [PSH, ACK] Seq=270562 Ack=1 Win=150 Len=2416 TSval=3546966157 TSecr=3233577402 [TCP PDU reassembled in 197]"
"197","15.935228787","2600:9000:2600:8600:5:c033:1800:93a1","2a0d:6fc7:213:782a:39d4:d935:834:ddaa","SSLv2","2502","Encrypted Data"
"198","15.935235987","2600:9000:2600:8600:5:c033:1800:93a1","2a0d:6fc7:213:782a:39d4:d935:834:ddaa","TCP","2502","443  >  34310 [PSH, ACK] Seq=275394 Ack=1 Win=150 Len=2416 TSval=3546966159 TSecr=3233577402 [TCP PDU reassembled in 206]"
"199","15.935352285","2600:9000:2600:8600:5:c033:1800:93a1","2a0d:6fc7:213:782a:39d4:d935:834:ddaa","TCP","2502","443  >  34310 [PSH, ACK] Seq=277810 Ack=1 Win=150 Len=2416 TSval=3546966159 TSecr=3233577402 [TCP PDU reassembled in 206]"
"200","15.935359984","2600:9000:2600:8600:5:c033:1800:93a1","2a0d:6fc7:213:782a:39d4:d935:834:ddaa","TCP","2502","443  >  34310 [PSH, ACK] Seq=280226 Ack=1 Win=150 Len=2416 TSval=3546966160 TSecr=3233577402 [TCP PDU reassembled in 206]"
"201","15.935367984","2600:9000:2600:8600:5:c033:1800:93a1","2a0d:6fc7:213:782a:39d4:d935:834:ddaa","TCP","2502","443  >  34310 [PSH, ACK] Seq=282642 Ack=1 Win=150 Len=2416 TSval=3546966161 TSecr=3233577402 [TCP PDU reassembled in 206]"
"202","15.935374984","2600:9000:2600:8600:5:c033:1800:93a1","2a0d:6fc7:213:782a:39d4:d935:834:ddaa","TCP","2502","443  >  34310 [PSH, ACK] Seq=285058 Ack=1 Win=150 Len=2416 TSval=3546966162 TSecr=3233577402 [TCP PDU reassembled in 206]"
"203","15.935433183","2600:9000:2600:8600:5:c033:1800:93a1","2a0d:6fc7:213:782a:39d4:d935:834:ddaa","TCP","2502","443  >  34310 [PSH, ACK] Seq=287474 Ack=1 Win=150 Len=2416 TSval=3546966162 TSecr=3233577402 [TCP PDU reassembled in 206]"
"204","15.935441183","2600:9000:2600:8600:5:c033:1800:93a1","2a0d:6fc7:213:782a:39d4:d935:834:ddaa","TCP","2502","443  >  34310 [PSH, ACK] Seq=289890 Ack=1 Win=150 Len=2416 TSval=3546966163 TSecr=3233577402 [TCP PDU reassembled in 206]"
"205","15.935449082","2600:9000:2600:8600:5:c033:1800:93a1","2a0d:6fc7:213:782a:39d4:d935:834:ddaa","TCP","2502","443  >  34310 [PSH, ACK] Seq=292306 Ack=1 Win=150 Len=2416 TSval=3546966164 TSecr=3233577402 [TCP PDU reassembled in 206]"
"206","15.935456082","2600:9000:2600:8600:5:c033:1800:93a1","2a0d:6fc7:213:782a:39d4:d935:834:ddaa","SSLv2","2502","Encrypted Data"
"207","15.935681377","2600:9000:2600:8600:5:c033:1800:93a1","2a0d:6fc7:213:782a:39d4:d935:834:ddaa","TCP","2502","443  >  34310 [PSH, ACK] Seq=297138 Ack=1 Win=150 Len=2416 TSval=3546966165 TSecr=3233577402 [TCP PDU reassembled in 209]"
"208","15.935739477","2600:9000:2600:8600:5:c033:1800:93a1","2a0d:6fc7:213:782a:39d4:d935:834:ddaa","TCP","2502","443  >  34310 [PSH, ACK] Seq=299554 Ack=1 Win=150 Len=2416 TSval=3546966166 TSecr=3233577402 [TCP PDU reassembled in 209]"
"209","15.935860674","2600:9000:2600:8600:5:c033:1800:93a1","2a0d:6fc7:213:782a:39d4:d935:834:ddaa","SSLv2","2502","Encrypted Data"
"210","15.935980472","2600:9000:2600:8600:5:c033:1800:93a1","2a0d:6fc7:213:782a:39d4:d935:834:ddaa","TCP","2502","443  >  34310 [PSH, ACK] Seq=304386 Ack=1 Win=150 Len=2416 TSval=3546966168 TSecr=3233577402 [TCP PDU reassembled in 216]"
"211","15.936081270","2600:9000:2600:8600:5:c033:1800:93a1","2a0d:6fc7:213:782a:39d4:d935:834:ddaa","TCP","2502","443  >  34310 [PSH, ACK] Seq=306802 Ack=1 Win=150 Len=2416 TSval=3546966168 TSecr=3233577402 [TCP PDU reassembled in 216]"
"212","15.936088370","2600:9000:2600:8600:5:c033:1800:93a1","2a0d:6fc7:213:782a:39d4:d935:834:ddaa","TCP","2502","443  >  34310 [PSH, ACK] Seq=309218 Ack=1 Win=150 Len=2416 TSval=3546966169 TSecr=3233577402 [TCP PDU reassembled in 216]"
"213","15.936095770","2600:9000:2600:8600:5:c033:1800:93a1","2a0d:6fc7:213:782a:39d4:d935:834:ddaa","TCP","2502","443  >  34310 [PSH, ACK] Seq=311634 Ack=1 Win=150 Len=2416 TSval=3546966170 TSecr=3233577402 [TCP PDU reassembled in 216]"
"214","15.936102869","2600:9000:2600:8600:5:c033:1800:93a1","2a0d:6fc7:213:782a:39d4:d935:834:ddaa","TCP","2502","443  >  34310 [PSH, ACK] Seq=314050 Ack=1 Win=150 Len=2416 TSval=3546966171 TSecr=3233577402 [TCP PDU reassembled in 216]"
"215","15.936206467","2600:9000:2600:8600:5:c033:1800:93a1","2a0d:6fc7:213:782a:39d4:d935:834:ddaa","TCP","2502","443  >  34310 [PSH, ACK] Seq=316466 Ack=1 Win=150 Len=2416 TSval=3546966171 TSecr=3233577402 [TCP PDU reassembled in 216]"
"216","15.936213367","2600:9000:2600:8600:5:c033:1800:93a1","2a0d:6fc7:213:782a:39d4:d935:834:ddaa","SSLv2","2502","Encrypted Data"
"217","15.936220567","2600:9000:2600:8600:5:c033:1800:93a1","2a0d:6fc7:213:782a:39d4:d935:834:ddaa","TCP","2502","443  >  34310 [PSH, ACK] Seq=321298 Ack=1 Win=150 Len=2416 TSval=3546966173 TSecr=3233577402 [TCP PDU reassembled in 220]"
"218","15.936228067","2600:9000:2600:8600:5:c033:1800:93a1","2a0d:6fc7:213:782a:39d4:d935:834:ddaa","TCP","1294","443  >  34310 [ACK] Seq=323714 Ack=1 Win=150 Len=1208 TSval=3546966174 TSecr=3233577402 [TCP PDU reassembled in 220]"
"219","15.936283365","2600:9000:2600:8600:5:c033:1800:93a1","2a0d:6fc7:213:782a:39d4:d935:834:ddaa","TCP","1294","443  >  34310 [PSH, ACK] Seq=324922 Ack=1 Win=150 Len=1208 TSval=3546966174 TSecr=3233577402 [TCP PDU reassembled in 220]"
"220","15.936290965","2600:9000:2600:8600:5:c033:1800:93a1","2a0d:6fc7:213:782a:39d4:d935:834:ddaa","SSLv2","2502","Encrypted Data, Encrypted Data"
"221","15.936298065","2600:9000:2600:8600:5:c033:1800:93a1","2a0d:6fc7:213:782a:39d4:d935:834:ddaa","TCP","2502","443  >  34310 [PSH, ACK] Seq=328546 Ack=1 Win=150 Len=2416 TSval=3546966175 TSecr=3233577402 [TCP PDU reassembled in 229]"
"222","15.936305965","2600:9000:2600:8600:5:c033:1800:93a1","2a0d:6fc7:213:782a:39d4:d935:834:ddaa","TCP","2502","443  >  34310 [PSH, ACK] Seq=330962 Ack=1 Win=150 Len=2416 TSval=3546966176 TSecr=3233577402 [TCP PDU reassembled in 229]"
"223","15.936313165","2600:9000:2600:8600:5:c033:1800:93a1","2a0d:6fc7:213:782a:39d4:d935:834:ddaa","TCP","2502","443  >  34310 [PSH, ACK] Seq=333378 Ack=1 Win=150 Len=2416 TSval=3546966177 TSecr=3233577402 [TCP PDU reassembled in 229]"
"224","15.936547961","2600:9000:2600:8600:5:c033:1800:93a1","2a0d:6fc7:213:782a:39d4:d935:834:ddaa","TCP","2502","443  >  34310 [PSH, ACK] Seq=335794 Ack=1 Win=150 Len=2416 TSval=3546966177 TSecr=3233577402 [TCP PDU reassembled in 229]"
"225","15.936555660","2600:9000:2600:8600:5:c033:1800:93a1","2a0d:6fc7:213:782a:39d4:d935:834:ddaa","TCP","2502","443  >  34310 [PSH, ACK] Seq=338210 Ack=1 Win=150 Len=2416 TSval=3546966178 TSecr=3233577402 [TCP PDU reassembled in 229]"
"226","15.936562660","2600:9000:2600:8600:5:c033:1800:93a1","2a0d:6fc7:213:782a:39d4:d935:834:ddaa","TCP","2502","443  >  34310 [PSH, ACK] Seq=340626 Ack=1 Win=150 Len=2416 TSval=3546966179 TSecr=3233577402 [TCP PDU reassembled in 229]"
"227","15.936569560","2600:9000:2600:8600:5:c033:1800:93a1","2a0d:6fc7:213:782a:39d4:d935:834:ddaa","TCP","2502","443  >  34310 [PSH, ACK] Seq=343042 Ack=1 Win=150 Len=2416 TSval=3546966180 TSecr=3233577402 [TCP PDU reassembled in 229]"
"228","15.936626359","2600:9000:2600:8600:5:c033:1800:93a1","2a0d:6fc7:213:782a:39d4:d935:834:ddaa","TCP","2502","443  >  34310 [PSH, ACK] Seq=345458 Ack=1 Win=150 Len=2416 TSval=3546966180 TSecr=3233577402 [TCP PDU reassembled in 229]"
"229","15.936633759","2600:9000:2600:8600:5:c033:1800:93a1","2a0d:6fc7:213:782a:39d4:d935:834:ddaa","SSLv2","2502","Encrypted Data"
"230","15.936640959","2600:9000:2600:8600:5:c033:1800:93a1","2a0d:6fc7:213:782a:39d4:d935:834:ddaa","TCP","2502","443  >  34310 [PSH, ACK] Seq=350290 Ack=1 Win=150 Len=2416 TSval=3546966182 TSecr=3233577402 [TCP PDU reassembled in 233]"
"231","15.936648259","2600:9000:2600:8600:5:c033:1800:93a1","2a0d:6fc7:213:782a:39d4:d935:834:ddaa","TCP","2502","443  >  34310 [PSH, ACK] Seq=352706 Ack=1 Win=150 Len=2416 TSval=3546966183 TSecr=3233577402 [TCP PDU reassembled in 233]"
"232","15.936750957","2600:9000:2600:8600:5:c033:1800:93a1","2a0d:6fc7:213:782a:39d4:d935:834:ddaa","TCP","2502","443  >  34310 [PSH, ACK] Seq=355122 Ack=1 Win=150 Len=2416 TSval=3546966183 TSecr=3233577402 [TCP PDU reassembled in 233]"
"233","15.936758056","2600:9000:2600:8600:5:c033:1800:93a1","2a0d:6fc7:213:782a:39d4:d935:834:ddaa","SSLv2","2502","Encrypted Data"
"234","15.936765456","2600:9000:2600:8600:5:c033:1800:93a1","2a0d:6fc7:213:782a:39d4:d935:834:ddaa","TCP","2502","443  >  34310 [PSH, ACK] Seq=359954 Ack=1 Win=150 Len=2416 TSval=3546966185 TSecr=3233577402 [TCP PDU reassembled in 236]"
"235","15.936772656","2600:9000:2600:8600:5:c033:1800:93a1","2a0d:6fc7:213:782a:39d4:d935:834:ddaa","TCP","2502","443  >  34310 [PSH, ACK] Seq=362370 Ack=1 Win=150 Len=2416 TSval=3546966186 TSecr=3233577402 [TCP PDU reassembled in 236]"
"236","15.936825155","2600:9000:2600:8600:5:c033:1800:93a1","2a0d:6fc7:213:782a:39d4:d935:834:ddaa","SSLv2","2502","Encrypted Data"
